file_path,api_count,code
code/lip_tracking/VisualizeLip.py,0,"b'import numpy as np\nimport cv2\nimport dlib\nimport math\nimport sys\nimport pickle\nimport argparse\nimport os\nimport skvideo.io\n\n\n""""""\nPART1: Construct the argument parse and parse the arguments\n""""""\nap = argparse.ArgumentParser()\nap.add_argument(""-i"", ""--input"", required=True,\n                help=""path to input video file"")\nap.add_argument(""-o"", ""--output"", required=True,\n                help=""path to output video file"")\nap.add_argument(""-f"", ""--fps"", type=int, default=30,\n                help=""FPS of output video"")\nap.add_argument(""-c"", ""--codec"", type=str, default=""MJPG"",\n                help=""codec of output video"")\nargs = vars(ap.parse_args())\n\n""""""\nPART2: Calling and defining required parameters for:\n\n       1 - Processing video for extracting each frame.\n       2 - Lip extraction from frames.\n""""""\n\n# Dlib requirements.\npredictor_path = \'dlib/shape_predictor_68_face_landmarks.dat\'\ndetector = dlib.get_frontal_face_detector()\npredictor = dlib.shape_predictor(predictor_path)\nmouth_destination_path = os.path.dirname(args[""output""]) + \'/\' + \'mouth\'\nif not os.path.exists(mouth_destination_path):\n    os.makedirs(mouth_destination_path)\n\ninputparameters = {}\noutputparameters = {}\nreader = skvideo.io.FFmpegReader(args[""input""],\n                inputdict=inputparameters,\n                outputdict=outputparameters)\nvideo_shape = reader.getShape()\n(num_frames, h, w, c) = video_shape\nprint(num_frames, h, w, c)\n\n# The required parameters\nactivation = []\nmax_counter = 150\ntotal_num_frames = int(video_shape[0])\nnum_frames = min(total_num_frames,max_counter)\ncounter = 0\nfont = cv2.FONT_HERSHEY_SIMPLEX\n\n# Define the writer\nwriter = skvideo.io.FFmpegWriter(args[""output""])\n\n\n# Required parameters for mouth extraction.\nwidth_crop_max = 0\nheight_crop_max = 0\n\n\n\'\'\'\nProcessing parameters.\n\n    activation: set to one if the full mouth can be extracted and set to zero otherwise.\n    max_counter: How many frames will be processed.\n    total_num_frames: Total number of frames for the video.\n    num_frames: The number of frames which are subjected to be processed.\n    counter: The frame counter.\n\'\'\'\n\n""""""\nPART3: Processing the video.\n\nProcedure:\n     1 - Extracting each frame.\n     2 - Detect the mouth in the frame.\n     3 - Define a boarder around the mouth.\n     4 - Crop and save the mouth.\n\nTechnical considerations:\n     * - For the first frame the mouth is detected and by using a boarder the mouth is extracted and cropped.\n     * - After the first frame the size of the cropped windows remains fixed unless for the subsequent frames\n          a bigger windows is required. In such a case the windows size will be increased and it will be held\n          fixed again unless increasing the size becoming necessary again too.\n""""""\n# Loop over all frames.\nfor frame in reader.nextFrame():\n    print(\'frame_shape:\', frame.shape)\n\n    # Process the video and extract the frames up to a certain number and then stop processing.\n    if counter > num_frames:\n        break\n\n    # Detection of the frame\n    frame.setflags(write=True)\n    detections = detector(frame, 1)\n\n    # 20 mark for mouth\n    marks = np.zeros((2, 20))\n\n    # All unnormalized face features.\n    Features_Abnormal = np.zeros((190, 1))\n\n    # If the face is detected.\n    print(len(detections))\n    if len(detections) > 0:\n        for k, d in enumerate(detections):\n\n            # Shape of the face.\n            shape = predictor(frame, d)\n\n            co = 0\n            # Specific for the mouth.\n            for ii in range(48, 68):\n                """"""\n                This for loop is going over all mouth-related features.\n                X and Y coordinates are extracted and stored separately.\n                """"""\n                X = shape.part(ii)\n                A = (X.x, X.y)\n                marks[0, co] = X.x\n                marks[1, co] = X.y\n                co += 1\n\n            # Get the extreme points(top-left & bottom-right)\n            X_left, Y_left, X_right, Y_right = [int(np.amin(marks, axis=1)[0]), int(np.amin(marks, axis=1)[1]),\n                                                int(np.amax(marks, axis=1)[0]),\n                                                int(np.amax(marks, axis=1)[1])]\n\n            # Find the center of the mouth.\n            X_center = (X_left + X_right) / 2.0\n            Y_center = (Y_left + Y_right) / 2.0\n\n            # Make a boarder for cropping.\n            border = 30\n            X_left_new = X_left - border\n            Y_left_new = Y_left - border\n            X_right_new = X_right + border\n            Y_right_new = Y_right + border\n\n            # Width and height for cropping(before and after considering the border).\n            width_new = X_right_new - X_left_new\n            height_new = Y_right_new - Y_left_new\n            width_current = X_right - X_left\n            height_current = Y_right - Y_left\n\n            # Determine the cropping rectangle dimensions(the main purpose is to have a fixed area).\n            if width_crop_max == 0 and height_crop_max == 0:\n                width_crop_max = width_new\n                height_crop_max = height_new\n            else:\n                width_crop_max += 1.5 * np.maximum(width_current - width_crop_max, 0)\n                height_crop_max += 1.5 * np.maximum(height_current - height_crop_max, 0)\n\n            # # # Uncomment if the lip area is desired to be rectangular # # # #\n            #########################################################\n            # Find the cropping points(top-left and bottom-right).\n            X_left_crop = int(X_center - width_crop_max / 2.0)\n            X_right_crop = int(X_center + width_crop_max / 2.0)\n            Y_left_crop = int(Y_center - height_crop_max / 2.0)\n            Y_right_crop = int(Y_center + height_crop_max / 2.0)\n            #########################################################\n\n            # # # # # Uncomment if the lip area is desired to be rectangular # # # #\n            # #######################################\n            # # Use this part if the cropped area should look like a square.\n            # crop_length_max = max(width_crop_max, height_crop_max) / 2\n            #\n            # # Find the cropping points(top-left and bottom-right).\n            # X_left_crop = int(X_center - crop_length_max)\n            # X_right_crop = int(X_center + crop_length_max)\n            # Y_left_crop = int(Y_center - crop_length_max)\n            # Y_right_crop = int(Y_center + crop_length_max)\n            #########################################\n\n            if X_left_crop >= 0 and Y_left_crop >= 0 and X_right_crop < w and Y_right_crop < h:\n                mouth = frame[Y_left_crop:Y_right_crop, X_left_crop:X_right_crop, :]\n\n                # Save the mouth area.\n                mouth_gray = cv2.cvtColor(mouth, cv2.COLOR_RGB2GRAY)\n                cv2.imwrite(mouth_destination_path + \'/\' + \'frame\' + \'_\' + str(counter) + \'.png\', mouth_gray)\n\n                print(""The cropped mouth is detected ..."")\n                activation.append(1)\n            else:\n                cv2.putText(frame, \'The full mouth is not detectable. \', (30, 30), font, 1, (0, 255, 255), 2)\n                print(""The full mouth is not detectable. ..."")\n                activation.append(0)\n\n    else:\n        cv2.putText(frame, \'Mouth is not detectable. \', (30, 30), font, 1, (0, 0, 255), 2)\n        print(""Mouth is not detectable. ..."")\n        activation.append(0)\n\n\n    if activation[counter] == 1:\n        # Demonstration of face.\n        cv2.rectangle(frame, (X_left_crop, Y_left_crop), (X_right_crop, Y_right_crop), (0, 255, 0), 2)\n\n    # cv2.imshow(\'frame\', frame)\n    print(\'frame number %d of %d\' % (counter, num_frames))\n\n    # write the output frame to file\n    print(""writing frame %d with activation %d"" % (counter + 1, activation[counter]))\n    writer.writeFrame(frame)\n    counter += 1\n\nwriter.close()\n\n""""""\nPART4: Save the activation vector as a list.\n\nThe python script for loading a list:\n    with open(the_filename, \'rb\') as f:\n        my_list = pickle.load(f)\n""""""\n\nthe_filename = os.path.dirname(args[""output""]) + \'/\' + \'activation\'\nmy_list = activation\nwith open(the_filename, \'wb\') as f:\n    pickle.dump(my_list, f)\n\n'"
code/speech-input/input_feature.py,0,"b'import os\nfrom scipy.io.wavfile import read\nimport scipy.io.wavfile as wav\nimport subprocess as sp\nimport numpy as np\nimport argparse\nimport random\nimport os\nimport sys\nfrom random import shuffle\nimport speechpy\nimport datetime\n\n\n######################################\n####### Define the dataset class #####\n######################################\nclass AudioDataset():\n    """"""Audio dataset.""""""\n\n    def __init__(self, files_path, audio_dir, transform=None):\n        """"""\n        Args:\n            files_path (string): Path to the .txt file which the address of files are saved in it.\n            root_dir (string): Directory with all the audio files.\n            transform (callable, optional): Optional transform to be applied\n                on a sample.\n        """"""\n\n        # self.sound_files = [x.strip() for x in content]\n        self.audio_dir = audio_dir\n        self.transform = transform\n\n        # Open the .txt file and create a list from each line.\n        with open(files_path, \'r\') as f:\n            content = f.readlines()\n        # you may also want to remove whitespace characters like `\\n` at the end of each line\n        list_files = []\n        for x in content:\n            sound_file_path = os.path.join(self.audio_dir, x.strip().split()[1])\n            try:\n                with open(sound_file_path, \'rb\') as f:\n                    riff_size, _ = wav._read_riff_chunk(f)\n                    file_size = os.path.getsize(sound_file_path)\n\n                # Assertion error.\n                assert riff_size == file_size and os.path.getsize(sound_file_path) > 1000, ""Bad file!""\n\n                # Add to list if file is OK!\n                list_files.append(x.strip())\n            except OSError as err:\n                print(""OS error: {0}"".format(err))\n            except ValueError:\n                print(\'file %s is corrupted!\' % sound_file_path)\n            # except:\n            #     print(""Unexpected error:"", sys.exc_info()[0])\n            #     raise\n\n        # Save the correct and healthy sound files to a list.\n        self.sound_files = list_files\n\n    def __len__(self):\n        return len(self.sound_files)\n\n    def __getitem__(self, idx):\n        # Get the sound file path\n        sound_file_path = os.path.join(self.audio_dir, self.sound_files[idx].split()[1])\n\n        ##############################\n        ### Reading and processing ###\n        ##############################\n\n        # Reading .wav file\n        fs, signal = wav.read(sound_file_path)\n\n        # Reading .wav file\n        import soundfile as sf\n        signal, fs = sf.read(sound_file_path)\n\n        ###########################\n        ### Feature Extraction ####\n        ###########################\n\n        # DEFAULTS:\n        num_coefficient = 40\n\n        # Staching frames\n        frames = speechpy.processing.stack_frames(signal, sampling_frequency=fs, frame_length=0.02,\n                                                  frame_stride=0.02,\n                                                  zero_padding=True)\n\n        # # Extracting power spectrum (choosing 3 seconds and elimination of DC)\n        power_spectrum = speechpy.processing.power_spectrum(frames, fft_points=2 * num_coefficient)[:, 1:]\n\n        logenergy = speechpy.feature.lmfe(signal, sampling_frequency=fs, frame_length=0.02, frame_stride=0.02,\n                                          num_filters=num_coefficient, fft_length=1024, low_frequency=0,\n                                          high_frequency=None)\n        \n\n        ########################\n        ### Handling sample ####\n        ########################\n\n        # Label extraction\n        label = int(self.sound_files[idx].split()[0])\n\n        sample = {\'feature\': logenergy, \'label\': label}\n\n        ########################\n        ### Post Processing ####\n        ########################\n        if self.transform:\n            sample = self.transform(sample)\n        else:\n            feature, label = sample[\'feature\'], sample[\'label\']\n            sample = feature, label\n\n        return sample\n        # return sample\n\n\nclass CMVN(object):\n    """"""Cepstral mean variance normalization.\n\n    """"""\n\n    def __call__(self, sample):\n        feature, label = sample[\'feature\'], sample[\'label\']\n\n        # Mean variance normalization of the spectrum.\n        # The following line should be Uncommented if cepstral mean variance normalization is desired!\n        feature = speechpy.processing.cmvn(feature, variance_normalization=True)\n\n        return {\'feature\': feature, \'label\': label}\n\nclass Extract_Derivative(object):\n    """"""\n    Extract derivative features.\n\n    """"""\n\n    def __call__(self, sample):\n        feature, label = sample[\'feature\'], sample[\'label\']\n\n        # Extract derivative features\n        feature = speechpy.feature.extract_derivative_feature(feature)\n\n        return {\'feature\': feature, \'label\': label}\n    \n\nclass Feature_Cube(object):\n    """"""Return a feature cube of desired size.\n\n    Args:\n        cube_shape (tuple): The shape of the feature cube.\n        ex: cube_shape=(15,40,3)\n    """"""\n\n    def __init__(self, cube_shape):\n        \n        self.cube_shape = cube_shape\n        if self.cube_shape != None:\n            self.num_frames = cube_shape[0]\n            self.num_features = cube_shape[1]\n            self.num_channels = cube_shape[2]\n\n\n    def __call__(self, sample):\n        feature, label = sample[\'feature\'], sample[\'label\']         \n\n        if self.cube_shape != None:\n            feature_cube = np.zeros((self.num_frames, self.num_features, self.num_channels), dtype=np.float32)\n            feature_cube = feature[0:self.num_frames, :, :]\n        else:\n            feature_cube = feature\n                 \n        \n        # return {\'feature\': feature_cube, \'label\': label}\n        return {\'feature\': feature_cube[None, :, :, :], \'label\': label}\n\n\nclass ToOutput(object):\n    """"""Return the output.\n\n    """"""\n\n    def __call__(self, sample):\n        feature, label = sample[\'feature\'], sample[\'label\']\n\n        return feature, label\n\nclass Compose(object):\n    """"""Composes several transforms together.\n    Args:\n        transforms (list of ``Transform`` objects): list of transforms to compose.\n    Example:\n        >>> Compose([\n        >>>     CMVN(),\n        >>>     Feature_Cube(cube_shape=(20, 80, 40),\n        >>>     augmentation=True), ToOutput(),\n        >>>        ])\n        If necessary, for the details of this class, please refer to Pytorch documentation.\n    """"""\n\n    def __init__(self, transforms):\n        self.transforms = transforms\n\n    def __call__(self, img):\n        for t in self.transforms:\n            img = t(img)\n        return img\n\n    def __repr__(self):\n        format_string = self.__class__.__name__ + \'(\'\n        for t in self.transforms:\n            format_string += \'\\n\'\n            format_string += \'    {0}\'.format(t)\n        format_string += \'\\n)\'\n        return format_string\n\n\nif __name__ == \'__main__\':\n    # add parser\n    parser = argparse.ArgumentParser(description=\'Input pipeline\')\n\n    # The text file in which the paths to the audio files are available.\n    # The path are relative to the directory of the audio files\n    # Format of each line of the txt file is ""class_label subject_dir/sound_file_name.ext""\n    # Example of each line: 0 subject/sound.wav\n    parser.add_argument(\'--file_path\',\n                        default=os.path.expanduser(\n                            \'~/github/3D-convolutional-speaker-recognition/code/0-input/file_path.txt\'),\n                        help=\'The file names for development phase\')\n\n    # The directory of the audio files separated by subject\n    parser.add_argument(\'--audio_dir\',\n                        default=os.path.expanduser(\'~/github/lip-reading-deeplearning/code/speech-input/Audio\'),\n                        help=\'Location of sound files\')\n    args = parser.parse_args()\n\n    dataset = AudioDataset(files_path=args.file_path, audio_dir=args.audio_dir,\n                           transform=Compose([Extract_Derivative(), Feature_Cube(cube_shape=None), ToOutput()]))\n    idx = 0\n    feature, label = dataset.__getitem__(idx)\n    print(feature.shape)\n    print(label)\n'"
