file_path,api_count,code
setup.py,1,"b'# Adapted from https://github.com/pybind/cmake_example/blob/master/setup.py\nimport os\nimport re\nimport sys\nimport platform\nimport subprocess\nimport importlib\nfrom sysconfig import get_paths\n\nfrom setuptools import setup, Extension\nfrom setuptools.command.build_ext import build_ext\nfrom setuptools.command.install import install\nfrom distutils.sysconfig import get_config_var\nfrom distutils.version import LooseVersion\n\nclass RemoveOldRednerBeforeInstall(install):\n    def run(self):\n        # Remove old redner packages installed by distutils\n        from distutils import sysconfig as sc\n        site_packages_dir = sc.get_python_lib()\n        import shutil\n        import glob\n        egg_info_path = glob.glob(os.path.join(site_packages_dir, \'redner-0.0.1-*.egg-info\'))\n        for p in egg_info_path:\n            try:\n                os.remove(p)\n            except:\n                print(\'Warning: detect old redner installation file {} and could not remove it. You may want to remove the file manually.\'.format(p))\n\n        install.run(self)\n\nclass CMakeExtension(Extension):\n    def __init__(self, name, sourcedir, build_with_cuda):\n        Extension.__init__(self, name, sources=[])\n        self.sourcedir = os.path.abspath(sourcedir)\n        self.build_with_cuda = build_with_cuda\n\nclass CopyExtension(Extension):\n    def __init__(self, name, filename_list):\n        Extension.__init__(self, name, sources=[])\n        self.filename_list = filename_list\n\nclass Build(build_ext):\n    def run(self):\n        try:\n            out = subprocess.check_output([\'cmake\', \'--version\'])\n        except OSError:\n            raise RuntimeError(""CMake must be installed to build the following extensions: "" +\n                               "", "".join(e.name for e in self.extensions))\n\n        super().run()\n\n    def build_extension(self, ext):\n        if isinstance(ext, CMakeExtension):\n            extdir = os.path.abspath(os.path.dirname(self.get_ext_fullpath(ext.name)))\n            info = get_paths()\n            include_path = info[\'include\']\n            cmake_args = [\'-DCMAKE_LIBRARY_OUTPUT_DIRECTORY=\' + extdir,\n                          \'-DPYTHON_INCLUDE_PATH=\' + include_path]\n\n            cfg = \'Debug\' if self.debug else \'Release\'\n            build_args = [\'--config\', cfg]\n\n            if platform.system() == ""Windows"":\n                cmake_args += [\'-DCMAKE_LIBRARY_OUTPUT_DIRECTORY_{}={}\'.format(cfg.upper(), extdir),\n                               \'-DCMAKE_RUNTIME_OUTPUT_DIRECTORY_{}={}\'.format(cfg.upper(), extdir)]\n                if sys.maxsize > 2**32:\n                    cmake_args += [\'-A\', \'x64\']\n                build_args += [\'--\', \'/m\']\n            else:\n                cmake_args += [\'-DCMAKE_BUILD_TYPE=\' + cfg]\n                build_args += [\'--\', \'-j8\']\n\n            if ext.build_with_cuda:\n                cmake_args += [\'-DREDNER_CUDA=1\']\n\n            env = os.environ.copy()\n            env[\'CXXFLAGS\'] = \'{} -DVERSION_INFO=\\\\""{}\\\\""\'.format(env.get(\'CXXFLAGS\', \'\'),\n                                                                  self.distribution.get_version())\n            if not os.path.exists(self.build_temp):\n                os.makedirs(self.build_temp)\n            subprocess.check_call([\'cmake\', ext.sourcedir] + cmake_args, cwd=self.build_temp, env=env)\n            subprocess.check_call([\'cmake\', \'--build\', \'.\'] + build_args, cwd=self.build_temp)\n        elif isinstance(ext, CopyExtension):\n            extdir = os.path.abspath(os.path.dirname(self.get_ext_fullpath(ext.name)))\n            # Copy the files to extdir\n            from shutil import copy\n            for f in ext.filename_list:\n                print(\'Copying {} to {}\'.format(f, extdir))\n                copy(f, extdir)\n        else:\n            super().build_extension(ext)\n\ntorch_spec = importlib.util.find_spec(""torch"")\ntf_spec = importlib.util.find_spec(""tensorflow"")\npackages = []\nbuild_with_cuda = False\nif torch_spec is not None:\n    packages.append(\'pyredner\')\n    import torch\n    if torch.cuda.is_available():\n        build_with_cuda = True\nif tf_spec is not None and sys.platform != \'win32\':\n    packages.append(\'pyredner_tensorflow\')\n    if not build_with_cuda:\n        import tensorflow as tf\n        if tf.test.is_gpu_available(cuda_only=True, min_cuda_compute_capability=None):\n            build_with_cuda = True\nif len(packages) == 0:\n    print(\'Error: PyTorch or Tensorflow must be installed. For Windows platform only PyTorch is supported.\')\n    exit()\n# Override build_with_cuda with environment variable\nif \'REDNER_CUDA\' in os.environ:\n    build_with_cuda = os.environ[\'REDNER_CUDA\'] == \'1\'\n\ndynamic_libraries = []\n# Make Embree and OptiX part of the package\nif sys.platform == \'darwin\':\n    dynamic_libraries.append(\'redner-dependencies/embree/lib-macos/libembree3.dylib\')\n    dynamic_libraries.append(\'redner-dependencies/embree/lib-macos/libtbb.dylib\')\n    dynamic_libraries.append(\'redner-dependencies/embree/lib-macos/libtbbmalloc.dylib\')\nelif sys.platform == \'linux\':\n    dynamic_libraries.append(\'redner-dependencies/embree/lib-linux/libembree3.so.3\')\n    dynamic_libraries.append(\'redner-dependencies/embree/lib-linux/libtbb.so.2\')\n    dynamic_libraries.append(\'redner-dependencies/embree/lib-linux/libtbbmalloc.so.2\')\n    if build_with_cuda:\n        dynamic_libraries.append(\'redner-dependencies/optix/lib64/liboptix_prime.so.1\')\nelif sys.platform == \'win32\':\n    dynamic_libraries.append(\'redner-dependencies/embree/bin/embree3.dll\')\n    dynamic_libraries.append(\'redner-dependencies/embree/bin/tbb.dll\')\n    dynamic_libraries.append(\'redner-dependencies/embree/bin/tbbmalloc.dll\')\n    if build_with_cuda:\n        dynamic_libraries.append(\'redner-dependencies/optix/bin64/optix_prime.1.dll\')\n\nproject_name = \'redner\'\nif \'PROJECT_NAME\' in os.environ:\n    project_name = os.environ[\'PROJECT_NAME\']\nsetup(name = project_name,\n      version = \'0.4.25\',\n      description = \'Differentiable rendering without approximation.\',\n      long_description = """"""redner is a differentiable renderer that can take the\n                            derivatives of rendering output with respect to arbitrary\n                            scene parameters, that is, you can backpropagate from the\n                            image to your 3D scene. One of the major usages of redner\n                            is inverse rendering (hence the name redner) through gradient\n                            descent. What sets redner apart are: 1) it computes correct\n                            rendering gradients stochastically without any approximation\n                            and 2) it has a physically-based mode -- which means it can\n                            simulate photons and produce realistic lighting phenomena,\n                            such as shadow and global illumination, and it handles the\n                            derivatives of these features correctly. You can also use\n                            redner in a fast deferred rendering mode for local shading:\n                            in this mode it still has correct gradient estimation and\n                            more elaborate material models compared to most differentiable\n                            renderers out there.\n                         """""",\n      url = \'https://github.com/BachiLi/redner\',\n      classifiers = [\n        \'Development Status :: 4 - Beta\',\n        \'License :: OSI Approved :: MIT License\',\n        \'Programming Language :: C++\',\n        \'Programming Language :: Python :: 3.6\',\n        \'Programming Language :: Python :: 3.7\',\n        \'Operating System :: MacOS\',\n        \'Operating System :: POSIX :: Linux\',\n        \'Topic :: Multimedia :: Graphics :: 3D Rendering\',\n        \'Topic :: Scientific/Engineering :: Artificial Intelligence\',\n        \'Topic :: Scientific/Engineering :: Image Recognition\'\n      ],\n      author = \'Tzu-Mao Li\',\n      author_email = \'tzumao@mit.edu\',\n      license = \'MIT\',\n      packages = packages,\n      ext_modules = [CMakeExtension(\'redner\', \'\', build_with_cuda),\n                     CopyExtension(\'redner-dependencies\', dynamic_libraries)],\n      cmdclass = dict(build_ext=Build, install=RemoveOldRednerBeforeInstall),\n      install_requires = [\'scikit-image\', \'imageio\'],\n      keywords = [\'rendering\',\n                  \'Monte Carlo ray tracing\',\n                  \'computer vision\',\n                  \'computer graphics\',\n                  \'differentiable rendering\',\n                  \'PyTorch\',\n                  \'TensorFlow\'],\n      zip_safe = False)\n'"
examples/joint_material_envmap_sh.py,0,"b'import torch\nimport math\nimport numpy as np\nimport pyredner\n\n# This is an example for setting up a spherical harmonics parameterized environment map\n# and jointly optimize for the spherical harmonics coefficients and object materials\n\n# Use GPU if available\npyredner.set_use_gpu(torch.cuda.is_available())\n\n# Setup camera\ncam = pyredner.Camera(position = torch.tensor([0.0, 0.0, -5.0]),\n                      look_at = torch.tensor([0.0, 0.0, 0.0]),\n                      up = torch.tensor([0.0, 1.0, 0.0]),\n                      fov = torch.tensor([45.0]), # in degree\n                      clip_near = 1e-2, # needs to > 0\n                      resolution = (256, 256),\n                      fisheye = False)\n\n# Setup material\nmat_grey = pyredner.Material(\\\n    diffuse_reflectance = \\\n        torch.tensor([0.4, 0.4, 0.4], device = pyredner.get_device()),\n    specular_reflectance = \\\n        torch.tensor([0.5, 0.5, 0.5], device = pyredner.get_device()),\n    roughness = \\\n        torch.tensor([0.02], device = pyredner.get_device()))\nmaterials = [mat_grey]\n\n# Setup scene geometry: we use the utility function ""generate_sphere"" to generate a sphere\n# triangle mesh\nvertices, indices, uvs, normals = pyredner.generate_sphere(128, 64)\nshape_sphere = pyredner.Shape(\\\n    vertices = vertices,\n    indices = indices,\n    uvs = uvs,\n    normals = normals,\n    material_id = 0)\nshapes = [shape_sphere]\n\n# Setup lighting: the scene is lit by a single environment map, parameterized by 3rd-order\n# spherical harmonics coefficients.\n# First we setup the target coefficients for r, g, b,\n# taken from https://cseweb.ucsd.edu/~ravir/papers/envmap/envmap.pdf\n# Last 7 coefficients are randomly determined\ncoeffs = torch.tensor([[ 0.79,\n                         0.39, -0.35, -0.34,\n                        -0.11, -0.26, -0.16,  0.56,  0.21,\n                         0.10,  0.05, -0.20, -0.03, -0.10, -0.30, -0.01], # coeffs for red\n                       [ 0.44,\n                         0.35, -0.18, -0.06,\n                        -0.05, -0.22, -0.09,  0.21, -0.05,\n                         0.03,  0.07, -0.01, -0.09, -0.06,  0.03, 0.05], # coeffs for green\n                       [ 0.54,\n                         0.60, -0.27,  0.01,\n                        -0.12, -0.47, -0.15,  0.14, -0.30,\n                         0.10,  0.04,  0.08, -0.10, -0.02, -0.07, 0.06]], # coeffs for blue\n                       device = pyredner.get_device())\n# Deringing: directly using the original coefficients creates aliasing due to truncation,\n#            which results in negative values in the environment map when we rasterize the coefficients.\n#            Our solution is to multiply (convolve in sptial domain) the coefficients with a low pass\n#            filter.\n#            Following the recommendation in https://www.ppsloan.org/publications/shdering.pdf\n#            We use sinc^4 filter with a window size of 6\ndef deringing(coeffs, window):\n    deringed_coeffs = torch.zeros_like(coeffs)\n    deringed_coeffs[:, 0] += coeffs[:, 0]\n    deringed_coeffs[:, 1:1 + 3] += \\\n        coeffs[:, 1:1 + 3] * math.pow(math.sin(math.pi * 1.0 / window) / (math.pi * 1.0 / window), 4.0)\n    deringed_coeffs[:, 4:4 + 5] += \\\n        coeffs[:, 4:4 + 5] * math.pow(math.sin(math.pi * 2.0 / window) / (math.pi * 2.0 / window), 4.0)\n    deringed_coeffs[:, 9:9 + 7] += \\\n        coeffs[:, 9:9 + 7] * math.pow(math.sin(math.pi * 3.0 / window) / (math.pi * 3.0 / window), 4.0)\n    return deringed_coeffs\nderinged_coeffs = deringing(coeffs, 6.0)\nres = (256, 128)\n# We call the utility function SH_reconstruct to rasterize the coefficients into an envmap\nenvmap = pyredner.SH_reconstruct(deringed_coeffs, res)\n# Save the target envmap\npyredner.imwrite(envmap.cpu(), \'results/joint_material_envmap_sh/target_envmap.exr\')\n# Convert the PyTorch tensor into pyredner compatible envmap\nenvmap = pyredner.EnvironmentMap(envmap)\n# Setup the scene\nscene = pyredner.Scene(camera = cam,\n                       shapes = shapes,\n                       materials = materials,\n                       envmap = envmap)\n# Serialize the scene\nscene_args = pyredner.RenderFunction.serialize_scene(\\\n    scene = scene,\n    num_samples = 512,\n    max_bounces = 1)\n# Render the target\nrender = pyredner.RenderFunction.apply\nimg = render(0, *scene_args)\n# Save the target image\npyredner.imwrite(img.cpu(), \'results/joint_material_envmap_sh/target.exr\')\npyredner.imwrite(img.cpu(), \'results/joint_material_envmap_sh/target.png\')\n# Read the target image back\ntarget = pyredner.imread(\'results/joint_material_envmap_sh/target.exr\')\nif pyredner.get_use_gpu():\n    target = target.cuda()\n\n# Reset the coefficients to some constant color, repeat the same process as in target envmap\ncoeffs = torch.tensor([[ 0.5,\n                         0.0, 0.0, 0.0,\n                         0.0, 0.0, 0.0, 0.0, 0.0,\n                         0.0, 0.0, 0.0, 0.0, 0.0, 0.0, 0.0], # coeffs for red\n                       [ 0.5,\n                         0.0, 0.0, 0.0,\n                         0.0, 0.0, 0.0, 0.0, 0.0,\n                         0.0, 0.0, 0.0, 0.0, 0.0, 0.0, 0.0], # coeffs for green\n                       [ 0.5,\n                         0.0, 0.0, 0.0,\n                         0.0, 0.0, 0.0, 0.0, 0.0,\n                         0.0, 0.0, 0.0, 0.0, 0.0, 0.0, 0.0]], # coeffs for blue\n                       device = pyredner.get_device(),\n                       requires_grad = True)\nderinged_coeffs = deringing(coeffs, 6.0)\nenvmap = pyredner.SH_reconstruct(deringed_coeffs, res)\npyredner.imwrite(envmap.cpu(), \'results/joint_material_envmap_sh/init_envmap.exr\')\nenvmap = pyredner.EnvironmentMap(envmap)\n# Also reset the material since we want to do joint estimation\n# We use an intermediate ""param"" variable and then take absolute value of it to avoid negative values\n# A better way to resolve this is to use projective SGD\ndiffuse_reflectance_param = \\\n    torch.tensor([0.3, 0.3, 0.3], device = pyredner.get_device(), requires_grad = True)\nspecular_reflectance_param = \\\n    torch.tensor([0.3, 0.3, 0.3], device = pyredner.get_device(), requires_grad = True)\nroughness_param = torch.tensor([0.3], device = pyredner.get_device(), requires_grad = True)\ndiffuse_reflectance = diffuse_reflectance_param.abs()\nspecular_reflectance = specular_reflectance_param.abs()\nroughness = roughness_param.abs() \nmat_grey = pyredner.Material(\\\n    diffuse_reflectance = diffuse_reflectance,\n    specular_reflectance = specular_reflectance,\n    roughness = roughness)\nmaterials = [mat_grey]\nscene = pyredner.Scene(camera = cam,\n                       shapes = shapes,\n                       materials = materials,\n                       envmap = envmap)\nscene_args = pyredner.RenderFunction.serialize_scene(\\\n    scene = scene,\n    num_samples = 512,\n    max_bounces = 1)\nimg = render(1, *scene_args)\npyredner.imwrite(img.cpu(), \'results/joint_material_envmap_sh/init.png\')\ndiff = torch.abs(target - img)\npyredner.imwrite(diff.cpu(), \'results/joint_material_envmap_sh/init_diff.png\')\n\n# Finally we can start the Adam iteration\noptimizer = torch.optim.Adam(\\\n    [coeffs, diffuse_reflectance_param, specular_reflectance_param, roughness_param], lr=3e-2)\nfor t in range(400):\n    print(\'iteration:\', t)\n    optimizer.zero_grad()\n    # Repeat the envmap generation & material for the gradients\n    deringed_coeffs = deringing(coeffs, 6.0)\n    envmap = pyredner.SH_reconstruct(deringed_coeffs, res)\n    pyredner.imwrite(envmap.cpu(), \'results/joint_material_envmap_sh/envmap_{}.exr\'.format(t))\n    envmap = pyredner.EnvironmentMap(envmap)\n    diffuse_reflectance = diffuse_reflectance_param.abs()\n    specular_reflectance = specular_reflectance_param.abs()\n    roughness = roughness_param.abs() # avoid going below zero\n    materials[0] = pyredner.Material(\\\n        diffuse_reflectance = diffuse_reflectance,\n        specular_reflectance = specular_reflectance,\n        roughness = roughness)\n    scene = pyredner.Scene(camera = cam,\n                           shapes = shapes,\n                           materials = materials,\n                           envmap = envmap)\n    scene_args = pyredner.RenderFunction.serialize_scene(\\\n        scene = scene,\n        num_samples = 4,\n        max_bounces = 1)\n    img = render(t+1, *scene_args)\n    pyredner.imwrite(img.cpu(), \'results/joint_material_envmap_sh/iter_{}.png\'.format(t))\n    loss = torch.pow(img - target, 2).sum()\n    print(\'loss:\', loss.item())\n\n    loss.backward()\n    optimizer.step()\n\n    # Print the gradients of the coefficients, material parameters\n    print(\'coeffs.grad:\', coeffs.grad)\n    print(\'diffuse_reflectance_param.grad:\', diffuse_reflectance_param.grad)\n    print(\'specular_reflectance_param.grad:\', specular_reflectance_param.grad)\n    print(\'roughness_param.grad:\', roughness_param.grad)\n    # Print the current parameters\n    print(\'coeffs:\', coeffs)\n    print(\'diffuse_reflectance:\', diffuse_reflectance)\n    print(\'specular_reflectance:\', specular_reflectance)\n    print(\'roughness:\', roughness)\n\nscene_args = pyredner.RenderFunction.serialize_scene(\\\n    scene = scene,\n    num_samples = 512,\n    max_bounces = 1)\nimg = render(202, *scene_args)\npyredner.imwrite(img.cpu(), \'results/joint_material_envmap_sh/final.exr\')\npyredner.imwrite(img.cpu(), \'results/joint_material_envmap_sh/final.png\')\npyredner.imwrite(torch.abs(target - img).cpu(), \'results/joint_material_envmap_sh/final_diff.png\')\n\nfrom subprocess import call\ncall([""ffmpeg"", ""-framerate"", ""24"", ""-i"",\n    ""results/joint_material_envmap_sh/iter_%d.png"", ""-vb"", ""20M"",\n    ""results/joint_material_envmap_sh/out.mp4""])\n'"
examples/two_d_mesh.py,0,"b'import pyredner\nimport numpy as np\nimport torch\nimport redner\n\n# Optimize vertices of 2D meshes\n\n# Use GPU if available\npyredner.set_use_gpu(torch.cuda.is_available())\n\n# Setup camera: We place the camera at (0, 0, -1), with look vector\n#               (0, 0, 1). We also use an orthographic camera just to\n#               make the projection more ""2D"": the depth is only used\n#               for determining the order of the meshes.\ncam = pyredner.Camera(position = torch.tensor([0.0, 0.0, -1.0]),\n                      look_at = torch.tensor([0.0, 0.0, 0.0]),\n                      up = torch.tensor([0.0, 1.0, 0.0]),\n                      fov = torch.tensor([45.0]), # in degree\n                      clip_near = 1e-2, # needs to > 0\n                      resolution = (256, 256),\n                      camera_type = redner.CameraType.orthographic)\n\n# The materials: \nmat_quad = pyredner.Material(\\\n    diffuse_reflectance = torch.tensor([0.75, 0.75, 0.25],\n    device = pyredner.get_device()))\nmat_tri = pyredner.Material(\\\n    diffuse_reflectance = torch.tensor([0.9, 0.35, 0.35],\n    device = pyredner.get_device()))\nmaterials = [mat_quad, mat_tri]\n\n# We\'ll have a quad and a triangle as our meshes.\n# First we define the 2D coordinates. The size of the screen is\n# from -1.0 to 1.0. Y is pointing up.\nquad_vertices_2d = torch.tensor(\\\n    [[-0.3, 0.5], [0.2, 0.6], [-0.5, -0.3], [0.5, -0.4]],\n    device = pyredner.get_device())\ntri_vertices_2d = torch.tensor(\\\n    [[-0.6, 0.3], [0.4, 0.5], [-0.1, -0.2]],\n    device = pyredner.get_device())\n# We need to pad the depth coordinates for these vertices\n# We\'ll assign depth = 1 for the quad, depth = 0 for the triangle,\n# so the triangle will block the quad.\nquad_vertices = torch.cat((quad_vertices_2d,\n    torch.ones(quad_vertices_2d.shape[0], 1, device = pyredner.get_device())), dim=1).contiguous()\ntri_vertices = torch.cat((tri_vertices_2d,\n    torch.zeros(tri_vertices_2d.shape[0], 1, device = pyredner.get_device())), dim=1).contiguous()\nquad_indices = torch.tensor([[0, 1, 2], [1, 2, 3]], dtype = torch.int32, device = pyredner.get_device())\ntri_indices = torch.tensor([[0, 1, 2]], dtype = torch.int32, device = pyredner.get_device())\nshape_quad = pyredner.Shape(\\\n    vertices = quad_vertices,\n    indices = quad_indices,\n    material_id = 0)\nshape_tri = pyredner.Shape(\\\n    vertices = tri_vertices,\n    indices = tri_indices,\n    material_id = 1)\nshapes = [shape_quad, shape_tri]\n\n# Setup the scene. We don\'t need lights.\nscene = pyredner.Scene(camera = cam,\n                       shapes = shapes,\n                       materials = materials)\n# We output the shape id, so that we can shape it later\nargs = pyredner.RenderFunction.serialize_scene(\\\n    scene = scene,\n    num_samples = 16,\n    # Set max bounces to 0, we don\'t need lighting.\n    max_bounces = 0,\n    # Use the diffuse color as the output\n    channels = [redner.channels.diffuse_reflectance])\n\n# Render the scene as our target image.\nrender = pyredner.RenderFunction.apply\nimg = render(0, *args)\npyredner.imwrite(img.cpu(), \'results/two_d_mesh/target.exr\')\npyredner.imwrite(img.cpu(), \'results/two_d_mesh/target.png\')\ntarget = pyredner.imread(\'results/two_d_mesh/target.exr\')\nif pyredner.get_use_gpu():\n    target = target.cuda(device = pyredner.get_device())\n\n# Perturb the scene, this is our initial guess\nquad_vertices_2d = torch.tensor(\\\n    [[-0.5, 0.3], [0.3, 0.4], [-0.7, -0.2], [0.4, -0.3]],\n    device = pyredner.get_device(),\n    requires_grad = True)\ntri_vertices_2d = torch.tensor(\\\n    [[-0.5, 0.4], [0.4, 0.6], [-0.0, -0.3]],\n    device = pyredner.get_device(),\n    requires_grad = True)\n# Need to redo the concatenation\nshape_quad.vertices = torch.cat((quad_vertices_2d,\n    torch.ones(quad_vertices_2d.shape[0], 1, device = pyredner.get_device())), dim=1).contiguous()\nshape_tri.vertices = torch.cat((tri_vertices_2d,\n    torch.zeros(tri_vertices_2d.shape[0], 1, device = pyredner.get_device())), dim=1).contiguous()\nargs = pyredner.RenderFunction.serialize_scene(\\\n    scene = scene,\n    num_samples = 16,\n    # Set max bounces to 0, we don\'t need lighting.\n    max_bounces = 0,\n    # Use the diffuse color as the output\n    channels = [redner.channels.diffuse_reflectance])\n# Render the initial guess.\nrender = pyredner.RenderFunction.apply\nimg = render(0, *args)\npyredner.imwrite(img.cpu(), \'results/two_d_mesh/init.exr\')\npyredner.imwrite(img.cpu(), \'results/two_d_mesh/init.png\')\n\n# Optimize for mesh vertices\noptimizer = torch.optim.Adam([quad_vertices_2d, tri_vertices_2d], lr=4e-2)\nfor t in range(200):\n    print(\'iteration:\', t)\n    optimizer.zero_grad()\n    # Forward pass: render the image\n    # Need to redo the concatenation\n    shape_quad.vertices = torch.cat((quad_vertices_2d,\n        torch.ones(quad_vertices_2d.shape[0], 1, device = pyredner.get_device())), dim=1).contiguous()\n    shape_tri.vertices = torch.cat((tri_vertices_2d,\n        torch.zeros(tri_vertices_2d.shape[0], 1, device = pyredner.get_device())), dim=1).contiguous()\n    args = pyredner.RenderFunction.serialize_scene(\\\n        scene = scene,\n        num_samples = 1,\n        max_bounces = 0,\n        channels = [redner.channels.diffuse_reflectance])\n    img = render(t+1, *args)\n    pyredner.imwrite(img.cpu(), \'results/two_d_mesh/iter_{}.png\'.format(t))\n    loss = (img - target).pow(2).sum()\n    print(\'loss:\', loss.item())\n\n    loss.backward()\n    print(\'quad_vertices_2d.grad:\', quad_vertices_2d.grad)\n    print(\'tri_vertices_2d.grad:\', tri_vertices_2d.grad)\n\n    optimizer.step()\n    print(\'quad_vertices_2d:\', quad_vertices_2d)\n    print(\'tri_vertices_2d:\', tri_vertices_2d)\n\nshape_quad.vertices = torch.cat((quad_vertices_2d,\n    torch.ones(quad_vertices_2d.shape[0], 1, device = pyredner.get_device())), dim=1).contiguous()\nshape_tri.vertices = torch.cat((tri_vertices_2d,\n    torch.zeros(tri_vertices_2d.shape[0], 1, device = pyredner.get_device())), dim=1).contiguous()\nargs = pyredner.RenderFunction.serialize_scene(\\\n    scene = scene,\n    num_samples = 16,\n    max_bounces = 0,\n    channels = [redner.channels.diffuse_reflectance])\nimg = render(t+1, *args)\n\npyredner.imwrite(img.cpu(), \'results/two_d_mesh/final.exr\')\npyredner.imwrite(img.cpu(), \'results/two_d_mesh/final.png\')\npyredner.imwrite(torch.abs(target - img).cpu(), \'results/two_d_mesh/final_diff.png\')\n\nfrom subprocess import call\ncall([""ffmpeg"", ""-framerate"", ""24"", ""-i"",\n    ""results/two_d_mesh/iter_%d.png"", ""-vb"", ""20M"",\n    ""results/two_d_mesh/out.mp4""])\n'"
