file_path,api_count,code
main.py,8,"b'import gym\nimport random\nimport logging\nimport tensorflow as tf\n\nfrom utils import get_model_dir\nfrom networks.cnn import CNN\nfrom networks.mlp import MLPSmall\nfrom agents.statistic import Statistic\nfrom environments.environment import ToyEnvironment, AtariEnvironment\n\nflags = tf.app.flags\n\n# Deep q Network\nflags.DEFINE_boolean(\'use_gpu\', True, \'Whether to use gpu or not. gpu use NHWC and gpu use NCHW for data_format\')\nflags.DEFINE_string(\'agent_type\', \'DQN\', \'The type of agent [DQN]\')\nflags.DEFINE_boolean(\'double_q\', False, \'Whether to use double Q-learning\')\nflags.DEFINE_string(\'network_header_type\', \'nips\', \'The type of network header [mlp, nature, nips]\')\nflags.DEFINE_string(\'network_output_type\', \'normal\', \'The type of network output [normal, dueling]\')\n\n# Environment\nflags.DEFINE_string(\'env_name\', \'Breakout-v0\', \'The name of gym environment to use\')\nflags.DEFINE_integer(\'n_action_repeat\', 1, \'The number of actions to repeat\')\nflags.DEFINE_integer(\'max_random_start\', 30, \'The maximum number of NOOP actions at the beginning of an episode\')\nflags.DEFINE_integer(\'history_length\', 4, \'The length of history of observation to use as an input to DQN\')\nflags.DEFINE_integer(\'max_r\', +1, \'The maximum value of clipped reward\')\nflags.DEFINE_integer(\'min_r\', -1, \'The minimum value of clipped reward\')\nflags.DEFINE_string(\'observation_dims\', \'[80, 80]\', \'The dimension of gym observation\')\nflags.DEFINE_boolean(\'random_start\', True, \'Whether to start with random state\')\nflags.DEFINE_boolean(\'use_cumulated_reward\', False, \'Whether to use cumulated reward or not\')\n\n# Training\nflags.DEFINE_boolean(\'is_train\', True, \'Whether to do training or testing\')\nflags.DEFINE_integer(\'max_delta\', None, \'The maximum value of delta\')\nflags.DEFINE_integer(\'min_delta\', None, \'The minimum value of delta\')\nflags.DEFINE_float(\'ep_start\', 1., \'The value of epsilon at start in e-greedy\')\nflags.DEFINE_float(\'ep_end\', 0.01, \'The value of epsilnon at the end in e-greedy\')\nflags.DEFINE_integer(\'batch_size\', 32, \'The size of batch for minibatch training\')\nflags.DEFINE_integer(\'max_grad_norm\', None, \'The maximum norm of gradient while updating\')\nflags.DEFINE_float(\'discount_r\', 0.99, \'The discount factor for reward\')\n\n# Timer\nflags.DEFINE_integer(\'t_train_freq\', 4, \'\')\n\n# Below numbers will be multiplied by scale\nflags.DEFINE_integer(\'scale\', 10000, \'The scale for big numbers\')\nflags.DEFINE_integer(\'memory_size\', 100, \'The size of experience memory (*= scale)\')\nflags.DEFINE_integer(\'t_target_q_update_freq\', 1, \'The frequency of target network to be updated (*= scale)\')\nflags.DEFINE_integer(\'t_test\', 1, \'The maximum number of t while training (*= scale)\')\nflags.DEFINE_integer(\'t_ep_end\', 100, \'The time when epsilon reach ep_end (*= scale)\')\nflags.DEFINE_integer(\'t_train_max\', 5000, \'The maximum number of t while training (*= scale)\')\nflags.DEFINE_float(\'t_learn_start\', 5, \'The time when to begin training (*= scale)\')\nflags.DEFINE_float(\'learning_rate_decay_step\', 5, \'The learning rate of training (*= scale)\')\n\n# Optimizer\nflags.DEFINE_float(\'learning_rate\', 0.00025, \'The learning rate of training\')\nflags.DEFINE_float(\'learning_rate_minimum\', 0.00025, \'The minimum learning rate of training\')\nflags.DEFINE_float(\'learning_rate_decay\', 0.96, \'The decay of learning rate of training\')\nflags.DEFINE_float(\'decay\', 0.99, \'Decay of RMSProp optimizer\')\nflags.DEFINE_float(\'momentum\', 0.0, \'Momentum of RMSProp optimizer\')\nflags.DEFINE_float(\'gamma\', 0.99, \'Discount factor of return\')\nflags.DEFINE_float(\'beta\', 0.01, \'Beta of RMSProp optimizer\')\n\n# Debug\nflags.DEFINE_boolean(\'display\', False, \'Whether to do display the game screen or not\')\nflags.DEFINE_string(\'log_level\', \'INFO\', \'Log level [DEBUG, INFO, WARNING, ERROR, CRITICAL]\')\nflags.DEFINE_integer(\'random_seed\', 123, \'Value of random seed\')\nflags.DEFINE_string(\'tag\', \'\', \'The name of tag for a model, only for debugging\')\nflags.DEFINE_boolean(\'allow_soft_placement\', True, \'Whether to use part or all of a GPU\')\n#flags.DEFINE_string(\'gpu_fraction\', \'1/1\', \'idx / # of gpu fraction e.g. 1/3, 2/3, 3/3\')\n\n# Internal\n# It is forbidden to set a flag that is not defined\nflags.DEFINE_string(\'data_format\', \'NCHW\', \'INTERNAL USED ONLY\')\n\ndef calc_gpu_fraction(fraction_string):\n  idx, num = fraction_string.split(\'/\')\n  idx, num = float(idx), float(num)\n\n  fraction = 1 / (num - idx + 1)\n  print ("" [*] GPU : %.4f"" % fraction)\n  return fraction\n\nconf = flags.FLAGS\n\nif conf.agent_type == \'DQN\':\n  from agents.deep_q import DeepQ\n  TrainAgent = DeepQ\nelse:\n  raise ValueError(\'Unknown agent_type: %s\' % conf.agent_type)\n\nlogger = logging.getLogger()\nlogger.propagate = False\nlogger.setLevel(conf.log_level)\n\n# set random seed\ntf.set_random_seed(conf.random_seed)\nrandom.seed(conf.random_seed)\n\ndef main(_):\n  # preprocess\n  conf.observation_dims = eval(conf.observation_dims)\n\n  for flag in [\'memory_size\', \'t_target_q_update_freq\', \'t_test\',\n               \'t_ep_end\', \'t_train_max\', \'t_learn_start\', \'learning_rate_decay_step\']:\n    setattr(conf, flag, getattr(conf, flag) * conf.scale)\n\n  if conf.use_gpu:\n    conf.data_format = \'NCHW\'\n  else:\n    conf.data_format = \'NHWC\'\n\n  model_dir = get_model_dir(conf,\n      [\'use_gpu\', \'max_random_start\', \'n_worker\', \'is_train\', \'memory_size\', \'gpu_fraction\',\n       \'t_save\', \'t_train\', \'display\', \'log_level\', \'random_seed\', \'tag\', \'scale\'])\n\n  # start\n  #gpu_options = tf.GPUOptions(\n  #    per_process_gpu_memory_fraction=calc_gpu_fraction(conf.gpu_fraction))\n\n  sess_config = tf.ConfigProto(\n      log_device_placement=False, allow_soft_placement=conf.allow_soft_placement)\n  sess_config.gpu_options.allow_growth = conf.allow_soft_placement\n\n  with tf.Session(config=sess_config) as sess:\n    if any(name in conf.env_name for name in [\'Corridor\', \'FrozenLake\']) :\n      env = ToyEnvironment(conf.env_name, conf.n_action_repeat,\n                           conf.max_random_start, conf.observation_dims,\n                           conf.data_format, conf.display, conf.use_cumulated_reward)\n    else:\n      env = AtariEnvironment(conf.env_name, conf.n_action_repeat,\n                             conf.max_random_start, conf.observation_dims,\n                             conf.data_format, conf.display, conf.use_cumulated_reward)\n\n    if conf.network_header_type in [\'nature\', \'nips\']:\n      pred_network = CNN(sess=sess,\n                         data_format=conf.data_format,\n                         history_length=conf.history_length,\n                         observation_dims=conf.observation_dims,\n                         output_size=env.env.action_space.n,\n                         network_header_type=conf.network_header_type,\n                         name=\'pred_network\', trainable=True)\n      target_network = CNN(sess=sess,\n                           data_format=conf.data_format,\n                           history_length=conf.history_length,\n                           observation_dims=conf.observation_dims,\n                           output_size=env.env.action_space.n,\n                           network_header_type=conf.network_header_type,\n                           name=\'target_network\', trainable=False)\n    elif conf.network_header_type == \'mlp\':\n      pred_network = MLPSmall(sess=sess,\n                              data_format=conf.data_format,\n                              observation_dims=conf.observation_dims,\n                              history_length=conf.history_length,\n                              output_size=env.env.action_space.n,\n                              hidden_activation_fn=tf.sigmoid,\n                              network_output_type=conf.network_output_type,\n                              name=\'pred_network\', trainable=True)\n      target_network = MLPSmall(sess=sess,\n                                data_format=conf.data_format,\n                                observation_dims=conf.observation_dims,\n                                history_length=conf.history_length,\n                                output_size=env.env.action_space.n,\n                                hidden_activation_fn=tf.sigmoid,\n                                network_output_type=conf.network_output_type,\n                                name=\'target_network\', trainable=False)\n    else:\n      raise ValueError(\'Unkown network_header_type: %s\' % (conf.network_header_type))\n\n    stat = Statistic(sess, conf.t_test, conf.t_learn_start, model_dir, pred_network.var.values())\n    agent = TrainAgent(sess, pred_network, env, stat, conf, target_network=target_network)\n\n    if conf.is_train:\n      agent.train(conf.t_train_max)\n    else:\n      agent.play(conf.ep_end)\n\nif __name__ == \'__main__\':\n  tf.app.run()\n'"
utils.py,0,"b'import os\nimport time\nimport tensorflow as tf\nfrom six.moves import range\nfrom logging import getLogger\n\nlogger = getLogger(__name__)\n\ndef get_model_dir(config, exceptions=None):\n  keys = dir(config)\n  keys.sort()\n  keys.remove(\'env_name\')\n  keys = [\'env_name\'] + keys\n\n  names = [config.env_name]\n  for key in keys:\n    # Only use useful flags\n    if key not in exceptions:\n      value = getattr(config, key)\n      names.append(\n        ""%s=%s"" % (key, "","".join([str(i) for i in value])\n                   if type(value) == list else value))\n\n  return os.path.join(\'checkpoints\', *names) + \'/\'\n\ndef timeit(f):\n  def timed(*args, **kwargs):\n    start_time = time.time()\n    result = f(*args, **kwargs)\n    end_time = time.time()\n\n    logger.info(""%s : %2.2f sec"" % (f.__name__, end_time - start_time))\n    return result\n  return timed\n'"
agents/__init__.py,0,b''
agents/_async.py,11,"b'import os\nimport time\nimport numpy as np\nimport tensorflow as tf\nfrom threading import Thread\nfrom logging import getLogger\n\nfrom .agent import Agent\nfrom .history import History\nfrom .experience import Experience\n\nlogger = getLogger(__name__)\n\nclass Async(Agent):\n  def __init__(self, sess, pred_network, env, stat, conf, target_network=None):\n    super(DeepQ, self).__init__(sess, pred_network, target_network, env, stat, conf)\n\n    raise Exception(""[!] Not fully implemented yet"")\n\n    # Optimizer\n    with tf.variable_scope(\'optimizer\'):\n      self.targets = tf.placeholder(\'float32\', [None], name=\'target_q_t\')\n      self.actions = tf.placeholder(\'int64\', [None], name=\'action\')\n\n      actions_one_hot = tf.one_hot(self.actions, self.env.action_size, 1.0, 0.0, name=\'action_one_hot\')\n      pred_q = tf.reduce_sum(self.pred_network.outputs * actions_one_hot, reduction_indices=1, name=\'q_acted\')\n\n      self.delta = self.targets - pred_q\n      if self.max_delta and self.min_delta:\n        self.delta = tf.clip_by_value(self.delta, self.min_delta, self.max_delta, name=\'clipped_delta\')\n\n      self.loss = tf.reduce_mean(tf.square(self.delta), name=\'loss\')\n\n      self.learning_rate_op = tf.maximum(self.learning_rate_minimum,\n          tf.train.exponential_decay(\n              self.learning_rate,\n              self.stat.t_op,\n              self.learning_rate_decay_step,\n              self.learning_rate_decay,\n              staircase=True))\n\n      optimizer = tf.train.RMSPropOptimizer(\n        self.learning_rate_op, momentum=0.95, epsilon=0.01)\n      \n      grads_and_vars = optimizer.compute_gradients(self.loss)\n      for idx, (grad, var) in enumerate(grads_and_vars):\n        if grad is not None:\n          grads_and_vars[idx] = (tf.clip_by_norm(grad, self.max_grad_norm), var)\n      self.optim = optimizer.apply_gradients(grads_and_vars)\n\n\n  def train(self, max_t, global_t):\n    self.global_t = global_t\n\n    # 0. Prepare training\n    state, reward, terminal = self.env.new_random_game()\n    self.observe(state, reward, terminal)\n\n    while True:\n      if global_t[0] > self.t_train_max:\n        break\n\n      # 1. Predict\n      action = self.predict(state)\n      # 2. Step\n      state, reward, terminal = self.env.step(action, is_training=True)\n      # 3. Observe\n      self.observe(state, reward, terminal)\n\n      if terminal:\n        observation, reward, terminal = self.new_game()\n\n      global_t[0] += 1\n\n  def train_with_log(self, max_t, global_t):\n    from tqdm import tqdm\n\n    for _ in tqdm(range(max_t), ncols=70, initial=int(global_t[0])):\n      if global_t[0] > self.t_train_max:\n        break\n\n      # 1. Predict\n      action = self.predict(state)\n      # 2. Step\n      state, reward, terminal = self.env.step(-1, is_training=True)\n      # 3. Observe\n      self.observe(state, reward, terminal)\n\n      if terminal:\n        observation, reward, terminal = self.new_game()\n\n      global_t[0] += 1\n\n    if self.stat:\n      self.stat.on_step(self.t, action, reward, terminal,\n                        ep, q, loss, is_update, self.learning_rate_op)\n\n  def observe(self, s_t, r_t, terminal):\n    self.prev_r[self.t] = max(self.min_reward, min(self.max_reward, r_t))\n\n    if (terminal and self.t_start < self.t) or self.t - self.t_start == self.t_max:\n      r = {}\n\n      lr = (self.t_train_max - self.global_t[0] + 1) / self.t_train_max * self.learning_rate\n\n      if terminal:\n        r[self.t] = 0.\n      else:\n        r[self.t] = self.sess.partial_run(\n            self.partial_graph,\n            self.networks[self.t_start - self.t].value,\n        )[0][0]\n\n      for t in range(self.t - 1, self.t_start - 1, -1):\n        r[t] = self.prev_r[t] + self.gamma * r[t + 1]\n\n      data = {}\n      data.update({\n        self.networks[t].R: [r[t + self.t_start]] for t in range(len(self.prev_r) - 1)\n      })\n      data.update({\n        self.networks[t].true_log_policy:\n          [self.prev_log_policy[t + self.t_start]] for t in range(len(self.prev_r) - 1)\n      })\n      data.update({\n        self.learning_rate_op: lr,\n      })\n\n      # 1. Update accumulated gradients\n      if not self.writer:\n        self.sess.partial_run(self.partial_graph,\n            [self.add_accum_grads[t] for t in range(len(self.prev_r) - 1)], data)\n      else:\n        results = self.sess.partial_run(self.partial_graph,\n            [self.value_policy_summary] + [self.add_accum_grads[t] for t in range(len(self.prev_r) - 1)], data)\n\n        summary_str = results[0]\n        self.writer.add_summary(summary_str, self.global_t[0])\n\n      # 2. Update global w with accumulated gradients\n      self.sess.run(self.apply_gradient, {\n        self.learning_rate_op: lr,\n      })\n\n      # 3. Reset accumulated gradients to zero\n      self.sess.run(self.reset_accum_grad)\n\n      # 4. Copy weights of global_network to local_network\n      self.networks[0].copy_from_global()\n\n      self.prev_r = {self.t: self.prev_r[self.t]}\n      self.t_start = self.t\n\n      del self.partial_graph\n'"
agents/_n_step_q.py,17,"b'import os\nimport time\nimport numpy as np\nimport tensorflow as tf\nfrom logging import getLogger\n\nfrom .agent import Agent\nfrom .history import History\nfrom .experience import Experience\n\nlogger = getLogger(__name__)\n\nclass NStepQ(Agent):\n  def __init__(self, sess, pred_network, env, stat, conf, target_network=None):\n    super(DeepQ, self).__init__(sess, pred_network, target_network, env, stat, conf)\n\n    raise Exception(""[!] Not fully implemented yet"")\n\n    # Optimizer\n    with tf.variable_scope(\'optimizer\'):\n      self.targets = tf.placeholder(\'float32\', [None], name=\'target_q_t\')\n      self.actions = tf.placeholder(\'int64\', [None], name=\'action\')\n\n      actions_one_hot = tf.one_hot(self.actions, self.env.action_size, 1.0, 0.0, name=\'action_one_hot\')\n      pred_q = tf.reduce_sum(self.pred_network.outputs * actions_one_hot, reduction_indices=1, name=\'q_acted\')\n\n      self.delta = self.targets - pred_q\n      if self.max_delta and self.min_delta:\n        self.delta = tf.clip_by_value(self.delta, self.min_delta, self.max_delta, name=\'clipped_delta\')\n\n      self.loss = tf.reduce_mean(tf.square(self.delta), name=\'loss\')\n\n      self.learning_rate_op = tf.maximum(self.learning_rate_minimum,\n          tf.train.exponential_decay(\n              self.learning_rate,\n              self.stat.t_op,\n              self.learning_rate_decay_step,\n              self.learning_rate_decay,\n              staircase=True))\n\n      optimizer = tf.train.RMSPropOptimizer(\n        self.learning_rate_op, momentum=0.95, epsilon=0.01)\n      \n      grads_and_vars = optimizer.compute_gradients(self.loss)\n      for idx, (grad, var) in enumerate(grads_and_vars):\n        if grad is not None:\n          grads_and_vars[idx] = (tf.clip_by_norm(grad, self.max_grad_norm), var)\n      self.optim = optimizer.apply_gradients(grads_and_vars)\n\n  # Add accumulated gradients for n-step Q-learning\n  def make_accumulated_gradients(self):\n    reset_accum_grads = []\n    new_grads_and_vars = []\n\n    # 1. Prepare accum_grads\n    self.accum_grads = {}\n    self.add_accum_grads = {}\n\n    for step, network in enumerate(self.networks):\n      grads_and_vars = self.global_optim.compute_gradients(network.total_loss, network.w.values())\n      _add_accum_grads = []\n\n      for grad, var in tuple(grads_and_vars):\n        if grad is not None:\n          shape = grad.get_shape().as_list()\n\n          name = \'accum/%s\' % ""/"".join(var.name.split(\':\')[0].split(\'/\')[-3:])\n          if step == 0:\n            self.accum_grads[name] = tf.Variable(\n                tf.zeros(shape), trainable=False, name=name)\n\n            global_v = global_var[re.sub(r\'.*\\/A3C_\\d+\\/\', \'\', var.name)]\n            new_grads_and_vars.append((tf.clip_by_norm(self.accum_grads[name].ref(), self.max_grad_norm), global_v))\n\n            reset_accum_grads.append(self.accum_grads[name].assign(tf.zeros(shape)))\n\n          _add_accum_grads.append(tf.assign_add(self.accum_grads[name], grad))\n\n      # 2. Add gradient to accum_grads\n      self.add_accum_grads[step] = tf.group(*_add_accum_grads)\n\n  def observe(self, observation, reward, action, terminal):\n    reward = max(self.min_r, min(self.max_r, reward))\n\n    self.history.add(observation)\n    self.experience.add(observation, reward, action, terminal)\n\n    # q, loss, is_update\n    result = [], 0, False\n\n    if self.t > self.t_learn_start:\n      if self.t % self.t_train_freq == 0:\n        result = self.q_learning_minibatch()\n\n      if self.t % self.t_target_q_update_freq == self.t_target_q_update_freq - 1:\n        self.update_target_q_network()\n\n    return result\n\n  def q_learning_minibatch(self):\n    if self.experience.count < self.history_length:\n      return [], 0, False\n    else:\n      s_t, action, reward, s_t_plus_1, terminal = self.experience.sample()\n\n    terminal = np.array(terminal) + 0.\n\n    # Deep Q-learning\n    max_q_t_plus_1 = self.target_network.calc_max_outputs(s_t_plus_1)\n    target_q_t = (1. - terminal) * self.discount_r * max_q_t_plus_1 + reward\n\n    _, q_t, loss = self.sess.run([self.optim, self.pred_network.outputs, self.loss], {\n      self.targets: target_q_t,\n      self.actions: action,\n      self.pred_network.inputs: s_t,\n    })\n\n    return q_t, loss, True\n'"
agents/_sarsa.py,11,"b'import os\nimport time\nimport numpy as np\nimport tensorflow as tf\nfrom logging import getLogger\n\nfrom .agent import Agent\nfrom .history import History\nfrom .experience import Experience\n\nlogger = getLogger(__name__)\n\nclass SARSA(Agent):\n  def __init__(self, sess, pred_network, \n               env, stat, conf, target_network=None, policy_network=None):\n    super(DeepQ, self).__init__(sess, pred_network, target_network, policy_network, env, stat, conf)\n\n    raise Exception(""policy is not implemented yet"")\n\n    # Optimizer\n    with tf.variable_scope(\'optimizer\'):\n      self.targets = tf.placeholder(\'float32\', [None], name=\'target_q_t\')\n      self.actions = tf.placeholder(\'int64\', [None], name=\'action\')\n\n      actions_one_hot = tf.one_hot(self.actions, self.env.action_size, 1.0, 0.0, name=\'action_one_hot\')\n      pred_q = tf.reduce_sum(self.pred_network.outputs * actions_one_hot, reduction_indices=1, name=\'q_acted\')\n\n      self.delta = self.targets - pred_q\n      if self.max_delta and self.min_delta:\n        self.delta = tf.clip_by_value(self.delta, self.min_delta, self.max_delta, name=\'clipped_delta\')\n\n      self.loss = tf.reduce_mean(tf.square(self.delta), name=\'loss\')\n\n      self.learning_rate_op = tf.maximum(self.learning_rate_minimum,\n          tf.train.exponential_decay(\n              self.learning_rate,\n              self.stat.t_op,\n              self.learning_rate_decay_step,\n              self.learning_rate_decay,\n              staircase=True))\n\n      optimizer = tf.train.RMSPropOptimizer(\n        self.learning_rate_op, momentum=0.95, epsilon=0.01)\n      \n      grads_and_vars = optimizer.compute_gradients(self.loss)\n      for idx, (grad, var) in enumerate(grads_and_vars):\n        if grad is not None:\n          grads_and_vars[idx] = (tf.clip_by_norm(grad, self.max_grad_norm), var)\n      self.optim = optimizer.apply_gradients(grads_and_vars)\n\n  def observe(self, observation, reward, action, terminal):\n    reward = max(self.min_r, min(self.max_r, reward))\n\n    self.history.add(observation)\n    self.experience.add(observation, reward, action, terminal)\n\n    # q, loss, is_update\n    result = [], 0, False\n\n    if self.t > self.t_learn_start:\n      if self.t % self.t_train_freq == 0:\n        result = self.q_learning_minibatch()\n\n      if self.t % self.t_target_q_update_freq == self.t_target_q_update_freq - 1:\n        self.update_target_q_network()\n\n    return result\n\n  def q_learning_minibatch(self):\n    if self.experience.count < self.history_length:\n      return [], 0, False\n    else:\n      s_t, action, reward, s_t_plus_1, terminal = self.experience.sample()\n\n    terminal = np.array(terminal) + 0.\n\n    # Deep Q-learning\n    max_q_t_plus_1 = self.target_network.calc_max_outputs(s_t_plus_1)\n    target_q_t = (1. - terminal) * self.discount_r * max_q_t_plus_1 + reward\n\n    _, q_t, loss = self.sess.run([self.optim, self.pred_network.outputs, self.loss], {\n      self.targets: target_q_t,\n      self.actions: action,\n      self.pred_network.inputs: s_t,\n    })\n\n    return q_t, loss, True\n'"
