file_path,api_count,code
setup.py,0,"b""from setuptools import setup, find_packages\n\nlong_description = '''\nImage ATM is a one-click tool that automates the workflow of a typical\nimage classification pipeline in an opinionated way, this includes:\n\n- Preprocessing and validating input images and labels\n- Starting/terminating cloud instance with GPU support\n- Training\n- Model evaluation\n\nRead the documentation at: https://idealo.github.io/imageatm/\n\nImage ATM is compatible with Python 3.6 and is distributed under the Apache 2.0 license.\n'''\n\nsetup(\n    name='imageatm',\n    version='0.1.1',\n    author='Christopher Lennan, Malgorzata Adamczyk, Gunar Maiwald, Dat Tran',\n    author_email='christopherlennan@gmail.com, m.adamczyk.berlin@gmail.com, gunar.maiwald@web.de, datitran@gmail.com',\n    description='Image classification for everyone',\n    long_description=long_description,\n    license='Apache 2.0',\n    install_requires=[\n        'Keras==2.3.*',\n        'keras-vis>=0.4.1',\n        'tensorflow==2.0.*',\n        'awscli',\n        'Click',\n        'h5py',\n        'matplotlib',\n        'papermill',\n        'Pillow',\n        'scikit-learn',\n        'scipy==1.1.*',\n        'tqdm',\n        'yarl',\n    ],\n    extras_require={\n        'tests': ['pytest==4.3.0', 'pytest-cov==2.6.1', 'pytest-mock', 'mock', 'mypy'],\n        'docs': ['mkdocs==1.0.4', 'mkdocs-material==4.0.2'],\n        'dev': ['bumpversion==0.5.3'],\n    },\n    classifiers=[\n        'Development Status :: 4 - Beta',\n        'Intended Audience :: Developers',\n        'Intended Audience :: Education',\n        'Intended Audience :: Science/Research',\n        'License :: OSI Approved :: Apache Software License',\n        'Programming Language :: Python :: 3',\n        'Programming Language :: Python :: 3.6',\n        'Topic :: Software Development :: Libraries',\n        'Topic :: Software Development :: Libraries :: Python Modules',\n    ],\n    packages=find_packages(exclude=('tests',)),\n    entry_points={'console_scripts': ['imageatm=imageatm.client.client:cli']},\n    include_package_data=True,\n)\n"""
imageatm/__init__.py,0,"b""__version__ = '0.1.1'\n"""
mkdocs/autogen.py,0,"b'# Heavily borrowed from the Auto-Keras project:\n# https://github.com/jhfjhfj1/autokeras/blob/master/mkdocs/autogen.py\n\nimport ast\nimport os\nimport re\n\n\ndef delete_space(parts, start, end):\n    if start > end or end >= len(parts):\n        return None\n    count = 0\n    while count < len(parts[start]):\n        if parts[start][count] == \' \':\n            count += 1\n        else:\n            break\n    return \'\\n\'.join(y for y in [x[count:] for x in parts[start : end + 1] if len(x) > count])\n\n\ndef change_args_to_dict(string):\n    if string is None:\n        return None\n    ans = []\n    strings = string.split(\'\\n\')\n    ind = 1\n    start = 0\n    while ind <= len(strings):\n        if ind < len(strings) and strings[ind].startswith("" ""):\n            ind += 1\n        else:\n            if start < ind:\n                ans.append(\'\\n\'.join(strings[start:ind]))\n            start = ind\n            ind += 1\n    d = {}\n    for line in ans:\n        if "":"" in line and len(line) > 0:\n            lines = line.split("":"")\n            d[lines[0]] = lines[1].strip()\n    return d\n\n\ndef remove_next_line(comments):\n    for x in comments:\n        if comments[x] is not None and \'\\n\' in comments[x]:\n            comments[x] = \' \'.join(comments[x].split(\'\\n\'))\n    return comments\n\n\ndef skip_space_line(parts, ind):\n    while ind < len(parts):\n        if re.match(r\'^\\s*$\', parts[ind]):\n            ind += 1\n        else:\n            break\n    return ind\n\n\n# check if comment is None or len(comment) == 0 return {}\ndef parse_func_string(comment):\n    if comment is None or len(comment) == 0:\n        return {}\n    comments = {}\n    paras = (\'Args\', \'Attributes\', \'Returns\', \'Raises\')\n    comment_parts = [\n        \'short_description\',\n        \'long_description\',\n        \'Args\',\n        \'Attributes\',\n        \'Returns\',\n        \'Raises\',\n    ]\n    for x in comment_parts:\n        comments[x] = None\n\n    parts = re.split(r\'\\n\', comment)\n    ind = 1\n    while ind < len(parts):\n        if re.match(r\'^\\s*$\', parts[ind]):\n            break\n        else:\n            ind += 1\n\n    comments[\'short_description\'] = \'\\n\'.join(\n        [\'\\n\'.join(re.split(\'\\n\\s+\', x.strip())) for x in parts[0:ind]]\n    ).strip(\':\\n\\t \')\n    ind = skip_space_line(parts, ind)\n\n    start = ind\n    while ind < len(parts):\n        if parts[ind].strip().startswith(paras):\n            break\n        else:\n            ind += 1\n    long_description = \'\\n\'.join(\n        [\'\\n\'.join(re.split(\'\\n\\s+\', x.strip())) for x in parts[start:ind]]\n    ).strip(\':\\n\\t \')\n    comments[\'long_description\'] = long_description\n\n    ind = skip_space_line(paras, ind)\n    while ind < len(parts):\n        if parts[ind].strip().startswith(paras):\n            start = ind\n            start_with = parts[ind].strip()\n            ind += 1\n            while ind < len(parts):\n                if parts[ind].strip().startswith(paras):\n                    break\n                else:\n                    ind += 1\n            part = delete_space(parts, start + 1, ind - 1)\n            if start_with.startswith(paras[0]):\n                comments[paras[0]] = change_args_to_dict(part)\n            elif start_with.startswith(paras[1]):\n                comments[paras[1]] = change_args_to_dict(part)\n            elif start_with.startswith(paras[2]):\n                comments[paras[2]] = change_args_to_dict(part)\n            elif start_with.startswith(paras[3]):\n                comments[paras[3]] = part\n            ind = skip_space_line(parts, ind)\n        else:\n            ind += 1\n\n    remove_next_line(comments)\n    return comments\n\n\ndef md_parse_line_break(comment):\n    comment = comment.replace(\'  \', \'\\n\\n\')\n    return comment.replace(\' - \', \'\\n\\n- \')\n\n\ndef to_md(comment_dict):\n    doc = \'\'\n    if \'short_description\' in comment_dict:\n        doc += comment_dict[\'short_description\']\n        doc += \'\\n\\n\'\n\n    if \'long_description\' in comment_dict:\n        doc += md_parse_line_break(comment_dict[\'long_description\'])\n        doc += \'\\n\'\n\n    if \'Args\' in comment_dict and comment_dict[\'Args\'] is not None:\n        doc += \'##### Args\\n\'\n        for arg, des in comment_dict[\'Args\'].items():\n            doc += \'* **\' + arg + \'**: \' + des + \'\\n\\n\'\n\n    if \'Attributes\' in comment_dict and comment_dict[\'Attributes\'] is not None:\n        doc += \'##### Attributes\\n\'\n        for arg, des in comment_dict[\'Attributes\'].items():\n            doc += \'* **\' + arg + \'**: \' + des + \'\\n\\n\'\n\n    if \'Returns\' in comment_dict and comment_dict[\'Returns\'] is not None:\n        doc += \'##### Returns\\n\'\n        if isinstance(comment_dict[\'Returns\'], str):\n            doc += comment_dict[\'Returns\']\n            doc += \'\\n\'\n        else:\n            for arg, des in comment_dict[\'Returns\'].items():\n                doc += \'* **\' + arg + \'**: \' + des + \'\\n\\n\'\n    return doc\n\n\ndef parse_func_args(function):\n    args = [a.arg for a in function.args.args if a.arg != \'self\']\n    kwargs = []\n    if function.args.kwarg:\n        kwargs = [\'**\' + function.args.kwarg.arg]\n\n    return \'(\' + \', \'.join(args + kwargs) + \')\'\n\n\ndef get_func_comments(function_definitions):\n    doc = \'\'\n    for f in function_definitions:\n        temp_str = to_md(parse_func_string(ast.get_docstring(f)))\n        doc += \'\'.join(\n            [\n                \'### \',\n                f.name.replace(\'_\', \'\\\\_\'),\n                \'\\n\',\n                \'```python\',\n                \'\\n\',\n                \'def \',\n                f.name,\n                parse_func_args(f),\n                \'\\n\',\n                \'```\',\n                \'\\n\',\n                temp_str,\n                \'\\n\',\n            ]\n        )\n\n    return doc\n\n\ndef get_comments_str(file_name):\n    with open(file_name) as fd:\n        file_contents = fd.read()\n    module = ast.parse(file_contents)\n\n    function_definitions = [node for node in module.body if isinstance(node, ast.FunctionDef)]\n\n    doc = get_func_comments(function_definitions)\n\n    class_definitions = [node for node in module.body if isinstance(node, ast.ClassDef)]\n    for class_def in class_definitions:\n        temp_str = to_md(parse_func_string(ast.get_docstring(class_def)))\n\n        # excludes private methods (start with \'_\')\n        method_definitions = [\n            node\n            for node in class_def.body\n            if isinstance(node, ast.FunctionDef) and (node.name[0] != \'_\' or node.name[:2] == \'__\')\n        ]\n\n        temp_str += get_func_comments(method_definitions)\n        doc += \'## class \' + class_def.name + \'\\n\' + temp_str\n    return doc\n\n\ndef extract_comments(directory):\n    for parent, dir_names, file_names in os.walk(directory):\n        for file_name in file_names:\n            if os.path.splitext(file_name)[1] == \'.py\' and file_name != \'__init__.py\':\n                # with open\n                doc = get_comments_str(os.path.join(parent, file_name))\n                directory = os.path.join(\'docs\', parent.replace(\'../imageatm/\', \'\'))\n                if not os.path.exists(directory):\n                    os.makedirs(directory)\n\n                output_file = open(os.path.join(directory, file_name[:-3] + \'.md\'), \'w\')\n                output_file.write(doc)\n                output_file.close()\n\n\nextract_comments(\'../imageatm/\')\n'"
imageatm/client/__init__.py,0,b''
imageatm/client/client.py,0,"b'import click\nfrom imageatm.client import commands\nfrom imageatm.client.config import Config\n\n\n# creates config object that will be passed from cli to subcommands\npass_config = click.make_pass_decorator(Config, ensure=True)\n\n\n# cli is the group parent, it gets run before any of the subcommands are run\n@click.group()\n@pass_config\ndef cli(config: Config):\n    pass\n\n\n@cli.command()\n@click.argument(\'config-file\', type=click.Path())\n@click.option(\'--image-dir\', type=click.Path(), help=\'Directory with image files.\')\n@click.option(\'--samples-file\', type=click.Path(), help=\'JSON file with samples.\')\n@click.option(\n    \'--job-dir\',\n    type=click.Path(),\n    help=(\'Directory with train, val, and test samples files and class_mapping file.\'),\n)\n@click.option(\'--provider\', help=\'Cloud provider, currently supported: [aws].\')\n@click.option(\'--instance-type\', help=\'Cloud instance_type [aws].\')\n@click.option(\'--region\', help=\'Cloud region [aws].\')\n@click.option(\'--vpc-id\', help=\'Cloud VPC id [aws].\')\n@click.option(\'--bucket\', help=\'Cloud bucket used for persistence [aws].\')\n@click.option(\'--tf-dir\', help=\'Directory with Terraform configs [aws].\')\n@click.option(\'--train-cloud\', is_flag=True, required=False, help=\'Run training in cloud [aws].\')\n@click.option(\'--destroy\', is_flag=True, required=False, help=\'Destroys cloud.\')\n@click.option(\'--resize\', is_flag=True, required=False, help=\'Resizes images in dataprep.\')\n@click.option(\'--batch-size\', type=int, help=\'Batch size.\', required=False)\n@click.option(\n    \'--epochs-train-dense\',\n    type=int,\n    help=\'Number of epochs train only dense layer.\',\n    required=False,\n)\n@click.option(\n    \'--epochs-train-all\', type=int, help=\'Number of epochs train all layers.\', required=False\n)\n@click.option(\n    \'--learning-rate-dense\', type=float, help=\'Learning rate dense layers.\', required=False\n)\n@click.option(\'--learning-rate-all\', type=float, help=\'Learning rate all layers.\', required=False)\n@click.option(\n    \'--base-model-name\', help=\'Pretrained CNN to be used for transfer learning.\', required=False\n)\n@click.option(\n    \'--create-report\', is_flag=True, required=False, help=\'Create evaluation report via jupyter notebook.\'\n)\n@click.option(\n    \'--kernel-name\',  required=False, help=\'Kernel-name for juypter notebook.\'\n)\n@click.option(\n    \'--export-html\', is_flag=True, required=False, help=\'Export evaluation report to html.\'\n)\n@click.option(\n    \'--export-pdf\', is_flag=True, required=False, help=\'Export evaluation report to pdf.\'\n)\n@click.option(\n    \'--cloud-tag\', help=\'Tag under which all cloud resources are created.\', required=False\n)\n@pass_config\ndef pipeline(config: Config, **kwargs):\n    """"""Runs all components for which run=True in config file.\n\n    All activated (run=True) components from config file will be run in sequence. Options overwrite the config file.\n    The config file is the only way to define pipeline components.\n\n    Args:\n        config-file: Central configuration file.\n    """"""\n    commands.pipeline(config, **kwargs)\n\n\n@cli.command()\n@click.option(\'--config-file\', type=click.Path(), help=\'Central configuration file.\')\n@click.option(\'--image-dir\', type=click.Path(), help=\'Directory with image files.\')\n@click.option(\'--samples-file\', type=click.Path(), help=\'JSON file with samples.\')\n@click.option(\n    \'--job-dir\',\n    type=click.Path(),\n    help=(\'Directory with train, val, and test samples files and class_mapping file.\'),\n)\n@click.option(\n    \'--resize\',\n    is_flag=True,\n    required=False,\n    help=\'Resizes images and stores them in _resized subfolder.\',\n)\n@pass_config\ndef dataprep(config: Config, **kwargs):\n    """"""Run data preparation and create job dir.\n\n    Creates a directory (job_dir) with the following files:\n\n        - train_samples.json\n\n        - val_samples.json\n\n        - test_samples.json\n\n        - class_mapping.json\n    """"""\n    commands.dataprep(config, **kwargs)\n\n\n@cli.command()\n@click.option(\'--config-file\', type=click.Path(), help=\'Central configuration file.\')\n@click.option(\'--image-dir\', type=click.Path(), help=\'Directory with image files.\')\n@click.option(\n    \'--job-dir\',\n    type=click.Path(),\n    help=(\'Directory with train, val, and test samples files and class_mapping file.\'),\n)\n@click.option(\'--provider\', help=\'Cloud provider, currently supported: [aws].\')\n@click.option(\'--instance-type\', help=\'Cloud instance_type [aws].\')\n@click.option(\'--region\', help=\'Cloud region [aws].\')\n@click.option(\'--vpc-id\', help=\'Cloud VPC id [aws].\')\n@click.option(\'--bucket\', help=\'Cloud bucket used for persistence [aws].\')\n@click.option(\'--tf-dir\', help=\'Directory with Terraform configs [aws].\')\n@click.option(\'--train-cloud\', is_flag=True, required=False, help=\'Run training in cloud [aws].\')\n@click.option(\'--destroy\', is_flag=True, required=False, help=\'Destroys cloud.\')\n@click.option(\'--batch-size\', type=int, help=\'Batch size.\', required=False)\n@click.option(\n    \'--epochs-train-dense\',\n    type=int,\n    help=\'Number of epochs train only dense layer.\',\n    required=False,\n)\n@click.option(\n    \'--epochs-train-all\', type=int, help=\'Number of epochs train all layers.\', required=False\n)\n@click.option(\n    \'--learning-rate-dense\', type=float, help=\'Learning rate dense layers.\', required=False\n)\n@click.option(\'--learning-rate-all\', type=float, help=\'Learning rate all layers.\', required=False)\n@click.option(\n    \'--base-model-name\', help=\'Pretrained CNN to be used for transfer learning.\', required=False\n)\n@click.option(\n    \'--cloud-tag\', help=\'Tag under which all cloud resources are created.\', required=False\n)\n@pass_config\ndef train(config: Config, **kwargs):\n    """"""Train a CNN.\n\n    Fine-tunes an ImageNet pre-trained CNN. The number of classes are derived from train_samples.json.\n    After each epoch the model will be evaluated on val_samples.json.\n\n    The best model (based on valuation accuracy) will be saved.\n\n    Args:\n        image_dir: Directory with image files.\n        job_dir: Directory with train_samples, val_samples, and class_mapping.json.\n\n    """"""\n    commands.train(config, **kwargs)\n\n\n@cli.command()\n@click.option(\'--config-file\', type=click.Path(), help=\'Central configuration file.\')\n@click.option(\'--image-dir\', type=click.Path(), help=\'Directory with image files.\')\n@click.option(\n    \'--job-dir\', type=click.Path(), help=(\'Directory with test samples files and trained model.\')\n)\n@click.option(\n    \'--create-report\', is_flag=True, required=False, help=\'Create evaluation report via jupyter notebook.\'\n)\n@click.option(\n    \'--kernel-name\',  required=False, help=\'Kernel-name for juypter notebook.\'\n)\n@click.option(\n    \'--export-html\', is_flag=True, required=False, help=\'Export evaluation report to html.\'\n)\n@click.option(\n    \'--export-pdf\', is_flag=True, required=False, help=\'Export evaluation report to pdf.\'\n)\n@pass_config\ndef evaluate(config: Config, **kwargs):\n    """"""Evaluate a trained model.\n\n    Evaluation will be performed on test_samples.json.\n\n    Args:\n        image_dir: Directory with image files.\n        job_dir: Directory with test_samples.json and class_mapping.json.\n    """"""\n    commands.evaluate(config, **kwargs)\n\n\n@cli.command()\n@click.option(\'--config-file\', type=click.Path(), help=\'Central configuration file.\')\n@click.option(\n    \'--job-dir\', type=click.Path(), help=(\'Directory with test samples files and trained model.\')\n)\n@click.option(\'--provider\', help=\'Cloud provider, currently supported: [aws].\')\n@click.option(\'--instance-type\', help=\'Cloud instance_type [aws].\')\n@click.option(\'--region\', help=\'Cloud region [aws].\')\n@click.option(\'--vpc-id\', help=\'Cloud VPC id [aws].\')\n@click.option(\'--bucket\', help=\'Cloud bucket used for persistence [aws].\')\n@click.option(\'--tf-dir\', help=\'Directory with Terraform configs [aws].\')\n@click.option(\'--train-cloud\', is_flag=True, required=False, help=\'Run training in cloud [aws].\')\n@click.option(\'--destroy\', is_flag=True, required=False, help=\'Destroys cloud.\')\n@click.option(\'--no-destroy\', is_flag=True, required=False, help=\'Keeps cloud.\')\n@click.option(\n    \'--cloud-tag\', help=\'Tag under which all cloud resources are created.\', required=False\n)\n@pass_config\ndef cloud(config: Config, **kwargs):\n    """"""Launch/destroy a cloud compute instance.\n\n    Launch/destroy cloud instances with Terraform based on Terraform files in tf_dir.\n    """"""\n    commands.cloud(config, **kwargs)\n'"
