file_path,api_count,code
keras_contrib/layers/advanced_activations/pelu.py,0,"b'from keras.layers import Layer, InputSpec\r\nfrom keras import initializers, regularizers, constraints\r\nimport keras.backend as K\r\nfrom keras_contrib.utils.test_utils import to_tuple\r\n\r\n\r\nclass PELU(Layer):\r\n    """"""Parametric Exponential Linear Unit.\r\n\r\n    It follows:\r\n    `f(x) = alphas * (exp(x / betas) - 1) for x < 0`,\r\n    `f(x) = (alphas / betas) * x for x >= 0`,\r\n    where `alphas` & `betas` are learned arrays with the same shape as x.\r\n\r\n    # Input shape\r\n        Arbitrary. Use the keyword argument `input_shape`\r\n        (tuple of integers, does not include the samples axis)\r\n        when using this layer as the first layer in a model.\r\n\r\n    # Output shape\r\n        Same shape as the input.\r\n\r\n    # Arguments\r\n        alphas_initializer: initialization function for the alpha variable weights.\r\n        betas_initializer: initialization function for the beta variable weights.\r\n        weights: initial weights, as a list of a single Numpy array.\r\n        shared_axes: the axes along which to share learnable\r\n            parameters for the activation function.\r\n            For example, if the incoming feature maps\r\n            are from a 2D convolution\r\n            with output shape `(batch, height, width, channels)`,\r\n            and you wish to share parameters across space\r\n            so that each filter only has one set of parameters,\r\n            set `shared_axes=[1, 2]`.\r\n\r\n    # References\r\n        - [Parametric exponential linear unit for deep convolutional neural networks](\r\n           https://arxiv.org/abs/1605.09332v3)\r\n    """"""\r\n\r\n    def __init__(self, alpha_initializer=\'ones\',\r\n                 alpha_regularizer=None,\r\n                 alpha_constraint=None,\r\n                 beta_initializer=\'ones\',\r\n                 beta_regularizer=None,\r\n                 beta_constraint=None,\r\n                 shared_axes=None,\r\n                 **kwargs):\r\n        super(PELU, self).__init__(**kwargs)\r\n        self.supports_masking = True\r\n        self.alpha_initializer = initializers.get(alpha_initializer)\r\n        self.alpha_regularizer = regularizers.get(alpha_regularizer)\r\n        self.alpha_constraint = constraints.get(alpha_constraint)\r\n        self.beta_initializer = initializers.get(beta_initializer)\r\n        self.beta_regularizer = regularizers.get(beta_regularizer)\r\n        self.beta_constraint = constraints.get(beta_constraint)\r\n        if shared_axes is None:\r\n            self.shared_axes = None\r\n        elif not isinstance(shared_axes, (list, tuple)):\r\n            self.shared_axes = [shared_axes]\r\n        else:\r\n            self.shared_axes = list(shared_axes)\r\n\r\n    def build(self, input_shape):\r\n        input_shape = to_tuple(input_shape)\r\n        param_shape = list(input_shape[1:])\r\n        self.param_broadcast = [False] * len(param_shape)\r\n        if self.shared_axes is not None:\r\n            for i in self.shared_axes:\r\n                param_shape[i - 1] = 1\r\n                self.param_broadcast[i - 1] = True\r\n\r\n        param_shape = tuple(param_shape)\r\n        # Initialised as ones to emulate the default ELU\r\n        self.alpha = self.add_weight(shape=param_shape,\r\n                                     name=\'alpha\',\r\n                                     initializer=self.alpha_initializer,\r\n                                     regularizer=self.alpha_regularizer,\r\n                                     constraint=self.alpha_constraint)\r\n        self.beta = self.add_weight(shape=param_shape,\r\n                                    name=\'beta\',\r\n                                    initializer=self.beta_initializer,\r\n                                    regularizer=self.beta_regularizer,\r\n                                    constraint=self.beta_constraint)\r\n\r\n        # Set input spec\r\n        axes = {}\r\n        if self.shared_axes:\r\n            for i in range(1, len(input_shape)):\r\n                if i not in self.shared_axes:\r\n                    axes[i] = input_shape[i]\r\n        self.input_spec = InputSpec(ndim=len(input_shape), axes=axes)\r\n        self.built = True\r\n\r\n    def call(self, x, mask=None):\r\n        if K.backend() == \'theano\':\r\n            pos = K.relu(x) * (K.pattern_broadcast(self.alpha, self.param_broadcast) /\r\n                               K.pattern_broadcast(self.beta, self.param_broadcast))\r\n            neg = (K.pattern_broadcast(self.alpha, self.param_broadcast) *\r\n                   (K.exp((-K.relu(-x))\r\n                          / K.pattern_broadcast(self.beta, self.param_broadcast)) - 1))\r\n        else:\r\n            pos = K.relu(x) * self.alpha / self.beta\r\n            neg = self.alpha * (K.exp((-K.relu(-x)) / self.beta) - 1)\r\n        return neg + pos\r\n\r\n    def get_config(self):\r\n        config = {\r\n            \'alpha_initializer\': initializers.serialize(self.alpha_initializer),\r\n            \'alpha_regularizer\': regularizers.serialize(self.alpha_regularizer),\r\n            \'alpha_constraint\': constraints.serialize(self.alpha_constraint),\r\n            \'beta_initializer\': initializers.serialize(self.beta_initializer),\r\n            \'beta_regularizer\': regularizers.serialize(self.beta_regularizer),\r\n            \'beta_constraint\': constraints.serialize(self.beta_constraint),\r\n            \'shared_axes\': self.shared_axes\r\n        }\r\n        base_config = super(PELU, self).get_config()\r\n        return dict(list(base_config.items()) + list(config.items()))\r\n\r\n    def compute_output_shape(self, input_shape):\r\n        return input_shape\r\n'"
keras_contrib/layers/advanced_activations/sinerelu.py,0,"b'import keras.backend as K\r\nfrom keras.layers import Layer\r\n\r\n\r\nclass SineReLU(Layer):\r\n    """"""Sine Rectified Linear Unit to generate oscilations.\r\n\r\n    It allows an oscilation in the gradients when the weights are negative.\r\n    The oscilation can be controlled with a parameter, which makes it be close\r\n    or equal to zero. The functional is diferentiable at any point due to\r\n    its derivative.\r\n    For instance, at 0, the derivative of \'sin(0) - cos(0)\'\r\n    is \'cos(0) + sin(0)\' which is 1.\r\n\r\n    # Input shape\r\n        Arbitrary. Use the keyword argument `input_shape`\r\n        (tuple of integers, does not include the samples axis)\r\n        when using this layer as the first layer in a model.\r\n\r\n    # Output shape\r\n        Same shape as the input.\r\n\r\n    # Arguments\r\n        epsilon: float. Hyper-parameter used to control the amplitude of the\r\n            sinusoidal wave when weights are negative.\r\n            The default value, 0.0025, since it works better for CNN layers and\r\n            those are the most used layers nowadays.\r\n            When using Dense Networks, try something around 0.006.\r\n\r\n    # References:\r\n        - [SineReLU: An Alternative to the ReLU Activation Function](\r\n           https://medium.com/@wilder.rodrigues/sinerelu-an-alternative-to-the-relu-activation-function-e46a6199997d).\r\n\r\n        This function was\r\n        first introduced at the Codemotion Amsterdam 2018 and then at\r\n        the DevDays, in Vilnius, Lithuania.\r\n        It has been extensively tested with Deep Nets, CNNs,\r\n        LSTMs, Residual Nets and GANs, based\r\n        on the MNIST, Kaggle Toxicity and IMDB datasets.\r\n\r\n    # Performance:\r\n\r\n        - Fashion MNIST\r\n          * Mean of 6 runs per Activation Function\r\n            * Fully Connection Network\r\n              - SineReLU: loss mean -> 0.3522; accuracy mean -> 89.18;\r\n                  mean of std loss -> 0.08375204467435822\r\n              - LeakyReLU: loss mean-> 0.3553; accuracy mean -> 88.98;\r\n              mean of std loss -> 0.0831161868455245\r\n              - ReLU: loss mean -> 0.3519; accuracy mean -> 88.84;\r\n              mean of std loss -> 0.08358816501301362\r\n            * Convolutional Neural Network\r\n              - SineReLU: loss mean -> 0.2180; accuracy mean -> 92.49;\r\n              mean of std loss -> 0.0781155784858847\r\n              - LeakyReLU: loss mean -> 0.2205; accuracy mean -> 92.37;\r\n              mean of std loss -> 0.09273670474788205\r\n              - ReLU: loss mean -> 0.2144; accuracy mean -> 92.45;\r\n              mean of std loss -> 0.09396114585977\r\n        - MNIST\r\n          * Mean of 6 runs per Activation Function\r\n            * Fully Connection Network\r\n              - SineReLU: loss mean -> 0.0623; accuracy mean -> 98.53;\r\n              mean of std loss -> 0.06012015231824904\r\n              - LeakyReLU: loss mean-> 0.0623; accuracy mean -> 98.50;\r\n              mean of std loss -> 0.06052147632835356\r\n              - ReLU: loss mean -> 0.0605; accuracy mean -> 98.49;\r\n              mean of std loss -> 0.059599885665016096\r\n            * Convolutional Neural Network\r\n              - SineReLU: loss mean -> 0.0198; accuracy mean -> 99.51;\r\n              mean of std loss -> 0.0425338329550847\r\n              - LeakyReLU: loss mean -> 0.0216; accuracy mean -> 99.40;\r\n              mean of std loss -> 0.04834468835196667\r\n              - ReLU: loss mean -> 0.0185; accuracy mean -> 99.49;\r\n              mean of std loss -> 0.05503719489690131\r\n\r\n    # Jupyter Notebooks\r\n        - https://github.com/ekholabs/DLinK/blob/master/notebooks/keras\r\n\r\n    # Examples\r\n        The Advanced Activation function SineReLU have to be imported from the\r\n        keras_contrib.layers package.\r\n\r\n        To see full source-code of this architecture and other examples,\r\n        please follow this link: https://github.com/ekholabs/DLinK\r\n\r\n        ```python\r\n            model = Sequential()\r\n            model.add(Dense(128, input_shape = (784,)))\r\n            model.add(SineReLU())\r\n            model.add(Dropout(0.2))\r\n\r\n            model.add(Dense(256))\r\n            model.add(SineReLU())\r\n            model.add(Dropout(0.3))\r\n\r\n            model.add(Dense(1024))\r\n            model.add(SineReLU())\r\n            model.add(Dropout(0.5))\r\n\r\n            model.add(Dense(10, activation = \'softmax\'))\r\n        ```\r\n    """"""\r\n\r\n    def __init__(self, epsilon=0.0025, **kwargs):\r\n        super(SineReLU, self).__init__(**kwargs)\r\n        self.supports_masking = True\r\n        self.epsilon = K.cast_to_floatx(epsilon)\r\n\r\n    def call(self, Z):\r\n        m = self.epsilon * (K.sin(Z) - K.cos(Z))\r\n        A = K.maximum(m, Z)\r\n        return A\r\n\r\n    def get_config(self):\r\n        config = {\'epsilon\': float(self.epsilon)}\r\n        base_config = super(SineReLU, self).get_config()\r\n        return dict(list(base_config.items()) + list(config.items()))\r\n\r\n    def compute_output_shape(self, input_shape):\r\n        return input_shape\r\n'"
keras_contrib/layers/advanced_activations/srelu.py,0,"b'from keras.layers import Layer, InputSpec\r\nfrom keras import initializers\r\nimport keras.backend as K\r\nfrom keras_contrib.utils.test_utils import to_tuple\r\n\r\n\r\nclass SReLU(Layer):\r\n    """"""S-shaped Rectified Linear Unit.\r\n\r\n    It follows:\r\n    `f(x) = t^r + a^r(x - t^r) for x >= t^r`,\r\n    `f(x) = x for t^r > x > t^l`,\r\n    `f(x) = t^l + a^l(x - t^l) for x <= t^l`.\r\n\r\n    # Input shape\r\n        Arbitrary. Use the keyword argument `input_shape`\r\n        (tuple of integers, does not include the samples axis)\r\n        when using this layer as the first layer in a model.\r\n\r\n    # Output shape\r\n        Same shape as the input.\r\n\r\n    # Arguments\r\n        t_left_initializer: initializer function for the left part intercept\r\n        a_left_initializer: initializer function for the left part slope\r\n        t_right_initializer: initializer function for the right part intercept\r\n        a_right_initializer: initializer function for the right part slope\r\n        shared_axes: the axes along which to share learnable\r\n            parameters for the activation function.\r\n            For example, if the incoming feature maps\r\n            are from a 2D convolution\r\n            with output shape `(batch, height, width, channels)`,\r\n            and you wish to share parameters across space\r\n            so that each filter only has one set of parameters,\r\n            set `shared_axes=[1, 2]`.\r\n\r\n    # References\r\n        - [Deep Learning with S-shaped Rectified Linear Activation Units](\r\n           http://arxiv.org/abs/1512.07030)\r\n    """"""\r\n\r\n    def __init__(self, t_left_initializer=\'zeros\',\r\n                 a_left_initializer=initializers.RandomUniform(minval=0, maxval=1),\r\n                 t_right_initializer=initializers.RandomUniform(minval=0, maxval=5),\r\n                 a_right_initializer=\'ones\',\r\n                 shared_axes=None,\r\n                 **kwargs):\r\n        super(SReLU, self).__init__(**kwargs)\r\n        self.supports_masking = True\r\n        self.t_left_initializer = initializers.get(t_left_initializer)\r\n        self.a_left_initializer = initializers.get(a_left_initializer)\r\n        self.t_right_initializer = initializers.get(t_right_initializer)\r\n        self.a_right_initializer = initializers.get(a_right_initializer)\r\n        if shared_axes is None:\r\n            self.shared_axes = None\r\n        elif not isinstance(shared_axes, (list, tuple)):\r\n            self.shared_axes = [shared_axes]\r\n        else:\r\n            self.shared_axes = list(shared_axes)\r\n\r\n    def build(self, input_shape):\r\n        input_shape = to_tuple(input_shape)\r\n        param_shape = list(input_shape[1:])\r\n        self.param_broadcast = [False] * len(param_shape)\r\n        if self.shared_axes is not None:\r\n            for i in self.shared_axes:\r\n                param_shape[i - 1] = 1\r\n                self.param_broadcast[i - 1] = True\r\n\r\n        param_shape = tuple(param_shape)\r\n\r\n        self.t_left = self.add_weight(shape=param_shape,\r\n                                      name=\'t_left\',\r\n                                      initializer=self.t_left_initializer)\r\n\r\n        self.a_left = self.add_weight(shape=param_shape,\r\n                                      name=\'a_left\',\r\n                                      initializer=self.a_left_initializer)\r\n\r\n        self.t_right = self.add_weight(shape=param_shape,\r\n                                       name=\'t_right\',\r\n                                       initializer=self.t_right_initializer)\r\n\r\n        self.a_right = self.add_weight(shape=param_shape,\r\n                                       name=\'a_right\',\r\n                                       initializer=self.a_right_initializer)\r\n\r\n        # Set input spec\r\n        axes = {}\r\n        if self.shared_axes:\r\n            for i in range(1, len(input_shape)):\r\n                if i not in self.shared_axes:\r\n                    axes[i] = input_shape[i]\r\n        self.input_spec = InputSpec(ndim=len(input_shape), axes=axes)\r\n        self.built = True\r\n\r\n    def call(self, x, mask=None):\r\n        # ensure the the right part is always to the right of the left\r\n        t_right_actual = self.t_left + K.abs(self.t_right)\r\n\r\n        if K.backend() == \'theano\':\r\n            t_left = K.pattern_broadcast(self.t_left, self.param_broadcast)\r\n            a_left = K.pattern_broadcast(self.a_left, self.param_broadcast)\r\n            a_right = K.pattern_broadcast(self.a_right, self.param_broadcast)\r\n            t_right_actual = K.pattern_broadcast(t_right_actual,\r\n                                                 self.param_broadcast)\r\n        else:\r\n            t_left = self.t_left\r\n            a_left = self.a_left\r\n            a_right = self.a_right\r\n\r\n        y_left_and_center = t_left + K.relu(x - t_left,\r\n                                            a_left,\r\n                                            t_right_actual - t_left)\r\n        y_right = K.relu(x - t_right_actual) * a_right\r\n        return y_left_and_center + y_right\r\n\r\n    def get_config(self):\r\n        config = {\r\n            \'t_left_initializer\': self.t_left_initializer,\r\n            \'a_left_initializer\': self.a_left_initializer,\r\n            \'t_right_initializer\': self.t_right_initializer,\r\n            \'a_right_initializer\': self.a_right_initializer,\r\n            \'shared_axes\': self.shared_axes\r\n        }\r\n        base_config = super(SReLU, self).get_config()\r\n        return dict(list(base_config.items()) + list(config.items()))\r\n\r\n    def compute_output_shape(self, input_shape):\r\n        return input_shape\r\n'"
keras_contrib/layers/advanced_activations/swish.py,0,"b'from keras import backend as K\r\nfrom keras.layers import Layer\r\n\r\n\r\nclass Swish(Layer):\r\n    """""" Swish (Ramachandranet al., 2017)\r\n\r\n    # Input shape\r\n        Arbitrary. Use the keyword argument `input_shape`\r\n        (tuple of integers, does not include the samples axis)\r\n        when using this layer as the first layer in a model.\r\n\r\n    # Output shape\r\n        Same shape as the input.\r\n\r\n    # Arguments\r\n        beta: float >= 0. Scaling factor\r\n            if set to 1 and trainable set to False (default),\r\n            Swish equals the SiLU activation (Elfwing et al., 2017)\r\n        trainable: whether to learn the scaling factor during training or not\r\n\r\n    # References\r\n        - [Searching for Activation Functions](https://arxiv.org/abs/1710.05941)\r\n        - [Sigmoid-weighted linear units for neural network function\r\n           approximation in reinforcement learning](https://arxiv.org/abs/1702.03118)\r\n    """"""\r\n\r\n    def __init__(self, beta=1.0, trainable=False, **kwargs):\r\n        super(Swish, self).__init__(**kwargs)\r\n        self.supports_masking = True\r\n        self.beta = beta\r\n        self.trainable = trainable\r\n\r\n    def build(self, input_shape):\r\n        self.scaling_factor = K.variable(self.beta,\r\n                                         dtype=K.floatx(),\r\n                                         name=\'scaling_factor\')\r\n        if self.trainable:\r\n            self._trainable_weights.append(self.scaling_factor)\r\n        super(Swish, self).build(input_shape)\r\n\r\n    def call(self, inputs, mask=None):\r\n        return inputs * K.sigmoid(self.scaling_factor * inputs)\r\n\r\n    def get_config(self):\r\n        config = {\'beta\': self.get_weights()[0] if self.trainable else self.beta,\r\n                  \'trainable\': self.trainable}\r\n        base_config = super(Swish, self).get_config()\r\n        return dict(list(base_config.items()) + list(config.items()))\r\n\r\n    def compute_output_shape(self, input_shape):\r\n        return input_shape\r\n'"
keras_contrib/layers/convolutional/__init__.py,0,b''
