file_path,api_count,code
convert_to_tf_keras.py,4,"b'import os\r\nimport sys\r\n\r\nlist_conversions = [(\'import keras.\', \'import tensorflow.keras.\'),\r\n                    (\'import keras \', \'from tensorflow import keras \'),\r\n                    (\'import keras\\n\', \'from tensorflow import keras\\n\'),\r\n                    (\'from keras.\', \'from tensorflow.keras.\'),\r\n                    (\'from keras \', \'from tensorflow.keras \')]\r\n\r\n\r\ndef replace_imports_in_text(string, revert):\r\n    if revert:\r\n        list_imports_to_change = [x[::-1] for x in list_conversions]\r\n    else:\r\n        list_imports_to_change = list_conversions\r\n\r\n    text_updated = string\r\n    for old_str, new_str in list_imports_to_change:\r\n        text_updated = text_updated.replace(old_str, new_str)\r\n    return text_updated\r\n\r\n\r\ndef replace_imports_in_file(file_path, revert):\r\n    if not file_path.endswith(\'.py\'):\r\n        return False\r\n    if os.path.abspath(file_path) == os.path.abspath(__file__):\r\n        return False\r\n    with open(file_path, \'r\') as f:\r\n        text = f.read()\r\n\r\n    text_updated = replace_imports_in_text(text, revert)\r\n\r\n    with open(file_path, \'w+\') as f:\r\n        f.write(text_updated)\r\n\r\n    return text_updated != text\r\n\r\n\r\ndef convert_codebase(revert):\r\n    nb_of_files_changed = 0\r\n    keras_dir = os.path.dirname(os.path.abspath(__file__))\r\n    for root, dirs, files in os.walk(keras_dir):\r\n        for name in files:\r\n            if replace_imports_in_file(os.path.join(root, name), revert):\r\n                nb_of_files_changed += 1\r\n    print(\'Changed imports in \' + str(nb_of_files_changed) + \' files.\')\r\n    print(\'Those files were found in the directory \' + keras_dir)\r\n\r\n\r\ndef convert_to_tf_keras():\r\n    """"""Convert the codebase to tf.keras""""""\r\n    convert_codebase(False)\r\n\r\n\r\ndef convert_to_keras_team_keras():\r\n    """"""Convert the codebase from tf.keras to keras-team/keras""""""\r\n    convert_codebase(True)\r\n\r\n\r\ndef test_replace_imports():\r\n    python_code = """"""\r\n    import keras\r\n    from keras import backend as K\r\n    import os\r\n    import keras_contrib\r\n    import keras_contrib.layers as lay\r\n    import keras.layers\r\n    from keras.layers import Dense\r\n\r\n    if K.backend() == \'tensorflow\':\r\n        import tensorflow as tf\r\n        function = tf.max\r\n    """"""\r\n\r\n    expected_code = """"""\r\n    from tensorflow import keras\r\n    from tensorflow.keras import backend as K\r\n    import os\r\n    import keras_contrib\r\n    import keras_contrib.layers as lay\r\n    import tensorflow.keras.layers\r\n    from tensorflow.keras.layers import Dense\r\n\r\n    if K.backend() == \'tensorflow\':\r\n        import tensorflow as tf\r\n        function = tf.max\r\n    """"""\r\n\r\n    code_with_replacement = replace_imports_in_text(python_code, False)\r\n    assert expected_code == code_with_replacement\r\n    assert python_code == replace_imports_in_text(code_with_replacement, True)\r\n\r\n\r\nif __name__ == \'__main__\':\r\n    if \'--revert\' in sys.argv:\r\n        convert_to_keras_team_keras()\r\n    else:\r\n        convert_to_tf_keras()\r\n'"
setup.py,0,"b""from setuptools import setup\nfrom setuptools import find_packages\nimport os\n\n\nif os.environ.get('USE_TF_KERAS', None) == '1':\n    name = 'tf_keras_contrib'\n    install_requires = []\nelse:\n    name = 'keras_contrib'\n    install_requires = ['keras']\n\nsetup(name=name,\n      version='2.0.8',\n      description='Keras Deep Learning for Python, Community Contributions',\n      author='Fariz Rahman',\n      author_email='farizrahman4u@gmail.com',\n      url='https://github.com/farizrahman4u/keras-contrib',\n      license='MIT',\n      install_requires=install_requires,\n      extras_require={\n          'h5py': ['h5py'],\n          'visualize': ['pydot>=1.2.0'],\n          'tests': ['pytest',\n                    'pytest-pep8',\n                    'pytest-xdist',\n                    'pytest-cov'],\n      },\n      classifiers=[\n          'Development Status :: 3 - Alpha',\n          'Intended Audience :: Developers',\n          'Intended Audience :: Education',\n          'Intended Audience :: Science/Research',\n          'License :: OSI Approved :: MIT License',\n          'Programming Language :: Python :: 2',\n          'Programming Language :: Python :: 2.7',\n          'Programming Language :: Python :: 3',\n          'Programming Language :: Python :: 3.6',\n          'Topic :: Software Development :: Libraries',\n          'Topic :: Software Development :: Libraries :: Python Modules'\n      ],\n      packages=find_packages())\n"""
examples/cifar10_clr.py,0,"b'\'\'\'Train a simple deep CNN on the CIFAR10 small images dataset using\na triangular cyclic learning rate (CLR) policy.\nIt gets to 75% validation accuracy in 15 epochs, and 79% after 40 epochs;\ncompare to 25 and 50 epochs respectively without CLR.\n\'\'\'\n\nfrom __future__ import print_function\nfrom __future__ import absolute_import\nimport keras\nfrom keras.datasets import cifar10\nfrom keras.preprocessing.image import ImageDataGenerator\nfrom keras.models import Sequential\nfrom keras.layers import Dense, Dropout, Activation, Flatten\nfrom keras.layers import Conv2D, MaxPooling2D\nfrom keras_contrib.callbacks import CyclicLR\n\nimport os\n\nbatch_size = 100\nepochs = 50\nnum_classes = 10\ndata_augmentation = True\nnum_predictions = 20\nsave_dir = os.path.join(os.getcwd(), \'saved_models\')\nmodel_name = \'keras_cifar10_trained_model.h5\'\n\n# The data, split between train and test sets:\n(x_train, y_train), (x_test, y_test) = cifar10.load_data()\nprint(\'x_train shape:\', x_train.shape)\nprint(x_train.shape[0], \'train samples\')\nprint(x_test.shape[0], \'test samples\')\n\n# Convert class vectors to binary class matrices.\ny_train = keras.utils.to_categorical(y_train, num_classes)\ny_test = keras.utils.to_categorical(y_test, num_classes)\n\nmodel = Sequential()\nmodel.add(Conv2D(32, (3, 3), padding=\'same\',\n                 input_shape=x_train.shape[1:]))\nmodel.add(Activation(\'relu\'))\nmodel.add(Conv2D(32, (3, 3)))\nmodel.add(Activation(\'relu\'))\nmodel.add(MaxPooling2D(pool_size=(2, 2)))\nmodel.add(Dropout(0.25))\n\nmodel.add(Conv2D(64, (3, 3), padding=\'same\'))\nmodel.add(Activation(\'relu\'))\nmodel.add(Conv2D(64, (3, 3)))\nmodel.add(Activation(\'relu\'))\nmodel.add(MaxPooling2D(pool_size=(2, 2)))\nmodel.add(Dropout(0.25))\n\nmodel.add(Flatten())\nmodel.add(Dense(512))\nmodel.add(Activation(\'relu\'))\nmodel.add(Dropout(0.5))\nmodel.add(Dense(num_classes))\nmodel.add(Activation(\'softmax\'))\n\n# initiate RMSprop optimizer\nopt = keras.optimizers.rmsprop(lr=0.0001, decay=1e-6)\n\n# initiate CyclicLR LR scheduler\nclr = CyclicLR(\n    base_lr=0.0001,\n    max_lr=0.0005,\n    step_size=2000,\n    mode=\'triangular\')\n\n\n# Let\'s train the model using RMSprop\nmodel.compile(loss=\'categorical_crossentropy\',\n              optimizer=opt,\n              metrics=[\'accuracy\'])\n\nx_train = x_train.astype(\'float32\')\nx_test = x_test.astype(\'float32\')\nx_train /= 255\nx_test /= 255\n\nif not data_augmentation:\n    print(\'Not using data augmentation.\')\n    model.fit(x_train, y_train,\n              batch_size=batch_size,\n              epochs=epochs,\n              validation_data=(x_test, y_test),\n              callbacks=[clr],\n              shuffle=True)\nelse:\n    print(\'Using real-time data augmentation.\')\n    # This will do preprocessing and realtime data augmentation:\n    datagen = ImageDataGenerator(\n        featurewise_center=False,  # set input mean to 0 over the dataset\n        samplewise_center=False,  # set each sample mean to 0\n        featurewise_std_normalization=False,  # divide inputs by std of the dataset\n        samplewise_std_normalization=False,  # divide each input by its std\n        zca_whitening=False,  # apply ZCA whitening\n        zca_epsilon=1e-06,  # epsilon for ZCA whitening\n        rotation_range=0,\n        # randomly rotate images in the range (degrees, 0 to 180)\n        # randomly shift images horizontally (fraction of total width)\n        width_shift_range=0.1,\n        # randomly shift images vertically (fraction of total height)\n        height_shift_range=0.1,\n        shear_range=0.,  # set range for random shear\n        zoom_range=0.,  # set range for random zoom\n        channel_shift_range=0.,  # set range for random channel shifts\n        # set mode for filling points outside the input boundaries\n        fill_mode=\'nearest\',\n        cval=0.,  # value used for fill_mode = ""constant""\n        horizontal_flip=True,  # randomly flip images\n        vertical_flip=False,  # randomly flip images\n        # set rescaling factor (applied before any other transformation)\n        rescale=None,\n        # set function that will be applied on each input\n        preprocessing_function=None,\n        # image data format, either ""channels_first"" or ""channels_last""\n        data_format=None,\n        # fraction of images reserved for validation (strictly between 0 and 1)\n        validation_split=0.0)\n\n    # Compute quantities required for feature-wise normalization\n    # (std, mean, and principal components if ZCA whitening is applied).\n    datagen.fit(x_train)\n\n    # Fit the model on the batches generated by datagen.flow().\n\n    model.fit_generator(datagen.flow(x_train, y_train,\n                                     batch_size=batch_size),\n                        epochs=epochs,\n                        validation_data=(x_test, y_test),\n                        callbacks=[clr],\n                        workers=4)\n\n# Save model and weights\nif not os.path.isdir(save_dir):\n    os.makedirs(save_dir)\nmodel_path = os.path.join(save_dir, model_name)\nmodel.save(model_path)\nprint(\'Saved trained model at %s \' % model_path)\n\n# Score trained model.\nscores = model.evaluate(x_test, y_test, verbose=1)\nprint(\'Test loss:\', scores[0])\nprint(\'Test accuracy:\', scores[1])\n'"
examples/cifar10_densenet.py,0,"b""'''\nTrains a DenseNet-40-12 model on the CIFAR-10 Dataset.\n\nGets a 94.84% accuracy score after 100 epochs.\n'''\nfrom __future__ import absolute_import\nfrom __future__ import print_function\nfrom __future__ import division\n\nimport numpy as np\n\nfrom keras import backend as K\nfrom keras.callbacks import ModelCheckpoint, ReduceLROnPlateau, EarlyStopping\nfrom keras.datasets import cifar10\nfrom keras.optimizers import Adam\nfrom keras.preprocessing.image import ImageDataGenerator\nfrom keras.utils import np_utils\nfrom keras_contrib.applications import DenseNet\n\nbatch_size = 64\nnb_classes = 10\nepochs = 100\n\nimg_rows, img_cols = 32, 32\nimg_channels = 3\n\n# Parameters for the DenseNet model builder\nif K.image_data_format() == 'channels_first':\n    img_dim = (img_channels, img_rows, img_cols)\nelse:\n    img_dim = (img_rows, img_cols, img_channels)\ndepth = 40\nnb_dense_block = 3\ngrowth_rate = 12\nnb_filter = 16\ndropout_rate = 0.0  # 0.0 for data augmentation\n\n# Create the model (without loading weights)\nmodel = DenseNet(depth=depth, nb_dense_block=nb_dense_block,\n                 growth_rate=growth_rate, nb_filter=nb_filter,\n                 dropout_rate=dropout_rate,\n                 input_shape=img_dim,\n                 weights=None)\nprint('Model created')\n\nmodel.summary()\n\noptimizer = Adam(lr=1e-3)  # Using Adam instead of SGD to speed up training\nmodel.compile(loss='categorical_crossentropy', optimizer=optimizer, metrics=['acc'])\nprint('Finished compiling')\n\n(trainX, trainY), (testX, testY) = cifar10.load_data()\n\ntrainX = trainX.astype('float32')\ntestX = testX.astype('float32')\n\ntrainX /= 255.\ntestX /= 255.\n\nY_train = np_utils.to_categorical(trainY, nb_classes)\nY_test = np_utils.to_categorical(testY, nb_classes)\n\ngenerator = ImageDataGenerator(rotation_range=15,\n                               width_shift_range=5. / 32,\n                               height_shift_range=5. / 32)\n\ngenerator.fit(trainX, seed=0)\n\nweights_file = 'DenseNet-40-12-CIFAR-10.h5'\n\nlr_reducer = ReduceLROnPlateau(monitor='val_loss', factor=np.sqrt(0.1),\n                               cooldown=0, patience=10, min_lr=0.5e-6)\nearly_stopper = EarlyStopping(monitor='val_acc', min_delta=1e-4, patience=20)\nmodel_checkpoint = ModelCheckpoint(weights_file, monitor='val_acc',\n                                   save_best_only=True,\n                                   save_weights_only=True, mode='auto')\n\ncallbacks = [lr_reducer, early_stopper, model_checkpoint]\n\nmodel.fit_generator(generator.flow(trainX, Y_train, batch_size=batch_size),\n                    steps_per_epoch=len(trainX) // batch_size,\n                    epochs=epochs,\n                    callbacks=callbacks,\n                    validation_data=(testX, Y_test),\n                    verbose=2)\n\nscores = model.evaluate(testX, Y_test, batch_size=batch_size)\nprint('Test loss : ', scores[0])\nprint('Test accuracy : ', scores[1])\n"""
examples/cifar10_nasnet.py,0,"b'""""""\nAdapted from keras example cifar10_cnn.py\nTrain NASNet-CIFAR on the CIFAR10 small images dataset.\n""""""\nfrom __future__ import print_function\nfrom keras.datasets import cifar10\nfrom keras.preprocessing.image import ImageDataGenerator\nfrom keras.utils import np_utils\nfrom keras.callbacks import ModelCheckpoint\nfrom keras.callbacks import ReduceLROnPlateau\nfrom keras.callbacks import CSVLogger\nfrom keras.optimizers import Adam\nfrom keras_contrib.applications.nasnet import NASNetCIFAR, preprocess_input\n\nimport numpy as np\n\n\nweights_file = \'NASNet-CIFAR-10.h5\'\nlr_reducer = ReduceLROnPlateau(factor=np.sqrt(0.5),\n                               cooldown=0,\n                               patience=5,\n                               min_lr=0.5e-5)\ncsv_logger = CSVLogger(\'NASNet-CIFAR-10.csv\')\nmodel_checkpoint = ModelCheckpoint(weights_file,\n                                   monitor=\'val_predictions_acc\',\n                                   save_best_only=True,\n                                   save_weights_only=True, mode=\'max\')\n\nbatch_size = 128\nnb_classes = 10\nnb_epoch = 600\ndata_augmentation = True\n\n# input image dimensions\nimg_rows, img_cols = 32, 32\n# The CIFAR10 images are RGB.\nimg_channels = 3\n\n# The data, shuffled and split between train and test sets:\n(X_train, y_train), (X_test, y_test) = cifar10.load_data()\n\n# Convert class vectors to binary class matrices.\nY_train = np_utils.to_categorical(y_train, nb_classes)\nY_test = np_utils.to_categorical(y_test, nb_classes)\n\nX_train = X_train.astype(\'float32\')\nX_test = X_test.astype(\'float32\')\n\n# preprocess input\nX_train = preprocess_input(X_train)\nX_test = preprocess_input(X_test)\n\n# For training, the auxilary branch must be used to correctly train NASNet\nmodel = NASNetCIFAR((img_rows, img_cols, img_channels), use_auxilary_branch=True)\nmodel.summary()\n\noptimizer = Adam(lr=1e-3, clipnorm=5)\nmodel.compile(loss=[\'categorical_crossentropy\', \'categorical_crossentropy\'],\n              optimizer=optimizer, metrics=[\'accuracy\'], loss_weights=[1.0, 0.4])\n\n# model.load_weights(\'NASNet-CIFAR-10.h5\', by_name=True)\n\nif not data_augmentation:\n    print(\'Not using data augmentation.\')\n    model.fit(X_train, [Y_train, Y_train],\n              batch_size=batch_size,\n              epochs=nb_epoch,\n              validation_data=(X_test, [Y_test, Y_test]),\n              shuffle=True,\n              verbose=2,\n              callbacks=[lr_reducer, csv_logger, model_checkpoint])\nelse:\n    print(\'Using real-time data augmentation.\')\n    # This will do preprocessing and realtime data augmentation:\n    datagen = ImageDataGenerator(\n        featurewise_center=False,  # set input mean to 0 over the dataset\n        samplewise_center=False,  # set each sample mean to 0\n        featurewise_std_normalization=False,  # divide inputs by std of the dataset\n        samplewise_std_normalization=False,  # divide each input by its std\n        zca_whitening=False,  # apply ZCA whitening\n        rotation_range=0,  # randomly rotate images in the range (degrees, 0 to 180)\n        width_shift_range=0.1,\n        height_shift_range=0.1,\n        horizontal_flip=True,  # randomly flip images\n        vertical_flip=False)  # randomly flip images\n\n    # Compute quantities required for featurewise normalization\n    # (std, mean, and principal components if ZCA whitening is applied).\n    datagen.fit(X_train)\n\n    # wrap the ImageDataGenerator to yield\n    # two label batches [y, y] for each input batch X\n    # When training a NASNet model, we have to use its auxilary training head\n    # Therefore the model is technically a 1 input - 2 output model, and requires\n    # the label to be duplicated for the auxilary head\n    def image_data_generator_wrapper(image_datagenerator, batch_size):\n        iterator = datagen.flow(X_train, Y_train, batch_size=batch_size)\n\n        while True:\n            X, y = next(iterator)  # get the next batch\n            yield X, [y, y]  # duplicate the labels for each batch\n\n    # Fit the model on the batches generated by datagen.flow().\n    model.fit_generator(image_data_generator_wrapper(datagen, batch_size),\n                        steps_per_epoch=X_train.shape[0] // batch_size,\n                        validation_data=(X_test, [Y_test, Y_test]),\n                        epochs=nb_epoch, verbose=2,\n                        callbacks=[lr_reducer, csv_logger, model_checkpoint])\n\nscores = model.evaluate(X_test, [Y_test, Y_test], batch_size=batch_size)\nfor score, metric_name in zip(scores, model.metrics_names):\n    print(""%s : %0.4f"" % (metric_name, score))\n'"
examples/cifar10_resnet.py,0,"b'""""""\nAdapted from keras example cifar10_cnn.py and github.com/raghakot/keras-resnet\nTrain ResNet-18 on the CIFAR10 small images dataset.\n\nGPU run command with Theano backend (with TensorFlow, the GPU is automatically used):\n    THEANO_FLAGS=mode=FAST_RUN,device=gpu,floatX=float32 python cifar10.py\n""""""\nfrom __future__ import print_function\nfrom keras.datasets import cifar10\nfrom keras.preprocessing.image import ImageDataGenerator\nfrom keras.utils import np_utils\nfrom keras.callbacks import ModelCheckpoint\nfrom keras.callbacks import ReduceLROnPlateau\nfrom keras.callbacks import CSVLogger\nfrom keras.callbacks import EarlyStopping\nfrom keras_contrib.applications.resnet import ResNet18\n\nimport numpy as np\n\n\nweights_file = \'ResNet18v2-CIFAR-10.h5\'\nlr_reducer = ReduceLROnPlateau(factor=np.sqrt(0.1), cooldown=0,\n                               patience=5, min_lr=0.5e-6)\nearly_stopper = EarlyStopping(min_delta=0.001, patience=10)\ncsv_logger = CSVLogger(\'ResNet18v2-CIFAR-10.csv\')\nmodel_checkpoint = ModelCheckpoint(weights_file, monitor=\'val_acc\', save_best_only=True,\n                                   save_weights_only=True, mode=\'auto\')\n\nbatch_size = 32\nnb_classes = 10\nnb_epoch = 200\ndata_augmentation = True\n\n# input image dimensions\nimg_rows, img_cols = 32, 32\n# The CIFAR10 images are RGB.\nimg_channels = 3\n\n# The data, shuffled and split between train and test sets:\n(X_train, y_train), (X_test, y_test) = cifar10.load_data()\n\n# Convert class vectors to binary class matrices.\nY_train = np_utils.to_categorical(y_train, nb_classes)\nY_test = np_utils.to_categorical(y_test, nb_classes)\n\nX_train = X_train.astype(\'float32\')\nX_test = X_test.astype(\'float32\')\n\n# subtract mean and normalize\nmean_image = np.mean(X_train, axis=0)\nX_train -= mean_image\nX_test -= mean_image\nX_train /= 128.\nX_test /= 128.\n\nmodel = ResNet18((img_rows, img_cols, img_channels), nb_classes)\nmodel.compile(loss=\'categorical_crossentropy\',\n              optimizer=\'adam\',\n              metrics=[\'accuracy\'])\n\nif not data_augmentation:\n    print(\'Not using data augmentation.\')\n    model.fit(X_train, Y_train,\n              batch_size=batch_size,\n              nb_epoch=nb_epoch,\n              validation_data=(X_test, Y_test),\n              shuffle=True,\n              callbacks=[lr_reducer, early_stopper, csv_logger, model_checkpoint])\nelse:\n    print(\'Using real-time data augmentation.\')\n    # This will do preprocessing and realtime data augmentation:\n    datagen = ImageDataGenerator(\n        featurewise_center=False,  # set input mean to 0 over the dataset\n        samplewise_center=False,  # set each sample mean to 0\n        featurewise_std_normalization=False,  # divide inputs by std of the dataset\n        samplewise_std_normalization=False,  # divide each input by its std\n        zca_whitening=False,  # apply ZCA whitening\n        rotation_range=0,  # randomly rotate images in the range (degrees, 0 to 180)\n        width_shift_range=0.1,  # randomly shift images horizontally\n        height_shift_range=0.1,  # randomly shift images vertically\n        horizontal_flip=True,  # randomly flip images\n        vertical_flip=False)  # randomly flip images\n\n    # Compute quantities required for featurewise normalization\n    # (std, mean, and principal components if ZCA whitening is applied).\n    datagen.fit(X_train)\n\n    callbacks = [lr_reducer, early_stopper, csv_logger, model_checkpoint]\n    # Fit the model on the batches generated by datagen.flow().\n    model.fit_generator(datagen.flow(X_train, Y_train, batch_size=batch_size),\n                        steps_per_epoch=X_train.shape[0] // batch_size,\n                        validation_data=(X_test, Y_test),\n                        epochs=nb_epoch, verbose=2,\n                        callbacks=callbacks)\n\nscores = model.evaluate(X_test, Y_test, batch_size=batch_size)\nprint(\'Test loss : \', scores[0])\nprint(\'Test accuracy : \', scores[1])\n'"
examples/cifar10_ror.py,0,"b""'''\nTrains a Residual-of-Residual Network (WRN-40-2) model on the CIFAR-10 Dataset.\n\nGets a 94.53% accuracy score after 150 epochs.\n'''\n\nimport keras.callbacks as callbacks\nimport keras.utils.np_utils as kutils\nfrom keras.datasets import cifar10\nfrom keras.preprocessing.image import ImageDataGenerator\nfrom keras.optimizers import Adam\n\nfrom keras_contrib.applications import ResidualOfResidual\n\nbatch_size = 64\nepochs = 150\nimg_rows, img_cols = 32, 32\n\n(trainX, trainY), (testX, testY) = cifar10.load_data()\n\ntrainX = trainX.astype('float32')\ntestX = testX.astype('float32')\n\ntrainX /= 255\ntestX /= 255\n\ntempY = testY\ntrainY = kutils.to_categorical(trainY)\ntestY = kutils.to_categorical(testY)\n\ngenerator = ImageDataGenerator(rotation_range=15,\n                               width_shift_range=5. / 32,\n                               height_shift_range=5. / 32)\n\ngenerator.fit(trainX, seed=0)\n\nmodel = ResidualOfResidual(depth=40, width=2, dropout_rate=0.0, weights=None)\n\noptimizer = Adam(lr=1e-3)\n\nmodel.compile(loss='categorical_crossentropy', optimizer=optimizer, metrics=['acc'])\nprint('Finished compiling')\n\ncheckpoint = callbacks.ModelCheckpoint('weights/RoR-WRN-40-2-Weights.h5',\n                                       monitor='val_acc',\n                                       save_best_only=True,\n                                       save_weights_only=True)\nmodel.fit_generator(generator.flow(trainX, trainY, batch_size=batch_size),\n                    steps_per_epoch=len(trainX) // batch_size,\n                    epochs=epochs,\n                    callbacks=[checkpoint],\n                    validation_data=(testX, testY),\n                    verbose=2)\n\nscores = model.evaluate(testX, testY, batch_size)\nprint('Test loss : ', scores[0])\nprint('Test accuracy : ', scores[1])\n"""
examples/cifar10_wide_resnet.py,0,"b""'''\nTrains a WRN-28-8 model on the CIFAR-10 Dataset.\n\nPerformance is slightly less than the paper, since\nthey use WRN-28-10 model (95.83%).\n\nGets a 95.54% accuracy score after 300 epochs.\n'''\nfrom __future__ import absolute_import\nfrom __future__ import print_function\nfrom __future__ import division\n\nfrom keras.datasets import cifar10\nimport keras.callbacks as callbacks\nimport keras.utils.np_utils as kutils\nfrom keras.preprocessing.image import ImageDataGenerator\n\nfrom keras_contrib.applications.wide_resnet import WideResidualNetwork\n\nbatch_size = 64\nepochs = 300\nimg_rows, img_cols = 32, 32\n\n(trainX, trainY), (testX, testY) = cifar10.load_data()\n\ntrainX = trainX.astype('float32')\ntrainX /= 255.0\ntestX = testX.astype('float32')\ntestX /= 255.0\n\ntempY = testY\ntrainY = kutils.to_categorical(trainY)\ntestY = kutils.to_categorical(testY)\n\ngenerator = ImageDataGenerator(rotation_range=10,\n                               width_shift_range=5. / 32,\n                               height_shift_range=5. / 32,\n                               horizontal_flip=True)\n\ngenerator.fit(trainX, seed=0, augment=True)\n\n# We will be training the model, therefore no need to load weights\nmodel = WideResidualNetwork(depth=28, width=8, dropout_rate=0.0, weights=None)\n\nmodel.summary()\n\nmodel.compile(loss='categorical_crossentropy', optimizer='adam', metrics=['acc'])\nprint('Finished compiling')\nmodel_checkpoint = callbacks.ModelCheckpoint('WRN-28-8 Weights.h5',\n                                             monitor='val_acc',\n                                             save_best_only=True,\n                                             save_weights_only=True)\nmodel.fit_generator(generator.flow(trainX, trainY, batch_size=batch_size),\n                    steps_per_epoch=len(trainX) // batch_size,\n                    epochs=epochs,\n                    callbacks=[model_checkpoint],\n                    validation_data=(testX, testY))\n\nscores = model.evaluate(testX, testY, batch_size)\nprint('Test loss : %0.5f' % (scores[0]))\nprint('Test accuracy = %0.5f' % (scores[1]))\n"""
