file_path,api_count,code
setup.py,0,"b' #!/usr/bin/env python\nfrom setuptools import find_packages\nfrom setuptools import setup\n\nDISTNAME = \'alphapy\'\nDESCRIPTION = ""AlphaPy: A Machine Learning Pipeline for Speculators""\nLONG_DESCRIPTION = ""alphapy is a Python library for machine learning using scikit-learn. We have a stock market pipeline and a sports pipeline so that speculators can test predictive models, along with functions for trading systems and portfolio management.""\n\nMAINTAINER = \'ScottFree LLC [Robert D. Scott II, Mark Conway]\'\nMAINTAINER_EMAIL = \'scottfree.analytics@scottfreellc.com\'\nURL = ""https://github.com/ScottFreeLLC/AlphaPy""\nLICENSE = ""Apache License, Version 2""\nVERSION = ""2.4.2""\n\nclassifiers = [\'Development Status :: 4 - Beta\',\n               \'Programming Language :: Python\',\n               \'Programming Language :: Python :: 3\',\n               \'Programming Language :: Python :: 3.6\',\n               \'Programming Language :: Python :: 3.7\',\n               \'License :: OSI Approved :: Apache Software License\',\n               \'Intended Audience :: Science/Research\',\n               \'Topic :: Scientific/Engineering\',\n               \'Topic :: Scientific/Engineering :: Mathematics\',\n               \'Operating System :: OS Independent\']\n\ninstall_reqs = [\n    \'arrow>=0.13\',\n    \'bokeh>=1.3\',\n    \'category_encoders>=2.1\',\n    \'iexfinance>=0.4.3\',\n    \'imbalanced-learn>=0.5\',\n    \'ipython>=7.2\',\n    \'keras>=2.2\',\n    \'matplotlib>=3.0\',\n    \'numpy>=1.17\',\n    \'pandas>=1.0\',\n    \'pandas-datareader>=0.8\',\n    \'pyfolio>=0.9\',\n    \'pyyaml>=5.0\',\n    \'scikit-learn>=0.22\',\n    \'scipy>=1.1\',\n    \'seaborn>=0.9\',\n    \'tensorflow>=1.15\',\n]\n\nif __name__ == ""__main__"":\n    setup(\n        name=DISTNAME,\n        version=VERSION,\n        maintainer=MAINTAINER,\n        maintainer_email=MAINTAINER_EMAIL,\n        description=DESCRIPTION,\n        license=LICENSE,\n        url=URL,\n        long_description=LONG_DESCRIPTION,\n        packages=find_packages(),\n        classifiers=classifiers,\n        install_requires=install_reqs,\n        entry_points={\n            \'console_scripts\': [\n                \'alphapy = alphapy.__main__:main\',\n                \'mflow = alphapy.market_flow:main\',\n                \'sflow = alphapy.sport_flow:main\',\n            ],\n        }\n    )\n'"
alphapy/__init__.py,0,b''
alphapy/__main__.py,0,"b'################################################################################\n#\n# Package   : AlphaPy\n# Module    : __main__\n# Created   : July 11, 2013\n#\n# Copyright 2020 ScottFree Analytics LLC\n# Mark Conway & Robert D. Scott II\n#\n# Licensed under the Apache License, Version 2.0 (the ""License"");\n# you may not use this file except in compliance with the License.\n# You may obtain a copy of the License at\n#\n#    http://www.apache.org/licenses/LICENSE-2.0\n#\n# Unless required by applicable law or agreed to in writing, software\n# distributed under the License is distributed on an ""AS IS"" BASIS,\n# WITHOUT WARRANTIES OR CONDITIONS OF ANY KIND, either express or implied.\n# See the License for the specific language governing permissions and\n# limitations under the License.\n#\n################################################################################\n\n\n#\n# Imports\n#\n\nfrom alphapy.data import get_data\nfrom alphapy.data import sample_data\nfrom alphapy.data import shuffle_data\nfrom alphapy.estimators import get_estimators\nfrom alphapy.estimators import scorers\nfrom alphapy.features import apply_transforms\nfrom alphapy.features import create_crosstabs\nfrom alphapy.features import create_features\nfrom alphapy.features import create_interactions\nfrom alphapy.features import drop_features\nfrom alphapy.features import remove_lv_features\nfrom alphapy.features import save_features\nfrom alphapy.features import select_features\nfrom alphapy.frame import write_frame\nfrom alphapy.globals import CSEP, PSEP, SSEP, USEP\nfrom alphapy.globals import ModelType\nfrom alphapy.globals import Partition, datasets\nfrom alphapy.globals import WILDCARD\nfrom alphapy.model import first_fit\nfrom alphapy.model import generate_metrics\nfrom alphapy.model import get_model_config\nfrom alphapy.model import load_feature_map\nfrom alphapy.model import load_predictor\nfrom alphapy.model import make_predictions\nfrom alphapy.model import Model\nfrom alphapy.model import predict_best\nfrom alphapy.model import predict_blend\nfrom alphapy.model import save_model\nfrom alphapy.model import save_predictions\nfrom alphapy.optimize import hyper_grid_search\nfrom alphapy.optimize import rfecv_search\nfrom alphapy.plots import generate_plots\nfrom alphapy.utilities import get_datestamp\n\nimport argparse\nfrom datetime import datetime\nimport logging\nimport numpy as np\nimport os\nimport pandas as pd\nfrom sklearn.model_selection import train_test_split\nimport sys\nimport warnings\n\n\n#\n# Initialize logger\n#\n\nlogger = logging.getLogger(__name__)\n\n\n#\n# Function training_pipeline\n#\n\ndef training_pipeline(model):\n    r""""""AlphaPy Training Pipeline\n\n    Parameters\n    ----------\n    model : alphapy.Model\n        The model object for controlling the pipeline.\n\n    Returns\n    -------\n    model : alphapy.Model\n        The final results are stored in the model object.\n\n    Raises\n    ------\n    KeyError\n        If the number of columns of the train and test data do not match,\n        then this exception is raised.\n\n    """"""\n\n    logger.info(""Training Pipeline"")\n\n    # Unpack the model specifications\n\n    calibration = model.specs[\'calibration\']\n    directory = model.specs[\'directory\']\n    drop = model.specs[\'drop\']\n    extension = model.specs[\'extension\']\n    feature_selection = model.specs[\'feature_selection\']\n    grid_search = model.specs[\'grid_search\']\n    model_type = model.specs[\'model_type\']\n    rfe = model.specs[\'rfe\']\n    sampling = model.specs[\'sampling\']\n    scorer = model.specs[\'scorer\']\n    seed = model.specs[\'seed\']\n    separator = model.specs[\'separator\']\n    split = model.specs[\'split\']\n    target = model.specs[\'target\']\n\n    # Get train and test data\n\n    X_train, y_train = get_data(model, Partition.train)\n    X_test, y_test = get_data(model, Partition.test)\n\n    # If there is no test partition, then we will split the train partition\n\n    if X_test.empty:\n        logger.info(""No Test Data Found"")\n        logger.info(""Splitting Training Data"")\n        X_train, X_test, y_train, y_test = train_test_split(\n            X_train, y_train, test_size=split, random_state=seed)\n\n    # Determine if there are any test labels\n\n    if y_test.any():\n        logger.info(""Test Labels Found"")\n        model.test_labels = True\n    model = save_features(model, X_train, X_test, y_train, y_test)\n\n    # Log feature statistics\n\n    logger.info(""Original Feature Statistics"")\n    logger.info(""Number of Training Rows    : %d"", X_train.shape[0])\n    logger.info(""Number of Training Columns : %d"", X_train.shape[1])\n    if model_type == ModelType.classification:\n        uv, uc = np.unique(y_train, return_counts=True)\n        logger.info(""Unique Training Values for %s : %s"", target, uv)\n        logger.info(""Unique Training Counts for %s : %s"", target, uc)\n    logger.info(""Number of Testing Rows     : %d"", X_test.shape[0])\n    logger.info(""Number of Testing Columns  : %d"", X_test.shape[1])\n    if model_type == ModelType.classification and model.test_labels:\n        uv, uc = np.unique(y_test, return_counts=True)\n        logger.info(""Unique Testing Values for %s : %s"", target, uv)\n        logger.info(""Unique Testing Counts for %s : %s"", target, uc)\n\n    # Merge training and test data\n\n    if X_train.shape[1] == X_test.shape[1]:\n        split_point = X_train.shape[0]\n        X_all = pd.concat([X_train, X_test])\n    else:\n        raise IndexError(""The number of training and test columns [%d, %d] must match."" %\n                         (X_train.shape[1], X_test.shape[1]))\n\n    # Apply transforms to the feature matrix\n    X_all = apply_transforms(model, X_all)\n\n    # Drop features\n    X_all = drop_features(X_all, drop)\n\n    # Save the train and test files with extracted and dropped features\n\n    datestamp = get_datestamp()\n    data_dir = SSEP.join([directory, \'input\'])\n    df_train = X_all.iloc[:split_point, :]\n    df_train[target] = y_train\n    output_file = USEP.join([model.train_file, datestamp])\n    write_frame(df_train, data_dir, output_file, extension, separator, index=False)\n    df_test = X_all.iloc[split_point:, :]\n    if y_test.any():\n        df_test[target] = y_test\n    output_file = USEP.join([model.test_file, datestamp])\n    write_frame(df_test, data_dir, output_file, extension, separator, index=False)\n\n    # Create crosstabs for any categorical features\n\n    if model_type == ModelType.classification:\n        create_crosstabs(model)\n\n    # Create initial features\n\n    X_all = create_features(model, X_all, X_train, X_test, y_train)\n    X_train, X_test = np.array_split(X_all, [split_point])\n    model = save_features(model, X_train, X_test)\n\n    # Generate interactions\n\n    X_all = create_interactions(model, X_all)\n    X_train, X_test = np.array_split(X_all, [split_point])\n    model = save_features(model, X_train, X_test)\n\n    # Remove low-variance features\n\n    X_all = remove_lv_features(model, X_all)\n    X_train, X_test = np.array_split(X_all, [split_point])\n    model = save_features(model, X_train, X_test)\n\n    # Shuffle the data [if specified]\n    model = shuffle_data(model)\n\n    # Oversampling or Undersampling [if specified]\n\n    if model_type == ModelType.classification:\n        if sampling:\n            model = sample_data(model)\n        else:\n            logger.info(""Skipping Sampling"")\n\n    # Perform feature selection, independent of algorithm\n\n    if feature_selection:\n        model = select_features(model)\n\n    # Get the available classifiers and regressors \n\n    logger.info(""Getting All Estimators"")\n    estimators = get_estimators(model)\n\n    # Get the available scorers\n\n    if scorer not in scorers:\n        raise KeyError(""Scorer function %s not found"" % scorer)\n\n    # Model Selection\n\n    logger.info(""Selecting Models"")\n\n    for algo in model.algolist:\n        logger.info(""Algorithm: %s"", algo)\n        # select estimator\n        try:\n            estimator = estimators[algo]\n            est = estimator.estimator\n        except KeyError:\n            logger.info(""Algorithm %s not found"", algo)\n        # initial fit\n        model = first_fit(model, algo, est)\n        # copy feature name master into feature names per algorithm\n        model.fnames_algo[algo] = model.feature_names\n        # recursive feature elimination\n        if rfe:\n            has_coef = hasattr(est, ""coef_"")\n            has_fimp = hasattr(est, ""feature_importances_"")\n            if has_coef or has_fimp:\n                model = rfecv_search(model, algo)\n            else:\n                logger.info(""No RFE Available for %s"", algo)\n        # grid search\n        if grid_search:\n            model = hyper_grid_search(model, estimator)\n        # predictions\n        model = make_predictions(model, algo, calibration)\n\n    # Create a blended estimator\n\n    if len(model.algolist) > 1:\n        model = predict_blend(model)\n\n    # Generate metrics\n\n    model = generate_metrics(model, Partition.train)\n    model = generate_metrics(model, Partition.test)\n\n    # Store the best estimator\n    model = predict_best(model)\n\n    # Generate plots\n\n    generate_plots(model, Partition.train)\n    if model.test_labels:\n        generate_plots(model, Partition.test)\n\n    # Save best features and predictions\n    save_model(model, \'BEST\', Partition.test)\n\n    # Return the model\n    return model\n\n\n#\n# Function prediction_pipeline\n#\n\ndef prediction_pipeline(model):\n    r""""""AlphaPy Prediction Pipeline\n\n    Parameters\n    ----------\n    model : alphapy.Model\n        The model object for controlling the pipeline.\n\n    Returns\n    -------\n    None : None\n\n    Notes\n    -----\n    The saved model is loaded from disk, and predictions are made\n    on the new testing data.\n\n    """"""\n\n    logger.info(""Predict Mode"")\n\n    # Unpack the model specifications\n\n    directory = model.specs[\'directory\']\n    drop = model.specs[\'drop\']\n    feature_selection = model.specs[\'feature_selection\']\n    model_type = model.specs[\'model_type\']\n    rfe = model.specs[\'rfe\']\n\n    # Get all data. We need original train and test for encodings.\n\n    X_train, y_train = get_data(model, Partition.train)\n\n    partition = Partition.predict\n    X_predict, _ = get_data(model, partition)\n\n    # Load feature_map\n    model = load_feature_map(model, directory)\n\n    # Log feature statistics\n\n    logger.info(""Feature Statistics"")\n    logger.info(""Number of Prediction Rows    : %d"", X_predict.shape[0])\n    logger.info(""Number of Prediction Columns : %d"", X_predict.shape[1])\n\n    # Apply transforms to the feature matrix\n    X_all = apply_transforms(model, X_predict)\n\n    # Drop features\n    X_all = drop_features(X_all, drop)\n\n    # Create initial features\n    X_all = create_features(model, X_all, X_train, X_predict, y_train)\n\n    # Generate interactions\n    X_all = create_interactions(model, X_all)\n\n    # Remove low-variance features\n    X_all = remove_lv_features(model, X_all)\n\n    # Load the univariate support vector, if any\n\n    if feature_selection:\n        logger.info(""Getting Univariate Support"")\n        try:\n            support = model.feature_map[\'uni_support\']\n            X_all = X_all[:, support]\n            logger.info(""New Feature Count : %d"", X_all.shape[1])\n        except:\n            logger.info(""No Univariate Support"")\n\n    # Load the RFE support vector, if any\n\n    if rfe:\n        logger.info(""Getting RFE Support"")\n        try:\n            support = model.feature_map[\'rfe_support\']\n            X_all = X_all[:, support]\n            logger.info(""New Feature Count : %d"", X_all.shape[1])\n        except:\n            logger.info(""No RFE Support"")\n\n    # Load predictor\n    predictor = load_predictor(directory)\n\n    # Make predictions\n    \n    logger.info(""Making Predictions"")\n    tag = \'BEST\'\n    model.preds[(tag, partition)] = predictor.predict(X_all)\n    if model_type == ModelType.classification:\n        model.probas[(tag, partition)]  = predictor.predict_proba(X_all)[:, 1]\n\n    # Save predictions\n    save_predictions(model, tag, partition)\n\n    # Return the model\n    return model\n\n\n#\n# Function main_pipeline\n#\n\ndef main_pipeline(model):\n    r""""""AlphaPy Main Pipeline\n\n    Parameters\n    ----------\n    model : alphapy.Model\n        The model specifications for the pipeline.\n\n    Returns\n    -------\n    model : alphapy.Model\n        The final model.\n\n    """"""\n\n    # Extract any model specifications\n    predict_mode = model.specs[\'predict_mode\']\n\n    # Prediction Only or Calibration\n\n    if predict_mode:\n        model = prediction_pipeline(model)\n    else:\n        model = training_pipeline(model)\n\n    # Return the completed model\n    return model\n\n\n#\n# Function main\n#\n\ndef main(args=None):\n    r""""""AlphaPy Main Program\n\n    Notes\n    -----\n    (1) Initialize logging.\n    (2) Parse the command line arguments.\n    (3) Get the model configuration.\n    (4) Create the model object.\n    (5) Call the main AlphaPy pipeline.\n\n    """"""\n\n    # Suppress Warnings\n\n    warnings.simplefilter(action=\'ignore\', category=DeprecationWarning)\n    warnings.simplefilter(action=\'ignore\', category=FutureWarning)\n\n    # Logging\n\n    logging.basicConfig(format=""[%(asctime)s] %(levelname)s\\t%(message)s"",\n                        filename=""alphapy.log"", filemode=\'a\', level=logging.INFO,\n                        datefmt=\'%m/%d/%y %H:%M:%S\')\n    formatter = logging.Formatter(""[%(asctime)s] %(levelname)s\\t%(message)s"",\n                                  datefmt=\'%m/%d/%y %H:%M:%S\')\n    console = logging.StreamHandler()\n    console.setFormatter(formatter)\n    console.setLevel(logging.INFO)\n    logging.getLogger().addHandler(console)\n\n    # Start the pipeline\n\n    logger.info(\'*\'*80)\n    logger.info(""AlphaPy Start"")\n    logger.info(\'*\'*80)\n\n    # Argument Parsing\n\n    parser = argparse.ArgumentParser(description=""AlphaPy Parser"")\n    parser.add_mutually_exclusive_group(required=False)\n    parser.add_argument(\'--predict\', dest=\'predict_mode\', action=\'store_true\')\n    parser.add_argument(\'--train\', dest=\'predict_mode\', action=\'store_false\')\n    parser.set_defaults(predict_mode=False)\n    args = parser.parse_args()\n\n    # Read configuration file\n\n    specs = get_model_config()\n    specs[\'predict_mode\'] = args.predict_mode\n\n    # Create directories if necessary\n\n    output_dirs = [\'config\', \'data\', \'input\', \'model\', \'output\', \'plots\']\n    for od in output_dirs:\n        output_dir = SSEP.join([specs[\'directory\'], od])\n        if not os.path.exists(output_dir):\n            logger.info(""Creating directory %s"", output_dir)\n            os.makedirs(output_dir)\n\n    # Create a model from the arguments\n\n    logger.info(""Creating Model"")\n    model = Model(specs)\n\n    # Start the pipeline\n\n    logger.info(""Calling Pipeline"")\n    model = main_pipeline(model)\n\n    # Complete the pipeline\n\n    logger.info(\'*\'*80)\n    logger.info(""AlphaPy End"")\n    logger.info(\'*\'*80)\n\n\n#\n# MAIN PROGRAM\n#\n\nif __name__ == ""__main__"":\n    main()\n'"
alphapy/alias.py,0,"b'################################################################################\n#\n# Package   : AlphaPy\n# Module    : alias\n# Created   : July 11, 2013\n#\n# Copyright 2017 ScottFree Analytics LLC\n# Mark Conway & Robert D. Scott II\n#\n# Licensed under the Apache License, Version 2.0 (the ""License"");\n# you may not use this file except in compliance with the License.\n# You may obtain a copy of the License at\n#\n#    http://www.apache.org/licenses/LICENSE-2.0\n#\n# Unless required by applicable law or agreed to in writing, software\n# distributed under the License is distributed on an ""AS IS"" BASIS,\n# WITHOUT WARRANTIES OR CONDITIONS OF ANY KIND, either express or implied.\n# See the License for the specific language governing permissions and\n# limitations under the License.\n#\n################################################################################\n\n\n#\n# Imports\n#\n\nimport logging\nimport parser\nimport re\n\n\n#\n# Initialize logger\n#\n\nlogger = logging.getLogger(__name__)\n\n\n#\n# Class Alias\n#\n\nclass Alias(object):\n    """"""Create a new alias as a key-value pair. All aliases are stored\n    in ``Alias.aliases``. Duplicate keys or values are not allowed,\n    unless the ``replace`` parameter is ``True``.\n\n    Parameters\n    ----------\n    name : str\n        Alias key.\n    expr : str\n        Alias value.\n    replace : bool, optional\n        Replace the current key-value pair if it already exists.\n\n    Attributes\n    ----------\n    Alias.aliases : dict\n        Class variable for storing all known aliases\n\n    Examples\n    --------\n    \n    >>> Alias(\'atr\', \'ma_truerange\')\n    >>> Alias(\'hc\', \'higher_close\')\n\n    """"""\n\n    # class variable to track all aliases\n\n    aliases = {}\n\n    # function __new__\n\n    def __new__(cls,\n                name,\n                expr,\n                replace = False):\n        # code\n        efound = expr in [Alias.aliases[key] for key in Alias.aliases]\n        if efound == True:\n            key = [key for key, aexpr in list(Alias.aliases.items()) if aexpr == expr]\n            logger.info(""Expression %s already exists for key %s"", expr, key)\n            return\n        else:\n            if replace == True or not name in Alias.aliases:\n                identifier = re.compile(r""^[^\\d\\W]\\w*\\Z"", re.UNICODE)\n                result1 = re.match(identifier, name)\n                if result1 is None:\n                    logger.info(""Invalid alias key: %s"", name)\n                    return\n                result2 = re.match(identifier, expr)\n                if result2 is None:\n                    logger.info(""Invalid alias expression: %s"", expr)\n                    return\n                return super(Alias, cls).__new__(cls)\n            else:\n                logger.info(""Key %s already exists"", name)\n\n    # function __init__\n\n    def __init__(self,\n                 name,\n                 expr,\n                 replace = False):\n        # code\n        self.name = name;\n        self.expr = expr;\n        # add key with expression\n        Alias.aliases[name] = expr\n            \n    # function __str__\n\n    def __str__(self):\n        return self.expr\n\n    \n#\n# Function get_alias\n#\n\ndef get_alias(alias):\n    r""""""Find an alias value with the given key.\n\n    Parameters\n    ----------\n    alias : str\n        Key for finding the alias value.\n\n    Returns\n    -------\n    alias_value : str\n        Value for the corresponding key.\n\n    Examples\n    --------\n\n    >>> alias_value = get_alias(\'atr\')\n    >>> alias_value = get_alias(\'hc\')\n\n    """"""\n    if alias in Alias.aliases:\n        return Alias.aliases[alias]\n    else:\n        return None\n'"
