file_path,api_count,code
python/setup.py,0,"b'#!/usr/bin/env python\nimport os\nfrom setuptools import setup, find_packages\nfrom seldon import __version__\n\nsetup(name=\'seldon\',\n      version=__version__,\n      description=\'Seldon Python Utilities\',\n      author=\'Clive Cox\',\n      author_email=\'support@seldon.io\',\n      url=\'https://github.com/SeldonIO/seldon-server\',\n      license=\'Apache 2 License\',\n      install_requires=[\'wabbit_wappa==3.0.2\',\'xgboost\',\'kazoo\',\'scikit-learn>=0.17\',\'scipy\',\'numpy\',\'boto\',\'filechunkio\',\'keras\',\'pylibmc\', \'annoy\', \'gensim\', ""Flask"", ""pandas>=0.17"", ""cmd2"", ""MySQL-python"", ""smart_open"", ""luigi""],\n      dependency_links = [\n          \'https://github.com/SeldonIO/wabbit_wappa/archive/3.0.2.zip#egg=wabbit-wappa-3.0.2\'\n      ],\n      packages=[\'seldon\', \'seldon.pipeline\', \'seldon.microservice\', \'seldon.text\', \'seldon.shell\', \'seldon.cli\',\'seldon.misc\',\'seldon.luigi\',\'seldon.rpc\',\'seldon.anomaly\'],\n      package_dir={\'seldon.shell\': \'seldon/shell\', \'seldon.cli\': \'seldon/cli\'},\n      package_data={\'seldon.shell\': [\'dbschema/mysql/api.sql\', \'dbschema/mysql/client.sql\'], \'seldon.cli\': [\'dbschema/mysql/api.sql\', \'dbschema/mysql/client.sql\', \'grafana/client-dashboard.json\']},\n      scripts=[\'bin/seldon-shell\',\'bin/seldon-cli\'],\n      )\n'"
scripts/add_attr_schema.py,0,"b'#!/usr/bin/env python\nimport json\nimport MySQLdb\nimport getopt, argparse\n\nfrom pprint import pprint\n\n\nvalid_value_types = set([\'double\', \'string\', \'date\', \'text\', \'int\',\'boolean\'])\nvalue_types_to_db_map = dict(double=\'DOUBLE\', string=\'VARCHAR\', date=\'DATETIME\', int=\'INT\', boolean=\'BOOLEAN\',\n\ttext=\'TEXT\', enum=\'ENUM\')\n\ndef addAttrsToDb(attrs, item_type):\n\tattrs.append({""name"":""content_type"", ""value_type"":[""article""]})\n\tfor attr in attrs:\n\t\tattrValType = attr[\'value_type\']\n\t\tif type(attrValType) is list:\n\t\t\tattrValType = \'enum\'\n\t\tcur = db.cursor()\n\t\tcur.execute(""INSERT INTO ITEM_ATTR (name, type, item_type) ""\n\t\t\t+ "" VALUES (%s, %s, %s)"", (attr[\'name\'], value_types_to_db_map[attrValType], item_type))\n\t\tif attrValType is \'enum\':\n\t\t\tfor index,enum in enumerate(attr[\'value_type\'], start=1):\n\t\t\t\tcur = db.cursor()\n\t\t\t\tcur.execute(""SELECT attr_id FROM ITEM_ATTR WHERE NAME = %s and ITEM_TYPE = %s"", (attr[\'name\'],item_type))\n\t\t\t\trows = cur.fetchall()\n\t\t\t\tattrId = rows[0][0]\n\t\t\t\tcur = db.cursor()\n\t\t\t\tcur.execute(""INSERT INTO ITEM_ATTR_ENUM (attr_id, value_id, value_name) VALUES (%s, %s, %s)"",(attrId, index, enum))\n\tcur = db.cursor()\n\n\tcur.execute(""SELECT attr_id, value_id, value_name FROM ITEM_ATTR_ENUM"")\n\trows = cur.fetchall()\n\tfor row in rows:\n\t\tenum_attr_id = row[0]\n\t\tenum_value_id = row[1]\n\t\tenum_value_name = row[2]\n\t\tcur = db.cursor()\n\t\tcur.execute(""INSERT INTO DIMENSION (item_type, attr_id, value_id) VALUES""\n\t\t\t+ "" (%s, %s, %s)"", (item_type, enum_attr_id, enum_value_id))\n\ndef doDbChecks():\n\tcur = db.cursor()\n\tcur.execute(""SELECT COUNT(*) FROM ITEM_TYPE"")\n\trows = cur.fetchall()\n\tif rows[0][0] != 0:\n\t\tprint ""ITEM_TYPE table was not empty, it had"", rows[0][0], \'rows\'\n\t\tdoExitBecauseDbNotEmpty()\n\tcur = db.cursor()\n\tcur.execute(""SELECT COUNT(*) FROM ITEM_ATTR"")\n\trows = cur.fetchall()\n\tif rows[0][0] != 0:\n\t\tprint ""ITEM_ATTR table was not empty, it had"", rows[0][0], \'rows\'\n\t\tdoExitBecauseDbNotEmpty()\n\tcur = db.cursor()\n\tcur.execute(""SELECT COUNT(*) FROM ITEM_ATTR_ENUM"")\n\trows = cur.fetchall()\n\tif rows[0][0] !=0:\n\t\tprint ""ITEM_ATTR_ENUM table was not empty, it had"", rows[0][0], \'rows\'\n\t\tdoExitBecauseDbNotEmpty()\n\tcur = db.cursor()\n\tcur.execute(""SELECT COUNT(*) FROM DIMENSION"")\n\trows = cur.fetchall()\n\tif rows[0][0] !=0:\n\t\tprint ""DIMENSION table was not empty, it had"", rows[0][0], \'rows\'\n\t\tdoExitBecauseDbNotEmpty()\n\n\ndef doExitBecauseDbNotEmpty():\n\tprint ""To run this script, the relevant DB tables must be empty. Please rerun this script with the -clean option to delete these entries.""\n\texit(1)\n\ndef addToDb(types):\n\twith db:\n\t\tdoDbChecks()\n\t\tfor theType in types:\n\t\t\tcur= db.cursor()\n\t\t\tcur.execute(""INSERT INTO ITEM_TYPE (type_id, name)""+\n\t\t\t\t"" values (%s, %s)"",(theType[\'type_id\'],theType[\'type_name\']))\n\t\t\taddAttrsToDb(theType[\'type_attrs\'], theType[\'type_id\'])\n\n\ndef validateValueType(valType):\n    theType = type(valType)\n    if theType is list:\n    \tfor enum in valType:\n    \t\ttheEnumType = type(enum)\n    \t\tif theEnumType is not unicode and theEnumType is not str:\n    \t\t\tprint ""enum objects must be strings:"", theEnumType\n    \t\t\texit(1)\n    elif theType is unicode:\n    \t\tif valType not in valid_value_types:\n    \t\t\t\tprint ""the value type must be one of \'double\', \'string\', \'date\' or an object""\n    \t\t\t\texit(1)\n    else:\n    \tprint ""the type of the field value_type must be a string or a list where as it was"",theType\n    \texit(1)\n\ndef validateAttr(theAttr):\n    if \'name\' not in theAttr or \'value_type\' not in theAttr:\n        print ""couldn\'t find one of (name, value_type) for attr ""\n        pprint(theAttr)\n        exit(1)\n    else:\n    \tvalidateValueType(theAttr[\'value_type\']);\n\ndef validateType(theType):\n    if \'type_id\' not in theType or \'type_name\' not in theType or \'type_attrs\' not in theType:\n        print ""couldn\'t find one of (type_id, type_name, type_attrs) for object""\n        pprint(theType)\n        exit(1)\n    for theAttr in theType[\'type_attrs\']:\n        validateAttr(theAttr)\n\ndef validateNumbering(types):\n    ids = set()\n    for theType in types:\n        if isinstance(theType[\'type_id\'], int):\n        \tif theType[\'type_id\'] in ids:\n        \t\tprint ""found a repeated type_id"", theType[\'type_id\']\n        \t\texit(1)\n        \telse:\n        \t\tids.add(theType[\'type_id\'])\n        else:\n        \tprint ""type_id s must be integers but one was"",""\\"""",theType[\'type_id\'],""\\""""\n        \texit(1)\n\ndef outputDimensionsToFile(file, db):\n\n\twith db:\n\t\tcur = db.cursor()\n\t\tcur.execute(""SELECT d.dim_id, e.value_name from DIMENSION d, ITEM_ATTR_ENUM e where d.attr_id = e.attr_id and d.value_id = e.value_id and e.value_name != \\\'article\\\'"")\n\t\trows = cur.fetchall()\n\t\tjson.dump(rows, file)\n\ndef readTypes(types):\n    for theType in types:\n        validateType(theType)\n    validateNumbering(types)\n    return types\n\ndef clearUp(db):\n\twith db:\n\t\tcur = db.cursor()\n\t\tcur.execute(""TRUNCATE TABLE ITEMS"")\n\t\tcur.execute(""TRUNCATE TABLE DIMENSION"")\n\t\tcur.execute(""TRUNCATE TABLE ITEM_ATTR_ENUM"")\n\t\tcur.execute(""TRUNCATE TABLE ITEM_ATTR"")\n\t\tcur.execute(""TRUNCATE TABLE ITEM_TYPE"")\n\t\tcur.execute(\'truncate table users\')\n\t\tcur.execute(\'truncate table items\')\n\t\tcur.execute(\'truncate table item_map_varchar\')\n\t\tcur.execute(\'truncate table item_map_double\')\n\t\tcur.execute(\'truncate table item_map_datetime\')\n\t\tcur.execute(\'truncate table item_map_int\')\n\t\tcur.execute(\'truncate table item_map_boolean\')\n\t\tcur.execute(\'truncate table item_map_enum\')\n\t\tcur.execute(\'truncate table item_map_text\')\n\nparser = argparse.ArgumentParser(description=""Adds the data schema defined via a file to the DB. Outputs a file (dimensions.json) which contains shortcuts that can be used to narrow the scope of the recommendation output (see API docs for further information)."", prog=\'add_attr_schema.py\')\nparser.add_argument(\'-db-host\', help=\'database host\', required=False, default=""localhost"")\nparser.add_argument(\'-db-user\', help=\'database username\', required=False, default=""root"")\nparser.add_argument(\'-db-pass\', help=\'database password\', required=False, default=""root"")\nparser.add_argument(\'-client\', help=\'client/database name\', required=False, default=""testclient"")\nparser.add_argument(\'-schema-file\', help=""json file with data schema"", required=True)\nparser.add_argument(\'-clean\',action=\'store_true\', help=""instead of adding a schema, clean the current one up (delete the entries in the DB)"", default=False)\n\nopts = vars(parser.parse_args())\n\nif opts[\'clean\']:\n\tprint ""Cleaning the database...""\nelse:\n\n\tjson_data=open(opts[\'schema_file\'])\n\n\tdata = json.load(json_data)\n\tif \'types\' not in data:\n\t    print ""couldn\'t find types object in json""\n\t    exit(1)\n\telse:\n\t    types = readTypes(data[\'types\'])\n\ndb = MySQLdb.connect(user=opts[\'db_user\'],db=opts[\'client\'],passwd=opts[\'db_pass\'], host=opts[\'db_host\'])\nif opts[\'clean\']:\n\tclearUp(db)\n\tprint ""Finished successfully""\nelse:\n\taddToDb(types)\n\tf = open(\'dimensions.json\',\'w\')\n\toutputDimensionsToFile(f,db)\n\n\tprint \'Finished successfully\'\n\n\tjson_data.close()\n\n'"
scripts/add_client.py,0,"b'#!/usr/bin/env python\nimport argparse, os, json\nimport seldon_utils as seldon\nfrom kazoo.client import KazooClient\ndir = os.path.dirname(os.path.abspath(__file__))\nparser = argparse.ArgumentParser(prog=""add_client"",\n\tdescription=""Adds a new client to the Seldon Server"")\nparser.add_argument(""client"",nargs=1,help=""The client to add"")\nparser.add_argument(""--json"",help=""extra JSON configuration for the client"")\nparser.add_argument(""--props"",help=""Relative path to the file with the props"", default=\'../server_config.json\')\nparser.add_argument(""--db"",help=""The name of the DB to use (from the config file), default is to use the first one mentioned."")\nparser.add_argument(""--zookeeper"",help=""Location of zookeeper (hosts)"", default=""localhost"")\n\nargs = parser.parse_args()\nfilename = os.path.join(dir, args.props)\nzk = KazooClient(hosts=args.zookeeper)\nzk.start()\nif not os.path.exists(filename):\n    print ""Properties file doesn\'t exist at"", filename, "", please create it before running this script""\n    exit(1)\nwith open(filename) as data_file:\n    data = json.load(data_file)\nseldon.clientSetup(zk,[{""name"":args.client[0],""db"":args.db}],data[""db""],""/all_clients"")\n\nprint ""Finished successfully""'"
scripts/add_items.py,0,"b'#!/usr/bin/env python\nimport time\nimport datetime\nimport sys\nimport getopt, argparse\nfrom collections import defaultdict\nimport json\nimport MySQLdb\nimport unicodecsv\nITEM_MAP_VARCHAR_INSERT = ""insert into item_map_varchar (item_id, attr_id, value) values ((select item_id from items where client_item_id = %(id)s),(select attr_id from item_attr where name = %(attr_name)s), %(value)s )""\nITEM_MAP_DOUBLE_INSERT = ""insert into item_map_double (item_id, attr_id, value) values ((select item_id from items where client_item_id = %(id)s),(select attr_id from item_attr where name = %(attr_name)s), %(value)s )""\nITEM_MAP_DATETIME_INSERT = ""insert into item_map_datetime (item_id, attr_id, value) values ((select item_id from items where client_item_id = %(id)s),(select attr_id from item_attr where name = %(attr_name)s), %(value)s )""\nITEM_MAP_ENUM_INSERT = ""insert into item_map_enum (item_id, attr_id, value_id) values ((select item_id from items where client_item_id = %(id)s),(select attr_id from item_attr where name = %(attr_name)s), (select e.value_id from ITEM_ATTR_ENUM e, item_attr a where a.name = %(attr_name)s and e.value_name = %(value)s and a.attr_id = e.attr_id) )""\nITEM_MAP_TEXT_INSERT = ""insert into item_map_text (item_id, attr_id, value) values ((select item_id from items where client_item_id = %(id)s),(select attr_id from item_attr where name = %(attr_name)s), %(value)s )""\nITEM_MAP_INT_INSERT = ""insert into item_map_int (item_id, attr_id, value) values ((select item_id from items where client_item_id = %(id)s),(select attr_id from item_attr where name = %(attr_name)s), %(value)s )""\nITEM_MAP_BOOLEAN_INSERT = ""insert into item_map_boolean (item_id, attr_id, value) values ((select item_id from items where client_item_id = %(id)s),(select attr_id from item_attr where name = %(attr_name)s), %(value)s )""\n\nITEM_INSERT = ""INSERT INTO ITEMS (name, first_op, last_op, client_item_id, type) VALUES (%(name)s, NOW(), NOW(), %(id)s, 1)""\nDB_BATCH_SIZE = 1000\nattr_insert_map = {\n\t\'ENUM\': ITEM_MAP_ENUM_INSERT,\n\t\'BOOLEAN\': ITEM_MAP_BOOLEAN_INSERT,\n\t\'VARCHAR\': ITEM_MAP_VARCHAR_INSERT,\n\t\'TEXT\': ITEM_MAP_TEXT_INSERT,\n\t\'DATETIME\': ITEM_MAP_DATETIME_INSERT,\n\t\'INT\': ITEM_MAP_INT_INSERT,\n\t\'DOUBLE\': ITEM_MAP_DOUBLE_INSERT\n}\n\n\navailable_attrs = dict()\navailable_enums = dict()\n\ndef retrieveDbAttrs(db):\n\tcur = db.cursor()\n\tcur.execute(""SELECT ATTR_ID, NAME, TYPE FROM ITEM_ATTR"")\n\trows = cur.fetchall()\n\tattrs = dict()\n\tfor row in rows:\n\t\tattrs[row[1]]= (row[0], row[2])\n\n\treturn attrs\n\ndef retrieveDbEnums(db):\n\tcur = db.cursor()\n\t# enum structure:\n\t#    attr_id1:\n\t#\t\t\t\tvalue_name1 : value_id1\n\t#\t\t\t\tvalue_name2 :value_id2\n\tcur.execute(""SELECT ATTR_ID, VALUE_NAME, VALUE_ID FROM ITEM_ATTR_ENUM"")\n\trows = cur.fetchall()\n\tenums = defaultdict(dict)\n\tfor row in rows:\n\t\tenums[row[0]][row[1]] = row[2]\n\n\treturn enums\n\ndef validateCSVAgainstDb(csv_file, db):\n\tglobal available_attrs, available_enums\n\tfailed = False\n\tattrs = retrieveDbAttrs(db)\n\tavailable_attrs = attrs\n\tenums = retrieveDbEnums(db)\n\tavailable_enums = enums\n\twith open(csv_file) as csvFile:\n\t\treader = unicodecsv.DictReader(csvFile,encoding=\'utf-8\')\n\t\tnoOfFields = 0\n\t\tfor index, line in enumerate(reader, start=1):\n\t\t\tif index is 1:\n\t\t\t\tnoOfFields = len(line)\n\t\t\t\tif not validateFieldsAgainstDbFields(set(line), attrs, db):\n\t\t\t\t\texit(1)\n\t\t\tvalidateLine(line, noOfFields, attrs, enums)\n\t\t\tif len(line) != noOfFields:\n\t\t\t\tfailLine(index, line)\n\t\t\t\tfailed = True\n\n\n\tif failed:\n\t\texit(1)\n\ndef validateLine(line, noOfFields, attrs, enums):\n\tif len(line) != noOfFields:\n\t\tfailLine(index, line)\n\t\tfailed = True\n\telse:\n\t\tfor word in line:\n\t\t\tif str(word) == \'id\':\n\t\t\t\tcontinue\n\t\t\tif str(word) == \'name\':\n\t\t\t\tcontinue\n\t\t\tvalue = line[word]\n\t\t\tif str(attrs[word][1]) == \'ENUM\':\n\t\t\t\tif value not in enums[attrs[word][0]]:\n\t\t\t\t\tprint \'couldn\\\'t find enum value\', value\n\t\t\t\t\texit(1)\n\n\ndef validateFieldsAgainstDbFields(fields,attrs,  db):\n\tfailed = False\n\tfor field in fields:\n\t\tif field not in attrs and field != \'id\' and field != \'name\':\n\t\t\tfailed = True\n\t\t\tprint \'Field \\\'\',field,\'\\\'not an attribute in the DB\'\n\n\treturn not failed\n\ndef doItemInserts(csv_file, db):\n\twith open(csv_file) as csvFile:\n\t\treader = unicodecsv.DictReader(csvFile,encoding=\'utf-8\')\n\t\tinserts = []\n\t\tfor line in reader:\n\t\t\tclient_id = line[\'id\']\n\t\t\tname = \'\'\n\t\t\tif \'name\' in line:\n\t\t\t\tname = line[\'name\']\n\t\t\tinserts.append({\'name\':name,\'id\':client_id})\n\t\tcur = db.cursor()\n\t\tprint ""inserting items into the db""\n\t\tcur.executemany(ITEM_INSERT, inserts)\n\t\tdb.commit()\n\t\tprint \'finished item inserts\'\n\ndef doAttrInserts(csv_file, db):\n\tinserts = defaultdict(list)\n\tinsertNum = 0\n\twith open(csv_file) as csvFile:\n\t\treader = unicodecsv.DictReader(csvFile,encoding=\'utf-8\')\n\t\tfor line in reader:\n\t\t\tfor field_name in line:\n\t\t\t\tif field_name == \'id\' or field_name== \'name\':\n\t\t\t\t\tcontinue\n\t\t\t\tattr_type = available_attrs[str(field_name)][1]\n\t\t\t\tinserts[attr_type].append({\'attr_name\': field_name, \'value\': line[field_name], \'id\': line[\'id\']})\n\t\t\t\tif len(inserts[attr_type]) > DB_BATCH_SIZE:\n\t\t\t\t\tinsertNum+=1\n\t\t\t\t\treallyDoInserts(inserts[attr_type], attr_insert_map[attr_type], insertNum, db)\n\t\t\t\t\tdel inserts[attr_type]\n\tfor index, insert_label in enumerate(inserts, start=1):\n\t\tinsertNum+=1\n\t\treallyDoInserts(inserts[insert_label], attr_insert_map[insert_label], insertNum, db)\n\tdb.commit()\n\tprint \'finished attribute inserts\'\n\ndef reallyDoInserts(params, insertStatement, insertNum, db):\n\t\tcur = db.cursor()\n\t\tprint ""inserting attribute batch"", insertNum,\'into the db\'\n\t\tcur.executemany(insertStatement, params)\n\ndef failLine(lineNum, line):\n\tprint ""line"",lineNum,""failed as it only had"",len(line),""fields""\n\ndef cleanUpDb(db):\n\tdbc = db.cursor()\n\tdbc.execute(\'truncate table items\')\n\tdbc.execute(\'truncate table item_map_varchar\')\n\tdbc.execute(\'truncate table item_map_double\')\n\tdbc.execute(\'truncate table item_map_datetime\')\n\tdbc.execute(\'truncate table item_map_int\')\n\tdbc.execute(\'truncate table item_map_boolean\')\n\tdbc.execute(\'truncate table item_map_enum\')\n\tdbc.execute(\'truncate table item_map_text\')\n\tdb.commit()\n\nparser = argparse.ArgumentParser(prog=""add_items.py"")\nparser.add_argument(\'-items\', help=\'items csv file\', required=True)\nparser.add_argument(\'-db-host\', help=\'database host\', required=False, default=""localhost"")\nparser.add_argument(\'-db-user\', help=\'database username\', required=False, default=""root"")\nparser.add_argument(\'-db-pass\', help=\'database password\', required=False, default=""root"")\nparser.add_argument(\'-client\', help=\'client/database name\', required=False, default=""testclient"")\n\nopts = vars(parser.parse_args())\n\ndb = MySQLdb.connect(user=opts[\'db_user\'],db=opts[\'client\'],passwd=opts[\'db_pass\'], host=opts[\'db_host\'])\ndb.set_character_set(\'utf8\')\ndbc = db.cursor()\ndbc.execute(\'SET NAMES utf8;\')\ndbc.execute(\'SET CHARACTER SET utf8;\')\ndbc.execute(\'SET character_set_connection=utf8;\')\ndbc.execute(""SET GLOBAL max_allowed_packet=1073741824"")\ntry:\n\tvalidateCSVAgainstDb(opts[\'items\'], db)\n\tdoItemInserts(opts[\'items\'], db)\n\tdoAttrInserts(opts[\'items\'],db)\nexcept:\n\tprint \'Unexpected error ...\', sys.exc_info()[0]\n\tprint \'Clearing DB of items and attributes\'\n\ttry:\n\t\tcleanUpDb(db)\n\texcept:\n\t\tprint \'couldn\\\'t clean up db\'\n\traise\nprint ""Successfully ran all inserts""'"
scripts/add_users.py,0,"b'#!/usr/bin/env python\nimport time\nimport datetime\nimport sys\nimport getopt, argparse\nfrom collections import defaultdict\nimport json\nimport MySQLdb\nimport unicodecsv\nUSER_INSERT = ""insert into users (client_user_id, username, first_op, last_op,type,num_op, active) values (%(id)s, %(name)s, now(), now(), 1,1,1)""\n\n\ndef validateCSV(csv_file):\n\twith open(csv_file) as csvFile:\n\t\treader = unicodecsv.DictReader(csvFile,encoding=\'utf-8\')\n\t\tline = reader.next()\n\t\tfor field_name in line:\n\t\t\tif not field_name == \'id\' and not field_name == \'username\':\n\t\t\t\tprint \'only id or username fields allowed\'\n\t\t\t\texit(1)\n\ndef doUserInserts(csv_file, db):\n\twith open(csv_file) as csvFile:\n\t\treader = unicodecsv.DictReader(csvFile,encoding=\'utf-8\')\n\t\tinserts = []\n\t\tinsertNum = 0\n\t\tfor line in reader:\n\t\t\tclient_id = line[\'id\']\n\t\t\tname = \'\'\n\t\t\tif \'name\' in line:\n\t\t\t\tname = line[\'name\']\n\t\t\tinserts.append({\'name\':name,\'id\':client_id})\n\t\t\tif len(inserts) > 1000:\n\t\t\t\tinsertNum+=1\n\t\t\t\treallyDoInserts(USER_INSERT, inserts, insertNum, db)\n\t\t\t\tinserts = []\n\n\t\tinsertNum+=1\n\t\treallyDoInserts(USER_INSERT, inserts, insertNum, db)\n\t\tdb.commit()\n\t\tprint \'finished user inserts\'\n\ndef reallyDoInserts(insertStatement, params, num, db):\n\tcur = db.cursor()\n\tprint ""inserting user batch"", num,\'into the db\'\n\tcur.executemany(insertStatement, params)\n\n\ndef cleanUpDb(db):\n\tdbc = db.cursor()\n\tdbc.execute(\'truncate table users\')\n\nparser = argparse.ArgumentParser(prog=""add_users.py"")\nparser.add_argument(\'-users\', help=\'user csv file\', required=True)\nparser.add_argument(\'-db-host\', help=\'database host\', required=False, default=""localhost"")\nparser.add_argument(\'-db-user\', help=\'database username\', required=False, default=""root"")\nparser.add_argument(\'-db-pass\', help=\'database password\', required=False, default=""root"")\nparser.add_argument(\'-client\', help=\'client/database name\', required=False, default=""testclient"")\n\nopts = vars(parser.parse_args())\n\ndb = MySQLdb.connect(user=opts[\'db_user\'],db=opts[\'client\'],passwd=opts[\'db_pass\'], host=opts[\'db_host\'])\ndb.set_character_set(\'utf8\')\ndbc = db.cursor()\ndbc.execute(\'SET NAMES utf8;\')\ndbc.execute(\'SET CHARACTER SET utf8;\')\ndbc.execute(\'SET character_set_connection=utf8;\')\ndbc.execute(""SET GLOBAL max_allowed_packet=1073741824"")\ntry:\n\tvalidateCSV(opts[\'users\'])\n\tdoUserInserts(opts[\'users\'], db)\nexcept:\n\tprint \'Unexpected error ...\', sys.exc_info()[0]\n\tprint \'Clearing DB of users\'\n\ttry:\n\t\tcleanUpDb(db)\n\texcept:\n\t\tprint \'couldn\\\'t clean up db\'\n\traise\nprint ""Successfully ran all inserts""'"
scripts/create_actions_json.py,0,"b'#!/usr/bin/env python\nimport time\nimport datetime\nimport sys\nimport getopt, argparse\nfrom collections import defaultdict\nimport json\nimport MySQLdb\nimport unicodecsv\n\nparser = argparse.ArgumentParser(prog=\'monitorClientsDb.py\')\nparser.add_argument(\'-actions\', help=\'actions csv file\', required=True)\nparser.add_argument(\'-db-host\', help=\'database host\', required=True)\nparser.add_argument(\'-db-user\', help=\'database username\', required=True)\nparser.add_argument(\'-db-pass\', help=\'database password\', required=False)\nparser.add_argument(\'-client\', help=\'client/database name\', required=False)\nparser.add_argument(\'-out\', help=\'json output file\', required=False)\n\nopts = vars(parser.parse_args())\nclient = opts[\'client\']\nif opts[\'db_pass\']:\n    db = MySQLdb.connect(user=opts[\'db_user\'], passwd=opts[\'db_pass\'],db=client, host=opts[\'db_host\'])\nelse:\n    db = MySQLdb.connect(user=opts[\'db_user\'],db=client, host=opts[\'db_host\'])\n\ndef getItemId(db,cache,client_item_id):\n    if client_item_id in cache:\n        return cache[client_item_id]\n    else:\n        cursor = db.cursor()\n        cursor.execute(""""""select item_id, client_item_id from items"""""")\n        rows = cursor.fetchall()\n        for row in rows:\n            itemId = long(row[0])\n            client_item_id_from_db = row[1]\n            cache[client_item_id_from_db] = itemId\n        cursor.close()\n        return cache[client_item_id]\n\ndef getUserId(db,cache,client_user_id):\n    if client_user_id in cache:\n        return cache[client_user_id]\n    else:\n        cursor = db.cursor()\n        cursor.execute(""""""select user_id,client_user_id from users"""""")\n        rows = cursor.fetchall()\n        for row in rows:\n            userId = long(row[0])\n            client_user_id_from_db = row[1]\n            cache[client_user_id_from_db] = userId\n\n        cursor.close()\n        return cache[client_user_id]\n\nuserCache = {}\nitemCache = {}\ncount = 0\nwith open(opts[\'actions\']) as csvfile, open(opts[\'out\'],\'w\') as outfile:\n    reader = unicodecsv.DictReader(csvfile,encoding=\'utf-8\')\n    for f in reader:\n        item = getItemId(db,itemCache,f[""item_id""])\n        user = getUserId(db,userCache,f[""user_id""])\n        action_type = 1\n        action = {}\n        action[""userid""] = int(user)\n        action[""client_userid""] = f[""item_id""]\n        action[""itemid""] = int(item)\n        action[""client_itemid""] = f[""user_id""]\n        action[""value""] = float(f[""value""])\n        utc = datetime.datetime.fromtimestamp(int(f[""time""])).strftime(\'%Y-%m-%dT%H:%M:%SZ\')\n        action[""timestamp_utc""] = utc\n        action[""rectag""] = ""default""\n        action[""type""] = action_type\n        action[""client""] = client\n        s = json.dumps(action,sort_keys=True)\n        outfile.write(s+""\\n"")\n        count += 1\n        if count % 50000 == 0:\n            print ""Processed ""+str(count)+"" actions""\n'"
