file_path,api_count,code
launch_cluster.py,0,"b""#!/usr/bin/env python\nimport subprocess\nimport argparse\nimport signal\nimport yaml\n\n\ndef launch_proc(proc_type, args):\n\tcmd = ['python', 'main.py'] + args \\\n\t\t+ ['--job_name', proc_type, '--task_index', str(i)]\n\treturn subprocess.Popen(cmd)\n\n\ndef launch_cluster(spec, arg_string, daemonize=False):\n\tparameter_servers = [launch_proc('ps', arg_string) for i in spec['ps']]\n\tworkers = [launch_proc('worker', arg_string) for i in spec['worker']]\n\n\tif not daemonize:\n\t\tprocs = parameter_servers + workers\n\t\ttry:\n\t\t\tfor p in procs:\n\t\t\t\tp.wait()\n\t\texcept KeyboardInterrupt:\n\t\t\tfor p in streams:\n\t\t\t\tp.send_signal(signal.SIGINT)\n\n\nif __name__ == '__main__':\n\tparser = argparse.ArgumentParser()\n\tparser.add_argument('-n', '--num_workers', default=8, type=int, help='number of workers to use if in local mode', dest='num_workers')\n\tparser.add_argument('--cluster_config', default=None, help='load cluster config from yaml file', dest='cluster_config')\n\tparser.add_argument('--daemonize', action='store_true', help='detach after cluster creation', dest='daemonize')\n\targs, unused_args = parser.parse_known_args()\n\n\tif args.cluster_config:\n\t\twith open(args.cluster_config, 'r') as f:\n\t\t\tspec = yaml.load(f)\n\telse:\n\t\tspec = {\n\t\t\t'ps': ['localhost:2048'],\n\t\t\t'worker': [\n\t\t\t\t'localhost:{}'.format(4096+i)\n\t\t\t\tfor i in range(args.num_workers)\n\t\t\t]}\n\n\tlaunch_cluster(spec, unused_args, daemonize=args.daemonize)\n\n\n"""
main.py,2,"b'# -*- coding: utf-8 -*-\r\nimport os\r\nimport sys\r\nimport time\r\nimport yaml\r\nimport argparse\r\nimport numpy as np\r\nimport utils.logger\r\nimport multiprocessing\r\nimport tensorflow as tf\r\n\r\nfrom networks.q_network import QNetwork\r\nfrom multiprocessing import Process, Queue\r\nfrom networks.dueling_network import DuelingNetwork\r\nfrom networks.continuous_actions import ContinuousPolicyNetwork, ContinuousPolicyValueNetwork\r\nfrom networks.policy_v_network import PolicyNetwork, PolicyValueNetwork, PolicyRepeatNetwork, SequencePolicyVNetwork\r\nfrom utils.shared_memory import SharedCounter, SharedVars, SharedFlags, Barrier\r\nfrom algorithms.policy_based_actor_learner import A3CLearner, A3CLSTMLearner\r\nfrom algorithms.sequence_decoder_actor_learner import ActionSequenceA3CLearner, ARA3CLearner\r\nfrom algorithms.value_based_actor_learner import NStepQLearner, DuelingLearner, OneStepSARSALearner\r\nfrom algorithms.intrinsic_motivation_actor_learner import PseudoCountA3CLearner, PseudoCountA3CLSTMLearner, PseudoCountQLearner\r\nfrom algorithms.trpo_actor_learner import TRPOLearner\r\nfrom algorithms.pgq_actor_learner import PGQLearner\r\nfrom algorithms.cem_actor_learner import CEMLearner\r\n\r\nlogger = utils.logger.getLogger(\'main\')\r\n\r\n\r\nALGORITHMS = {\r\n    \'q\': (NStepQLearner, QNetwork),\r\n    \'sarsa\': (OneStepSARSALearner, QNetwork),\r\n    \'dueling\': (DuelingLearner, DuelingNetwork),\r\n    \'a3c\': (A3CLearner, PolicyValueNetwork),\r\n    \'a3c-lstm\': (A3CLSTMLearner, PolicyValueNetwork),\r\n    \'a3c-sequence-decoder\': (ActionSequenceA3CLearner, SequencePolicyVNetwork),\r\n    \'pgq\': (PGQLearner, PolicyValueNetwork),\r\n    \'trpo\': (TRPOLearner, PolicyNetwork),\r\n    \'cem\': (CEMLearner, PolicyNetwork),\r\n    \'dqn-cts\': (PseudoCountQLearner, QNetwork),\r\n    \'a3c-cts\': (PseudoCountA3CLearner, PolicyValueNetwork),\r\n    \'a3c-lstm-cts\': (PseudoCountA3CLSTMLearner, PolicyValueNetwork),\r\n    \'a3c-repeat\': (ARA3CLearner, PolicyRepeatNetwork),\r\n    \'a3c-continuous\': (A3CLearner, ContinuousPolicyValueNetwork),\r\n    \'a3c-lstm-continuous\': (A3CLSTMLearner, ContinuousPolicyValueNetwork),\r\n    \'cem-continuous\': (CEMLearner, ContinuousPolicyNetwork),\r\n    \'trpo-continuous\': (TRPOLearner, ContinuousPolicyNetwork),\r\n}\r\n\r\ndef get_num_actions(rom_path, rom_name):\r\n    from ale_python_interface import ALEInterface\r\n    filename = \'{0}/{1}.bin\'.format(rom_path, rom_name)\r\n    ale = ALEInterface()\r\n    ale.loadROM(filename)\r\n    return len(ale.getMinimalActionSet())\r\n\r\ndef main(args):\r\n    args.batch_size = None\r\n    logger.debug(\'CONFIGURATION: {}\'.format(args))\r\n    \r\n    """""" Set up the graph, the agents, and run the agents in parallel. """"""\r\n    if args.env == \'GYM\':\r\n        from environments import atari_environment\r\n        num_actions, action_space, _ = atari_environment.get_actions(args.game)\r\n        input_shape = atari_environment.get_input_shape(args.game)\r\n    else:\r\n        num_actions = get_num_actions(args.rom_path, args.game)\r\n    \r\n    args.action_space = action_space\r\n    args.summ_base_dir = \'/tmp/summary_logs/{}/{}\'.format(args.game, time.strftime(\'%m.%d/%H.%M\'))\r\n    logger.info(\'logging summaries to {}\'.format(args.summ_base_dir))\r\n\r\n    Learner, Network = ALGORITHMS[args.alg_type]\r\n    network = Network({\r\n        \'name\': \'shared_vars_network\',\r\n        \'input_shape\': input_shape,\r\n        \'num_act\': num_actions,\r\n        \'args\': args\r\n    })\r\n    args.network = Network\r\n\r\n    #initialize shared variables\r\n    args.learning_vars = SharedVars(network.params)\r\n    args.opt_state = SharedVars(\r\n        network.params, opt_type=args.opt_type, lr=args.initial_lr\r\n    ) if args.opt_mode == \'shared\' else None\r\n    args.batch_opt_state = SharedVars(\r\n        network.params, opt_type=args.opt_type, lr=args.initial_lr\r\n    ) if args.opt_mode == \'shared\' else None\r\n\r\n    #TODO: need to refactor so TRPO+GAE doesn\'t need special treatment\r\n    if args.alg_type in [\'trpo\', \'trpo-continuous\']:\r\n        if args.arch == \'FC\': #add timestep feature\r\n            vf_input_shape = [input_shape[0]+1]\r\n        else:\r\n            vf_input_shape = input_shape\r\n\r\n        baseline_network = PolicyValueNetwork({\r\n            \'name\': \'shared_value_network\',\r\n            \'input_shape\': vf_input_shape,\r\n            \'num_act\': num_actions,\r\n            \'args\': args\r\n        }, use_policy_head=False)\r\n        args.baseline_vars = SharedVars(baseline_network.params)\r\n        args.vf_input_shape = vf_input_shape\r\n        \r\n    if args.alg_type in [\'q\', \'sarsa\', \'dueling\', \'dqn-cts\']:\r\n        args.target_vars = SharedVars(network.params)\r\n        args.target_update_flags = SharedFlags(args.num_actor_learners)\r\n    if args.alg_type in [\'dqn-cts\', \'a3c-cts\', \'a3c-lstm-cts\']:\r\n        args.density_model_update_flags = SharedFlags(args.num_actor_learners)\r\n\r\n    tf.reset_default_graph()\r\n    args.barrier = Barrier(args.num_actor_learners)\r\n    args.global_step = SharedCounter(0)\r\n    args.num_actions = num_actions\r\n\r\n    cuda_visible_devices = os.getenv(\'CUDA_VISIBLE_DEVICES\')\r\n    num_gpus = 0\r\n    if cuda_visible_devices:\r\n        num_gpus = len(cuda_visible_devices.split())\r\n\r\n    #spin up processes and block\r\n    if (args.visualize == 2): args.visualize = 0        \r\n    actor_learners = []\r\n    task_queue = Queue()\r\n    experience_queue = Queue()\r\n    seed = args.seed or np.random.randint(2**32)\r\n    np.random.seed(seed)\r\n    tf.set_random_seed(seed)\r\n    for i in xrange(args.num_actor_learners):\r\n        if (args.visualize == 2) and (i == args.num_actor_learners - 1):\r\n            args.args.visualize = 1\r\n\r\n        args.actor_id = i\r\n        args.device = \'/gpu:{}\'.format(i % num_gpus) if num_gpus else \'/cpu:0\'\r\n        \r\n        args.random_seed = seed + i\r\n            \r\n        #only used by TRPO\r\n        args.task_queue = task_queue\r\n        args.experience_queue = experience_queue\r\n\r\n        args.input_shape = input_shape\r\n        actor_learners.append(Learner(args))\r\n        actor_learners[-1].start()\r\n\r\n    try:\r\n        for t in actor_learners:\r\n            t.join()\r\n    except KeyboardInterrupt:\r\n        #Terminate with extreme prejudice\r\n        for t in actor_learners:\r\n            t.terminate()\r\n    \r\n    logger.info(\'All training threads finished!\')\r\n    logger.info(\'Use seed={} to reproduce\'.format(seed))\r\n\r\n\r\ndef get_validated_params(args):\r\n    #validate param\r\n    if args.env==\'ALE\' and args.rom_path is None:\r\n        raise argparse.ArgumentTypeError(\'Need to specify the directory where the game roms are located, via --rom_path\')         \r\n    if args.reward_clip_val <= 0:\r\n        raise argparse.ArgumentTypeError(\'value of --reward_clip_val option must be non-negative\')\r\n    if args.alg_type not in ALGORITHMS:\r\n        raise argparse.ArgumentTypeError(\'alg_type `{}` not implemented\'.format(args.alg_type))\r\n\r\n    # fix up frame_skip depending on whether it was an int or tuple \r\n    if len(args.frame_skip) == 1:\r\n        args.frame_skip = args.frame_skip[0]\r\n    elif len(args.frame_skip) > 2:\r\n        raise argparse.ArgumentTypeError(\'Expected tuple of length two or int for param `frame_skip`\')\r\n\r\n    return args\r\n\r\n\r\ndef get_config():\r\n    parser = argparse.ArgumentParser()\r\n    parser.add_argument(\'--load_config\', default=None, help=\'load config defaults from yaml file\', dest=\'config_path\')\r\n    args, unprocessed_args = parser.parse_known_args()\r\n\r\n    #override defaults\r\n    parser.add_argument(\'game\', help=\'Name of game\')\r\n    parser.add_argument(\'--alg_type\', default=""a3c"", help=\'Type of algorithm: q (for Q-learning), sarsa, a3c (for actor-critic)\', dest=\'alg_type\')\r\n    parser.add_argument(\'--arch\', default=\'NIPS\', help=\'Which network architecture to use: NIPS, NATURE, ATARI-TRPO, or FC (fully connected)\', dest=\'arch\')\r\n    parser.add_argument(\'--env\', default=\'GYM\', help=\'Type of environment: ALE or GYM\', dest=\'env\')\r\n    parser.add_argument(\'--rom_path\', help=\'Directory where the game roms are located (needed for ALE environment)\', dest=\'rom_path\')\r\n    parser.add_argument(\'-n\', \'--num_actor_learners\', default=8, type=int, help=\'number of actors (processes)\', dest=\'num_actor_learners\')\r\n    parser.add_argument(\'-v\', \'--visualize\', default=0, type=int, help=\'0: no visualization of emulator; 1: all emulators, for all actors, are visualized; 2: only 1 emulator (for one of the actors) is visualized\', dest=\'visualize\')\r\n    parser.add_argument(\'--gamma\', default=0.99, type=float, help=\'Discount factor\', dest=\'gamma\')\r\n    parser.add_argument(\'--frame_skip\', default=[4], type=int, nargs=\'+\', help=\'number of frames to repeat action\', dest=\'frame_skip\')\r\n    parser.add_argument(\'--history_length\', default=4, type=int, help=\'number of frames to stack as input state\', dest=\'history_length\')\r\n    parser.add_argument(\'--single_life_episodes\', action=\'store_true\', help=\'if true, training episodes will be terminated when a life is lost (for games)\', dest=\'single_life_episodes\')\r\n    parser.add_argument(\'--max_decoder_steps\', default=20, type=int, help=\'max number of steps that sequence decoder will be allowed to take\', dest=\'max_decoder_steps\')\r\n    parser.add_argument(\'--test\', action=\'store_false\', help=\'if not set train agents in parallel, otherwise follow optimal policy with single agent\', dest=\'is_train\')\r\n    parser.add_argument(\'--restore_checkpoint\', action=\'store_true\', help=\'resume training from last checkpoint\', dest=\'restore_checkpoint\')\r\n    parser.add_argument(\'--use_monitor\', action=\'store_true\', help=\'Record video / episode stats if set\', dest=\'use_monitor\')\r\n    parser.add_argument(\'--pgq_fraction\', default=0.5, type=float, help=\'fraction by which to multiply q gradients\', dest=\'pgq_fraction\')\r\n    parser.add_argument(\'--activation\', default=\'relu\', type=str, help=\'specify relu, softplus, or tanh activations\', dest=\'activation\')\r\n    parser.add_argument(\'--use_rgb\', action=\'store_true\', help=\'If set use rgb image channels instead of stacked luninance frames\', dest=\'use_rgb\')\r\n    parser.add_argument(\'--no_share_weights\', action=\'store_false\', help=\'If set don\\\'t share parameters between policy and value function\', dest=\'share_encoder_weights\')\r\n    parser.add_argument(\'--fc_layer_sizes\', default=[60, 60], type=int, nargs=\'+\', help=\'width of layers in fully connected architecture\', dest=\'fc_layer_sizes\')\r\n    parser.add_argument(\'--seed\', default=None, type=int, help=\'Specify random seed. Each process will get its own unique seed computed as seed+actor_id. Due to race conditions only 1 worker process should be used to get deterministic results\', dest=\'seed\')\r\n\r\n    #optimizer args\r\n    parser.add_argument(\'--opt_type\', default=\'rmsprop\', help=\'Type of optimizer: rmsprop, momentum, adam, adamax\', dest=\'opt_type\')\r\n    parser.add_argument(\'--opt_mode\', default=\'shared\', help=\'Whether to use \\""local\\"" or \\""shared\\"" vector(s) for the momemtum/optimizer statistics\', dest=\'opt_mode\')\r\n    parser.add_argument(\'--b1\', default=0.9, type=float, help=\'Beta1 for the Adam optimizer\', dest=\'b1\')\r\n    parser.add_argument(\'--b2\', default=0.999, type=float, help=\'Beta2 for the Adam optimizer\', dest=\'b2\')\r\n    parser.add_argument(\'--e\', default=0.1, type=float, help=\'Epsilon for the Rmsprop and Adam optimizers\', dest=\'e\')\r\n    parser.add_argument(\'--momentum\', default=0.99, type=float, help=\'Discount factor for the history/coming gradient, for the Rmsprop optimizer\', dest=\'momentum\')\r\n    parser.add_argument(\'-lr\', \'--initial_lr\', default=0.001, type=float, help=\'Initial value for the learning rate. Default = LogUniform(10**-4, 10**-2)\', dest=\'initial_lr\')\r\n    parser.add_argument(\'-lra\', \'--lr_annealing_steps\', default=200000000, type=int, help=\'Nr. of global steps during which the learning rate will be linearly annealed towards zero\', dest=\'lr_annealing_steps\')\r\n    parser.add_argument(\'--max_episode_steps\', default=None, type=int, help=\'max rollout steps per trpo episode\', dest=\'max_episode_steps\')\r\n\r\n    #clipping args\r\n    parser.add_argument(\'--clip_loss\', default=0.0, type=float, help=\'If bigger than 0.0, the loss will be clipped at +/-clip_loss\', dest=\'clip_loss_delta\')\r\n    parser.add_argument(\'--clip_norm\', default=40, type=float, help=\'If clip_norm_type is local/global, grads will be clipped at the specified maximum (avaerage) L2-norm\', dest=\'clip_norm\')\r\n    parser.add_argument(\'--clip_norm_type\', default=\'global\', help=\'Whether to clip grads by their norm or not. Values: ignore (no clipping), local (layer-wise norm), global (global norm)\', dest=\'clip_norm_type\')\r\n    parser.add_argument(\'--rescale_rewards\', action=\'store_true\', help=\'If True, rewards will be rescaled (dividing by the max. possible reward) to be in the range [-1, 1]. If False, rewards will be clipped to be in the range [-REWARD_CLIP, REWARD_CLIP]\', dest=\'rescale_rewards\')\r\n    parser.add_argument(\'--reward_clip_val\', default=1.0, type=float, help=\'Clip rewards outside of [-REWARD_CLIP, REWARD_CLIP]\', dest=\'reward_clip_val\')\r\n    \r\n    #q-learning args\r\n    parser.add_argument(\'-ea\', \'--epsilon_annealing_steps\', default=1000000, type=int, help=\'Nr. of global steps during which the exploration epsilon will be annealed\', dest=\'epsilon_annealing_steps\')\r\n    parser.add_argument(\'--final_epsilon\', default=0.1, type=float, help=\'Final epsilon after annealing is complete. Only used for dqn-cts\', dest=\'final_epsilon\')\r\n    parser.add_argument(\'--grads_update_steps\', default=5, type=int, help=\'Nr. of local steps during which grads are accumulated before applying them to the shared network parameters (needed for 1-step Q/Sarsa learning)\', dest=\'grads_update_steps\')\r\n    parser.add_argument(\'--q_target_update_steps\', default=10000, type=int, help=\'Interval (in nr. of global steps) at which the parameters of the Q target network are updated (obs! 1 step = 4 video frames) (needed for Q-learning and Sarsa)\', dest=\'q_target_update_steps\') \r\n    parser.add_argument(\'--replay_size\', default=100000, type=int, help=\'Maximum capacity of replay memory\', dest=\'replay_size\')\r\n    parser.add_argument(\'--batch_update_size\', default=32, type=int, help=\'Minibatch size for q-learning updates\', dest=\'batch_update_size\')\r\n    parser.add_argument(\'--exploration_strategy\', default=\'epsilon-greedy\', type=str, help=\'boltzmann or epsilon-greedy\', dest=\'exploration_strategy\')\r\n    parser.add_argument(\'--temperature\', default=1.0, type=float, help=\'temperature to use for boltzmann exploration\', dest=\'bolzmann_temperature\')\r\n\r\n    #a3c args \r\n    parser.add_argument(\'--entropy\', default=0.01, type=float, help=\'Strength of the entropy regularization term (needed for actor-critic)\', dest=\'entropy_regularisation_strength\')\r\n    parser.add_argument(\'--max_global_steps\', default=200000000, type=int, help=\'Max. number of training steps\', dest=\'max_global_steps\')\r\n    parser.add_argument(\'--max_local_steps\', default=5, type=int, help=\'Number of steps to gain experience from before every update for the Q learning/A3C algorithm\', dest=\'max_local_steps\')\r\n    \r\n    #trpo args\r\n    parser.add_argument(\'--num_epochs\', default=1000, type=int, help=\'number of epochs for which to run TRPO\', dest=\'num_epochs\')\r\n    parser.add_argument(\'--episodes_per_batch\', default=50, type=int, help=\'number of episodes to batch for TRPO updates\', dest=\'episodes_per_batch\')\r\n    parser.add_argument(\'--trpo_max_rollout\', default=1000, type=int, help=\'max rollout steps per trpo episode\', dest=\'max_rollout\')\r\n    parser.add_argument(\'--cg_subsample\', default=0.1, type=float, help=\'rate at which to subsample data for TRPO conjugate gradient iteration\', dest=\'cg_subsample\')\r\n    parser.add_argument(\'--cg_damping\', default=0.001, type=float, help=\'conjugate gradient damping weight\', dest=\'cg_damping\')   \r\n    parser.add_argument(\'--max_kl\', default=0.01, type=float, help=\'max kl divergence for TRPO updates\', dest=\'max_kl\')\r\n    parser.add_argument(\'--td_lambda\', default=1.0, type=float, help=\'lambda parameter for GAE\', dest=\'td_lambda\')\r\n    \r\n    #cts args\r\n    parser.add_argument(\'--cts_bins\', default=8, type=int, help=\'number of bins to assign pixel values\', dest=\'cts_bins\')\r\n    parser.add_argument(\'--cts_rescale_dim\', default=42, type=int, help=\'rescaled image size to use with cts density model\', dest=\'cts_rescale_dim\')\r\n    parser.add_argument(\'--cts_beta\', default=.05, type=float, help=\'weight by which to scale novelty bonuses\', dest=\'cts_beta\')\r\n    parser.add_argument(\'--cts_eta\', default=.9, type=float, help=\'mixing param between 1-step TD-Error and Monte-Carlo Error\', dest=\'cts_eta\')\r\n    parser.add_argument(\'--density_model\', default=\'cts\', type=str, help=\'density model to use for generating novelty bonuses: cts, or pixel-counts\', dest=\'density_model\')\r\n    parser.add_argument(\'--q_update_interval\', default=4, type=int, help=\'Number of steps between successive batch q-learning updates\', dest=\'q_update_interval\')\r\n\r\n    if args.config_path:\r\n        with open(args.config_path, \'r\') as f:\r\n            parser.set_defaults(**yaml.load(f))\r\n\r\n    args = parser.parse_args(unprocessed_args)\r\n    return get_validated_params(args)\r\n\r\n\r\nif __name__ == \'__main__\':\r\n    main(get_config())\r\n\r\n '"
setup.py,0,"b""#!/usr/bin/env python\nfrom distutils.core import setup\nfrom distutils.extension import Extension\nfrom Cython.Build import cythonize\nimport numpy as np\n\nextensions = [\n\tExtension('utils.fast_cts', sources=['utils/fast_cts.pyx']),\n\tExtension('utils.hogupdatemv', sources=['utils/hogupdatemv.pyx']),\n]\n\nsetup(\n\tname='async-rl-extensions',\n\tinclude_dirs=[np.get_include()],   \n\text_modules=cythonize(extensions)\n)\n"""
algorithms/__init__.py,0,b''
