file_path,api_count,code
examine_data.py,1,"b'"""""" Some data examination """"""\nimport numpy as np\nimport matplotlib.pyplot as plt\n\ndef plot_rollout():\n    """""" Plot a rollout """"""\n    from torch.utils.data import DataLoader\n    from data.loaders import RolloutSequenceDataset\n    dataloader = DataLoader(\n        RolloutSequenceDataset(\n            root=\'datasets/carracing\', seq_len=900,\n            transform=lambda x: x, buffer_size=10,\n            train=False),\n        batch_size=1, shuffle=True)\n\n    dataloader.dataset.load_next_buffer()\n\n    # setting up subplots\n    plt.subplot(2, 2, 1)\n    monitor_obs = plt.imshow(np.zeros((64, 64, 3)))\n    plt.subplot(2, 2, 2)\n    monitor_next_obs = plt.imshow(np.zeros((64, 64, 3)))\n    plt.subplot(2, 2, 3)\n    monitor_diff = plt.imshow(np.zeros((64, 64, 3)))\n\n    for data in dataloader:\n        obs_seq = data[0].numpy().squeeze()\n        action_seq = data[1].numpy().squeeze()\n        next_obs_seq = data[-1].numpy().squeeze()\n        for obs, action, next_obs in zip(obs_seq, action_seq, next_obs_seq):\n            monitor_obs.set_data(obs)\n            monitor_next_obs.set_data(next_obs)\n            monitor_diff.set_data(next_obs - obs)\n            print(action)\n            plt.pause(.01)\n        break\n\nif __name__ == \'__main__\':\n    plot_rollout()\n'"
test_controller.py,2,"b'"""""" Test controller """"""\nimport argparse\nfrom os.path import join, exists\nfrom utils.misc import RolloutGenerator\nimport torch\n\nparser = argparse.ArgumentParser()\nparser.add_argument(\'--logdir\', type=str, help=\'Where models are stored.\')\nargs = parser.parse_args()\n\nctrl_file = join(args.logdir, \'ctrl\', \'best.tar\')\n\nassert exists(ctrl_file),\\\n    ""Controller was not trained...""\n\ndevice = torch.device(\'cpu\')\n\ngenerator = RolloutGenerator(args.logdir, device, 1000)\n\nwith torch.no_grad():\n    generator.rollout(None)\n'"
traincontroller.py,6,"b'""""""\nTraining a linear controller on latent + recurrent state\nwith CMAES.\n\nThis is a bit complex. num_workers slave threads are launched\nto process a queue filled with parameters to be evaluated.\n""""""\nimport argparse\nimport sys\nfrom os.path import join, exists\nfrom os import mkdir, unlink, listdir, getpid\nfrom time import sleep\nfrom torch.multiprocessing import Process, Queue\nimport torch\nimport cma\nfrom models import Controller\nfrom tqdm import tqdm\nimport numpy as np\nfrom utils.misc import RolloutGenerator, ASIZE, RSIZE, LSIZE\nfrom utils.misc import load_parameters\nfrom utils.misc import flatten_parameters\n\n# parsing\nparser = argparse.ArgumentParser()\nparser.add_argument(\'--logdir\', type=str, help=\'Where everything is stored.\')\nparser.add_argument(\'--n-samples\', type=int, help=\'Number of samples used to obtain \'\n                    \'return estimate.\')\nparser.add_argument(\'--pop-size\', type=int, help=\'Population size.\')\nparser.add_argument(\'--target-return\', type=float, help=\'Stops once the return \'\n                    \'gets above target_return\')\nparser.add_argument(\'--display\', action=\'store_true\', help=""Use progress bars if ""\n                    ""specified."")\nparser.add_argument(\'--max-workers\', type=int, help=\'Maximum number of workers.\',\n                    default=32)\nargs = parser.parse_args()\n\n# Max number of workers. M\n\n# multiprocessing variables\nn_samples = args.n_samples\npop_size = args.pop_size\nnum_workers = min(args.max_workers, n_samples * pop_size)\ntime_limit = 1000\n\n# create tmp dir if non existent and clean it if existent\ntmp_dir = join(args.logdir, \'tmp\')\nif not exists(tmp_dir):\n    mkdir(tmp_dir)\nelse:\n    for fname in listdir(tmp_dir):\n        unlink(join(tmp_dir, fname))\n\n# create ctrl dir if non exitent\nctrl_dir = join(args.logdir, \'ctrl\')\nif not exists(ctrl_dir):\n    mkdir(ctrl_dir)\n\n\n################################################################################\n#                           Thread routines                                    #\n################################################################################\ndef slave_routine(p_queue, r_queue, e_queue, p_index):\n    """""" Thread routine.\n\n    Threads interact with p_queue, the parameters queue, r_queue, the result\n    queue and e_queue the end queue. They pull parameters from p_queue, execute\n    the corresponding rollout, then place the result in r_queue.\n\n    Each parameter has its own unique id. Parameters are pulled as tuples\n    (s_id, params) and results are pushed as (s_id, result).  The same\n    parameter can appear multiple times in p_queue, displaying the same id\n    each time.\n\n    As soon as e_queue is non empty, the thread terminate.\n\n    When multiple gpus are involved, the assigned gpu is determined by the\n    process index p_index (gpu = p_index % n_gpus).\n\n    :args p_queue: queue containing couples (s_id, parameters) to evaluate\n    :args r_queue: where to place results (s_id, results)\n    :args e_queue: as soon as not empty, terminate\n    :args p_index: the process index\n    """"""\n    # init routine\n    gpu = p_index % torch.cuda.device_count()\n    device = torch.device(\'cuda:{}\'.format(gpu) if torch.cuda.is_available() else \'cpu\')\n\n    # redirect streams\n    sys.stdout = open(join(tmp_dir, str(getpid()) + \'.out\'), \'a\')\n    sys.stderr = open(join(tmp_dir, str(getpid()) + \'.err\'), \'a\')\n\n    with torch.no_grad():\n        r_gen = RolloutGenerator(args.logdir, device, time_limit)\n\n        while e_queue.empty():\n            if p_queue.empty():\n                sleep(.1)\n            else:\n                s_id, params = p_queue.get()\n                r_queue.put((s_id, r_gen.rollout(params)))\n\n\n################################################################################\n#                Define queues and start workers                               #\n################################################################################\np_queue = Queue()\nr_queue = Queue()\ne_queue = Queue()\n\nfor p_index in range(num_workers):\n    Process(target=slave_routine, args=(p_queue, r_queue, e_queue, p_index)).start()\n\n\n################################################################################\n#                           Evaluation                                         #\n################################################################################\ndef evaluate(solutions, results, rollouts=100):\n    """""" Give current controller evaluation.\n\n    Evaluation is minus the cumulated reward averaged over rollout runs.\n\n    :args solutions: CMA set of solutions\n    :args results: corresponding results\n    :args rollouts: number of rollouts\n\n    :returns: minus averaged cumulated reward\n    """"""\n    index_min = np.argmin(results)\n    best_guess = solutions[index_min]\n    restimates = []\n\n    for s_id in range(rollouts):\n        p_queue.put((s_id, best_guess))\n\n    print(""Evaluating..."")\n    for _ in tqdm(range(rollouts)):\n        while r_queue.empty():\n            sleep(.1)\n        restimates.append(r_queue.get()[1])\n\n    return best_guess, np.mean(restimates), np.std(restimates)\n\n################################################################################\n#                           Launch CMA                                         #\n################################################################################\ncontroller = Controller(LSIZE, RSIZE, ASIZE)  # dummy instance\n\n# define current best and load parameters\ncur_best = None\nctrl_file = join(ctrl_dir, \'best.tar\')\nprint(""Attempting to load previous best..."")\nif exists(ctrl_file):\n    state = torch.load(ctrl_file, map_location={\'cuda:0\': \'cpu\'})\n    cur_best = - state[\'reward\']\n    controller.load_state_dict(state[\'state_dict\'])\n    print(""Previous best was {}..."".format(-cur_best))\n\nparameters = controller.parameters()\nes = cma.CMAEvolutionStrategy(flatten_parameters(parameters), 0.1,\n                              {\'popsize\': pop_size})\n\nepoch = 0\nlog_step = 3\nwhile not es.stop():\n    if cur_best is not None and - cur_best > args.target_return:\n        print(""Already better than target, breaking..."")\n        break\n\n    r_list = [0] * pop_size  # result list\n    solutions = es.ask()\n\n    # push parameters to queue\n    for s_id, s in enumerate(solutions):\n        for _ in range(n_samples):\n            p_queue.put((s_id, s))\n\n    # retrieve results\n    if args.display:\n        pbar = tqdm(total=pop_size * n_samples)\n    for _ in range(pop_size * n_samples):\n        while r_queue.empty():\n            sleep(.1)\n        r_s_id, r = r_queue.get()\n        r_list[r_s_id] += r / n_samples\n        if args.display:\n            pbar.update(1)\n    if args.display:\n        pbar.close()\n\n    es.tell(solutions, r_list)\n    es.disp()\n\n    # evaluation and saving\n    if epoch % log_step == log_step - 1:\n        best_params, best, std_best = evaluate(solutions, r_list)\n        print(""Current evaluation: {}"".format(best))\n        if not cur_best or cur_best > best:\n            cur_best = best\n            print(""Saving new best with value {}+-{}..."".format(-cur_best, std_best))\n            load_parameters(best_params, controller)\n            torch.save(\n                {\'epoch\': epoch,\n                 \'reward\': - cur_best,\n                 \'state_dict\': controller.state_dict()},\n                join(ctrl_dir, \'best.tar\'))\n        if - best > args.target_return:\n            print(""Terminating controller training with value {}..."".format(best))\n            break\n\n\n    epoch += 1\n\nes.result_pretty()\ne_queue.put(\'EOP\')\n'"
trainmdrnn.py,9,"b'"""""" Recurrent model training """"""\nimport argparse\nfrom functools import partial\nfrom os.path import join, exists\nfrom os import mkdir\nimport torch\nimport torch.nn.functional as f\nfrom torch.utils.data import DataLoader\nfrom torchvision import transforms\nimport numpy as np\nfrom tqdm import tqdm\nfrom utils.misc import save_checkpoint\nfrom utils.misc import ASIZE, LSIZE, RSIZE, RED_SIZE, SIZE\nfrom utils.learning import EarlyStopping\n## WARNING : THIS SHOULD BE REPLACED WITH PYTORCH 0.5\nfrom utils.learning import ReduceLROnPlateau\n\nfrom data.loaders import RolloutSequenceDataset\nfrom models.vae import VAE\nfrom models.mdrnn import MDRNN, gmm_loss\n\nparser = argparse.ArgumentParser(""MDRNN training"")\nparser.add_argument(\'--logdir\', type=str,\n                    help=""Where things are logged and models are loaded from."")\nparser.add_argument(\'--noreload\', action=\'store_true\',\n                    help=""Do not reload if specified."")\nparser.add_argument(\'--include_reward\', action=\'store_true\',\n                    help=""Add a reward modelisation term to the loss."")\nargs = parser.parse_args()\n\ndevice = torch.device(\'cuda\' if torch.cuda.is_available() else \'cpu\')\n\n# constants\nBSIZE = 16\nSEQ_LEN = 32\nepochs = 30\n\n# Loading VAE\nvae_file = join(args.logdir, \'vae\', \'best.tar\')\nassert exists(vae_file), ""No trained VAE in the logdir...""\nstate = torch.load(vae_file)\nprint(""Loading VAE at epoch {} ""\n      ""with test error {}"".format(\n          state[\'epoch\'], state[\'precision\']))\n\nvae = VAE(3, LSIZE).to(device)\nvae.load_state_dict(state[\'state_dict\'])\n\n# Loading model\nrnn_dir = join(args.logdir, \'mdrnn\')\nrnn_file = join(rnn_dir, \'best.tar\')\n\nif not exists(rnn_dir):\n    mkdir(rnn_dir)\n\nmdrnn = MDRNN(LSIZE, ASIZE, RSIZE, 5)\nmdrnn.to(device)\noptimizer = torch.optim.RMSprop(mdrnn.parameters(), lr=1e-3, alpha=.9)\nscheduler = ReduceLROnPlateau(optimizer, \'min\', factor=0.5, patience=5)\nearlystopping = EarlyStopping(\'min\', patience=30)\n\n\nif exists(rnn_file) and not args.noreload:\n    rnn_state = torch.load(rnn_file)\n    print(""Loading MDRNN at epoch {} ""\n          ""with test error {}"".format(\n              rnn_state[""epoch""], rnn_state[""precision""]))\n    mdrnn.load_state_dict(rnn_state[""state_dict""])\n    optimizer.load_state_dict(rnn_state[""optimizer""])\n    scheduler.load_state_dict(state[\'scheduler\'])\n    earlystopping.load_state_dict(state[\'earlystopping\'])\n\n\n# Data Loading\ntransform = transforms.Lambda(\n    lambda x: np.transpose(x, (0, 3, 1, 2)) / 255)\ntrain_loader = DataLoader(\n    RolloutSequenceDataset(\'datasets/carracing\', SEQ_LEN, transform, buffer_size=30),\n    batch_size=BSIZE, num_workers=8, shuffle=True)\ntest_loader = DataLoader(\n    RolloutSequenceDataset(\'datasets/carracing\', SEQ_LEN, transform, train=False, buffer_size=10),\n    batch_size=BSIZE, num_workers=8)\n\ndef to_latent(obs, next_obs):\n    """""" Transform observations to latent space.\n\n    :args obs: 5D torch tensor (BSIZE, SEQ_LEN, ASIZE, SIZE, SIZE)\n    :args next_obs: 5D torch tensor (BSIZE, SEQ_LEN, ASIZE, SIZE, SIZE)\n\n    :returns: (latent_obs, latent_next_obs)\n        - latent_obs: 4D torch tensor (BSIZE, SEQ_LEN, LSIZE)\n        - next_latent_obs: 4D torch tensor (BSIZE, SEQ_LEN, LSIZE)\n    """"""\n    with torch.no_grad():\n        obs, next_obs = [\n            f.upsample(x.view(-1, 3, SIZE, SIZE), size=RED_SIZE,\n                       mode=\'bilinear\', align_corners=True)\n            for x in (obs, next_obs)]\n\n        (obs_mu, obs_logsigma), (next_obs_mu, next_obs_logsigma) = [\n            vae(x)[1:] for x in (obs, next_obs)]\n\n        latent_obs, latent_next_obs = [\n            (x_mu + x_logsigma.exp() * torch.randn_like(x_mu)).view(BSIZE, SEQ_LEN, LSIZE)\n            for x_mu, x_logsigma in\n            [(obs_mu, obs_logsigma), (next_obs_mu, next_obs_logsigma)]]\n    return latent_obs, latent_next_obs\n\ndef get_loss(latent_obs, action, reward, terminal,\n             latent_next_obs, include_reward: bool):\n    """""" Compute losses.\n\n    The loss that is computed is:\n    (GMMLoss(latent_next_obs, GMMPredicted) + MSE(reward, predicted_reward) +\n         BCE(terminal, logit_terminal)) / (LSIZE + 2)\n    The LSIZE + 2 factor is here to counteract the fact that the GMMLoss scales\n    approximately linearily with LSIZE. All losses are averaged both on the\n    batch and the sequence dimensions (the two first dimensions).\n\n    :args latent_obs: (BSIZE, SEQ_LEN, LSIZE) torch tensor\n    :args action: (BSIZE, SEQ_LEN, ASIZE) torch tensor\n    :args reward: (BSIZE, SEQ_LEN) torch tensor\n    :args latent_next_obs: (BSIZE, SEQ_LEN, LSIZE) torch tensor\n\n    :returns: dictionary of losses, containing the gmm, the mse, the bce and\n        the averaged loss.\n    """"""\n    latent_obs, action,\\\n        reward, terminal,\\\n        latent_next_obs = [arr.transpose(1, 0)\n                           for arr in [latent_obs, action,\n                                       reward, terminal,\n                                       latent_next_obs]]\n    mus, sigmas, logpi, rs, ds = mdrnn(action, latent_obs)\n    gmm = gmm_loss(latent_next_obs, mus, sigmas, logpi)\n    bce = f.binary_cross_entropy_with_logits(ds, terminal)\n    if include_reward:\n        mse = f.mse_loss(rs, reward)\n        scale = LSIZE + 2\n    else:\n        mse = 0\n        scale = LSIZE + 1\n    loss = (gmm + bce + mse) / scale\n    return dict(gmm=gmm, bce=bce, mse=mse, loss=loss)\n\n\ndef data_pass(epoch, train, include_reward): # pylint: disable=too-many-locals\n    """""" One pass through the data """"""\n    if train:\n        mdrnn.train()\n        loader = train_loader\n    else:\n        mdrnn.eval()\n        loader = test_loader\n\n    loader.dataset.load_next_buffer()\n\n    cum_loss = 0\n    cum_gmm = 0\n    cum_bce = 0\n    cum_mse = 0\n\n    pbar = tqdm(total=len(loader.dataset), desc=""Epoch {}"".format(epoch))\n    for i, data in enumerate(loader):\n        obs, action, reward, terminal, next_obs = [arr.to(device) for arr in data]\n\n        # transform obs\n        latent_obs, latent_next_obs = to_latent(obs, next_obs)\n\n        if train:\n            losses = get_loss(latent_obs, action, reward,\n                              terminal, latent_next_obs, include_reward)\n\n            optimizer.zero_grad()\n            losses[\'loss\'].backward()\n            optimizer.step()\n        else:\n            with torch.no_grad():\n                losses = get_loss(latent_obs, action, reward,\n                                  terminal, latent_next_obs, include_reward)\n\n        cum_loss += losses[\'loss\'].item()\n        cum_gmm += losses[\'gmm\'].item()\n        cum_bce += losses[\'bce\'].item()\n        cum_mse += losses[\'mse\'].item() if hasattr(losses[\'mse\'], \'item\') else \\\n            losses[\'mse\']\n\n        pbar.set_postfix_str(""loss={loss:10.6f} bce={bce:10.6f} ""\n                             ""gmm={gmm:10.6f} mse={mse:10.6f}"".format(\n                                 loss=cum_loss / (i + 1), bce=cum_bce / (i + 1),\n                                 gmm=cum_gmm / LSIZE / (i + 1), mse=cum_mse / (i + 1)))\n        pbar.update(BSIZE)\n    pbar.close()\n    return cum_loss * BSIZE / len(loader.dataset)\n\n\ntrain = partial(data_pass, train=True, include_reward=args.include_reward)\ntest = partial(data_pass, train=False, include_reward=args.include_reward)\n\ncur_best = None\nfor e in range(epochs):\n    train(e)\n    test_loss = test(e)\n    scheduler.step(test_loss)\n    earlystopping.step(test_loss)\n\n    is_best = not cur_best or test_loss < cur_best\n    if is_best:\n        cur_best = test_loss\n    checkpoint_fname = join(rnn_dir, \'checkpoint.tar\')\n    save_checkpoint({\n        ""state_dict"": mdrnn.state_dict(),\n        ""optimizer"": optimizer.state_dict(),\n        \'scheduler\': scheduler.state_dict(),\n        \'earlystopping\': earlystopping.state_dict(),\n        ""precision"": test_loss,\n        ""epoch"": e}, is_best, checkpoint_fname,\n                    rnn_file)\n\n    if earlystopping.stop:\n        print(""End of Training because of early stopping at epoch {}"".format(e))\n        break\n'"
trainvae.py,13,"b'"""""" Training VAE """"""\nimport argparse\nfrom os.path import join, exists\nfrom os import mkdir\n\nimport torch\nimport torch.utils.data\nfrom torch import optim\nfrom torch.nn import functional as F\nfrom torchvision import transforms\nfrom torchvision.utils import save_image\n\nfrom models.vae import VAE\n\nfrom utils.misc import save_checkpoint\nfrom utils.misc import LSIZE, RED_SIZE\n## WARNING : THIS SHOULD BE REPLACE WITH PYTORCH 0.5\nfrom utils.learning import EarlyStopping\nfrom utils.learning import ReduceLROnPlateau\nfrom data.loaders import RolloutObservationDataset\n\nparser = argparse.ArgumentParser(description=\'VAE Trainer\')\nparser.add_argument(\'--batch-size\', type=int, default=32, metavar=\'N\',\n                    help=\'input batch size for training (default: 32)\')\nparser.add_argument(\'--epochs\', type=int, default=1000, metavar=\'N\',\n                    help=\'number of epochs to train (default: 1000)\')\nparser.add_argument(\'--logdir\', type=str, help=\'Directory where results are logged\')\nparser.add_argument(\'--noreload\', action=\'store_true\',\n                    help=\'Best model is not reloaded if specified\')\nparser.add_argument(\'--nosamples\', action=\'store_true\',\n                    help=\'Does not save samples during training if specified\')\n\n\nargs = parser.parse_args()\ncuda = torch.cuda.is_available()\n\n\ntorch.manual_seed(123)\n# Fix numeric divergence due to bug in Cudnn\ntorch.backends.cudnn.benchmark = True\n\ndevice = torch.device(""cuda"" if cuda else ""cpu"")\n\n\ntransform_train = transforms.Compose([\n    transforms.ToPILImage(),\n    transforms.Resize((RED_SIZE, RED_SIZE)),\n    transforms.RandomHorizontalFlip(),\n    transforms.ToTensor(),\n])\n\ntransform_test = transforms.Compose([\n    transforms.ToPILImage(),\n    transforms.Resize((RED_SIZE, RED_SIZE)),\n    transforms.ToTensor(),\n])\n\ndataset_train = RolloutObservationDataset(\'datasets/carracing\',\n                                          transform_train, train=True)\ndataset_test = RolloutObservationDataset(\'datasets/carracing\',\n                                         transform_test, train=False)\ntrain_loader = torch.utils.data.DataLoader(\n    dataset_train, batch_size=args.batch_size, shuffle=True, num_workers=2)\ntest_loader = torch.utils.data.DataLoader(\n    dataset_test, batch_size=args.batch_size, shuffle=True, num_workers=2)\n\n\nmodel = VAE(3, LSIZE).to(device)\noptimizer = optim.Adam(model.parameters())\nscheduler = ReduceLROnPlateau(optimizer, \'min\', factor=0.5, patience=5)\nearlystopping = EarlyStopping(\'min\', patience=30)\n\n# Reconstruction + KL divergence losses summed over all elements and batch\ndef loss_function(recon_x, x, mu, logsigma):\n    """""" VAE loss function """"""\n    BCE = F.mse_loss(recon_x, x, size_average=False)\n\n    # see Appendix B from VAE paper:\n    # Kingma and Welling. Auto-Encoding Variational Bayes. ICLR, 2014\n    # https://arxiv.org/abs/1312.6114\n    # 0.5 * sum(1 + log(sigma^2) - mu^2 - sigma^2)\n    KLD = -0.5 * torch.sum(1 + 2 * logsigma - mu.pow(2) - (2 * logsigma).exp())\n    return BCE + KLD\n\n\ndef train(epoch):\n    """""" One training epoch """"""\n    model.train()\n    dataset_train.load_next_buffer()\n    train_loss = 0\n    for batch_idx, data in enumerate(train_loader):\n        data = data.to(device)\n        optimizer.zero_grad()\n        recon_batch, mu, logvar = model(data)\n        loss = loss_function(recon_batch, data, mu, logvar)\n        loss.backward()\n        train_loss += loss.item()\n        optimizer.step()\n        if batch_idx % 20 == 0:\n            print(\'Train Epoch: {} [{}/{} ({:.0f}%)]\\tLoss: {:.6f}\'.format(\n                epoch, batch_idx * len(data), len(train_loader.dataset),\n                100. * batch_idx / len(train_loader),\n                loss.item() / len(data)))\n\n    print(\'====> Epoch: {} Average loss: {:.4f}\'.format(\n        epoch, train_loss / len(train_loader.dataset)))\n\n\ndef test():\n    """""" One test epoch """"""\n    model.eval()\n    dataset_test.load_next_buffer()\n    test_loss = 0\n    with torch.no_grad():\n        for data in test_loader:\n            data = data.to(device)\n            recon_batch, mu, logvar = model(data)\n            test_loss += loss_function(recon_batch, data, mu, logvar).item()\n\n    test_loss /= len(test_loader.dataset)\n    print(\'====> Test set loss: {:.4f}\'.format(test_loss))\n    return test_loss\n\n# check vae dir exists, if not, create it\nvae_dir = join(args.logdir, \'vae\')\nif not exists(vae_dir):\n    mkdir(vae_dir)\n    mkdir(join(vae_dir, \'samples\'))\n\nreload_file = join(vae_dir, \'best.tar\')\nif not args.noreload and exists(reload_file):\n    state = torch.load(reload_file)\n    print(""Reloading model at epoch {}""\n          "", with test error {}"".format(\n              state[\'epoch\'],\n              state[\'precision\']))\n    model.load_state_dict(state[\'state_dict\'])\n    optimizer.load_state_dict(state[\'optimizer\'])\n    scheduler.load_state_dict(state[\'scheduler\'])\n    earlystopping.load_state_dict(state[\'earlystopping\'])\n\n\ncur_best = None\n\nfor epoch in range(1, args.epochs + 1):\n    train(epoch)\n    test_loss = test()\n    scheduler.step(test_loss)\n    earlystopping.step(test_loss)\n\n    # checkpointing\n    best_filename = join(vae_dir, \'best.tar\')\n    filename = join(vae_dir, \'checkpoint.tar\')\n    is_best = not cur_best or test_loss < cur_best\n    if is_best:\n        cur_best = test_loss\n\n    save_checkpoint({\n        \'epoch\': epoch,\n        \'state_dict\': model.state_dict(),\n        \'precision\': test_loss,\n        \'optimizer\': optimizer.state_dict(),\n        \'scheduler\': scheduler.state_dict(),\n        \'earlystopping\': earlystopping.state_dict()\n    }, is_best, filename, best_filename)\n\n\n\n    if not args.nosamples:\n        with torch.no_grad():\n            sample = torch.randn(RED_SIZE, LSIZE).to(device)\n            sample = model.decoder(sample).cpu()\n            save_image(sample.view(64, 3, RED_SIZE, RED_SIZE),\n                       join(vae_dir, \'samples/sample_\' + str(epoch) + \'.png\'))\n\n    if earlystopping.stop:\n        print(""End of Training because of early stopping at epoch {}"".format(epoch))\n        break\n'"
data/__init__.py,0,b'\n'
