file_path,api_count,code
utils.py,7,"b'import torch\nimport torchvision\nimport numpy as np\nimport matplotlib.pyplot as plt\nimport os\n\n\ndef batch_transform(batch, transform):\n    """"""Applies a transform to a batch of samples.\n\n    Keyword arguments:\n    - batch (): a batch os samples\n    - transform (callable): A function/transform to apply to ``batch``\n\n    """"""\n\n    # Convert the single channel label to RGB in tensor form\n    # 1. torch.unbind removes the 0-dimension of ""labels"" and returns a tuple of\n    # all slices along that dimension\n    # 2. the transform is applied to each slice\n    transf_slices = [transform(tensor) for tensor in torch.unbind(batch)]\n\n    return torch.stack(transf_slices)\n\n\ndef imshow_batch(images, labels):\n    """"""Displays two grids of images. The top grid displays ``images``\n    and the bottom grid ``labels``\n\n    Keyword arguments:\n    - images (``Tensor``): a 4D mini-batch tensor of shape\n    (B, C, H, W)\n    - labels (``Tensor``): a 4D mini-batch tensor of shape\n    (B, C, H, W)\n\n    """"""\n\n    # Make a grid with the images and labels and convert it to numpy\n    images = torchvision.utils.make_grid(images).numpy()\n    labels = torchvision.utils.make_grid(labels).numpy()\n\n    fig, (ax1, ax2) = plt.subplots(2, 1, figsize=(15, 7))\n    ax1.imshow(np.transpose(images, (1, 2, 0)))\n    ax2.imshow(np.transpose(labels, (1, 2, 0)))\n\n    plt.show()\n\n\ndef save_checkpoint(model, optimizer, epoch, miou, args):\n    """"""Saves the model in a specified directory with a specified name.save\n\n    Keyword arguments:\n    - model (``nn.Module``): The model to save.\n    - optimizer (``torch.optim``): The optimizer state to save.\n    - epoch (``int``): The current epoch for the model.\n    - miou (``float``): The mean IoU obtained by the model.\n    - args (``ArgumentParser``): An instance of ArgumentParser which contains\n    the arguments used to train ``model``. The arguments are written to a text\n    file in ``args.save_dir`` named ""``args.name``_args.txt"".\n\n    """"""\n    name = args.name\n    save_dir = args.save_dir\n\n    assert os.path.isdir(\n        save_dir), ""The directory \\""{0}\\"" doesn\'t exist."".format(save_dir)\n\n    # Save model\n    model_path = os.path.join(save_dir, name)\n    checkpoint = {\n        \'epoch\': epoch,\n        \'miou\': miou,\n        \'state_dict\': model.state_dict(),\n        \'optimizer\': optimizer.state_dict()\n    }\n    torch.save(checkpoint, model_path)\n\n    # Save arguments\n    summary_filename = os.path.join(save_dir, name + \'_summary.txt\')\n    with open(summary_filename, \'w\') as summary_file:\n        sorted_args = sorted(vars(args))\n        summary_file.write(""ARGUMENTS\\n"")\n        for arg in sorted_args:\n            arg_str = ""{0}: {1}\\n"".format(arg, getattr(args, arg))\n            summary_file.write(arg_str)\n\n        summary_file.write(""\\nBEST VALIDATION\\n"")\n        summary_file.write(""Epoch: {0}\\n"". format(epoch))\n        summary_file.write(""Mean IoU: {0}\\n"". format(miou))\n\n\ndef load_checkpoint(model, optimizer, folder_dir, filename):\n    """"""Saves the model in a specified directory with a specified name.save\n\n    Keyword arguments:\n    - model (``nn.Module``): The stored model state is copied to this model\n    instance.\n    - optimizer (``torch.optim``): The stored optimizer state is copied to this\n    optimizer instance.\n    - folder_dir (``string``): The path to the folder where the saved model\n    state is located.\n    - filename (``string``): The model filename.\n\n    Returns:\n    The epoch, mean IoU, ``model``, and ``optimizer`` loaded from the\n    checkpoint.\n\n    """"""\n    assert os.path.isdir(\n        folder_dir), ""The directory \\""{0}\\"" doesn\'t exist."".format(folder_dir)\n\n    # Create folder to save model and information\n    model_path = os.path.join(folder_dir, filename)\n    assert os.path.isfile(\n        model_path), ""The model file \\""{0}\\"" doesn\'t exist."".format(filename)\n\n    # Load the stored model parameters to the model instance\n    checkpoint = torch.load(model_path)\n    model.load_state_dict(checkpoint[\'state_dict\'])\n    optimizer.load_state_dict(checkpoint[\'optimizer\'])\n    epoch = checkpoint[\'epoch\']\n    miou = checkpoint[\'miou\']\n\n    return model, optimizer, epoch, miou\n'"
data/__init__.py,0,"b""from .camvid import CamVid\nfrom .cityscapes import Cityscapes\n\n__all__ = ['CamVid', 'Cityscapes']\n"""
data/camvid.py,1,"b'import os\nfrom collections import OrderedDict\nimport torch.utils.data as data\nfrom . import utils\n\n\nclass CamVid(data.Dataset):\n    """"""CamVid dataset loader where the dataset is arranged as in\n    https://github.com/alexgkendall/SegNet-Tutorial/tree/master/CamVid.\n\n\n    Keyword arguments:\n    - root_dir (``string``): Root directory path.\n    - mode (``string``): The type of dataset: \'train\' for training set, \'val\'\n    for validation set, and \'test\' for test set.\n    - transform (``callable``, optional): A function/transform that  takes in\n    an PIL image and returns a transformed version. Default: None.\n    - label_transform (``callable``, optional): A function/transform that takes\n    in the target and transforms it. Default: None.\n    - loader (``callable``, optional): A function to load an image given its\n    path. By default ``default_loader`` is used.\n\n    """"""\n    # Training dataset root folders\n    train_folder = \'train\'\n    train_lbl_folder = \'trainannot\'\n\n    # Validation dataset root folders\n    val_folder = \'val\'\n    val_lbl_folder = \'valannot\'\n\n    # Test dataset root folders\n    test_folder = \'test\'\n    test_lbl_folder = \'testannot\'\n\n    # Images extension\n    img_extension = \'.png\'\n\n    # Default encoding for pixel value, class name, and class color\n    color_encoding = OrderedDict([\n        (\'sky\', (128, 128, 128)),\n        (\'building\', (128, 0, 0)),\n        (\'pole\', (192, 192, 128)),\n        (\'road_marking\', (255, 69, 0)),\n        (\'road\', (128, 64, 128)),\n        (\'pavement\', (60, 40, 222)),\n        (\'tree\', (128, 128, 0)),\n        (\'sign_symbol\', (192, 128, 128)),\n        (\'fence\', (64, 64, 128)),\n        (\'car\', (64, 0, 128)),\n        (\'pedestrian\', (64, 64, 0)),\n        (\'bicyclist\', (0, 128, 192)),\n        (\'unlabeled\', (0, 0, 0))\n    ])\n\n    def __init__(self,\n                 root_dir,\n                 mode=\'train\',\n                 transform=None,\n                 label_transform=None,\n                 loader=utils.pil_loader):\n        self.root_dir = root_dir\n        self.mode = mode\n        self.transform = transform\n        self.label_transform = label_transform\n        self.loader = loader\n\n        if self.mode.lower() == \'train\':\n            # Get the training data and labels filepaths\n            self.train_data = utils.get_files(\n                os.path.join(root_dir, self.train_folder),\n                extension_filter=self.img_extension)\n\n            self.train_labels = utils.get_files(\n                os.path.join(root_dir, self.train_lbl_folder),\n                extension_filter=self.img_extension)\n        elif self.mode.lower() == \'val\':\n            # Get the validation data and labels filepaths\n            self.val_data = utils.get_files(\n                os.path.join(root_dir, self.val_folder),\n                extension_filter=self.img_extension)\n\n            self.val_labels = utils.get_files(\n                os.path.join(root_dir, self.val_lbl_folder),\n                extension_filter=self.img_extension)\n        elif self.mode.lower() == \'test\':\n            # Get the test data and labels filepaths\n            self.test_data = utils.get_files(\n                os.path.join(root_dir, self.test_folder),\n                extension_filter=self.img_extension)\n\n            self.test_labels = utils.get_files(\n                os.path.join(root_dir, self.test_lbl_folder),\n                extension_filter=self.img_extension)\n        else:\n            raise RuntimeError(""Unexpected dataset mode. ""\n                               ""Supported modes are: train, val and test"")\n\n    def __getitem__(self, index):\n        """"""\n        Args:\n        - index (``int``): index of the item in the dataset\n\n        Returns:\n        A tuple of ``PIL.Image`` (image, label) where label is the ground-truth\n        of the image.\n\n        """"""\n        if self.mode.lower() == \'train\':\n            data_path, label_path = self.train_data[index], self.train_labels[\n                index]\n        elif self.mode.lower() == \'val\':\n            data_path, label_path = self.val_data[index], self.val_labels[\n                index]\n        elif self.mode.lower() == \'test\':\n            data_path, label_path = self.test_data[index], self.test_labels[\n                index]\n        else:\n            raise RuntimeError(""Unexpected dataset mode. ""\n                               ""Supported modes are: train, val and test"")\n\n        img, label = self.loader(data_path, label_path)\n\n        if self.transform is not None:\n            img = self.transform(img)\n\n        if self.label_transform is not None:\n            label = self.label_transform(label)\n\n        return img, label\n\n    def __len__(self):\n        """"""Returns the length of the dataset.""""""\n        if self.mode.lower() == \'train\':\n            return len(self.train_data)\n        elif self.mode.lower() == \'val\':\n            return len(self.val_data)\n        elif self.mode.lower() == \'test\':\n            return len(self.test_data)\n        else:\n            raise RuntimeError(""Unexpected dataset mode. ""\n                               ""Supported modes are: train, val and test"")\n'"
data/cityscapes.py,1,"b'import os\nfrom collections import OrderedDict\nimport torch.utils.data as data\nfrom . import utils\n\n\nclass Cityscapes(data.Dataset):\n    """"""Cityscapes dataset https://www.cityscapes-dataset.com/.\n\n    Keyword arguments:\n    - root_dir (``string``): Root directory path.\n    - mode (``string``): The type of dataset: \'train\' for training set, \'val\'\n    for validation set, and \'test\' for test set.\n    - transform (``callable``, optional): A function/transform that  takes in\n    an PIL image and returns a transformed version. Default: None.\n    - label_transform (``callable``, optional): A function/transform that takes\n    in the target and transforms it. Default: None.\n    - loader (``callable``, optional): A function to load an image given its\n    path. By default ``default_loader`` is used.\n\n    """"""\n    # Training dataset root folders\n    train_folder = ""leftImg8bit_trainvaltest/leftImg8bit/train""\n    train_lbl_folder = ""gtFine_trainvaltest/gtFine/train""\n\n    # Validation dataset root folders\n    val_folder = ""leftImg8bit_trainvaltest/leftImg8bit/val""\n    val_lbl_folder = ""gtFine_trainvaltest/gtFine/val""\n\n    # Test dataset root folders\n    test_folder = ""leftImg8bit_trainvaltest/leftImg8bit/test""\n    test_lbl_folder = ""gtFine_trainvaltest/gtFine/test""\n\n    # Filters to find the images\n    img_extension = \'.png\'\n    lbl_name_filter = \'labelIds\'\n\n    # The values associated with the 35 classes\n    full_classes = (0, 1, 2, 3, 4, 5, 6, 7, 8, 9, 10, 11, 12, 13, 14, 15, 16,\n                    17, 18, 19, 20, 21, 22, 23, 24, 25, 26, 27, 28, 29, 30, 31,\n                    32, 33, -1)\n    # The values above are remapped to the following\n    new_classes = (0, 0, 0, 0, 0, 0, 0, 1, 2, 0, 0, 3, 4, 5, 0, 0, 0, 6, 0, 7,\n                   8, 9, 10, 11, 12, 13, 14, 15, 16, 0, 0, 17, 18, 19, 0)\n\n    # Default encoding for pixel value, class name, and class color\n    color_encoding = OrderedDict([\n            (\'unlabeled\', (0, 0, 0)),\n            (\'road\', (128, 64, 128)),\n            (\'sidewalk\', (244, 35, 232)),\n            (\'building\', (70, 70, 70)),\n            (\'wall\', (102, 102, 156)),\n            (\'fence\', (190, 153, 153)),\n            (\'pole\', (153, 153, 153)),\n            (\'traffic_light\', (250, 170, 30)),\n            (\'traffic_sign\', (220, 220, 0)),\n            (\'vegetation\', (107, 142, 35)),\n            (\'terrain\', (152, 251, 152)),\n            (\'sky\', (70, 130, 180)),\n            (\'person\', (220, 20, 60)),\n            (\'rider\', (255, 0, 0)),\n            (\'car\', (0, 0, 142)),\n            (\'truck\', (0, 0, 70)),\n            (\'bus\', (0, 60, 100)),\n            (\'train\', (0, 80, 100)),\n            (\'motorcycle\', (0, 0, 230)),\n            (\'bicycle\', (119, 11, 32))\n    ])\n\n    def __init__(self,\n                 root_dir,\n                 mode=\'train\',\n                 transform=None,\n                 label_transform=None,\n                 loader=utils.pil_loader):\n        self.root_dir = root_dir\n        self.mode = mode\n        self.transform = transform\n        self.label_transform = label_transform\n        self.loader = loader\n\n        if self.mode.lower() == \'train\':\n            # Get the training data and labels filepaths\n            self.train_data = utils.get_files(\n                os.path.join(root_dir, self.train_folder),\n                extension_filter=self.img_extension)\n\n            self.train_labels = utils.get_files(\n                os.path.join(root_dir, self.train_lbl_folder),\n                name_filter=self.lbl_name_filter,\n                extension_filter=self.img_extension)\n        elif self.mode.lower() == \'val\':\n            # Get the validation data and labels filepaths\n            self.val_data = utils.get_files(\n                os.path.join(root_dir, self.val_folder),\n                extension_filter=self.img_extension)\n\n            self.val_labels = utils.get_files(\n                os.path.join(root_dir, self.val_lbl_folder),\n                name_filter=self.lbl_name_filter,\n                extension_filter=self.img_extension)\n        elif self.mode.lower() == \'test\':\n            # Get the test data and labels filepaths\n            self.test_data = utils.get_files(\n                os.path.join(root_dir, self.test_folder),\n                extension_filter=self.img_extension)\n\n            self.test_labels = utils.get_files(\n                os.path.join(root_dir, self.test_lbl_folder),\n                name_filter=self.lbl_name_filter,\n                extension_filter=self.img_extension)\n        else:\n            raise RuntimeError(""Unexpected dataset mode. ""\n                               ""Supported modes are: train, val and test"")\n\n    def __getitem__(self, index):\n        """"""\n        Args:\n        - index (``int``): index of the item in the dataset\n\n        Returns:\n        A tuple of ``PIL.Image`` (image, label) where label is the ground-truth\n        of the image.\n\n        """"""\n        if self.mode.lower() == \'train\':\n            data_path, label_path = self.train_data[index], self.train_labels[\n                index]\n        elif self.mode.lower() == \'val\':\n            data_path, label_path = self.val_data[index], self.val_labels[\n                index]\n        elif self.mode.lower() == \'test\':\n            data_path, label_path = self.test_data[index], self.test_labels[\n                index]\n        else:\n            raise RuntimeError(""Unexpected dataset mode. ""\n                               ""Supported modes are: train, val and test"")\n\n        img, label = self.loader(data_path, label_path)\n\n        # Remap class labels\n        label = utils.remap(label, self.full_classes, self.new_classes)\n\n        if self.transform is not None:\n            img = self.transform(img)\n\n        if self.label_transform is not None:\n            label = self.label_transform(label)\n\n        return img, label\n\n    def __len__(self):\n        """"""Returns the length of the dataset.""""""\n        if self.mode.lower() == \'train\':\n            return len(self.train_data)\n        elif self.mode.lower() == \'val\':\n            return len(self.val_data)\n        elif self.mode.lower() == \'test\':\n            return len(self.test_data)\n        else:\n            raise RuntimeError(""Unexpected dataset mode. ""\n                               ""Supported modes are: train, val and test"")\n'"
data/utils.py,0,"b'import os\nfrom PIL import Image\nimport numpy as np\n\n\ndef get_files(folder, name_filter=None, extension_filter=None):\n    """"""Helper function that returns the list of files in a specified folder\n    with a specified extension.\n\n    Keyword arguments:\n    - folder (``string``): The path to a folder.\n    - name_filter (```string``, optional): The returned files must contain\n    this substring in their filename. Default: None; files are not filtered.\n    - extension_filter (``string``, optional): The desired file extension.\n    Default: None; files are not filtered\n\n    """"""\n    if not os.path.isdir(folder):\n        raise RuntimeError(""\\""{0}\\"" is not a folder."".format(folder))\n\n    # Filename filter: if not specified don\'t filter (condition always true);\n    # otherwise, use a lambda expression to filter out files that do not\n    # contain ""name_filter""\n    if name_filter is None:\n        # This looks hackish...there is probably a better way\n        name_cond = lambda filename: True\n    else:\n        name_cond = lambda filename: name_filter in filename\n\n    # Extension filter: if not specified don\'t filter (condition always true);\n    # otherwise, use a lambda expression to filter out files whose extension\n    # is not ""extension_filter""\n    if extension_filter is None:\n        # This looks hackish...there is probably a better way\n        ext_cond = lambda filename: True\n    else:\n        ext_cond = lambda filename: filename.endswith(extension_filter)\n\n    filtered_files = []\n\n    # Explore the directory tree to get files that contain ""name_filter"" and\n    # with extension ""extension_filter""\n    for path, _, files in os.walk(folder):\n        files.sort()\n        for file in files:\n            if name_cond(file) and ext_cond(file):\n                full_path = os.path.join(path, file)\n                filtered_files.append(full_path)\n\n    return filtered_files\n\n\ndef pil_loader(data_path, label_path):\n    """"""Loads a sample and label image given their path as PIL images.\n\n    Keyword arguments:\n    - data_path (``string``): The filepath to the image.\n    - label_path (``string``): The filepath to the ground-truth image.\n\n    Returns the image and the label as PIL images.\n\n    """"""\n    data = Image.open(data_path)\n    label = Image.open(label_path)\n\n    return data, label\n\n\ndef remap(image, old_values, new_values):\n    assert isinstance(image, Image.Image) or isinstance(\n        image, np.ndarray), ""image must be of type PIL.Image or numpy.ndarray""\n    assert type(new_values) is tuple, ""new_values must be of type tuple""\n    assert type(old_values) is tuple, ""old_values must be of type tuple""\n    assert len(new_values) == len(\n        old_values), ""new_values and old_values must have the same length""\n\n    # If image is a PIL.Image convert it to a numpy array\n    if isinstance(image, Image.Image):\n        image = np.array(image)\n\n    # Replace old values by the new ones\n    tmp = np.zeros_like(image)\n    for old, new in zip(old_values, new_values):\n        # Since tmp is already initialized as zeros we can skip new values\n        # equal to 0\n        if new != 0:\n            tmp[image == old] = new\n\n    return Image.fromarray(tmp)\n\n\ndef enet_weighing(dataloader, num_classes, c=1.02):\n    """"""Computes class weights as described in the ENet paper:\n\n        w_class = 1 / (ln(c + p_class)),\n\n    where c is usually 1.02 and p_class is the propensity score of that\n    class:\n\n        propensity_score = freq_class / total_pixels.\n\n    References: https://arxiv.org/abs/1606.02147\n\n    Keyword arguments:\n    - dataloader (``data.Dataloader``): A data loader to iterate over the\n    dataset.\n    - num_classes (``int``): The number of classes.\n    - c (``int``, optional): AN additional hyper-parameter which restricts\n    the interval of values for the weights. Default: 1.02.\n\n    """"""\n    class_count = 0\n    total = 0\n    for _, label in dataloader:\n        label = label.cpu().numpy()\n\n        # Flatten label\n        flat_label = label.flatten()\n\n        # Sum up the number of pixels of each class and the total pixel\n        # counts for each label\n        class_count += np.bincount(flat_label, minlength=num_classes)\n        total += flat_label.size\n\n    # Compute propensity score and then the weights for each class\n    propensity_score = class_count / total\n    class_weights = 1 / (np.log(c + propensity_score))\n\n    return class_weights\n\n\ndef median_freq_balancing(dataloader, num_classes):\n    """"""Computes class weights using median frequency balancing as described\n    in https://arxiv.org/abs/1411.4734:\n\n        w_class = median_freq / freq_class,\n\n    where freq_class is the number of pixels of a given class divided by\n    the total number of pixels in images where that class is present, and\n    median_freq is the median of freq_class.\n\n    Keyword arguments:\n    - dataloader (``data.Dataloader``): A data loader to iterate over the\n    dataset.\n    whose weights are going to be computed.\n    - num_classes (``int``): The number of classes\n\n    """"""\n    class_count = 0\n    total = 0\n    for _, label in dataloader:\n        label = label.cpu().numpy()\n\n        # Flatten label\n        flat_label = label.flatten()\n\n        # Sum up the class frequencies\n        bincount = np.bincount(flat_label, minlength=num_classes)\n\n        # Create of mask of classes that exist in the label\n        mask = bincount > 0\n        # Multiply the mask by the pixel count. The resulting array has\n        # one element for each class. The value is either 0 (if the class\n        # does not exist in the label) or equal to the pixel count (if\n        # the class exists in the label)\n        total += mask * flat_label.size\n\n        # Sum up the number of pixels found for each class\n        class_count += bincount\n\n    # Compute the frequency and its median\n    freq = class_count / total\n    med = np.median(freq)\n\n    return med / freq\n'"
metric/__init__.py,0,"b""from .confusionmatrix import ConfusionMatrix\nfrom .iou import IoU\nfrom .metric import Metric\n\n__all__ = ['ConfusionMatrix', 'IoU', 'Metric']\n"""
