file_path,api_count,code
args.py,0,"b'from argparse import ArgumentParser\n\n\ndef get_arguments():\n    """"""Defines command-line arguments, and parses them.\n\n    """"""\n    parser = ArgumentParser()\n\n    # Execution mode\n    parser.add_argument(\n        ""--mode"",\n        ""-m"",\n        choices=[\'train\', \'test\', \'full\'],\n        default=\'train\',\n        help=(""train: performs training and validation; test: tests the model ""\n              ""found in \\""--save_dir\\"" with name \\""--name\\"" on \\""--dataset\\""; ""\n              ""full: combines train and test modes. Default: train""))\n    parser.add_argument(\n        ""--resume"",\n        action=\'store_true\',\n        help=(""The model found in \\""--checkpoint_dir/--name/\\"" and filename ""\n              ""\\""--name.h5\\"" is loaded.""))\n\n    # Hyperparameters\n    parser.add_argument(\n        ""--batch-size"",\n        ""-b"",\n        type=int,\n        default=10,\n        help=""The batch size. Default: 10"")\n    parser.add_argument(\n        ""--epochs"",\n        type=int,\n        default=300,\n        help=""Number of training epochs. Default: 300"")\n    parser.add_argument(\n        ""--learning-rate"",\n        ""-lr"",\n        type=float,\n        default=5e-4,\n        help=""The learning rate. Default: 5e-4"")\n    parser.add_argument(\n        ""--lr-decay"",\n        type=float,\n        default=0.1,\n        help=""The learning rate decay factor. Default: 0.5"")\n    parser.add_argument(\n        ""--lr-decay-epochs"",\n        type=int,\n        default=100,\n        help=""The number of epochs before adjusting the learning rate. ""\n        ""Default: 100"")\n    parser.add_argument(\n        ""--weight-decay"",\n        ""-wd"",\n        type=float,\n        default=2e-4,\n        help=""L2 regularization factor. Default: 2e-4"")\n\n    # Dataset\n    parser.add_argument(\n        ""--dataset"",\n        choices=[\'camvid\', \'cityscapes\'],\n        default=\'camvid\',\n        help=""Dataset to use. Default: camvid"")\n    parser.add_argument(\n        ""--dataset-dir"",\n        type=str,\n        default=""data/CamVid"",\n        help=""Path to the root directory of the selected dataset. ""\n        ""Default: data/CamVid"")\n    parser.add_argument(\n        ""--height"",\n        type=int,\n        default=360,\n        help=""The image height. Default: 360"")\n    parser.add_argument(\n        ""--width"",\n        type=int,\n        default=480,\n        help=""The image width. Default: 480"")\n    parser.add_argument(\n        ""--weighing"",\n        choices=[\'enet\', \'mfb\', \'none\'],\n        default=\'ENet\',\n        help=""The class weighing technique to apply to the dataset. ""\n        ""Default: enet"")\n    parser.add_argument(\n        ""--with-unlabeled"",\n        dest=\'ignore_unlabeled\',\n        action=\'store_false\',\n        help=""The unlabeled class is not ignored."")\n\n    # Settings\n    parser.add_argument(\n        ""--workers"",\n        type=int,\n        default=4,\n        help=""Number of subprocesses to use for data loading. Default: 4"")\n    parser.add_argument(\n        ""--print-step"",\n        action=\'store_true\',\n        help=""Print loss every step"")\n    parser.add_argument(\n        ""--imshow-batch"",\n        action=\'store_true\',\n        help=(""Displays batch images when loading the dataset and making ""\n              ""predictions.""))\n    parser.add_argument(\n        ""--device"",\n        default=\'cuda\',\n        help=""Device on which the network will be trained. Default: cuda"")\n\n    # Storage settings\n    parser.add_argument(\n        ""--name"",\n        type=str,\n        default=\'ENet\',\n        help=""Name given to the model when saving. Default: ENet"")\n    parser.add_argument(\n        ""--save-dir"",\n        type=str,\n        default=\'save\',\n        help=""The directory where models are saved. Default: save"")\n\n    return parser.parse_args()\n'"
main.py,8,"b'import os\n\nimport torch\nimport torch.nn as nn\nimport torch.optim as optim\nimport torch.optim.lr_scheduler as lr_scheduler\nimport torch.utils.data as data\nimport torchvision.transforms as transforms\n\nfrom PIL import Image\n\nimport transforms as ext_transforms\nfrom models.enet import ENet\nfrom train import Train\nfrom test import Test\nfrom metric.iou import IoU\nfrom args import get_arguments\nfrom data.utils import enet_weighing, median_freq_balancing\nimport utils\n\n# Get the arguments\nargs = get_arguments()\n\ndevice = torch.device(args.device)\n\n\ndef load_dataset(dataset):\n    print(""\\nLoading dataset...\\n"")\n\n    print(""Selected dataset:"", args.dataset)\n    print(""Dataset directory:"", args.dataset_dir)\n    print(""Save directory:"", args.save_dir)\n\n    image_transform = transforms.Compose(\n        [transforms.Resize((args.height, args.width)),\n         transforms.ToTensor()])\n\n    label_transform = transforms.Compose([\n        transforms.Resize((args.height, args.width), Image.NEAREST),\n        ext_transforms.PILToLongTensor()\n    ])\n\n    # Get selected dataset\n    # Load the training set as tensors\n    train_set = dataset(\n        args.dataset_dir,\n        transform=image_transform,\n        label_transform=label_transform)\n    train_loader = data.DataLoader(\n        train_set,\n        batch_size=args.batch_size,\n        shuffle=True,\n        num_workers=args.workers)\n\n    # Load the validation set as tensors\n    val_set = dataset(\n        args.dataset_dir,\n        mode=\'val\',\n        transform=image_transform,\n        label_transform=label_transform)\n    val_loader = data.DataLoader(\n        val_set,\n        batch_size=args.batch_size,\n        shuffle=False,\n        num_workers=args.workers)\n\n    # Load the test set as tensors\n    test_set = dataset(\n        args.dataset_dir,\n        mode=\'test\',\n        transform=image_transform,\n        label_transform=label_transform)\n    test_loader = data.DataLoader(\n        test_set,\n        batch_size=args.batch_size,\n        shuffle=False,\n        num_workers=args.workers)\n\n    # Get encoding between pixel valus in label images and RGB colors\n    class_encoding = train_set.color_encoding\n\n    # Remove the road_marking class from the CamVid dataset as it\'s merged\n    # with the road class\n    if args.dataset.lower() == \'camvid\':\n        del class_encoding[\'road_marking\']\n\n    # Get number of classes to predict\n    num_classes = len(class_encoding)\n\n    # Print information for debugging\n    print(""Number of classes to predict:"", num_classes)\n    print(""Train dataset size:"", len(train_set))\n    print(""Validation dataset size:"", len(val_set))\n\n    # Get a batch of samples to display\n    if args.mode.lower() == \'test\':\n        images, labels = iter(test_loader).next()\n    else:\n        images, labels = iter(train_loader).next()\n    print(""Image size:"", images.size())\n    print(""Label size:"", labels.size())\n    print(""Class-color encoding:"", class_encoding)\n\n    # Show a batch of samples and labels\n    if args.imshow_batch:\n        print(""Close the figure window to continue..."")\n        label_to_rgb = transforms.Compose([\n            ext_transforms.LongTensorToRGBPIL(class_encoding),\n            transforms.ToTensor()\n        ])\n        color_labels = utils.batch_transform(labels, label_to_rgb)\n        utils.imshow_batch(images, color_labels)\n\n    # Get class weights from the selected weighing technique\n    print(""\\nWeighing technique:"", args.weighing)\n    print(""Computing class weights..."")\n    print(""(this can take a while depending on the dataset size)"")\n    class_weights = 0\n    if args.weighing.lower() == \'enet\':\n        class_weights = enet_weighing(train_loader, num_classes)\n    elif args.weighing.lower() == \'mfb\':\n        class_weights = median_freq_balancing(train_loader, num_classes)\n    else:\n        class_weights = None\n\n    if class_weights is not None:\n        class_weights = torch.from_numpy(class_weights).float().to(device)\n        # Set the weight of the unlabeled class to 0\n        if args.ignore_unlabeled:\n            ignore_index = list(class_encoding).index(\'unlabeled\')\n            class_weights[ignore_index] = 0\n\n    print(""Class weights:"", class_weights)\n\n    return (train_loader, val_loader,\n            test_loader), class_weights, class_encoding\n\n\ndef train(train_loader, val_loader, class_weights, class_encoding):\n    print(""\\nTraining...\\n"")\n\n    num_classes = len(class_encoding)\n\n    # Intialize ENet\n    model = ENet(num_classes).to(device)\n    # Check if the network architecture is correct\n    print(model)\n\n    # We are going to use the CrossEntropyLoss loss function as it\'s most\n    # frequentely used in classification problems with multiple classes which\n    # fits the problem. This criterion  combines LogSoftMax and NLLLoss.\n    criterion = nn.CrossEntropyLoss(weight=class_weights)\n\n    # ENet authors used Adam as the optimizer\n    optimizer = optim.Adam(\n        model.parameters(),\n        lr=args.learning_rate,\n        weight_decay=args.weight_decay)\n\n    # Learning rate decay scheduler\n    lr_updater = lr_scheduler.StepLR(optimizer, args.lr_decay_epochs,\n                                     args.lr_decay)\n\n    # Evaluation metric\n    if args.ignore_unlabeled:\n        ignore_index = list(class_encoding).index(\'unlabeled\')\n    else:\n        ignore_index = None\n    metric = IoU(num_classes, ignore_index=ignore_index)\n\n    # Optionally resume from a checkpoint\n    if args.resume:\n        model, optimizer, start_epoch, best_miou = utils.load_checkpoint(\n            model, optimizer, args.save_dir, args.name)\n        print(""Resuming from model: Start epoch = {0} ""\n              ""| Best mean IoU = {1:.4f}"".format(start_epoch, best_miou))\n    else:\n        start_epoch = 0\n        best_miou = 0\n\n    # Start Training\n    print()\n    train = Train(model, train_loader, optimizer, criterion, metric, device)\n    val = Test(model, val_loader, criterion, metric, device)\n    for epoch in range(start_epoch, args.epochs):\n        print("">>>> [Epoch: {0:d}] Training"".format(epoch))\n\n        lr_updater.step()\n        epoch_loss, (iou, miou) = train.run_epoch(args.print_step)\n\n        print("">>>> [Epoch: {0:d}] Avg. loss: {1:.4f} | Mean IoU: {2:.4f}"".\n              format(epoch, epoch_loss, miou))\n\n        if (epoch + 1) % 10 == 0 or epoch + 1 == args.epochs:\n            print("">>>> [Epoch: {0:d}] Validation"".format(epoch))\n\n            loss, (iou, miou) = val.run_epoch(args.print_step)\n\n            print("">>>> [Epoch: {0:d}] Avg. loss: {1:.4f} | Mean IoU: {2:.4f}"".\n                  format(epoch, loss, miou))\n\n            # Print per class IoU on last epoch or if best iou\n            if epoch + 1 == args.epochs or miou > best_miou:\n                for key, class_iou in zip(class_encoding.keys(), iou):\n                    print(""{0}: {1:.4f}"".format(key, class_iou))\n\n            # Save the model if it\'s the best thus far\n            if miou > best_miou:\n                print(""\\nBest model thus far. Saving...\\n"")\n                best_miou = miou\n                utils.save_checkpoint(model, optimizer, epoch + 1, best_miou,\n                                      args)\n\n    return model\n\n\ndef test(model, test_loader, class_weights, class_encoding):\n    print(""\\nTesting...\\n"")\n\n    num_classes = len(class_encoding)\n\n    # We are going to use the CrossEntropyLoss loss function as it\'s most\n    # frequentely used in classification problems with multiple classes which\n    # fits the problem. This criterion  combines LogSoftMax and NLLLoss.\n    criterion = nn.CrossEntropyLoss(weight=class_weights)\n\n    # Evaluation metric\n    if args.ignore_unlabeled:\n        ignore_index = list(class_encoding).index(\'unlabeled\')\n    else:\n        ignore_index = None\n    metric = IoU(num_classes, ignore_index=ignore_index)\n\n    # Test the trained model on the test set\n    test = Test(model, test_loader, criterion, metric, device)\n\n    print("">>>> Running test dataset"")\n\n    loss, (iou, miou) = test.run_epoch(args.print_step)\n    class_iou = dict(zip(class_encoding.keys(), iou))\n\n    print("">>>> Avg. loss: {0:.4f} | Mean IoU: {1:.4f}"".format(loss, miou))\n\n    # Print per class IoU\n    for key, class_iou in zip(class_encoding.keys(), iou):\n        print(""{0}: {1:.4f}"".format(key, class_iou))\n\n    # Show a batch of samples and labels\n    if args.imshow_batch:\n        print(""A batch of predictions from the test set..."")\n        images, _ = iter(test_loader).next()\n        predict(model, images, class_encoding)\n\n\ndef predict(model, images, class_encoding):\n    images = images.to(device)\n\n    # Make predictions!\n    model.eval()\n    with torch.no_grad():\n        predictions = model(images)\n\n    # Predictions is one-hot encoded with ""num_classes"" channels.\n    # Convert it to a single int using the indices where the maximum (1) occurs\n    _, predictions = torch.max(predictions.data, 1)\n\n    label_to_rgb = transforms.Compose([\n        ext_transforms.LongTensorToRGBPIL(class_encoding),\n        transforms.ToTensor()\n    ])\n    color_predictions = utils.batch_transform(predictions.cpu(), label_to_rgb)\n    utils.imshow_batch(images.data.cpu(), color_predictions)\n\n\n# Run only if this module is being run directly\nif __name__ == \'__main__\':\n\n    # Fail fast if the dataset directory doesn\'t exist\n    assert os.path.isdir(\n        args.dataset_dir), ""The directory \\""{0}\\"" doesn\'t exist."".format(\n            args.dataset_dir)\n\n    # Fail fast if the saving directory doesn\'t exist\n    assert os.path.isdir(\n        args.save_dir), ""The directory \\""{0}\\"" doesn\'t exist."".format(\n            args.save_dir)\n\n    # Import the requested dataset\n    if args.dataset.lower() == \'camvid\':\n        from data import CamVid as dataset\n    elif args.dataset.lower() == \'cityscapes\':\n        from data import Cityscapes as dataset\n    else:\n        # Should never happen...but just in case it does\n        raise RuntimeError(""\\""{0}\\"" is not a supported dataset."".format(\n            args.dataset))\n\n    loaders, w_class, class_encoding = load_dataset(dataset)\n    train_loader, val_loader, test_loader = loaders\n\n    if args.mode.lower() in {\'train\', \'full\'}:\n        model = train(train_loader, val_loader, w_class, class_encoding)\n\n    if args.mode.lower() in {\'test\', \'full\'}:\n        if args.mode.lower() == \'test\':\n            # Intialize a new ENet model\n            num_classes = len(class_encoding)\n            model = ENet(num_classes).to(device)\n\n        # Initialize a optimizer just so we can retrieve the model from the\n        # checkpoint\n        optimizer = optim.Adam(model.parameters())\n\n        # Load the previoulsy saved model state to the ENet model\n        model = utils.load_checkpoint(model, optimizer, args.save_dir,\n                                      args.name)[0]\n\n        if args.mode.lower() == \'test\':\n            print(model)\n\n        test(model, test_loader, w_class, class_encoding)\n'"
test.py,2,"b'import torch\n\n\nclass Test:\n    """"""Tests the ``model`` on the specified test dataset using the\n    data loader, and loss criterion.\n\n    Keyword arguments:\n    - model (``nn.Module``): the model instance to test.\n    - data_loader (``Dataloader``): Provides single or multi-process\n    iterators over the dataset.\n    - criterion (``Optimizer``): The loss criterion.\n    - metric (```Metric``): An instance specifying the metric to return.\n    - device (``torch.device``): An object representing the device on which\n    tensors are allocated.\n\n    """"""\n\n    def __init__(self, model, data_loader, criterion, metric, device):\n        self.model = model\n        self.data_loader = data_loader\n        self.criterion = criterion\n        self.metric = metric\n        self.device = device\n\n    def run_epoch(self, iteration_loss=False):\n        """"""Runs an epoch of validation.\n\n        Keyword arguments:\n        - iteration_loss (``bool``, optional): Prints loss at every step.\n\n        Returns:\n        - The epoch loss (float), and the values of the specified metrics\n\n        """"""\n        self.model.eval()\n        epoch_loss = 0.0\n        self.metric.reset()\n        for step, batch_data in enumerate(self.data_loader):\n            # Get the inputs and labels\n            inputs = batch_data[0].to(self.device)\n            labels = batch_data[1].to(self.device)\n\n            with torch.no_grad():\n                # Forward propagation\n                outputs = self.model(inputs)\n\n                # Loss computation\n                loss = self.criterion(outputs, labels)\n\n            # Keep track of loss for current epoch\n            epoch_loss += loss.item()\n\n            # Keep track of evaluation the metric\n            self.metric.add(outputs.detach(), labels.detach())\n\n            if iteration_loss:\n                print(""[Step: %d] Iteration loss: %.4f"" % (step, loss.item()))\n\n        return epoch_loss / len(self.data_loader), self.metric.value()\n'"
train.py,1,"b'class Train:\n    """"""Performs the training of ``model`` given a training dataset data\n    loader, the optimizer, and the loss criterion.\n\n    Keyword arguments:\n    - model (``nn.Module``): the model instance to train.\n    - data_loader (``Dataloader``): Provides single or multi-process\n    iterators over the dataset.\n    - optim (``Optimizer``): The optimization algorithm.\n    - criterion (``Optimizer``): The loss criterion.\n    - metric (```Metric``): An instance specifying the metric to return.\n    - device (``torch.device``): An object representing the device on which\n    tensors are allocated.\n\n    """"""\n\n    def __init__(self, model, data_loader, optim, criterion, metric, device):\n        self.model = model\n        self.data_loader = data_loader\n        self.optim = optim\n        self.criterion = criterion\n        self.metric = metric\n        self.device = device\n\n    def run_epoch(self, iteration_loss=False):\n        """"""Runs an epoch of training.\n\n        Keyword arguments:\n        - iteration_loss (``bool``, optional): Prints loss at every step.\n\n        Returns:\n        - The epoch loss (float).\n\n        """"""\n        self.model.train()\n        epoch_loss = 0.0\n        self.metric.reset()\n        for step, batch_data in enumerate(self.data_loader):\n            # Get the inputs and labels\n            inputs = batch_data[0].to(self.device)\n            labels = batch_data[1].to(self.device)\n\n            # Forward propagation\n            outputs = self.model(inputs)\n\n            # Loss computation\n            loss = self.criterion(outputs, labels)\n\n            # Backpropagation\n            self.optim.zero_grad()\n            loss.backward()\n            self.optim.step()\n\n            # Keep track of loss for current epoch\n            epoch_loss += loss.item()\n\n            # Keep track of the evaluation metric\n            self.metric.add(outputs.detach(), labels.detach())\n\n            if iteration_loss:\n                print(""[Step: %d] Iteration loss: %.4f"" % (step, loss.item()))\n\n        return epoch_loss / len(self.data_loader), self.metric.value()\n'"
transforms.py,15,"b'import torch\nimport numpy as np\nfrom PIL import Image\nfrom collections import OrderedDict\nfrom torchvision.transforms import ToPILImage\n\n\nclass PILToLongTensor(object):\n    """"""Converts a ``PIL Image`` to a ``torch.LongTensor``.\n\n    Code adapted from: http://pytorch.org/docs/master/torchvision/transforms.html?highlight=totensor\n\n    """"""\n\n    def __call__(self, pic):\n        """"""Performs the conversion from a ``PIL Image`` to a ``torch.LongTensor``.\n\n        Keyword arguments:\n        - pic (``PIL.Image``): the image to convert to ``torch.LongTensor``\n\n        Returns:\n        A ``torch.LongTensor``.\n\n        """"""\n        if not isinstance(pic, Image.Image):\n            raise TypeError(""pic should be PIL Image. Got {}"".format(\n                type(pic)))\n\n        # handle numpy array\n        if isinstance(pic, np.ndarray):\n            img = torch.from_numpy(pic.transpose((2, 0, 1)))\n            # backward compatibility\n            return img.long()\n\n        # Convert PIL image to ByteTensor\n        img = torch.ByteTensor(torch.ByteStorage.from_buffer(pic.tobytes()))\n\n        # Reshape tensor\n        nchannel = len(pic.mode)\n        img = img.view(pic.size[1], pic.size[0], nchannel)\n\n        # Convert to long and squeeze the channels\n        return img.transpose(0, 1).transpose(0,\n                                             2).contiguous().long().squeeze_()\n\n\nclass LongTensorToRGBPIL(object):\n    """"""Converts a ``torch.LongTensor`` to a ``PIL image``.\n\n    The input is a ``torch.LongTensor`` where each pixel\'s value identifies the\n    class.\n\n    Keyword arguments:\n    - rgb_encoding (``OrderedDict``): An ``OrderedDict`` that relates pixel\n    values, class names, and class colors.\n\n    """"""\n    def __init__(self, rgb_encoding):\n        self.rgb_encoding = rgb_encoding\n\n    def __call__(self, tensor):\n        """"""Performs the conversion from ``torch.LongTensor`` to a ``PIL image``\n\n        Keyword arguments:\n        - tensor (``torch.LongTensor``): the tensor to convert\n\n        Returns:\n        A ``PIL.Image``.\n\n        """"""\n        # Check if label_tensor is a LongTensor\n        if not isinstance(tensor, torch.LongTensor):\n            raise TypeError(""label_tensor should be torch.LongTensor. Got {}""\n                            .format(type(tensor)))\n        # Check if encoding is a ordered dictionary\n        if not isinstance(self.rgb_encoding, OrderedDict):\n            raise TypeError(""encoding should be an OrderedDict. Got {}"".format(\n                type(self.rgb_encoding)))\n\n        # label_tensor might be an image without a channel dimension, in this\n        # case unsqueeze it\n        if len(tensor.size()) == 2:\n            tensor.unsqueeze_(0)\n\n        color_tensor = torch.ByteTensor(3, tensor.size(1), tensor.size(2))\n\n        for index, (class_name, color) in enumerate(self.rgb_encoding.items()):\n            # Get a mask of elements equal to index\n            mask = torch.eq(tensor, index).squeeze_()\n            # Fill color_tensor with corresponding colors\n            for channel, color_value in enumerate(color):\n                color_tensor[channel].masked_fill_(mask, color_value)\n\n        return ToPILImage()(color_tensor)\n'"
