file_path,api_count,code
models/base_model.py,8,"b'import os\nimport torch\nfrom collections import OrderedDict\nfrom abc import ABC, abstractmethod\nfrom . import networks\n\n\nclass BaseModel(ABC):\n    """"""This class is an abstract base class (ABC) for models.\n    To create a subclass, you need to implement the following five functions:\n        -- <__init__>:                      initialize the class; first call BaseModel.__init__(self, opt).\n        -- <set_input>:                     unpack data from dataset and apply preprocessing.\n        -- <forward>:                       produce intermediate results.\n        -- <optimize_parameters>:           calculate losses, gradients, and update network weights.\n        -- <modify_commandline_options>:    (optionally) add model-specific options and set default options.\n    """"""\n\n    def __init__(self, opt):\n        """"""Initialize the BaseModel class.\n\n        Parameters:\n            opt (Option class)-- stores all the experiment flags; needs to be a subclass of BaseOptions\n\n        When creating your custom class, you need to implement your own initialization.\n        In this function, you should first call <BaseModel.__init__(self, opt)>\n        Then, you need to define four lists:\n            -- self.loss_names (str list):          specify the training losses that you want to plot and save.\n            -- self.model_names (str list):         define networks used in our training.\n            -- self.visual_names (str list):        specify the images that you want to display and save.\n            -- self.optimizers (optimizer list):    define and initialize optimizers. You can define one optimizer for each network. If two networks are updated at the same time, you can use itertools.chain to group them. See cycle_gan_model.py for an example.\n        """"""\n        self.opt = opt\n        self.gpu_ids = opt.gpu_ids\n        self.isTrain = opt.isTrain\n        self.device = torch.device(\'cuda:{}\'.format(self.gpu_ids[0])) if self.gpu_ids else torch.device(\'cpu\')  # get device name: CPU or GPU\n        self.save_dir = os.path.join(opt.checkpoints_dir, opt.name)  # save all the checkpoints to save_dir\n        if opt.preprocess != \'scale_width\':  # with [scale_width], input images might have different sizes, which hurts the performance of cudnn.benchmark.\n            torch.backends.cudnn.benchmark = True\n        self.loss_names = []\n        self.model_names = []\n        self.visual_names = []\n        self.optimizers = []\n        self.image_paths = []\n        self.metric = 0  # used for learning rate policy \'plateau\'\n\n    @staticmethod\n    def modify_commandline_options(parser, is_train):\n        """"""Add new model-specific options, and rewrite default values for existing options.\n\n        Parameters:\n            parser          -- original option parser\n            is_train (bool) -- whether training phase or test phase. You can use this flag to add training-specific or test-specific options.\n\n        Returns:\n            the modified parser.\n        """"""\n        return parser\n\n    @abstractmethod\n    def set_input(self, input):\n        """"""Unpack input data from the dataloader and perform necessary pre-processing steps.\n\n        Parameters:\n            input (dict): includes the data itself and its metadata information.\n        """"""\n        pass\n\n    @abstractmethod\n    def forward(self):\n        """"""Run forward pass; called by both functions <optimize_parameters> and <test>.""""""\n        pass\n\n    @abstractmethod\n    def optimize_parameters(self):\n        """"""Calculate losses, gradients, and update network weights; called in every training iteration""""""\n        pass\n\n    def setup(self, opt):\n        """"""Load and print networks; create schedulers\n\n        Parameters:\n            opt (Option class) -- stores all the experiment flags; needs to be a subclass of BaseOptions\n        """"""\n        if self.isTrain:\n            self.schedulers = [networks.get_scheduler(optimizer, opt) for optimizer in self.optimizers]\n        if not self.isTrain or opt.continue_train:\n            load_suffix = \'iter_%d\' % opt.load_iter if opt.load_iter > 0 else opt.epoch\n            self.load_networks(load_suffix)\n        self.print_networks(opt.verbose)\n\n    def eval(self):\n        """"""Make models eval mode during test time""""""\n        for name in self.model_names:\n            if isinstance(name, str):\n                net = getattr(self, \'net\' + name)\n                net.eval()\n\n    def test(self):\n        """"""Forward function used in test time.\n\n        This function wraps <forward> function in no_grad() so we don\'t save intermediate steps for backprop\n        It also calls <compute_visuals> to produce additional visualization results\n        """"""\n        with torch.no_grad():\n            self.forward()\n            self.compute_visuals()\n\n    def compute_visuals(self):\n        """"""Calculate additional output images for visdom and HTML visualization""""""\n        pass\n\n    def get_image_paths(self):\n        """""" Return image paths that are used to load current data""""""\n        return self.image_paths\n\n    def update_learning_rate(self):\n        """"""Update learning rates for all the networks; called at the end of every epoch""""""\n        for scheduler in self.schedulers:\n            if self.opt.lr_policy == \'plateau\':\n                scheduler.step(self.metric)\n            else:\n                scheduler.step()\n\n        lr = self.optimizers[0].param_groups[0][\'lr\']\n        print(\'learning rate = %.7f\' % lr)\n\n    def get_current_visuals(self):\n        """"""Return visualization images. train.py will display these images with visdom, and save the images to a HTML""""""\n        visual_ret = OrderedDict()\n        for name in self.visual_names:\n            if isinstance(name, str):\n                visual_ret[name] = getattr(self, name)\n        return visual_ret\n\n    def get_current_losses(self):\n        """"""Return traning losses / errors. train.py will print out these errors on console, and save them to a file""""""\n        errors_ret = OrderedDict()\n        for name in self.loss_names:\n            if isinstance(name, str):\n                errors_ret[name] = float(getattr(self, \'loss_\' + name))  # float(...) works for both scalar tensor and float number\n        return errors_ret\n\n    def save_networks(self, epoch):\n        """"""Save all the networks to the disk.\n\n        Parameters:\n            epoch (int) -- current epoch; used in the file name \'%s_net_%s.pth\' % (epoch, name)\n        """"""\n        for name in self.model_names:\n            if isinstance(name, str):\n                save_filename = \'%s_net_%s.pth\' % (epoch, name)\n                save_path = os.path.join(self.save_dir, save_filename)\n                net = getattr(self, \'net\' + name)\n\n                if len(self.gpu_ids) > 0 and torch.cuda.is_available():\n                    torch.save(net.module.cpu().state_dict(), save_path)\n                    net.cuda(self.gpu_ids[0])\n                else:\n                    torch.save(net.cpu().state_dict(), save_path)\n\n    def __patch_instance_norm_state_dict(self, state_dict, module, keys, i=0):\n        """"""Fix InstanceNorm checkpoints incompatibility (prior to 0.4)""""""\n        key = keys[i]\n        if i + 1 == len(keys):  # at the end, pointing to a parameter/buffer\n            if module.__class__.__name__.startswith(\'InstanceNorm\') and \\\n                    (key == \'running_mean\' or key == \'running_var\'):\n                if getattr(module, key) is None:\n                    state_dict.pop(\'.\'.join(keys))\n            if module.__class__.__name__.startswith(\'InstanceNorm\') and \\\n               (key == \'num_batches_tracked\'):\n                state_dict.pop(\'.\'.join(keys))\n        else:\n            self.__patch_instance_norm_state_dict(state_dict, getattr(module, key), keys, i + 1)\n\n    def load_networks(self, epoch):\n        """"""Load all the networks from the disk.\n\n        Parameters:\n            epoch (int) -- current epoch; used in the file name \'%s_net_%s.pth\' % (epoch, name)\n        """"""\n        for name in self.model_names:\n            if isinstance(name, str):\n                load_filename = \'%s_net_%s.pth\' % (epoch, name)\n                load_path = os.path.join(self.save_dir, load_filename)\n                net = getattr(self, \'net\' + name)\n                if isinstance(net, torch.nn.DataParallel):\n                    net = net.module\n                print(\'loading the model from %s\' % load_path)\n                # if you are using PyTorch newer than 0.4 (e.g., built from\n                # GitHub source), you can remove str() on self.device\n                state_dict = torch.load(load_path, map_location=str(self.device))\n                if hasattr(state_dict, \'_metadata\'):\n                    del state_dict._metadata\n\n                # patch InstanceNorm checkpoints prior to 0.4\n                for key in list(state_dict.keys()):  # need to copy keys here because we mutate in loop\n                    self.__patch_instance_norm_state_dict(state_dict, net, key.split(\'.\'))\n                net.load_state_dict(state_dict)\n\n    def print_networks(self, verbose):\n        """"""Print the total number of parameters in the network and (if verbose) network architecture\n\n        Parameters:\n            verbose (bool) -- if verbose: print the network architecture\n        """"""\n        print(\'---------- Networks initialized -------------\')\n        for name in self.model_names:\n            if isinstance(name, str):\n                net = getattr(self, \'net\' + name)\n                num_params = 0\n                for param in net.parameters():\n                    num_params += param.numel()\n                if verbose:\n                    print(net)\n                print(\'[Network %s] Total number of parameters : %.3f M\' % (name, num_params / 1e6))\n        print(\'-----------------------------------------------\')\n\n    def set_requires_grad(self, nets, requires_grad=False):\n        """"""Set requies_grad=Fasle for all the networks to avoid unnecessary computations\n        Parameters:\n            nets (network list)   -- a list of networks\n            requires_grad (bool)  -- whether the networks require gradients or not\n        """"""\n        if not isinstance(nets, list):\n            nets = [nets]\n        for net in nets:\n            if net is not None:\n                for param in net.parameters():\n                    param.requires_grad = requires_grad\n'"
models/colorization_model.py,1,"b'from .pix2pix_model import Pix2PixModel\nimport torch\nfrom skimage import color  # used for lab2rgb\nimport numpy as np\n\n\nclass ColorizationModel(Pix2PixModel):\n    """"""This is a subclass of Pix2PixModel for image colorization (black & white image -> colorful images).\n\n    The model training requires \'-dataset_model colorization\' dataset.\n    It trains a pix2pix model, mapping from L channel to ab channels in Lab color space.\n    By default, the colorization dataset will automatically set \'--input_nc 1\' and \'--output_nc 2\'.\n    """"""\n    @staticmethod\n    def modify_commandline_options(parser, is_train=True):\n        """"""Add new dataset-specific options, and rewrite default values for existing options.\n\n        Parameters:\n            parser          -- original option parser\n            is_train (bool) -- whether training phase or test phase. You can use this flag to add training-specific or test-specific options.\n\n        Returns:\n            the modified parser.\n\n        By default, we use \'colorization\' dataset for this model.\n        See the original pix2pix paper (https://arxiv.org/pdf/1611.07004.pdf) and colorization results (Figure 9 in the paper)\n        """"""\n        Pix2PixModel.modify_commandline_options(parser, is_train)\n        parser.set_defaults(dataset_mode=\'colorization\')\n        return parser\n\n    def __init__(self, opt):\n        """"""Initialize the class.\n\n        Parameters:\n            opt (Option class)-- stores all the experiment flags; needs to be a subclass of BaseOptions\n\n        For visualization, we set \'visual_names\' as \'real_A\' (input real image),\n        \'real_B_rgb\' (ground truth RGB image), and \'fake_B_rgb\' (predicted RGB image)\n        We convert the Lab image \'real_B\' (inherited from Pix2pixModel) to a RGB image \'real_B_rgb\'.\n        we convert the Lab image \'fake_B\' (inherited from Pix2pixModel) to a RGB image \'fake_B_rgb\'.\n        """"""\n        # reuse the pix2pix model\n        Pix2PixModel.__init__(self, opt)\n        # specify the images to be visualized.\n        self.visual_names = [\'real_A\', \'real_B_rgb\', \'fake_B_rgb\']\n\n    def lab2rgb(self, L, AB):\n        """"""Convert an Lab tensor image to a RGB numpy output\n        Parameters:\n            L  (1-channel tensor array): L channel images (range: [-1, 1], torch tensor array)\n            AB (2-channel tensor array):  ab channel images (range: [-1, 1], torch tensor array)\n\n        Returns:\n            rgb (RGB numpy image): rgb output images  (range: [0, 255], numpy array)\n        """"""\n        AB2 = AB * 110.0\n        L2 = (L + 1.0) * 50.0\n        Lab = torch.cat([L2, AB2], dim=1)\n        Lab = Lab[0].data.cpu().float().numpy()\n        Lab = np.transpose(Lab.astype(np.float64), (1, 2, 0))\n        rgb = color.lab2rgb(Lab) * 255\n        return rgb\n\n    def compute_visuals(self):\n        """"""Calculate additional output images for visdom and HTML visualization""""""\n        self.real_B_rgb = self.lab2rgb(self.real_A, self.real_B)\n        self.fake_B_rgb = self.lab2rgb(self.real_A, self.fake_B)\n'"
models/cycle_gan_model.py,4,"b'import torch\nimport itertools\nfrom util.image_pool import ImagePool\nfrom .base_model import BaseModel\nfrom . import networks\n\n\nclass CycleGANModel(BaseModel):\n    """"""\n    This class implements the CycleGAN model, for learning image-to-image translation without paired data.\n\n    The model training requires \'--dataset_mode unaligned\' dataset.\n    By default, it uses a \'--netG resnet_9blocks\' ResNet generator,\n    a \'--netD basic\' discriminator (PatchGAN introduced by pix2pix),\n    and a least-square GANs objective (\'--gan_mode lsgan\').\n\n    CycleGAN paper: https://arxiv.org/pdf/1703.10593.pdf\n    """"""\n    @staticmethod\n    def modify_commandline_options(parser, is_train=True):\n        """"""Add new dataset-specific options, and rewrite default values for existing options.\n\n        Parameters:\n            parser          -- original option parser\n            is_train (bool) -- whether training phase or test phase. You can use this flag to add training-specific or test-specific options.\n\n        Returns:\n            the modified parser.\n\n        For CycleGAN, in addition to GAN losses, we introduce lambda_A, lambda_B, and lambda_identity for the following losses.\n        A (source domain), B (target domain).\n        Generators: G_A: A -> B; G_B: B -> A.\n        Discriminators: D_A: G_A(A) vs. B; D_B: G_B(B) vs. A.\n        Forward cycle loss:  lambda_A * ||G_B(G_A(A)) - A|| (Eqn. (2) in the paper)\n        Backward cycle loss: lambda_B * ||G_A(G_B(B)) - B|| (Eqn. (2) in the paper)\n        Identity loss (optional): lambda_identity * (||G_A(B) - B|| * lambda_B + ||G_B(A) - A|| * lambda_A) (Sec 5.2 ""Photo generation from paintings"" in the paper)\n        Dropout is not used in the original CycleGAN paper.\n        """"""\n        parser.set_defaults(no_dropout=True)  # default CycleGAN did not use dropout\n        if is_train:\n            parser.add_argument(\'--lambda_A\', type=float, default=10.0, help=\'weight for cycle loss (A -> B -> A)\')\n            parser.add_argument(\'--lambda_B\', type=float, default=10.0, help=\'weight for cycle loss (B -> A -> B)\')\n            parser.add_argument(\'--lambda_identity\', type=float, default=0.5, help=\'use identity mapping. Setting lambda_identity other than 0 has an effect of scaling the weight of the identity mapping loss. For example, if the weight of the identity loss should be 10 times smaller than the weight of the reconstruction loss, please set lambda_identity = 0.1\')\n\n        return parser\n\n    def __init__(self, opt):\n        """"""Initialize the CycleGAN class.\n\n        Parameters:\n            opt (Option class)-- stores all the experiment flags; needs to be a subclass of BaseOptions\n        """"""\n        BaseModel.__init__(self, opt)\n        # specify the training losses you want to print out. The training/test scripts will call <BaseModel.get_current_losses>\n        self.loss_names = [\'D_A\', \'G_A\', \'cycle_A\', \'idt_A\', \'D_B\', \'G_B\', \'cycle_B\', \'idt_B\']\n        # specify the images you want to save/display. The training/test scripts will call <BaseModel.get_current_visuals>\n        visual_names_A = [\'real_A\', \'fake_B\', \'rec_A\']\n        visual_names_B = [\'real_B\', \'fake_A\', \'rec_B\']\n        if self.isTrain and self.opt.lambda_identity > 0.0:  # if identity loss is used, we also visualize idt_B=G_A(B) ad idt_A=G_A(B)\n            visual_names_A.append(\'idt_B\')\n            visual_names_B.append(\'idt_A\')\n\n        self.visual_names = visual_names_A + visual_names_B  # combine visualizations for A and B\n        # specify the models you want to save to the disk. The training/test scripts will call <BaseModel.save_networks> and <BaseModel.load_networks>.\n        if self.isTrain:\n            self.model_names = [\'G_A\', \'G_B\', \'D_A\', \'D_B\']\n        else:  # during test time, only load Gs\n            self.model_names = [\'G_A\', \'G_B\']\n\n        # define networks (both Generators and discriminators)\n        # The naming is different from those used in the paper.\n        # Code (vs. paper): G_A (G), G_B (F), D_A (D_Y), D_B (D_X)\n        self.netG_A = networks.define_G(opt.input_nc, opt.output_nc, opt.ngf, opt.netG, opt.norm,\n                                        not opt.no_dropout, opt.init_type, opt.init_gain, self.gpu_ids)\n        self.netG_B = networks.define_G(opt.output_nc, opt.input_nc, opt.ngf, opt.netG, opt.norm,\n                                        not opt.no_dropout, opt.init_type, opt.init_gain, self.gpu_ids)\n\n        if self.isTrain:  # define discriminators\n            self.netD_A = networks.define_D(opt.output_nc, opt.ndf, opt.netD,\n                                            opt.n_layers_D, opt.norm, opt.init_type, opt.init_gain, self.gpu_ids)\n            self.netD_B = networks.define_D(opt.input_nc, opt.ndf, opt.netD,\n                                            opt.n_layers_D, opt.norm, opt.init_type, opt.init_gain, self.gpu_ids)\n\n        if self.isTrain:\n            if opt.lambda_identity > 0.0:  # only works when input and output images have the same number of channels\n                assert(opt.input_nc == opt.output_nc)\n            self.fake_A_pool = ImagePool(opt.pool_size)  # create image buffer to store previously generated images\n            self.fake_B_pool = ImagePool(opt.pool_size)  # create image buffer to store previously generated images\n            # define loss functions\n            self.criterionGAN = networks.GANLoss(opt.gan_mode).to(self.device)  # define GAN loss.\n            self.criterionCycle = torch.nn.L1Loss()\n            self.criterionIdt = torch.nn.L1Loss()\n            # initialize optimizers; schedulers will be automatically created by function <BaseModel.setup>.\n            self.optimizer_G = torch.optim.Adam(itertools.chain(self.netG_A.parameters(), self.netG_B.parameters()), lr=opt.lr, betas=(opt.beta1, 0.999))\n            self.optimizer_D = torch.optim.Adam(itertools.chain(self.netD_A.parameters(), self.netD_B.parameters()), lr=opt.lr, betas=(opt.beta1, 0.999))\n            self.optimizers.append(self.optimizer_G)\n            self.optimizers.append(self.optimizer_D)\n\n    def set_input(self, input):\n        """"""Unpack input data from the dataloader and perform necessary pre-processing steps.\n\n        Parameters:\n            input (dict): include the data itself and its metadata information.\n\n        The option \'direction\' can be used to swap domain A and domain B.\n        """"""\n        AtoB = self.opt.direction == \'AtoB\'\n        self.real_A = input[\'A\' if AtoB else \'B\'].to(self.device)\n        self.real_B = input[\'B\' if AtoB else \'A\'].to(self.device)\n        self.image_paths = input[\'A_paths\' if AtoB else \'B_paths\']\n\n    def forward(self):\n        """"""Run forward pass; called by both functions <optimize_parameters> and <test>.""""""\n        self.fake_B = self.netG_A(self.real_A)  # G_A(A)\n        self.rec_A = self.netG_B(self.fake_B)   # G_B(G_A(A))\n        self.fake_A = self.netG_B(self.real_B)  # G_B(B)\n        self.rec_B = self.netG_A(self.fake_A)   # G_A(G_B(B))\n\n    def backward_D_basic(self, netD, real, fake):\n        """"""Calculate GAN loss for the discriminator\n\n        Parameters:\n            netD (network)      -- the discriminator D\n            real (tensor array) -- real images\n            fake (tensor array) -- images generated by a generator\n\n        Return the discriminator loss.\n        We also call loss_D.backward() to calculate the gradients.\n        """"""\n        # Real\n        pred_real = netD(real)\n        loss_D_real = self.criterionGAN(pred_real, True)\n        # Fake\n        pred_fake = netD(fake.detach())\n        loss_D_fake = self.criterionGAN(pred_fake, False)\n        # Combined loss and calculate gradients\n        loss_D = (loss_D_real + loss_D_fake) * 0.5\n        loss_D.backward()\n        return loss_D\n\n    def backward_D_A(self):\n        """"""Calculate GAN loss for discriminator D_A""""""\n        fake_B = self.fake_B_pool.query(self.fake_B)\n        self.loss_D_A = self.backward_D_basic(self.netD_A, self.real_B, fake_B)\n\n    def backward_D_B(self):\n        """"""Calculate GAN loss for discriminator D_B""""""\n        fake_A = self.fake_A_pool.query(self.fake_A)\n        self.loss_D_B = self.backward_D_basic(self.netD_B, self.real_A, fake_A)\n\n    def backward_G(self):\n        """"""Calculate the loss for generators G_A and G_B""""""\n        lambda_idt = self.opt.lambda_identity\n        lambda_A = self.opt.lambda_A\n        lambda_B = self.opt.lambda_B\n        # Identity loss\n        if lambda_idt > 0:\n            # G_A should be identity if real_B is fed: ||G_A(B) - B||\n            self.idt_A = self.netG_A(self.real_B)\n            self.loss_idt_A = self.criterionIdt(self.idt_A, self.real_B) * lambda_B * lambda_idt\n            # G_B should be identity if real_A is fed: ||G_B(A) - A||\n            self.idt_B = self.netG_B(self.real_A)\n            self.loss_idt_B = self.criterionIdt(self.idt_B, self.real_A) * lambda_A * lambda_idt\n        else:\n            self.loss_idt_A = 0\n            self.loss_idt_B = 0\n\n        # GAN loss D_A(G_A(A))\n        self.loss_G_A = self.criterionGAN(self.netD_A(self.fake_B), True)\n        # GAN loss D_B(G_B(B))\n        self.loss_G_B = self.criterionGAN(self.netD_B(self.fake_A), True)\n        # Forward cycle loss || G_B(G_A(A)) - A||\n        self.loss_cycle_A = self.criterionCycle(self.rec_A, self.real_A) * lambda_A\n        # Backward cycle loss || G_A(G_B(B)) - B||\n        self.loss_cycle_B = self.criterionCycle(self.rec_B, self.real_B) * lambda_B\n        # combined loss and calculate gradients\n        self.loss_G = self.loss_G_A + self.loss_G_B + self.loss_cycle_A + self.loss_cycle_B + self.loss_idt_A + self.loss_idt_B\n        self.loss_G.backward()\n\n    def optimize_parameters(self):\n        """"""Calculate losses, gradients, and update network weights; called in every training iteration""""""\n        # forward\n        self.forward()      # compute fake images and reconstruction images.\n        # G_A and G_B\n        self.set_requires_grad([self.netD_A, self.netD_B], False)  # Ds require no gradients when optimizing Gs\n        self.optimizer_G.zero_grad()  # set G_A and G_B\'s gradients to zero\n        self.backward_G()             # calculate gradients for G_A and G_B\n        self.optimizer_G.step()       # update G_A and G_B\'s weights\n        # D_A and D_B\n        self.set_requires_grad([self.netD_A, self.netD_B], True)\n        self.optimizer_D.zero_grad()   # set D_A and D_B\'s gradients to zero\n        self.backward_D_A()      # calculate gradients for D_A\n        self.backward_D_B()      # calculate graidents for D_B\n        self.optimizer_D.step()  # update D_A and D_B\'s weights\n'"
