file_path,api_count,code
models/pix2pix_model.py,6,"b'import torch\nfrom .base_model import BaseModel\nfrom . import networks\n\n\nclass Pix2PixModel(BaseModel):\n    """""" This class implements the pix2pix model, for learning a mapping from input images to output images given paired data.\n\n    The model training requires \'--dataset_mode aligned\' dataset.\n    By default, it uses a \'--netG unet256\' U-Net generator,\n    a \'--netD basic\' discriminator (PatchGAN),\n    and a \'--gan_mode\' vanilla GAN loss (the cross-entropy objective used in the orignal GAN paper).\n\n    pix2pix paper: https://arxiv.org/pdf/1611.07004.pdf\n    """"""\n    @staticmethod\n    def modify_commandline_options(parser, is_train=True):\n        """"""Add new dataset-specific options, and rewrite default values for existing options.\n\n        Parameters:\n            parser          -- original option parser\n            is_train (bool) -- whether training phase or test phase. You can use this flag to add training-specific or test-specific options.\n\n        Returns:\n            the modified parser.\n\n        For pix2pix, we do not use image buffer\n        The training objective is: GAN Loss + lambda_L1 * ||G(A)-B||_1\n        By default, we use vanilla GAN loss, UNet with batchnorm, and aligned datasets.\n        """"""\n        # changing the default values to match the pix2pix paper (https://phillipi.github.io/pix2pix/)\n        parser.set_defaults(norm=\'batch\', netG=\'unet_256\', dataset_mode=\'aligned\')\n        if is_train:\n            parser.set_defaults(pool_size=0, gan_mode=\'vanilla\')\n            parser.add_argument(\'--lambda_L1\', type=float, default=100.0, help=\'weight for L1 loss\')\n\n        return parser\n\n    def __init__(self, opt):\n        """"""Initialize the pix2pix class.\n\n        Parameters:\n            opt (Option class)-- stores all the experiment flags; needs to be a subclass of BaseOptions\n        """"""\n        BaseModel.__init__(self, opt)\n        # specify the training losses you want to print out. The training/test scripts will call <BaseModel.get_current_losses>\n        self.loss_names = [\'G_GAN\', \'G_L1\', \'D_real\', \'D_fake\']\n        # specify the images you want to save/display. The training/test scripts will call <BaseModel.get_current_visuals>\n        self.visual_names = [\'real_A\', \'fake_B\', \'real_B\']\n        # specify the models you want to save to the disk. The training/test scripts will call <BaseModel.save_networks> and <BaseModel.load_networks>\n        if self.isTrain:\n            self.model_names = [\'G\', \'D\']\n        else:  # during test time, only load G\n            self.model_names = [\'G\']\n        # define networks (both generator and discriminator)\n        self.netG = networks.define_G(opt.input_nc, opt.output_nc, opt.ngf, opt.netG, opt.norm,\n                                      not opt.no_dropout, opt.init_type, opt.init_gain, self.gpu_ids)\n\n        if self.isTrain:  # define a discriminator; conditional GANs need to take both input and output images; Therefore, #channels for D is input_nc + output_nc\n            self.netD = networks.define_D(opt.input_nc + opt.output_nc, opt.ndf, opt.netD,\n                                          opt.n_layers_D, opt.norm, opt.init_type, opt.init_gain, self.gpu_ids)\n\n        if self.isTrain:\n            # define loss functions\n            self.criterionGAN = networks.GANLoss(opt.gan_mode).to(self.device)\n            self.criterionL1 = torch.nn.L1Loss()\n            # initialize optimizers; schedulers will be automatically created by function <BaseModel.setup>.\n            self.optimizer_G = torch.optim.Adam(self.netG.parameters(), lr=opt.lr, betas=(opt.beta1, 0.999))\n            self.optimizer_D = torch.optim.Adam(self.netD.parameters(), lr=opt.lr, betas=(opt.beta1, 0.999))\n            self.optimizers.append(self.optimizer_G)\n            self.optimizers.append(self.optimizer_D)\n\n    def set_input(self, input):\n        """"""Unpack input data from the dataloader and perform necessary pre-processing steps.\n\n        Parameters:\n            input (dict): include the data itself and its metadata information.\n\n        The option \'direction\' can be used to swap images in domain A and domain B.\n        """"""\n        AtoB = self.opt.direction == \'AtoB\'\n        self.real_A = input[\'A\' if AtoB else \'B\'].to(self.device)\n        self.real_B = input[\'B\' if AtoB else \'A\'].to(self.device)\n        self.image_paths = input[\'A_paths\' if AtoB else \'B_paths\']\n\n    def forward(self):\n        """"""Run forward pass; called by both functions <optimize_parameters> and <test>.""""""\n        self.fake_B = self.netG(self.real_A)  # G(A)\n\n    def backward_D(self):\n        """"""Calculate GAN loss for the discriminator""""""\n        # Fake; stop backprop to the generator by detaching fake_B\n        fake_AB = torch.cat((self.real_A, self.fake_B), 1)  # we use conditional GANs; we need to feed both input and output to the discriminator\n        pred_fake = self.netD(fake_AB.detach())\n        self.loss_D_fake = self.criterionGAN(pred_fake, False)\n        # Real\n        real_AB = torch.cat((self.real_A, self.real_B), 1)\n        pred_real = self.netD(real_AB)\n        self.loss_D_real = self.criterionGAN(pred_real, True)\n        # combine loss and calculate gradients\n        self.loss_D = (self.loss_D_fake + self.loss_D_real) * 0.5\n        self.loss_D.backward()\n\n    def backward_G(self):\n        """"""Calculate GAN and L1 loss for the generator""""""\n        # First, G(A) should fake the discriminator\n        fake_AB = torch.cat((self.real_A, self.fake_B), 1)\n        pred_fake = self.netD(fake_AB)\n        self.loss_G_GAN = self.criterionGAN(pred_fake, True)\n        # Second, G(A) = B\n        self.loss_G_L1 = self.criterionL1(self.fake_B, self.real_B) * self.opt.lambda_L1\n        # combine loss and calculate gradients\n        self.loss_G = self.loss_G_GAN + self.loss_G_L1\n        self.loss_G.backward()\n\n    def optimize_parameters(self):\n        self.forward()                   # compute fake images: G(A)\n        # update D\n        self.set_requires_grad(self.netD, True)  # enable backprop for D\n        self.optimizer_D.zero_grad()     # set D\'s gradients to zero\n        self.backward_D()                # calculate gradients for D\n        self.optimizer_D.step()          # update D\'s weights\n        # update G\n        self.set_requires_grad(self.netD, False)  # D requires no gradients when optimizing G\n        self.optimizer_G.zero_grad()        # set G\'s gradients to zero\n        self.backward_G()                   # calculate graidents for G\n        self.optimizer_G.step()             # udpate G\'s weights\n'"
models/template_model.py,3,"b'""""""Model class template\n\nThis module provides a template for users to implement custom models.\nYou can specify \'--model template\' to use this model.\nThe class name should be consistent with both the filename and its model option.\nThe filename should be <model>_dataset.py\nThe class name should be <Model>Dataset.py\nIt implements a simple image-to-image translation baseline based on regression loss.\nGiven input-output pairs (data_A, data_B), it learns a network netG that can minimize the following L1 loss:\n    min_<netG> ||netG(data_A) - data_B||_1\nYou need to implement the following functions:\n    <modify_commandline_options>:\xe3\x80\x80Add model-specific options and rewrite default values for existing options.\n    <__init__>: Initialize this model class.\n    <set_input>: Unpack input data and perform data pre-processing.\n    <forward>: Run forward pass. This will be called by both <optimize_parameters> and <test>.\n    <optimize_parameters>: Update network weights; it will be called in every training iteration.\n""""""\nimport torch\nfrom .base_model import BaseModel\nfrom . import networks\n\n\nclass TemplateModel(BaseModel):\n    @staticmethod\n    def modify_commandline_options(parser, is_train=True):\n        """"""Add new model-specific options and rewrite default values for existing options.\n\n        Parameters:\n            parser -- the option parser\n            is_train -- if it is training phase or test phase. You can use this flag to add training-specific or test-specific options.\n\n        Returns:\n            the modified parser.\n        """"""\n        parser.set_defaults(dataset_mode=\'aligned\')  # You can rewrite default values for this model. For example, this model usually uses aligned dataset as its dataset.\n        if is_train:\n            parser.add_argument(\'--lambda_regression\', type=float, default=1.0, help=\'weight for the regression loss\')  # You can define new arguments for this model.\n\n        return parser\n\n    def __init__(self, opt):\n        """"""Initialize this model class.\n\n        Parameters:\n            opt -- training/test options\n\n        A few things can be done here.\n        - (required) call the initialization function of BaseModel\n        - define loss function, visualization images, model names, and optimizers\n        """"""\n        BaseModel.__init__(self, opt)  # call the initialization method of BaseModel\n        # specify the training losses you want to print out. The program will call base_model.get_current_losses to plot the losses to the console and save them to the disk.\n        self.loss_names = [\'loss_G\']\n        # specify the images you want to save and display. The program will call base_model.get_current_visuals to save and display these images.\n        self.visual_names = [\'data_A\', \'data_B\', \'output\']\n        # specify the models you want to save to the disk. The program will call base_model.save_networks and base_model.load_networks to save and load networks.\n        # you can use opt.isTrain to specify different behaviors for training and test. For example, some networks will not be used during test, and you don\'t need to load them.\n        self.model_names = [\'G\']\n        # define networks; you can use opt.isTrain to specify different behaviors for training and test.\n        self.netG = networks.define_G(opt.input_nc, opt.output_nc, opt.ngf, opt.netG, gpu_ids=self.gpu_ids)\n        if self.isTrain:  # only defined during training time\n            # define your loss functions. You can use losses provided by torch.nn such as torch.nn.L1Loss.\n            # We also provide a GANLoss class ""networks.GANLoss"". self.criterionGAN = networks.GANLoss().to(self.device)\n            self.criterionLoss = torch.nn.L1Loss()\n            # define and initialize optimizers. You can define one optimizer for each network.\n            # If two networks are updated at the same time, you can use itertools.chain to group them. See cycle_gan_model.py for an example.\n            self.optimizer = torch.optim.Adam(self.netG.parameters(), lr=opt.lr, betas=(opt.beta1, 0.999))\n            self.optimizers = [self.optimizer]\n\n        # Our program will automatically call <model.setup> to define schedulers, load networks, and print networks\n\n    def set_input(self, input):\n        """"""Unpack input data from the dataloader and perform necessary pre-processing steps.\n\n        Parameters:\n            input: a dictionary that contains the data itself and its metadata information.\n        """"""\n        AtoB = self.opt.direction == \'AtoB\'  # use <direction> to swap data_A and data_B\n        self.data_A = input[\'A\' if AtoB else \'B\'].to(self.device)  # get image data A\n        self.data_B = input[\'B\' if AtoB else \'A\'].to(self.device)  # get image data B\n        self.image_paths = input[\'A_paths\' if AtoB else \'B_paths\']  # get image paths\n\n    def forward(self):\n        """"""Run forward pass. This will be called by both functions <optimize_parameters> and <test>.""""""\n        self.output = self.netG(self.data_A)  # generate output image given the input data_A\n\n    def backward(self):\n        """"""Calculate losses, gradients, and update network weights; called in every training iteration""""""\n        # caculate the intermediate results if necessary; here self.output has been computed during function <forward>\n        # calculate loss given the input and intermediate results\n        self.loss_G = self.criterionLoss(self.output, self.data_B) * self.opt.lambda_regression\n        self.loss_G.backward()       # calculate gradients of network G w.r.t. loss_G\n\n    def optimize_parameters(self):\n        """"""Update network weights; it will be called in every training iteration.""""""\n        self.forward()               # first call forward to calculate intermediate results\n        self.optimizer.zero_grad()   # clear network G\'s existing gradients\n        self.backward()              # calculate gradients for network G\n        self.optimizer.step()        # update gradients for network G\n'"
models/test_model.py,0,"b'from .base_model import BaseModel\nfrom . import networks\n\n\nclass TestModel(BaseModel):\n    """""" This TesteModel can be used to generate CycleGAN results for only one direction.\n    This model will automatically set \'--dataset_mode single\', which only loads the images from one collection.\n\n    See the test instruction for more details.\n    """"""\n    @staticmethod\n    def modify_commandline_options(parser, is_train=True):\n        """"""Add new dataset-specific options, and rewrite default values for existing options.\n\n        Parameters:\n            parser          -- original option parser\n            is_train (bool) -- whether training phase or test phase. You can use this flag to add training-specific or test-specific options.\n\n        Returns:\n            the modified parser.\n\n        The model can only be used during test time. It requires \'--dataset_mode single\'.\n        You need to specify the network using the option \'--model_suffix\'.\n        """"""\n        assert not is_train, \'TestModel cannot be used during training time\'\n        parser.set_defaults(dataset_mode=\'single\')\n        parser.add_argument(\'--model_suffix\', type=str, default=\'\', help=\'In checkpoints_dir, [epoch]_net_G[model_suffix].pth will be loaded as the generator.\')\n\n        return parser\n\n    def __init__(self, opt):\n        """"""Initialize the pix2pix class.\n\n        Parameters:\n            opt (Option class)-- stores all the experiment flags; needs to be a subclass of BaseOptions\n        """"""\n        assert(not opt.isTrain)\n        BaseModel.__init__(self, opt)\n        # specify the training losses you want to print out. The training/test scripts  will call <BaseModel.get_current_losses>\n        self.loss_names = []\n        # specify the images you want to save/display. The training/test scripts  will call <BaseModel.get_current_visuals>\n        self.visual_names = [\'real\', \'fake\']\n        # specify the models you want to save to the disk. The training/test scripts will call <BaseModel.save_networks> and <BaseModel.load_networks>\n        self.model_names = [\'G\' + opt.model_suffix]  # only generator is needed.\n        self.netG = networks.define_G(opt.input_nc, opt.output_nc, opt.ngf, opt.netG,\n                                      opt.norm, not opt.no_dropout, opt.init_type, opt.init_gain, self.gpu_ids)\n\n        # assigns the model to self.netG_[suffix] so that it can be loaded\n        # please see <BaseModel.load_networks>\n        setattr(self, \'netG\' + opt.model_suffix, self.netG)  # store netG in self.\n\n    def set_input(self, input):\n        """"""Unpack input data from the dataloader and perform necessary pre-processing steps.\n\n        Parameters:\n            input: a dictionary that contains the data itself and its metadata information.\n\n        We need to use \'single_dataset\' dataset mode. It only load images from one domain.\n        """"""\n        self.real = input[\'A\'].to(self.device)\n        self.image_paths = input[\'A_paths\']\n\n    def forward(self):\n        """"""Run forward pass.""""""\n        self.fake = self.netG(self.real)  # G(real)\n\n    def optimize_parameters(self):\n        """"""No optimization for test model.""""""\n        pass\n'"
options/__init__.py,0,"b'""""""This package options includes option modules: training options, test options, and basic options (used in both training and test).""""""\n'"
options/base_options.py,1,"b'import argparse\nimport os\nfrom util import util\nimport torch\nimport models\nimport data\n\n\nclass BaseOptions():\n    """"""This class defines options used during both training and test time.\n\n    It also implements several helper functions such as parsing, printing, and saving the options.\n    It also gathers additional options defined in <modify_commandline_options> functions in both dataset class and model class.\n    """"""\n\n    def __init__(self):\n        """"""Reset the class; indicates the class hasn\'t been initailized""""""\n        self.initialized = False\n\n    def initialize(self, parser):\n        """"""Define the common options that are used in both training and test.""""""\n        # basic parameters\n        parser.add_argument(\'--dataroot\', required=True, help=\'path to images (should have subfolders trainA, trainB, valA, valB, etc)\')\n        parser.add_argument(\'--name\', type=str, default=\'experiment_name\', help=\'name of the experiment. It decides where to store samples and models\')\n        parser.add_argument(\'--gpu_ids\', type=str, default=\'0\', help=\'gpu ids: e.g. 0  0,1,2, 0,2. use -1 for CPU\')\n        parser.add_argument(\'--checkpoints_dir\', type=str, default=\'./checkpoints\', help=\'models are saved here\')\n        # model parameters\n        parser.add_argument(\'--model\', type=str, default=\'cycle_gan\', help=\'chooses which model to use. [cycle_gan | pix2pix | test | colorization]\')\n        parser.add_argument(\'--input_nc\', type=int, default=3, help=\'# of input image channels: 3 for RGB and 1 for grayscale\')\n        parser.add_argument(\'--output_nc\', type=int, default=3, help=\'# of output image channels: 3 for RGB and 1 for grayscale\')\n        parser.add_argument(\'--ngf\', type=int, default=64, help=\'# of gen filters in the last conv layer\')\n        parser.add_argument(\'--ndf\', type=int, default=64, help=\'# of discrim filters in the first conv layer\')\n        parser.add_argument(\'--netD\', type=str, default=\'basic\', help=\'specify discriminator architecture [basic | n_layers | pixel]. The basic model is a 70x70 PatchGAN. n_layers allows you to specify the layers in the discriminator\')\n        parser.add_argument(\'--netG\', type=str, default=\'resnet_9blocks\', help=\'specify generator architecture [resnet_9blocks | resnet_6blocks | unet_256 | unet_128]\')\n        parser.add_argument(\'--n_layers_D\', type=int, default=3, help=\'only used if netD==n_layers\')\n        parser.add_argument(\'--norm\', type=str, default=\'instance\', help=\'instance normalization or batch normalization [instance | batch | none]\')\n        parser.add_argument(\'--init_type\', type=str, default=\'normal\', help=\'network initialization [normal | xavier | kaiming | orthogonal]\')\n        parser.add_argument(\'--init_gain\', type=float, default=0.02, help=\'scaling factor for normal, xavier and orthogonal.\')\n        parser.add_argument(\'--no_dropout\', action=\'store_true\', help=\'no dropout for the generator\')\n        # dataset parameters\n        parser.add_argument(\'--dataset_mode\', type=str, default=\'unaligned\', help=\'chooses how datasets are loaded. [unaligned | aligned | single | colorization]\')\n        parser.add_argument(\'--direction\', type=str, default=\'AtoB\', help=\'AtoB or BtoA\')\n        parser.add_argument(\'--serial_batches\', action=\'store_true\', help=\'if true, takes images in order to make batches, otherwise takes them randomly\')\n        parser.add_argument(\'--num_threads\', default=4, type=int, help=\'# threads for loading data\')\n        parser.add_argument(\'--batch_size\', type=int, default=1, help=\'input batch size\')\n        parser.add_argument(\'--load_size\', type=int, default=286, help=\'scale images to this size\')\n        parser.add_argument(\'--crop_size\', type=int, default=256, help=\'then crop to this size\')\n        parser.add_argument(\'--max_dataset_size\', type=int, default=float(""inf""), help=\'Maximum number of samples allowed per dataset. If the dataset directory contains more than max_dataset_size, only a subset is loaded.\')\n        parser.add_argument(\'--preprocess\', type=str, default=\'resize_and_crop\', help=\'scaling and cropping of images at load time [resize_and_crop | crop | scale_width | scale_width_and_crop | none]\')\n        parser.add_argument(\'--no_flip\', action=\'store_true\', help=\'if specified, do not flip the images for data augmentation\')\n        parser.add_argument(\'--display_winsize\', type=int, default=256, help=\'display window size for both visdom and HTML\')\n        # additional parameters\n        parser.add_argument(\'--epoch\', type=str, default=\'latest\', help=\'which epoch to load? set to latest to use latest cached model\')\n        parser.add_argument(\'--load_iter\', type=int, default=\'0\', help=\'which iteration to load? if load_iter > 0, the code will load models by iter_[load_iter]; otherwise, the code will load models by [epoch]\')\n        parser.add_argument(\'--verbose\', action=\'store_true\', help=\'if specified, print more debugging information\')\n        parser.add_argument(\'--suffix\', default=\'\', type=str, help=\'customized suffix: opt.name = opt.name + suffix: e.g., {model}_{netG}_size{load_size}\')\n        self.initialized = True\n        return parser\n\n    def gather_options(self):\n        """"""Initialize our parser with basic options(only once).\n        Add additional model-specific and dataset-specific options.\n        These options are defined in the <modify_commandline_options> function\n        in model and dataset classes.\n        """"""\n        if not self.initialized:  # check if it has been initialized\n            parser = argparse.ArgumentParser(formatter_class=argparse.ArgumentDefaultsHelpFormatter)\n            parser = self.initialize(parser)\n\n        # get the basic options\n        opt, _ = parser.parse_known_args()\n\n        # modify model-related parser options\n        model_name = opt.model\n        model_option_setter = models.get_option_setter(model_name)\n        parser = model_option_setter(parser, self.isTrain)\n        opt, _ = parser.parse_known_args()  # parse again with new defaults\n\n        # modify dataset-related parser options\n        dataset_name = opt.dataset_mode\n        dataset_option_setter = data.get_option_setter(dataset_name)\n        parser = dataset_option_setter(parser, self.isTrain)\n\n        # save and return the parser\n        self.parser = parser\n        return parser.parse_args()\n\n    def print_options(self, opt):\n        """"""Print and save options\n\n        It will print both current options and default values(if different).\n        It will save options into a text file / [checkpoints_dir] / opt.txt\n        """"""\n        message = \'\'\n        message += \'----------------- Options ---------------\\n\'\n        for k, v in sorted(vars(opt).items()):\n            comment = \'\'\n            default = self.parser.get_default(k)\n            if v != default:\n                comment = \'\\t[default: %s]\' % str(default)\n            message += \'{:>25}: {:<30}{}\\n\'.format(str(k), str(v), comment)\n        message += \'----------------- End -------------------\'\n        print(message)\n\n        # save to the disk\n        expr_dir = os.path.join(opt.checkpoints_dir, opt.name)\n        util.mkdirs(expr_dir)\n        file_name = os.path.join(expr_dir, \'{}_opt.txt\'.format(opt.phase))\n        with open(file_name, \'wt\') as opt_file:\n            opt_file.write(message)\n            opt_file.write(\'\\n\')\n\n    def parse(self):\n        """"""Parse our options, create checkpoints directory suffix, and set up gpu device.""""""\n        opt = self.gather_options()\n        opt.isTrain = self.isTrain   # train or test\n\n        # process opt.suffix\n        if opt.suffix:\n            suffix = (\'_\' + opt.suffix.format(**vars(opt))) if opt.suffix != \'\' else \'\'\n            opt.name = opt.name + suffix\n\n        self.print_options(opt)\n\n        # set gpu ids\n        str_ids = opt.gpu_ids.split(\',\')\n        opt.gpu_ids = []\n        for str_id in str_ids:\n            id = int(str_id)\n            if id >= 0:\n                opt.gpu_ids.append(id)\n        if len(opt.gpu_ids) > 0:\n            torch.cuda.set_device(opt.gpu_ids[0])\n\n        self.opt = opt\n        return self.opt\n'"
