file_path,api_count,code
test.py,0,"b'""""""General-purpose test script for image-to-image translation.\n\nOnce you have trained your model with train.py, you can use this script to test the model.\nIt will load a saved model from \'--checkpoints_dir\' and save the results to \'--results_dir\'.\n\nIt first creates model and dataset given the option. It will hard-code some parameters.\nIt then runs inference for \'--num_test\' images and save results to an HTML file.\n\nExample (You need to train models first or download pre-trained models from our website):\n    Test a CycleGAN model (both sides):\n        python test.py --dataroot ./datasets/maps --name maps_cyclegan --model cycle_gan\n\n    Test a CycleGAN model (one side only):\n        python test.py --dataroot datasets/horse2zebra/testA --name horse2zebra_pretrained --model test --no_dropout\n\n    The option \'--model test\' is used for generating CycleGAN results only for one side.\n    This option will automatically set \'--dataset_mode single\', which only loads the images from one set.\n    On the contrary, using \'--model cycle_gan\' requires loading and generating results in both directions,\n    which is sometimes unnecessary. The results will be saved at ./results/.\n    Use \'--results_dir <directory_path_to_save_result>\' to specify the results directory.\n\n    Test a pix2pix model:\n        python test.py --dataroot ./datasets/facades --name facades_pix2pix --model pix2pix --direction BtoA\n\nSee options/base_options.py and options/test_options.py for more test options.\nSee training and test tips at: https://github.com/junyanz/pytorch-CycleGAN-and-pix2pix/blob/master/docs/tips.md\nSee frequently asked questions at: https://github.com/junyanz/pytorch-CycleGAN-and-pix2pix/blob/master/docs/qa.md\n""""""\nimport os\nfrom options.test_options import TestOptions\nfrom data import create_dataset\nfrom models import create_model\nfrom util.visualizer import save_images\nfrom util import html\n\n\nif __name__ == \'__main__\':\n    opt = TestOptions().parse()  # get test options\n    # hard-code some parameters for test\n    opt.num_threads = 0   # test code only supports num_threads = 1\n    opt.batch_size = 1    # test code only supports batch_size = 1\n    opt.serial_batches = True  # disable data shuffling; comment this line if results on randomly chosen images are needed.\n    opt.no_flip = True    # no flip; comment this line if results on flipped images are needed.\n    opt.display_id = -1   # no visdom display; the test code saves the results to a HTML file.\n    dataset = create_dataset(opt)  # create a dataset given opt.dataset_mode and other options\n    model = create_model(opt)      # create a model given opt.model and other options\n    model.setup(opt)               # regular setup: load and print networks; create schedulers\n    # create a website\n    web_dir = os.path.join(opt.results_dir, opt.name, \'{}_{}\'.format(opt.phase, opt.epoch))  # define the website directory\n    if opt.load_iter > 0:  # load_iter is 0 by default\n        web_dir = \'{:s}_iter{:d}\'.format(web_dir, opt.load_iter)\n    print(\'creating web directory\', web_dir)\n    webpage = html.HTML(web_dir, \'Experiment = %s, Phase = %s, Epoch = %s\' % (opt.name, opt.phase, opt.epoch))\n    # test with eval mode. This only affects layers like batchnorm and dropout.\n    # For [pix2pix]: we use batchnorm and dropout in the original pix2pix. You can experiment it with and without eval() mode.\n    # For [CycleGAN]: It should not affect CycleGAN as CycleGAN uses instancenorm without dropout.\n    if opt.eval:\n        model.eval()\n    for i, data in enumerate(dataset):\n        if i >= opt.num_test:  # only apply our model to opt.num_test images.\n            break\n        model.set_input(data)  # unpack data from data loader\n        model.test()           # run inference\n        visuals = model.get_current_visuals()  # get image results\n        img_path = model.get_image_paths()     # get image paths\n        if i % 5 == 0:  # save images to an HTML file\n            print(\'processing (%04d)-th image... %s\' % (i, img_path))\n        save_images(webpage, visuals, img_path, aspect_ratio=opt.aspect_ratio, width=opt.display_winsize)\n    webpage.save()  # save the HTML\n'"
train.py,0,"b'""""""General-purpose training script for image-to-image translation.\n\nThis script works for various models (with option \'--model\': e.g., pix2pix, cyclegan, colorization) and\ndifferent datasets (with option \'--dataset_mode\': e.g., aligned, unaligned, single, colorization).\nYou need to specify the dataset (\'--dataroot\'), experiment name (\'--name\'), and model (\'--model\').\n\nIt first creates model, dataset, and visualizer given the option.\nIt then does standard network training. During the training, it also visualize/save the images, print/save the loss plot, and save models.\nThe script supports continue/resume training. Use \'--continue_train\' to resume your previous training.\n\nExample:\n    Train a CycleGAN model:\n        python train.py --dataroot ./datasets/maps --name maps_cyclegan --model cycle_gan\n    Train a pix2pix model:\n        python train.py --dataroot ./datasets/facades --name facades_pix2pix --model pix2pix --direction BtoA\n\nSee options/base_options.py and options/train_options.py for more training options.\nSee training and test tips at: https://github.com/junyanz/pytorch-CycleGAN-and-pix2pix/blob/master/docs/tips.md\nSee frequently asked questions at: https://github.com/junyanz/pytorch-CycleGAN-and-pix2pix/blob/master/docs/qa.md\n""""""\nimport time\nfrom options.train_options import TrainOptions\nfrom data import create_dataset\nfrom models import create_model\nfrom util.visualizer import Visualizer\n\nif __name__ == \'__main__\':\n    opt = TrainOptions().parse()   # get training options\n    dataset = create_dataset(opt)  # create a dataset given opt.dataset_mode and other options\n    dataset_size = len(dataset)    # get the number of images in the dataset.\n    print(\'The number of training images = %d\' % dataset_size)\n\n    model = create_model(opt)      # create a model given opt.model and other options\n    model.setup(opt)               # regular setup: load and print networks; create schedulers\n    visualizer = Visualizer(opt)   # create a visualizer that display/save images and plots\n    total_iters = 0                # the total number of training iterations\n\n    for epoch in range(opt.epoch_count, opt.n_epochs + opt.n_epochs_decay + 1):    # outer loop for different epochs; we save the model by <epoch_count>, <epoch_count>+<save_latest_freq>\n        epoch_start_time = time.time()  # timer for entire epoch\n        iter_data_time = time.time()    # timer for data loading per iteration\n        epoch_iter = 0                  # the number of training iterations in current epoch, reset to 0 every epoch\n        visualizer.reset()              # reset the visualizer: make sure it saves the results to HTML at least once every epoch\n\n        for i, data in enumerate(dataset):  # inner loop within one epoch\n            iter_start_time = time.time()  # timer for computation per iteration\n            if total_iters % opt.print_freq == 0:\n                t_data = iter_start_time - iter_data_time\n\n            total_iters += opt.batch_size\n            epoch_iter += opt.batch_size\n            model.set_input(data)         # unpack data from dataset and apply preprocessing\n            model.optimize_parameters()   # calculate loss functions, get gradients, update network weights\n\n            if total_iters % opt.display_freq == 0:   # display images on visdom and save images to a HTML file\n                save_result = total_iters % opt.update_html_freq == 0\n                model.compute_visuals()\n                visualizer.display_current_results(model.get_current_visuals(), epoch, save_result)\n\n            if total_iters % opt.print_freq == 0:    # print training losses and save logging information to the disk\n                losses = model.get_current_losses()\n                t_comp = (time.time() - iter_start_time) / opt.batch_size\n                visualizer.print_current_losses(epoch, epoch_iter, losses, t_comp, t_data)\n                if opt.display_id > 0:\n                    visualizer.plot_current_losses(epoch, float(epoch_iter) / dataset_size, losses)\n\n            if total_iters % opt.save_latest_freq == 0:   # cache our latest model every <save_latest_freq> iterations\n                print(\'saving the latest model (epoch %d, total_iters %d)\' % (epoch, total_iters))\n                save_suffix = \'iter_%d\' % total_iters if opt.save_by_iter else \'latest\'\n                model.save_networks(save_suffix)\n\n            iter_data_time = time.time()\n        if epoch % opt.save_epoch_freq == 0:              # cache our model every <save_epoch_freq> epochs\n            print(\'saving the model at the end of epoch %d, iters %d\' % (epoch, total_iters))\n            model.save_networks(\'latest\')\n            model.save_networks(epoch)\n\n        print(\'End of epoch %d / %d \\t Time Taken: %d sec\' % (epoch, opt.n_epochs + opt.n_epochs_decay, time.time() - epoch_start_time))\n        model.update_learning_rate()                     # update learning rates at the end of every epoch.\n'"
data/__init__.py,2,"b'""""""This package includes all the modules related to data loading and preprocessing\n\n To add a custom dataset class called \'dummy\', you need to add a file called \'dummy_dataset.py\' and define a subclass \'DummyDataset\' inherited from BaseDataset.\n You need to implement four functions:\n    -- <__init__>:                      initialize the class, first call BaseDataset.__init__(self, opt).\n    -- <__len__>:                       return the size of dataset.\n    -- <__getitem__>:                   get a data point from data loader.\n    -- <modify_commandline_options>:    (optionally) add dataset-specific options and set default options.\n\nNow you can use the dataset class by specifying flag \'--dataset_mode dummy\'.\nSee our template dataset class \'template_dataset.py\' for more details.\n""""""\nimport importlib\nimport torch.utils.data\nfrom data.base_dataset import BaseDataset\n\n\ndef find_dataset_using_name(dataset_name):\n    """"""Import the module ""data/[dataset_name]_dataset.py"".\n\n    In the file, the class called DatasetNameDataset() will\n    be instantiated. It has to be a subclass of BaseDataset,\n    and it is case-insensitive.\n    """"""\n    dataset_filename = ""data."" + dataset_name + ""_dataset""\n    datasetlib = importlib.import_module(dataset_filename)\n\n    dataset = None\n    target_dataset_name = dataset_name.replace(\'_\', \'\') + \'dataset\'\n    for name, cls in datasetlib.__dict__.items():\n        if name.lower() == target_dataset_name.lower() \\\n           and issubclass(cls, BaseDataset):\n            dataset = cls\n\n    if dataset is None:\n        raise NotImplementedError(""In %s.py, there should be a subclass of BaseDataset with class name that matches %s in lowercase."" % (dataset_filename, target_dataset_name))\n\n    return dataset\n\n\ndef get_option_setter(dataset_name):\n    """"""Return the static method <modify_commandline_options> of the dataset class.""""""\n    dataset_class = find_dataset_using_name(dataset_name)\n    return dataset_class.modify_commandline_options\n\n\ndef create_dataset(opt):\n    """"""Create a dataset given the option.\n\n    This function wraps the class CustomDatasetDataLoader.\n        This is the main interface between this package and \'train.py\'/\'test.py\'\n\n    Example:\n        >>> from data import create_dataset\n        >>> dataset = create_dataset(opt)\n    """"""\n    data_loader = CustomDatasetDataLoader(opt)\n    dataset = data_loader.load_data()\n    return dataset\n\n\nclass CustomDatasetDataLoader():\n    """"""Wrapper class of Dataset class that performs multi-threaded data loading""""""\n\n    def __init__(self, opt):\n        """"""Initialize this class\n\n        Step 1: create a dataset instance given the name [dataset_mode]\n        Step 2: create a multi-threaded data loader.\n        """"""\n        self.opt = opt\n        dataset_class = find_dataset_using_name(opt.dataset_mode)\n        self.dataset = dataset_class(opt)\n        print(""dataset [%s] was created"" % type(self.dataset).__name__)\n        self.dataloader = torch.utils.data.DataLoader(\n            self.dataset,\n            batch_size=opt.batch_size,\n            shuffle=not opt.serial_batches,\n            num_workers=int(opt.num_threads))\n\n    def load_data(self):\n        return self\n\n    def __len__(self):\n        """"""Return the number of data in the dataset""""""\n        return min(len(self.dataset), self.opt.max_dataset_size)\n\n    def __iter__(self):\n        """"""Return a batch of data""""""\n        for i, data in enumerate(self.dataloader):\n            if i * self.opt.batch_size >= self.opt.max_dataset_size:\n                break\n            yield data\n'"
data/aligned_dataset.py,0,"b'import os.path\nfrom data.base_dataset import BaseDataset, get_params, get_transform\nfrom data.image_folder import make_dataset\nfrom PIL import Image\n\n\nclass AlignedDataset(BaseDataset):\n    """"""A dataset class for paired image dataset.\n\n    It assumes that the directory \'/path/to/data/train\' contains image pairs in the form of {A,B}.\n    During test time, you need to prepare a directory \'/path/to/data/test\'.\n    """"""\n\n    def __init__(self, opt):\n        """"""Initialize this dataset class.\n\n        Parameters:\n            opt (Option class) -- stores all the experiment flags; needs to be a subclass of BaseOptions\n        """"""\n        BaseDataset.__init__(self, opt)\n        self.dir_AB = os.path.join(opt.dataroot, opt.phase)  # get the image directory\n        self.AB_paths = sorted(make_dataset(self.dir_AB, opt.max_dataset_size))  # get image paths\n        assert(self.opt.load_size >= self.opt.crop_size)   # crop_size should be smaller than the size of loaded image\n        self.input_nc = self.opt.output_nc if self.opt.direction == \'BtoA\' else self.opt.input_nc\n        self.output_nc = self.opt.input_nc if self.opt.direction == \'BtoA\' else self.opt.output_nc\n\n    def __getitem__(self, index):\n        """"""Return a data point and its metadata information.\n\n        Parameters:\n            index - - a random integer for data indexing\n\n        Returns a dictionary that contains A, B, A_paths and B_paths\n            A (tensor) - - an image in the input domain\n            B (tensor) - - its corresponding image in the target domain\n            A_paths (str) - - image paths\n            B_paths (str) - - image paths (same as A_paths)\n        """"""\n        # read a image given a random integer index\n        AB_path = self.AB_paths[index]\n        AB = Image.open(AB_path).convert(\'RGB\')\n        # split AB image into A and B\n        w, h = AB.size\n        w2 = int(w / 2)\n        A = AB.crop((0, 0, w2, h))\n        B = AB.crop((w2, 0, w, h))\n\n        # apply the same transform to both A and B\n        transform_params = get_params(self.opt, A.size)\n        A_transform = get_transform(self.opt, transform_params, grayscale=(self.input_nc == 1))\n        B_transform = get_transform(self.opt, transform_params, grayscale=(self.output_nc == 1))\n\n        A = A_transform(A)\n        B = B_transform(B)\n\n        return {\'A\': A, \'B\': B, \'A_paths\': AB_path, \'B_paths\': AB_path}\n\n    def __len__(self):\n        """"""Return the total number of images in the dataset.""""""\n        return len(self.AB_paths)\n'"
data/base_dataset.py,1,"b'""""""This module implements an abstract base class (ABC) \'BaseDataset\' for datasets.\n\nIt also includes common transformation functions (e.g., get_transform, __scale_width), which can be later used in subclasses.\n""""""\nimport random\nimport numpy as np\nimport torch.utils.data as data\nfrom PIL import Image\nimport torchvision.transforms as transforms\nfrom abc import ABC, abstractmethod\n\n\nclass BaseDataset(data.Dataset, ABC):\n    """"""This class is an abstract base class (ABC) for datasets.\n\n    To create a subclass, you need to implement the following four functions:\n    -- <__init__>:                      initialize the class, first call BaseDataset.__init__(self, opt).\n    -- <__len__>:                       return the size of dataset.\n    -- <__getitem__>:                   get a data point.\n    -- <modify_commandline_options>:    (optionally) add dataset-specific options and set default options.\n    """"""\n\n    def __init__(self, opt):\n        """"""Initialize the class; save the options in the class\n\n        Parameters:\n            opt (Option class)-- stores all the experiment flags; needs to be a subclass of BaseOptions\n        """"""\n        self.opt = opt\n        self.root = opt.dataroot\n\n    @staticmethod\n    def modify_commandline_options(parser, is_train):\n        """"""Add new dataset-specific options, and rewrite default values for existing options.\n\n        Parameters:\n            parser          -- original option parser\n            is_train (bool) -- whether training phase or test phase. You can use this flag to add training-specific or test-specific options.\n\n        Returns:\n            the modified parser.\n        """"""\n        return parser\n\n    @abstractmethod\n    def __len__(self):\n        """"""Return the total number of images in the dataset.""""""\n        return 0\n\n    @abstractmethod\n    def __getitem__(self, index):\n        """"""Return a data point and its metadata information.\n\n        Parameters:\n            index - - a random integer for data indexing\n\n        Returns:\n            a dictionary of data with their names. It ususally contains the data itself and its metadata information.\n        """"""\n        pass\n\n\ndef get_params(opt, size):\n    w, h = size\n    new_h = h\n    new_w = w\n    if opt.preprocess == \'resize_and_crop\':\n        new_h = new_w = opt.load_size\n    elif opt.preprocess == \'scale_width_and_crop\':\n        new_w = opt.load_size\n        new_h = opt.load_size * h // w\n\n    x = random.randint(0, np.maximum(0, new_w - opt.crop_size))\n    y = random.randint(0, np.maximum(0, new_h - opt.crop_size))\n\n    flip = random.random() > 0.5\n\n    return {\'crop_pos\': (x, y), \'flip\': flip}\n\n\ndef get_transform(opt, params=None, grayscale=False, method=Image.BICUBIC, convert=True):\n    transform_list = []\n    if grayscale:\n        transform_list.append(transforms.Grayscale(1))\n    if \'resize\' in opt.preprocess:\n        osize = [opt.load_size, opt.load_size]\n        transform_list.append(transforms.Resize(osize, method))\n    elif \'scale_width\' in opt.preprocess:\n        transform_list.append(transforms.Lambda(lambda img: __scale_width(img, opt.load_size, opt.crop_size, method)))\n\n    if \'crop\' in opt.preprocess:\n        if params is None:\n            transform_list.append(transforms.RandomCrop(opt.crop_size))\n        else:\n            transform_list.append(transforms.Lambda(lambda img: __crop(img, params[\'crop_pos\'], opt.crop_size)))\n\n    if opt.preprocess == \'none\':\n        transform_list.append(transforms.Lambda(lambda img: __make_power_2(img, base=4, method=method)))\n\n    if not opt.no_flip:\n        if params is None:\n            transform_list.append(transforms.RandomHorizontalFlip())\n        elif params[\'flip\']:\n            transform_list.append(transforms.Lambda(lambda img: __flip(img, params[\'flip\'])))\n\n    if convert:\n        transform_list += [transforms.ToTensor()]\n        if grayscale:\n            transform_list += [transforms.Normalize((0.5,), (0.5,))]\n        else:\n            transform_list += [transforms.Normalize((0.5, 0.5, 0.5), (0.5, 0.5, 0.5))]\n    return transforms.Compose(transform_list)\n\n\ndef __make_power_2(img, base, method=Image.BICUBIC):\n    ow, oh = img.size\n    h = int(round(oh / base) * base)\n    w = int(round(ow / base) * base)\n    if h == oh and w == ow:\n        return img\n\n    __print_size_warning(ow, oh, w, h)\n    return img.resize((w, h), method)\n\n\ndef __scale_width(img, target_size, crop_size, method=Image.BICUBIC):\n    ow, oh = img.size\n    if ow == target_size and oh >= crop_size:\n        return img\n    w = target_size\n    h = int(max(target_size * oh / ow, crop_size))\n    return img.resize((w, h), method)\n\n\ndef __crop(img, pos, size):\n    ow, oh = img.size\n    x1, y1 = pos\n    tw = th = size\n    if (ow > tw or oh > th):\n        return img.crop((x1, y1, x1 + tw, y1 + th))\n    return img\n\n\ndef __flip(img, flip):\n    if flip:\n        return img.transpose(Image.FLIP_LEFT_RIGHT)\n    return img\n\n\ndef __print_size_warning(ow, oh, w, h):\n    """"""Print warning information about image size(only print once)""""""\n    if not hasattr(__print_size_warning, \'has_printed\'):\n        print(""The image size needs to be a multiple of 4. ""\n              ""The loaded image size was (%d, %d), so it was adjusted to ""\n              ""(%d, %d). This adjustment will be done to all images ""\n              ""whose sizes are not multiples of 4"" % (ow, oh, w, h))\n        __print_size_warning.has_printed = True\n'"
data/colorization_dataset.py,0,"b'import os.path\nfrom data.base_dataset import BaseDataset, get_transform\nfrom data.image_folder import make_dataset\nfrom skimage import color  # require skimage\nfrom PIL import Image\nimport numpy as np\nimport torchvision.transforms as transforms\n\n\nclass ColorizationDataset(BaseDataset):\n    """"""This dataset class can load a set of natural images in RGB, and convert RGB format into (L, ab) pairs in Lab color space.\n\n    This dataset is required by pix2pix-based colorization model (\'--model colorization\')\n    """"""\n    @staticmethod\n    def modify_commandline_options(parser, is_train):\n        """"""Add new dataset-specific options, and rewrite default values for existing options.\n\n        Parameters:\n            parser          -- original option parser\n            is_train (bool) -- whether training phase or test phase. You can use this flag to add training-specific or test-specific options.\n\n        Returns:\n            the modified parser.\n\n        By default, the number of channels for input image  is 1 (L) and\n        the number of channels for output image is 2 (ab). The direction is from A to B\n        """"""\n        parser.set_defaults(input_nc=1, output_nc=2, direction=\'AtoB\')\n        return parser\n\n    def __init__(self, opt):\n        """"""Initialize this dataset class.\n\n        Parameters:\n            opt (Option class) -- stores all the experiment flags; needs to be a subclass of BaseOptions\n        """"""\n        BaseDataset.__init__(self, opt)\n        self.dir = os.path.join(opt.dataroot, opt.phase)\n        self.AB_paths = sorted(make_dataset(self.dir, opt.max_dataset_size))\n        assert(opt.input_nc == 1 and opt.output_nc == 2 and opt.direction == \'AtoB\')\n        self.transform = get_transform(self.opt, convert=False)\n\n    def __getitem__(self, index):\n        """"""Return a data point and its metadata information.\n\n        Parameters:\n            index - - a random integer for data indexing\n\n        Returns a dictionary that contains A, B, A_paths and B_paths\n            A (tensor) - - the L channel of an image\n            B (tensor) - - the ab channels of the same image\n            A_paths (str) - - image paths\n            B_paths (str) - - image paths (same as A_paths)\n        """"""\n        path = self.AB_paths[index]\n        im = Image.open(path).convert(\'RGB\')\n        im = self.transform(im)\n        im = np.array(im)\n        lab = color.rgb2lab(im).astype(np.float32)\n        lab_t = transforms.ToTensor()(lab)\n        A = lab_t[[0], ...] / 50.0 - 1.0\n        B = lab_t[[1, 2], ...] / 110.0\n        return {\'A\': A, \'B\': B, \'A_paths\': path, \'B_paths\': path}\n\n    def __len__(self):\n        """"""Return the total number of images in the dataset.""""""\n        return len(self.AB_paths)\n'"
