file_path,api_count,code
beam_search.py,2,"b'""""""Beam search implementation in PyTorch.""""""\n#\n#\n#         hyp1#-hyp1---hyp1 -hyp1\n#                 \\             /\n#         hyp2 \\-hyp2 /-hyp2#hyp2\n#                               /      \\\n#         hyp3#-hyp3---hyp3 -hyp3\n#         ========================\n#\n# Takes care of beams, back pointers, and scores.\n\n# Code borrowed from PyTorch OpenNMT example\n# https://github.com/pytorch/examples/blob/master/OpenNMT/onmt/Beam.py\n\nimport torch\n\n\nclass Beam(object):\n    """"""Ordered beam of candidate outputs.""""""\n\n    def __init__(self, size, vocab, cuda=False):\n        """"""Initialize params.""""""\n        self.size = size\n        self.done = False\n        self.pad = vocab[\'<pad>\']\n        self.bos = vocab[\'<s>\']\n        self.eos = vocab[\'</s>\']\n        self.tt = torch.cuda if cuda else torch\n\n        # The score for each translation on the beam.\n        self.scores = self.tt.FloatTensor(size).zero_()\n\n        # The backpointers at each time-step.\n        self.prevKs = []\n\n        # The outputs at each time-step.\n        self.nextYs = [self.tt.LongTensor(size).fill_(self.pad)]\n        self.nextYs[0][0] = self.bos\n\n        # The attentions (matrix) for each time.\n        self.attn = []\n\n    # Get the outputs for the current timestep.\n    def get_current_state(self):\n        """"""Get state of beam.""""""\n        return self.nextYs[-1]\n\n    # Get the backpointers for the current timestep.\n    def get_current_origin(self):\n        """"""Get the backpointer to the beam at this step.""""""\n        return self.prevKs[-1]\n\n    #  Given prob over words for every last beam `wordLk` and attention\n    #   `attnOut`: Compute and update the beam search.\n    #\n    # Parameters:\n    #\n    #     * `wordLk`- probs of advancing from the last step (K x words)\n    #     * `attnOut`- attention at the last step\n    #\n    # Returns: True if beam search is complete.\n\n    def advance(self, workd_lk):\n        """"""Advance the beam.""""""\n        num_words = workd_lk.size(1)\n\n        # Sum the previous scores.\n        if len(self.prevKs) > 0:\n            beam_lk = workd_lk + self.scores.unsqueeze(1).expand_as(workd_lk)\n        else:\n            beam_lk = workd_lk[0]\n\n        flat_beam_lk = beam_lk.view(-1)\n\n        bestScores, bestScoresId = flat_beam_lk.topk(self.size, 0, True, True)\n        self.scores = bestScores\n\n        # bestScoresId is flattened beam x word array, so calculate which\n        # word and beam each score came from\n        prev_k = bestScoresId / num_words\n        self.prevKs.append(prev_k)\n        self.nextYs.append(bestScoresId - prev_k * num_words)\n\n        # End condition is when top-of-beam is EOS.\n        if self.nextYs[-1][0] == self.eos:\n            self.done = True\n\n        return self.done\n\n    def sort_best(self):\n        """"""Sort the beam.""""""\n        return torch.sort(self.scores, 0, True)\n\n    # Get the score of the best in the beam.\n    def get_best(self):\n        """"""Get the most likely candidate.""""""\n        scores, ids = self.sort_best()\n        return scores[1], ids[1]\n\n    # Walk back to construct the full hypothesis.\n    #\n    # Parameters.\n    #\n    #     * `k` - the position in the beam to construct.\n    #\n    # Returns.\n    #\n    #     1. The hypothesis\n    #     2. The attention at each time step.\n    def get_hyp(self, k):\n        """"""Get hypotheses.""""""\n        hyp = []\n        # print(len(self.prevKs), len(self.nextYs), len(self.attn))\n        for j in range(len(self.prevKs) - 1, -1, -1):\n            hyp.append(self.nextYs[j + 1][k])\n            k = self.prevKs[j][k]\n\n        return hyp[::-1]\n'"
data_utils.py,7,"b'""""""Data utilities.""""""\nimport torch\nfrom torch.autograd import Variable\nimport operator\nimport json\n\n\ndef hyperparam_string(config):\n    """"""Hyerparam string.""""""\n    exp_name = \'\'\n    exp_name += \'model_%s__\' % (config[\'data\'][\'task\'])\n    exp_name += \'src_%s__\' % (config[\'model\'][\'src_lang\'])\n    exp_name += \'trg_%s__\' % (config[\'model\'][\'trg_lang\'])\n    exp_name += \'attention_%s__\' % (config[\'model\'][\'seq2seq\'])\n    exp_name += \'dim_%s__\' % (config[\'model\'][\'dim\'])\n    exp_name += \'emb_dim_%s__\' % (config[\'model\'][\'dim_word_src\'])\n    exp_name += \'optimizer_%s__\' % (config[\'training\'][\'optimizer\'])\n    exp_name += \'n_layers_src_%d__\' % (config[\'model\'][\'n_layers_src\'])\n    exp_name += \'n_layers_trg_%d__\' % (1)\n    exp_name += \'bidir_%s\' % (config[\'model\'][\'bidirectional\'])\n\n    return exp_name\n\n\ndef read_config(file_path):\n    """"""Read JSON config.""""""\n    json_object = json.load(open(file_path, \'r\'))\n    return json_object\n\n\ndef construct_vocab(lines, vocab_size):\n    """"""Construct a vocabulary from tokenized lines.""""""\n    vocab = {}\n    for line in lines:\n        for word in line:\n            if word not in vocab:\n                vocab[word] = 1\n            else:\n                vocab[word] += 1\n\n    # Discard start, end, pad and unk tokens if already present\n    if \'<s>\' in vocab:\n        del vocab[\'<s>\']\n    if \'<pad>\' in vocab:\n        del vocab[\'<pad>\']\n    if \'</s>\' in vocab:\n        del vocab[\'</s>\']\n    if \'<unk>\' in vocab:\n        del vocab[\'<unk>\']\n\n    word2id = {\n        \'<s>\': 0,\n        \'<pad>\': 1,\n        \'</s>\': 2,\n        \'<unk>\': 3,\n    }\n\n    id2word = {\n        0: \'<s>\',\n        1: \'<pad>\',\n        2: \'</s>\',\n        3: \'<unk>\',\n    }\n\n    sorted_word2id = sorted(\n        vocab.items(),\n        key=operator.itemgetter(1),\n        reverse=True\n    )\n\n    sorted_words = [x[0] for x in sorted_word2id[:vocab_size]]\n\n    for ind, word in enumerate(sorted_words):\n        word2id[word] = ind + 4\n\n    for ind, word in enumerate(sorted_words):\n        id2word[ind + 4] = word\n\n    return word2id, id2word\n\n\ndef read_dialog_summarization_data(src, config, trg):\n    """"""Read data from files.""""""\n    print \'Reading source data ...\'\n    src_lines = []\n    with open(src, \'r\') as f:\n        for ind, line in enumerate(f):\n            src_lines.append(line.strip().split())\n\n    print \'Reading target data ...\'\n    trg_lines = []\n    with open(trg, \'r\') as f:\n        for line in f:\n            trg_lines.append(line.strip().split())\n\n    print \'Constructing common vocabulary ...\'\n    word2id, id2word = construct_vocab(\n        src_lines + trg_lines, config[\'data\'][\'n_words_src\']\n    )\n\n    src = {\'data\': src_lines, \'word2id\': word2id, \'id2word\': id2word}\n    trg = {\'data\': trg_lines, \'word2id\': word2id, \'id2word\': id2word}\n\n    return src, trg\n\n\ndef read_nmt_data(src, config, trg=None):\n    """"""Read data from files.""""""\n    print \'Reading source data ...\'\n    src_lines = []\n    with open(src, \'r\') as f:\n        for ind, line in enumerate(f):\n            src_lines.append(line.strip().split())\n\n    print \'Constructing source vocabulary ...\'\n    src_word2id, src_id2word = construct_vocab(\n        src_lines, config[\'data\'][\'n_words_src\']\n    )\n\n    src = {\'data\': src_lines, \'word2id\': src_word2id, \'id2word\': src_id2word}\n    del src_lines\n\n    if trg is not None:\n        print \'Reading target data ...\'\n        trg_lines = []\n        with open(trg, \'r\') as f:\n            for line in f:\n                trg_lines.append(line.strip().split())\n\n        print \'Constructing target vocabulary ...\'\n        trg_word2id, trg_id2word = construct_vocab(\n            trg_lines, config[\'data\'][\'n_words_trg\']\n        )\n\n        trg = {\'data\': trg_lines, \'word2id\': trg_word2id, \'id2word\': trg_id2word}\n    else:\n        trg = None\n\n    return src, trg\n\n\ndef read_summarization_data(src, trg):\n    """"""Read data from files.""""""\n    src_lines = [line.strip().split() for line in open(src, \'r\')]\n    trg_lines = [line.strip().split() for line in open(trg, \'r\')]\n    word2id, id2word = construct_vocab(src_lines + trg_lines, 30000)\n    src = {\'data\': src_lines, \'word2id\': word2id, \'id2word\': id2word}\n    trg = {\'data\': trg_lines, \'word2id\': word2id, \'id2word\': id2word}\n\n    return src, trg\n\n\ndef get_minibatch(\n    lines, word2ind, index, batch_size,\n    max_len, add_start=True, add_end=True\n):\n    """"""Prepare minibatch.""""""\n    if add_start and add_end:\n        lines = [\n            [\'<s>\'] + line + [\'</s>\']\n            for line in lines[index:index + batch_size]\n        ]\n    elif add_start and not add_end:\n        lines = [\n            [\'<s>\'] + line\n            for line in lines[index:index + batch_size]\n        ]\n    elif not add_start and add_end:\n        lines = [\n            line + [\'</s>\']\n            for line in lines[index:index + batch_size]\n        ]\n    elif not add_start and not add_end:\n        lines = [\n            line\n            for line in lines[index:index + batch_size]\n        ]\n    lines = [line[:max_len] for line in lines]\n\n    lens = [len(line) for line in lines]\n    max_len = max(lens)\n\n    input_lines = [\n        [word2ind[w] if w in word2ind else word2ind[\'<unk>\'] for w in line[:-1]] +\n        [word2ind[\'<pad>\']] * (max_len - len(line))\n        for line in lines\n    ]\n\n    output_lines = [\n        [word2ind[w] if w in word2ind else word2ind[\'<unk>\'] for w in line[1:]] +\n        [word2ind[\'<pad>\']] * (max_len - len(line))\n        for line in lines\n    ]\n\n    mask = [\n        ([1] * (l - 1)) + ([0] * (max_len - l))\n        for l in lens\n    ]\n\n    input_lines = Variable(torch.LongTensor(input_lines)).cuda()\n    output_lines = Variable(torch.LongTensor(output_lines)).cuda()\n    mask = Variable(torch.FloatTensor(mask)).cuda()\n\n    return input_lines, output_lines, lens, mask\n\n\ndef get_autoencode_minibatch(\n    lines, word2ind, index, batch_size,\n    max_len, add_start=True, add_end=True\n):\n    """"""Prepare minibatch.""""""\n    if add_start and add_end:\n        lines = [\n            [\'<s>\'] + line + [\'</s>\']\n            for line in lines[index:index + batch_size]\n        ]\n    elif add_start and not add_end:\n        lines = [\n            [\'<s>\'] + line\n            for line in lines[index:index + batch_size]\n        ]\n    elif not add_start and add_end:\n        lines = [\n            line + [\'</s>\']\n            for line in lines[index:index + batch_size]\n        ]\n    elif not add_start and not add_end:\n        lines = [\n            line\n            for line in lines[index:index + batch_size]\n        ]\n    lines = [line[:max_len] for line in lines]\n\n    lens = [len(line) for line in lines]\n    max_len = max(lens)\n\n    input_lines = [\n        [word2ind[w] if w in word2ind else word2ind[\'<unk>\'] for w in line[:-1]] +\n        [word2ind[\'<pad>\']] * (max_len - len(line))\n        for line in lines\n    ]\n\n    output_lines = [\n        [word2ind[w] if w in word2ind else word2ind[\'<unk>\'] for w in line[1:]] +\n        [word2ind[\'<pad>\']] * (max_len - len(line))\n        for line in lines\n    ]\n\n    mask = [\n        ([1] * (l)) + ([0] * (max_len - l))\n        for l in lens\n    ]\n\n    input_lines = Variable(torch.LongTensor(input_lines)).cuda()\n    output_lines = Variable(torch.LongTensor(output_lines)).cuda()\n    mask = Variable(torch.FloatTensor(mask)).cuda()\n\n    return input_lines, output_lines, lens, mask\n'"
