file_path,api_count,code
week0_09_intro_to_DL/mnist.py,0,"b'import sys\nimport os\nimport time\n\nimport numpy as np\n\n__doc__=""""""taken from https://github.com/Lasagne/Lasagne/blob/master/examples/mnist.py""""""\n\ndef load_dataset(flatten=False):\n    # We first define a download function, supporting both Python 2 and 3.\n    if sys.version_info[0] == 2:\n        from urllib import urlretrieve\n    else:\n        from urllib.request import urlretrieve\n\n    def download(filename, source=\'http://yann.lecun.com/exdb/mnist/\'):\n        print(""Downloading %s"" % filename)\n        urlretrieve(source + filename, filename)\n\n    # We then define functions for loading MNIST images and labels.\n    # For convenience, they also download the requested files if needed.\n    import gzip\n\n    def load_mnist_images(filename):\n        if not os.path.exists(filename):\n            download(filename)\n        # Read the inputs in Yann LeCun\'s binary format.\n        with gzip.open(filename, \'rb\') as f:\n            data = np.frombuffer(f.read(), np.uint8, offset=16)\n        # The inputs are vectors now, we reshape them to monochrome 2D images,\n        # following the shape convention: (examples, channels, rows, columns)\n        data = data.reshape(-1, 1, 28, 28)\n        # The inputs come as bytes, we convert them to float32 in range [0,1].\n        # (Actually to range [0, 255/256], for compatibility to the version\n        # provided at http://deeplearning.net/data/mnist/mnist.pkl.gz.)\n        return (data / np.float32(256)).squeeze()\n\n    def load_mnist_labels(filename):\n        if not os.path.exists(filename):\n            download(filename)\n        # Read the labels in Yann LeCun\'s binary format.\n        with gzip.open(filename, \'rb\') as f:\n            data = np.frombuffer(f.read(), np.uint8, offset=8)\n        # The labels are vectors of integers now, that\'s exactly what we want.\n        return data\n\n    # We can now download and read the training and test set images and labels.\n    X_train = load_mnist_images(\'train-images-idx3-ubyte.gz\')\n    y_train = load_mnist_labels(\'train-labels-idx1-ubyte.gz\')\n    X_test = load_mnist_images(\'t10k-images-idx3-ubyte.gz\')\n    y_test = load_mnist_labels(\'t10k-labels-idx1-ubyte.gz\')\n\n    # We reserve the last 10000 training examples for validation.\n    X_train, X_val = X_train[:-10000], X_train[-10000:]\n    y_train, y_val = y_train[:-10000], y_train[-10000:]\n\n    if flatten:\n        X_train = X_train.reshape([-1, 28**2])\n        X_val = X_val.reshape([-1, 28**2])\n        X_test = X_test.reshape([-1, 28**2])\n\n\n    # We just return all the arrays in order, as expected in main().\n    # (It doesn\'t matter how we do this as long as we can read them again.)\n    return X_train, y_train, X_val, y_val, X_test, y_test\n\n\n\n\n'"
week0_09_intro_to_DL/modules.py,0,"b'import numpy as np\n\nclass Module(object):\n    """"""\n    Basically, you can think of a module as of a something (black box) \n    which can process `input` data and produce `ouput` data.\n    This is like applying a function which is called `forward`: \n        \n        output = module.forward(input)\n    \n    The module should be able to perform a backward pass: to differentiate the `forward` function. \n    More, it should be able to differentiate it if is a part of chain (chain rule).\n    The latter implies there is a gradient from previous step of a chain rule. \n    \n        gradInput = module.backward(input, gradOutput)\n    """"""\n    def __init__ (self):\n        self.output = None\n        self.gradInput = None\n        self.training = True\n    \n    def forward(self, input):\n        """"""\n        Takes an input object, and computes the corresponding output of the module.\n        """"""\n        return self.updateOutput(input)\n\n    def backward(self, input, gradOutput):\n        """"""\n        Performs a backpropagation step through the module, with respect to the given input.\n        \n        This includes \n         - computing a gradient w.r.t. `input` (is needed for further backprop),\n         - computing a gradient w.r.t. parameters (to update parameters while optimizing).\n        """"""\n        self.updateGradInput(input, gradOutput)\n        self.accGradParameters(input, gradOutput)\n        return self.gradInput\n    \n\n    def updateOutput(self, input):\n        """"""\n        Computes the output using the current parameter set of the class and input.\n        This function returns the result which is stored in the `output` field.\n        \n        Make sure to both store the data in `output` field and return it. \n        """"""\n        \n        # The easiest case:\n            \n        # self.output = input \n        # return self.output\n        \n        pass\n\n    def updateGradInput(self, input, gradOutput):\n        """"""\n        Computing the gradient of the module with respect to its own input. \n        This is returned in `gradInput`. Also, the `gradInput` state variable is updated accordingly.\n        \n        The shape of `gradInput` is always the same as the shape of `input`.\n        \n        Make sure to both store the gradients in `gradInput` field and return it.\n        """"""\n        \n        # The easiest case:\n        \n        # self.gradInput = gradOutput \n        # return self.gradInput\n        \n        pass   \n    \n    def accGradParameters(self, input, gradOutput):\n        """"""\n        Computing the gradient of the module with respect to its own parameters.\n        No need to override if module has no parameters (e.g. ReLU).\n        """"""\n        pass\n    \n    def zeroGradParameters(self): \n        """"""\n        Zeroes `gradParams` variable if the module has params.\n        """"""\n        pass\n        \n    def getParameters(self):\n        """"""\n        Returns a list with its parameters. \n        If the module does not have parameters return empty list. \n        """"""\n        return []\n        \n    def getGradParameters(self):\n        """"""\n        Returns a list with gradients with respect to its parameters. \n        If the module does not have parameters return empty list. \n        """"""\n        return []\n    \n    def train(self):\n        """"""\n        Sets training mode for the module.\n        Training and testing behaviour differs for Dropout, BatchNorm.\n        """"""\n        self.training = True\n    \n    def evaluate(self):\n        """"""\n        Sets evaluation mode for the module.\n        Training and testing behaviour differs for Dropout, BatchNorm.\n        """"""\n        self.training = False\n    \n    def __repr__(self):\n        """"""\n        Pretty printing. Should be overrided in every module if you want \n        to have readable description. \n        """"""\n        return ""Module""\n    \n\nclass Sequential(Module):\n    """"""\n         This class implements a container, which processes `input` data sequentially. \n         \n         `input` is processed by each module (layer) in self.modules consecutively.\n         The resulting array is called `output`. \n    """"""\n    \n    def __init__ (self):\n        super(Sequential, self).__init__()\n        self.modules = []\n   \n    def add(self, module):\n        """"""\n        Adds a module to the container.\n        """"""\n        self.modules.append(module)\n\n    def updateOutput(self, input):\n        """"""\n        Basic workflow of FORWARD PASS:\n        \n            y_0    = module[0].forward(input)\n            y_1    = module[1].forward(y_0)\n            ...\n            output = module[n-1].forward(y_{n-2})   \n            \n            \n        Just write a little loop. \n        """"""\n\n        # Your code goes here. ################################################\n        self.output = input\n        \n        for module in self.modules:\n            self.output = module.forward(self.output)\n        \n        return self.output\n\n    def backward(self, input, gradOutput):\n        """"""\n        Workflow of BACKWARD PASS:\n            \n            g_{n-1} = module[n-1].backward(y_{n-2}, gradOutput)\n            g_{n-2} = module[n-2].backward(y_{n-3}, g_{n-1})\n            ...\n            g_1 = module[1].backward(y_0, g_2)   \n            gradInput = module[0].backward(input, g_1)   \n             \n             \n        !!!\n                \n        To ech module you need to provide the input, module saw while forward pass, \n        it is used while computing gradients. \n        Make sure that the input for `i-th` layer the output of `module[i]` (just the same input as in forward pass) \n        and NOT `input` to this Sequential module. \n        \n        !!!\n        \n        """"""\n        # Your code goes here. ################################################\n        \n        for i in range(len(self.modules)-1, 0, -1):\n            gradOutput = self.modules[i].backward(self.modules[i-1].output, gradOutput)\n        \n        self.gradInput = self.modules[0].backward(input, gradOutput)\n        \n        return self.gradInput\n      \n\n    def zeroGradParameters(self): \n        for module in self.modules:\n            module.zeroGradParameters()\n    \n    def getParameters(self):\n        """"""\n        Should gather all parameters in a list.\n        """"""\n        return [x.getParameters() for x in self.modules]\n    \n    def getGradParameters(self):\n        """"""\n        Should gather all gradients w.r.t parameters in a list.\n        """"""\n        return [x.getGradParameters() for x in self.modules]\n    \n    def __repr__(self):\n        string = """".join([str(x) + \'\\n\' for x in self.modules])\n        return string\n    \n    def __getitem__(self,x):\n        return self.modules.__getitem__(x)\n    \n    def train(self):\n        """"""\n        Propagates training parameter through all modules\n        """"""\n        self.training = True\n        for module in self.modules:\n            module.train()\n    \n    def evaluate(self):\n        """"""\n        Propagates training parameter through all modules\n        """"""\n        self.training = False\n        for module in self.modules:\n            module.evaluate()\n            \n            \nclass Criterion(object):\n    def __init__ (self):\n        self.output = None\n        self.gradInput = None\n        \n    def forward(self, input, target):\n        """"""\n            Given an input and a target, compute the loss function \n            associated to the criterion and return the result.\n            \n            For consistency this function should not be overrided,\n            all the code goes in `updateOutput`.\n        """"""\n        return self.updateOutput(input, target)\n\n    def backward(self, input, target):\n        """"""\n            Given an input and a target, compute the gradients of the loss function\n            associated to the criterion and return the result. \n\n            For consistency this function should not be overrided,\n            all the code goes in `updateGradInput`.\n        """"""\n        return self.updateGradInput(input, target)\n    \n    def updateOutput(self, input, target):\n        """"""\n        Function to override.\n        """"""\n        return self.output\n\n    def updateGradInput(self, input, target):\n        """"""\n        Function to override.\n        """"""\n        return self.gradInput   \n\n    def __repr__(self):\n        """"""\n        Pretty printing. Should be overrided in every module if you want \n        to have readable description. \n        """"""\n        return ""Criterion""'"
week0_10_DL_step_2/notmnist.py,0,"b'import os\nimport numpy as np\nfrom scipy.misc import imread,imresize\nfrom sklearn.model_selection import train_test_split\nfrom glob import glob\n\ndef load_notmnist(path=\'./notMNIST_small\',letters=\'ABCDEFGHIJ\',\n                  img_shape=(28,28),test_size=0.25,one_hot=False):\n    \n    # download data if it\'s missing. If you have any problems, go to the urls and load it manually.\n    if not os.path.exists(path):\n        if not os.path.exists(\'./notMNIST_small.tar.gz\'):\n            print(""Downloading data..."")\n            assert os.system(\'curl http://yaroslavvb.com/upload/notMNIST/notMNIST_small.tar.gz > notMNIST_small.tar.gz\') == 0\n        print(""Extracting ..."")\n        assert os.system(\'tar -zxvf notMNIST_small.tar.gz > untar_notmnist.log\') == 0\n    \n    data,labels = [],[]\n    print(""Parsing..."")\n    for img_path in glob(os.path.join(path,\'*/*\')):\n        class_i = img_path.split(os.sep)[-2]\n        if class_i not in letters: continue\n        try:\n            data.append(imresize(imread(img_path), img_shape))\n            labels.append(class_i,)\n        except:\n            print(""found broken img: %s [it\'s ok if <10 images are broken]"" % img_path)\n        \n    data = np.stack(data)[:,None].astype(\'float32\')\n    data = (data - np.mean(data)) / np.std(data)\n\n    #convert classes to ints\n    letter_to_i = {l:i for i,l in enumerate(letters)}\n    labels = np.array(list(map(letter_to_i.get, labels)))\n    \n    if one_hot:\n        labels = (np.arange(np.max(labels) + 1)[None,:] == labels[:, None]).astype(\'float32\')\n    \n    #split into train/test\n    X_train, X_test, y_train, y_test = train_test_split(data, labels, test_size=test_size, random_state=42)\n    \n    print(""Done"")\n    return X_train, y_train, X_test, y_test'"
