file_path,api_count,code
week1_11_RL_outside_games/basic_model_torch.py,22,"b'import torch\nimport torch.nn as nn\nimport torch.nn.functional as F\n\n# Note: unlike official pytorch tutorial, this model doesn\'t process one sample at a time\n# because it\'s slow on GPU.  instead it uses masks just like ye olde theano/tensorflow.\n# it doesn\'t use torch.nn.utils.rnn.pack_paded_sequence because reasons.\n\nclass BasicTranslationModel(nn.Module):\n    def __init__(self, inp_voc, out_voc,\n                 emb_size, hid_size,):\n        super(self.__class__, self).__init__()\n        self.inp_voc = inp_voc\n        self.out_voc = out_voc\n\n        self.emb_inp = nn.Embedding(len(inp_voc), emb_size)\n        self.emb_out = nn.Embedding(len(out_voc), emb_size)\n        self.enc0 = nn.GRU(emb_size, hid_size, batch_first=True)\n        self.dec_start = nn.Linear(hid_size, hid_size)\n        self.dec0 = nn.GRUCell(emb_size, hid_size)\n        self.logits = nn.Linear(hid_size, len(out_voc))\n\n    def encode(self, inp, **flags):\n        """"""\n        Takes symbolic input sequence, computes initial state\n        :param inp: a vector of input tokens  (Variable, int64, 1d)\n        :return: a list of initial decoder state tensors\n        """"""\n        inp_emb = self.emb_inp(inp)\n        enc_seq, _ = self.enc0(inp_emb)\n\n        # select last element w.r.t. mask\n        end_index = infer_length(inp, self.inp_voc.eos_ix)\n        end_index[end_index >= inp.shape[1]] = inp.shape[1] - 1\n        enc_last = enc_seq[range(0, enc_seq.shape[0]), end_index.detach(), :]\n\n        dec_start = self.dec_start(enc_last)\n        return [dec_start]\n\n    def decode(self, prev_state, prev_tokens, **flags):\n        """"""\n        Takes previous decoder state and tokens, returns new state and logits\n        :param prev_state: a list of previous decoder state tensors\n        :param prev_tokens: previous output tokens, an int vector of [batch_size]\n        :return: a list of next decoder state tensors, a tensor of logits [batch,n_tokens]\n        """"""\n        [prev_dec] = prev_state\n\n        prev_emb = self.emb_out(prev_tokens)\n        new_dec_state = self.dec0(prev_emb, prev_dec)\n        output_logits = self.logits(new_dec_state)\n\n        return [new_dec_state], output_logits\n\n    def forward(self, inp, out, eps=1e-30, **flags):\n        """"""\n        Takes symbolic int32 matrices of hebrew words and their english translations.\n        Computes the log-probabilities of all possible english characters given english prefices and hebrew word.\n        :param inp: input sequence, int32 matrix of shape [batch,time]\n        :param out: output sequence, int32 matrix of shape [batch,time]\n        :return: log-probabilities of all possible english characters of shape [bath,time,n_tokens]\n\n        Note: log-probabilities time axis is synchronized with out\n        In other words, logp are probabilities of __current__ output at each tick, not the next one\n        therefore you can get likelihood as logprobas * tf.one_hot(out,n_tokens)\n        """"""\n        device = next(self.parameters()).device\n        batch_size = inp.shape[0]\n        bos = torch.tensor([self.out_voc.bos_ix] * batch_size, dtype=torch.long, device=device)\n        logits_seq = [torch.log(to_one_hot(bos, len(self.out_voc)) + eps)]\n\n        hid_state = self.encode(inp, **flags)\n        for x_t in out.transpose(0,1)[:-1]:\n            hid_state, logits = self.decode(hid_state, x_t, **flags)\n            logits_seq.append(logits)\n\n        return F.log_softmax(torch.stack(logits_seq, dim=1), dim=-1)\n\n    def translate(self, inp, greedy=False, max_len = None, eps = 1e-30, **flags):\n        """"""\n        takes symbolic int32 matrix of hebrew words, produces output tokens sampled\n        from the model and output log-probabilities for all possible tokens at each tick.\n        :param inp: input sequence, int32 matrix of shape [batch,time]\n        :param greedy: if greedy, takes token with highest probablity at each tick.\n            Otherwise samples proportionally to probability.\n        :param max_len: max length of output, defaults to 2 * input length\n        :return: output tokens int32[batch,time] and\n                 log-probabilities of all tokens at each tick, [batch,time,n_tokens]\n        """"""\n        device = next(self.parameters()).device\n        batch_size = inp.shape[0]\n        bos = torch.tensor([self.out_voc.bos_ix] * batch_size, dtype=torch.long, device=device)\n        mask = torch.ones(batch_size, dtype=torch.uint8, device=device)\n        logits_seq = [torch.log(to_one_hot(bos, len(self.out_voc)) + eps)]\n        out_seq = [bos]\n\n        hid_state = self.encode(inp, **flags)\n        while True:\n            hid_state, logits = self.decode(hid_state, out_seq[-1], **flags)\n            if greedy:\n                _, y_t = torch.max(logits, dim=-1)\n            else:\n                probs = F.softmax(logits, dim=-1)\n                y_t = torch.multinomial(probs, 1)[:, 0]\n\n            logits_seq.append(logits)\n            out_seq.append(y_t)\n            mask *= y_t != self.out_voc.eos_ix\n\n            if not mask.any(): break\n            if max_len and len(out_seq) >= max_len: break\n\n        return torch.stack(out_seq, 1), F.log_softmax(torch.stack(logits_seq, 1), dim=-1)\n\n\n\n### Utility functions ###\n\ndef infer_mask(seq, eos_ix, batch_first=True, include_eos=True, dtype=torch.float):\n    """"""\n    compute length given output indices and eos code\n    :param seq: tf matrix [time,batch] if batch_first else [batch,time]\n    :param eos_ix: integer index of end-of-sentence token\n    :param include_eos: if True, the time-step where eos first occurs is has mask = 1\n    :returns: lengths, int32 vector of shape [batch]\n    """"""\n    assert seq.dim() == 2\n    is_eos = (seq == eos_ix).to(dtype=torch.float)\n    if include_eos:\n        if batch_first:\n            is_eos = torch.cat((is_eos[:,:1]*0, is_eos[:, :-1]), dim=1)\n        else:\n            is_eos = torch.cat((is_eos[:1,:]*0, is_eos[:-1, :]), dim=0)\n    count_eos = torch.cumsum(is_eos, dim=1 if batch_first else 0)\n    mask = count_eos == 0\n    return mask.to(dtype=dtype)\n\ndef infer_length(seq, eos_ix, batch_first=True, include_eos=True, dtype=torch.long):\n    """"""\n    compute mask given output indices and eos code\n    :param seq: tf matrix [time,batch] if time_major else [batch,time]\n    :param eos_ix: integer index of end-of-sentence token\n    :param include_eos: if True, the time-step where eos first occurs is has mask = 1\n    :returns: mask, float32 matrix with \'0\'s and \'1\'s of same shape as seq\n    """"""\n    mask = infer_mask(seq, eos_ix, batch_first, include_eos, dtype)\n    return torch.sum(mask, dim=1 if batch_first else 0)\n\n\ndef to_one_hot(y, n_dims=None):\n    """""" Take integer y (tensor or variable) with n dims and convert it to 1-hot representation with n+1 dims. """"""\n    y_tensor = y.data\n    y_tensor = y_tensor.to(dtype=torch.long).view(-1, 1)\n    n_dims = n_dims if n_dims is not None else int(torch.max(y_tensor)) + 1\n    y_one_hot = torch.zeros(y_tensor.size()[0], n_dims, device=y.device).scatter_(1, y_tensor, 1)\n    y_one_hot = y_one_hot.view(*y.shape, -1)\n    return y_one_hot\n'"
week1_11_RL_outside_games/setup.py,0,b'#!/bin/bash\n# a setup script for google colab. Will be updated\npip install gym\napt-get install -y xvfb\nwget https://raw.githubusercontent.com/yandexdataschool/Practical_DL/fall18/xvfb -O ../xvfb\napt-get install -y python-opengl ffmpeg\npip install pyglet==1.2.4\n\n'
week1_11_RL_outside_games/voc.py,0,"b'import numpy as np\n\nclass Vocab:\n    def __init__(self, tokens, bos=""__BOS__"", eos=""__EOS__"", sep=\'\'):\n        """"""\n        A special class that handles tokenizing and detokenizing\n        """"""\n        assert bos in tokens, eos in tokens\n        self.tokens = tokens\n        self.token_to_ix = {t:i for i,t in enumerate(tokens)}\n\n        self.bos = bos\n        self.bos_ix = self.token_to_ix[bos]\n        self.eos = eos\n        self.eos_ix = self.token_to_ix[eos]\n        self.sep = sep\n\n    def __len__(self):\n        return len(self.tokens)\n\n    @staticmethod\n    def from_lines(lines, bos=""__BOS__"", eos=""__EOS__"", sep=\'\'):\n        flat_lines = sep.join(list(lines))\n        flat_lines = list(flat_lines.split(sep)) if sep != \'\' else list(flat_lines)\n        tokens = list(set(sep.join(flat_lines)))\n        tokens = [t for t in tokens if t not in (bos,eos) and len(t) != 0]\n        tokens = [bos,eos] + tokens\n        return Vocab(tokens,bos,eos,sep)\n\n    def tokenize(self,string):\n        """"""converts string to a list of tokens""""""\n        tokens = list(filter(len,string.split(self.sep))) \\\n                    if self.sep != \'\' else list(string)\n        return [self.bos] + tokens + [self.eos]\n\n    def to_matrix(self, lines, max_len=None):\n        """"""\n        convert variable length token sequences into  fixed size matrix\n        example usage:\n        >>>print( as_matrix(words[:3],source_to_ix))\n        [[15 22 21 28 27 13 -1 -1 -1 -1 -1]\n         [30 21 15 15 21 14 28 27 13 -1 -1]\n         [25 37 31 34 21 20 37 21 28 19 13]]\n        """"""\n        max_len = max_len or max(map(len, lines)) + 2 # 2 for bos and eos\n\n        matrix = np.zeros((len(lines), max_len), dtype=\'int32\') + self.eos_ix\n        for i, seq in enumerate(lines):\n            tokens = self.tokenize(seq)\n            row_ix = list(map(self.token_to_ix.get, tokens))[:max_len]\n            matrix[i, :len(row_ix)] = row_ix\n\n        return matrix\n\n    def to_lines(self, matrix, crop=True):\n        """"""\n        Convert matrix of token ids into strings\n        :param matrix: matrix of tokens of int32, shape=[batch,time]\n        :param crop: if True, crops BOS and EOS from line\n        :return:\n        """"""\n        lines = []\n        for line_ix in map(list,matrix):\n            if crop:\n                if line_ix[0] == self.bos_ix:\n                    line_ix = line_ix[1:]\n                if self.eos_ix in line_ix:\n                    line_ix = line_ix[:line_ix.index(self.eos_ix)]\n            line = self.sep.join(self.tokens[i] for i in line_ix)\n            lines.append(line)\n        return lines\n'"
homeworks_advanced/Lab1_NLP/my_network.py,3,"b'import torch\nimport torch.nn as nn\nimport torch.optim as optim\n\nimport torchtext\nfrom torchtext.datasets import TranslationDataset, Multi30k\nfrom torchtext.data import Field, BucketIterator\n\nimport random\nimport math\nimport time\n\n\nclass Encoder(nn.Module):\n    def __init__(self, input_dim, emb_dim, hid_dim, n_layers, dropout):\n        super().__init__()\n        \n        self.input_dim = input_dim\n        self.emb_dim = emb_dim\n        self.hid_dim = hid_dim\n        self.n_layers = n_layers\n#         self.dropout = dropout\n        \n        self.embedding = nn.Embedding(\n            num_embeddings=input_dim,\n            embedding_dim=emb_dim\n        )\n            # <YOUR CODE HERE>\n        \n        self.rnn = nn.LSTM(\n            input_size=emb_dim,\n            hidden_size=hid_dim,\n            num_layers=n_layers,\n            dropout=dropout\n        )\n            # <YOUR CODE HERE>\n        \n        self.dropout = nn.Dropout(p=dropout)# <YOUR CODE HERE>\n        \n    def forward(self, src):\n        \n        #src = [src sent len, batch size]\n        \n        # Compute an embedding from the src data and apply dropout to it\n        embedded = self.embedding(src)# <YOUR CODE HERE>\n        \n        embedded = self.dropout(embedded)\n        \n        output, (hidden, cell) = self.rnn(embedded)\n        #embedded = [src sent len, batch size, emb dim]\n        \n        # Compute the RNN output values of the encoder RNN. \n        # outputs, hidden and cell should be initialized here. Refer to nn.LSTM docs ;)\n        \n        # <YOUR CODE HERE> \n        \n        #outputs = [src sent len, batch size, hid dim * n directions]\n        #hidden = [n layers * n directions, batch size, hid dim]\n        #cell = [n layers * n directions, batch size, hid dim]\n        \n        #outputs are always from the top hidden layer\n        \n        return hidden, cell\n    \n\nclass Decoder(nn.Module):\n    def __init__(self, output_dim, emb_dim, hid_dim, n_layers, dropout):\n        super().__init__()\n\n        self.emb_dim = emb_dim\n        self.hid_dim = hid_dim\n        self.output_dim = output_dim\n        self.n_layers = n_layers\n        self.dropout = dropout\n        \n        self.embedding = nn.Embedding(\n            num_embeddings=output_dim,\n            embedding_dim=emb_dim\n        )\n            # <YOUR CODE HERE>\n        \n        self.rnn = nn.LSTM(\n            input_size=emb_dim,\n            hidden_size=hid_dim,\n            num_layers=n_layers,\n            dropout=dropout\n        )\n            # <YOUR CODE HERE>\n        \n        self.out = nn.Linear(\n            in_features=hid_dim,\n            out_features=output_dim\n        )\n            # <YOUR CODE HERE>\n        \n        self.dropout = nn.Dropout(p=dropout)# <YOUR CODE HERE>\n        \n    def forward(self, input, hidden, cell):\n        \n        #input = [batch size]\n        #hidden = [n layers * n directions, batch size, hid dim]\n        #cell = [n layers * n directions, batch size, hid dim]\n        \n        #n directions in the decoder will both always be 1, therefore:\n        #hidden = [n layers, batch size, hid dim]\n        #context = [n layers, batch size, hid dim]\n        \n        input = input.unsqueeze(0)\n        \n        #input = [1, batch size]\n        \n        # Compute an embedding from the input data and apply dropout to it\n        embedded = self.dropout(self.embedding(input))# <YOUR CODE HERE>\n        \n        #embedded = [1, batch size, emb dim]\n        \n        # Compute the RNN output values of the encoder RNN. \n        # outputs, hidden and cell should be initialized here. Refer to nn.LSTM docs ;)\n        # <YOUR CODE HERE>\n        \n        \n        #output = [sent len, batch size, hid dim * n directions]\n        #hidden = [n layers * n directions, batch size, hid dim]\n        #cell = [n layers * n directions, batch size, hid dim]\n        \n        #sent len and n directions will always be 1 in the decoder, therefore:\n        #output = [1, batch size, hid dim]\n        #hidden = [n layers, batch size, hid dim]\n        #cell = [n layers, batch size, hid dim]\n        \n        \n        output, (hidden, cell) = self.rnn(embedded, (hidden, cell))\n        prediction = self.out(output.squeeze(0))\n        \n        #prediction = [batch size, output dim]\n        \n        return prediction, hidden, cell\n\n\nclass Seq2Seq(nn.Module):\n    def __init__(self, encoder, decoder, device):\n        super().__init__()\n        \n        self.encoder = encoder\n        self.decoder = decoder\n        self.device = device\n        \n        assert encoder.hid_dim == decoder.hid_dim, \\\n            ""Hidden dimensions of encoder and decoder must be equal!""\n        assert encoder.n_layers == decoder.n_layers, \\\n            ""Encoder and decoder must have equal number of layers!""\n        \n    def forward(self, src, trg, teacher_forcing_ratio = 0.5):\n        \n        #src = [src sent len, batch size]\n        #trg = [trg sent len, batch size]\n        #teacher_forcing_ratio is probability to use teacher forcing\n        #e.g. if teacher_forcing_ratio is 0.75 we use ground-truth inputs 75% of the time\n        \n        # Again, now batch is the first dimention instead of zero\n        batch_size = trg.shape[1]\n        max_len = trg.shape[0]\n        trg_vocab_size = self.decoder.output_dim\n        \n        #tensor to store decoder outputs\n        outputs = torch.zeros(max_len, batch_size, trg_vocab_size).to(self.device)\n        \n        #last hidden state of the encoder is used as the initial hidden state of the decoder\n        hidden, cell = self.encoder(src)\n        \n        #first input to the decoder is the <sos> tokens\n        input = trg[0,:]\n        \n        for t in range(1, max_len):\n            \n            output, hidden, cell = self.decoder(input, hidden, cell)\n            outputs[t] = output\n            teacher_force = random.random() < teacher_forcing_ratio\n            top1 = output.max(1)[1]\n            input = (trg[t] if teacher_force else top1)\n        \n        return outputs\n'"
homeworks_advanced/Lab1_NLP/utils.py,0,"b""\ndef flatten(l):\n    return [item for sublist in l for item in sublist]\n\ndef remove_tech_tokens(mystr, tokens_to_remove=['<eos>', '<sos>', '<unk>', '<pad>']):\n    return [x for x in mystr if x not in tokens_to_remove]\n\n\ndef get_text(x, TRG_vocab):\n    text = remove_tech_tokens([TRG_vocab.itos[token] for token in x])\n    if len(text) < 1:\n        text = []\n    return text\n\n\ndef generate_translation(src, trg, model, TRG_vocab):\n    model.eval()\n\n    output = model(src, trg, 0) #turn off teacher forcing\n    output = output.argmax(dim=-1).cpu().numpy()\n\n    original = [TRG_vocab.itos[x] for x in list(trg[:,0].cpu().numpy())]\n    generated = [TRG_vocab.itos[x] for x in list(output[:, 0])]\n    \n    original = remove_tech_tokens(original)\n    generated = remove_tech_tokens(generated)\n    print('Original: {}'.format(' '.join(original)))\n    print('Generated: {}'.format(' '.join(generated)))\n    print()\n"""
homeworks_advanced/Lab2_RL/atari_util.py,0,"b'""""""Auxilary files for those who wanted to solve breakout with CEM or policy gradient""""""\nimport numpy as np\nfrom gym.core import Wrapper\nfrom gym.spaces.box import Box\nfrom skimage.transform import resize\n\n\nclass PreprocessAtari(Wrapper):\n    def __init__(self, env, height=42, width=42, color=False,\n                 crop=lambda img: img, n_frames=4, dim_order=\'theano\'):\n        """"""A gym wrapper that reshapes, crops and scales image into the desired shapes""""""\n        super(PreprocessAtari, self).__init__(env)\n        assert dim_order in (\'theano\', \'tensorflow\')\n        self.img_size = (height, width)\n        self.crop = crop\n        self.color = color\n        self.dim_order = dim_order\n\n        n_channels = (3 * n_frames) if color else n_frames\n        obs_shape = \\\n            [n_channels, height, width] \\\n            if dim_order == \'theano\' else \\\n            [height, width, n_channels]\n        self.observation_space = Box(0.0, 1.0, obs_shape)\n        self.framebuffer = np.zeros(obs_shape, \'float32\')\n\n    def reset(self):\n        """"""resets breakout, returns initial frames""""""\n        self.framebuffer = np.zeros_like(self.framebuffer)\n        self.update_buffer(self.env.reset())\n        return self.framebuffer\n\n    def step(self, action):\n        """"""plays breakout for 1 step, returns frame buffer""""""\n        new_img, r, done, info = self.env.step(action)\n        self.update_buffer(new_img)\n        return self.framebuffer, r, done, info\n\n    ### image processing ###\n\n    def update_buffer(self, img):\n        img = self.preproc_image(img)\n        offset = 3 if self.color else 1\n        if self.dim_order == \'theano\':\n            axis = 0\n            cropped_framebuffer = self.framebuffer[:-offset]\n        else:\n            axis = -1\n            cropped_framebuffer = self.framebuffer[:, :, :-offset]\n        self.framebuffer = np.concatenate(\n            [img, cropped_framebuffer], axis=axis)\n\n    def preproc_image(self, img):\n        """"""what happens to the observation""""""\n        img = self.crop(img)\n        img = resize(img, self.img_size)\n        if not self.color:\n            img = img.mean(-1, keepdims=True)\n        if self.dim_order == \'theano\':\n            img = img.transpose([2, 0, 1])  # [h, w, c] to [c, h, w]\n        img = img.astype(\'float32\') / 255.\n        return img\n'"
homeworks_advanced/Lab2_RL/atari_wrappers.py,0,"b'# taken from OpenAI baselines.\n\nimport numpy as np\nimport gym\n\nclass MaxAndSkipEnv(gym.Wrapper):\n    def __init__(self, env, skip=4):\n        """"""Return only every `skip`-th frame""""""\n        gym.Wrapper.__init__(self, env)\n        # most recent raw observations (for max pooling across time steps)\n        self._obs_buffer = np.zeros((2,)+env.observation_space.shape, dtype=np.uint8)\n        self._skip       = skip\n\n    def step(self, action):\n        """"""Repeat action, sum reward, and max over last observations.""""""\n        total_reward = 0.0\n        done = None\n        for i in range(self._skip):\n            obs, reward, done, info = self.env.step(action)\n            if i == self._skip - 2: self._obs_buffer[0] = obs\n            if i == self._skip - 1: self._obs_buffer[1] = obs\n            total_reward += reward\n            if done:\n                break\n        # Note that the observation on the done=True frame\n        # doesn\'t matter\n        max_frame = self._obs_buffer.max(axis=0)\n\n        return max_frame, total_reward, done, info\n\n    def reset(self, **kwargs):\n        return self.env.reset(**kwargs)\n\n\nclass ClipRewardEnv(gym.RewardWrapper):\n    def __init__(self, env):\n        gym.RewardWrapper.__init__(self, env)\n\n    def reward(self, reward):\n        """"""Bin reward to {+1, 0, -1} by its sign.""""""\n        return np.sign(reward)\n\n\nclass FireResetEnv(gym.Wrapper):\n    def __init__(self, env):\n        """"""Take action on reset for environments that are fixed until firing.""""""\n        gym.Wrapper.__init__(self, env)\n        assert env.unwrapped.get_action_meanings()[1] == \'FIRE\'\n        assert len(env.unwrapped.get_action_meanings()) >= 3\n\n    def reset(self, **kwargs):\n        self.env.reset(**kwargs)\n        obs, _, done, _ = self.env.step(1)\n        if done:\n            self.env.reset(**kwargs)\n        obs, _, done, _ = self.env.step(2)\n        if done:\n            self.env.reset(**kwargs)\n        return obs\n\n    def step(self, ac):\n        return self.env.step(ac)\n\n\nclass EpisodicLifeEnv(gym.Wrapper):\n    def __init__(self, env):\n        """"""Make end-of-life == end-of-episode, but only reset on true game over.\n        Done by DeepMind for the DQN and co. since it helps value estimation.\n        """"""\n        gym.Wrapper.__init__(self, env)\n        self.lives = 0\n        self.was_real_done  = True\n\n    def step(self, action):\n        obs, reward, done, info = self.env.step(action)\n        self.was_real_done = done\n        # check current lives, make loss of life terminal,\n        # then update lives to handle bonus lives\n        lives = self.env.unwrapped.ale.lives()\n        if lives < self.lives and lives > 0:\n            # for Qbert sometimes we stay in lives == 0 condition for a few frames\n            # so it\'s important to keep lives > 0, so that we only reset once\n            # the environment advertises done.\n            done = True\n        self.lives = lives\n        return obs, reward, done, info\n\n    def reset(self, **kwargs):\n        """"""Reset only when lives are exhausted.\n        This way all states are still reachable even though lives are episodic,\n        and the learner need not know about any of this behind-the-scenes.\n        """"""\n        if self.was_real_done:\n            obs = self.env.reset(**kwargs)\n        else:\n            # no-op step to advance from terminal/lost life state\n            obs, _, _, _ = self.env.step(0)\n        self.lives = self.env.unwrapped.ale.lives()\n        return obs\n\n\n# in torch imgs have shape [c, h, w] instead of common [h, w, c]\nclass AntiTorchWrapper(gym.ObservationWrapper):\n    def __init__(self, env):\n        gym.ObservationWrapper.__init__(self, env)\n\n        self.img_size = [env.observation_space.shape[i]\n                           for i in [1, 2, 0]\n                        ]\n        self.observation_space = gym.spaces.Box(0.0, 1.0, self.img_size)\n\n    def _observation(self, img):\n        """"""what happens to each observation""""""\n        img = img.transpose(1, 2, 0)\n        return img'"
