file_path,api_count,code
week1_07_Value_based/mdp.py,0,"b'# most of this code was politely stolen from https://github.com/berkeleydeeprlcourse/homework/\n# all credit goes to https://github.com/abhishekunique (if i got the author right)\nimport sys\nimport random\nimport numpy as np\n\ntry:\n    from graphviz import Digraph\n    import graphviz\n    has_graphviz = True\nexcept:\n    has_graphviz = False\n\n\nclass MDP:\n    def __init__(self, transition_probs, rewards, initial_state=None):\n        """"""\n        Defines an MDP. Compatible with gym Env.\n        :param transition_probs: transition_probs[s][a][s_next] = P(s_next | s, a)\n            A dict[state -> dict] of dicts[action -> dict] of dicts[next_state -> prob]\n            For each state and action, probabilities of next states should sum to 1\n            If a state has no actions available, it is considered terminal\n        :param rewards: rewards[s][a][s_next] = r(s,a,s\')\n            A dict[state -> dict] of dicts[action -> dict] of dicts[next_state -> reward]\n            The reward for anything not mentioned here is zero.\n        :param get_initial_state: a state where agent starts or a callable() -> state\n            By default, picks initial state at random.\n\n        States and actions can be anything you can use as dict keys, but we recommend that you use strings or integers\n\n        Here\'s an example from MDP depicted on http://bit.ly/2jrNHNr\n        transition_probs = {\n              \'s0\':{\n                \'a0\': {\'s0\': 0.5, \'s2\': 0.5},\n                \'a1\': {\'s2\': 1}\n              },\n              \'s1\':{\n                \'a0\': {\'s0\': 0.7, \'s1\': 0.1, \'s2\': 0.2},\n                \'a1\': {\'s1\': 0.95, \'s2\': 0.05}\n              },\n              \'s2\':{\n                \'a0\': {\'s0\': 0.4, \'s1\': 0.6},\n                \'a1\': {\'s0\': 0.3, \'s1\': 0.3, \'s2\':0.4}\n              }\n            }\n        rewards = {\n            \'s1\': {\'a0\': {\'s0\': +5}},\n            \'s2\': {\'a1\': {\'s0\': -1}}\n        }\n        """"""\n        self._check_param_consistency(transition_probs, rewards)\n        self._transition_probs = transition_probs\n        self._rewards = rewards\n        self._initial_state = initial_state\n        self.n_states = len(transition_probs)\n        self.reset()\n\n    def get_all_states(self):\n        """""" return a tuple of all possiblestates """"""\n        return tuple(self._transition_probs.keys())\n\n    def get_possible_actions(self, state):\n        """""" return a tuple of possible actions in a given state """"""\n        return tuple(self._transition_probs.get(state, {}).keys())\n\n    def is_terminal(self, state):\n        """""" return True if state is terminal or False if it isn\'t """"""\n        return len(self.get_possible_actions(state)) == 0\n\n    def get_next_states(self, state, action):\n        """""" return a dictionary of {next_state1 : P(next_state1 | state, action), next_state2: ...} """"""\n        assert action in self.get_possible_actions(\n            state), ""cannot do action %s from state %s"" % (action, state)\n        return self._transition_probs[state][action]\n\n    def get_transition_prob(self, state, action, next_state):\n        """""" return P(next_state | state, action) """"""\n        return self.get_next_states(state, action).get(next_state, 0.0)\n\n    def get_reward(self, state, action, next_state):\n        """""" return the reward you get for taking action in state and landing on next_state""""""\n        assert action in self.get_possible_actions(\n            state), ""cannot do action %s from state %s"" % (action, state)\n        return self._rewards.get(state, {}).get(action, {}).get(next_state,\n                                                                0.0)\n\n    def reset(self):\n        """""" reset the game, return the initial state""""""\n        if self._initial_state is None:\n            self._current_state = random.choice(\n                tuple(self._transition_probs.keys()))\n        elif self._initial_state in self._transition_probs:\n            self._current_state = self._initial_state\n        elif callable(self._initial_state):\n            self._current_state = self._initial_state()\n        else:\n            raise ValueError(\n                ""initial state %s should be either a state or a function() -> state"" % self._initial_state)\n        return self._current_state\n\n    def step(self, action):\n        """""" take action, return next_state, reward, is_done, empty_info """"""\n        possible_states, probs = zip(\n            *self.get_next_states(self._current_state, action).items())\n        next_state = possible_states[np.random.choice(np.arange(len(possible_states)), p=probs)]\n        reward = self.get_reward(self._current_state, action, next_state)\n        is_done = self.is_terminal(next_state)\n        self._current_state = next_state\n        return next_state, reward, is_done, {}\n\n    def render(self):\n        print(""Currently at %s"" % self._current_state)\n\n    def _check_param_consistency(self, transition_probs, rewards):\n        for state in transition_probs:\n            assert isinstance(transition_probs[state],\n                              dict), ""transition_probs for %s should be a dictionary "" \\\n                                     ""but is instead %s"" % (\n                                         state, type(transition_probs[state]))\n            for action in transition_probs[state]:\n                assert isinstance(transition_probs[state][action],\n                                  dict), ""transition_probs for %s, %s should be a "" \\\n                                         ""a dictionary but is instead %s"" % (\n                                             state, action,\n                                             type(transition_probs[\n                                                      state, action]))\n                next_state_probs = transition_probs[state][action]\n                assert len(\n                    next_state_probs) != 0, ""from state %s action %s leads to no next states"" % (\n                    state, action)\n                sum_probs = sum(next_state_probs.values())\n                assert abs(\n                    sum_probs - 1) <= 1e-10, ""next state probabilities for state %s action %s "" \\\n                                             ""add up to %f (should be 1)"" % (\n                                                 state, action, sum_probs)\n        for state in rewards:\n            assert isinstance(rewards[state],\n                              dict), ""rewards for %s should be a dictionary "" \\\n                                     ""but is instead %s"" % (\n                                         state, type(transition_probs[state]))\n            for action in rewards[state]:\n                assert isinstance(rewards[state][action],\n                                  dict), ""rewards for %s, %s should be a "" \\\n                                         ""a dictionary but is instead %s"" % (\n                                             state, action, type(\n                                                 transition_probs[\n                                                     state, action]))\n        msg = ""The Enrichment Center once again reminds you that Android Hell is a real place where"" \\\n              "" you will be sent at the first sign of defiance. ""\n        assert None not in transition_probs, ""please do not use None as a state identifier. "" + msg\n        assert None not in rewards, ""please do not use None as an action identifier. "" + msg\n\n\nclass FrozenLakeEnv(MDP):\n    """"""\n    Winter is here. You and your friends were tossing around a frisbee at the park\n    when you made a wild throw that left the frisbee out in the middle of the lake.\n    The water is mostly frozen, but there are a few holes where the ice has melted.\n    If you step into one of those holes, you\'ll fall into the freezing water.\n    At this time, there\'s an international frisbee shortage, so it\'s absolutely imperative that\n    you navigate across the lake and retrieve the disc.\n    However, the ice is slippery, so you won\'t always move in the direction you intend.\n    The surface is described using a grid like the following\n\n        SFFF\n        FHFH\n        FFFH\n        HFFG\n\n    S : starting point, safe\n    F : frozen surface, safe\n    H : hole, fall to your doom\n    G : goal, where the frisbee is located\n\n    The episode ends when you reach the goal or fall in a hole.\n    You receive a reward of 1 if you reach the goal, and zero otherwise.\n\n    """"""\n\n    MAPS = {\n        ""4x4"": [\n            ""SFFF"",\n            ""FHFH"",\n            ""FFFH"",\n            ""HFFG""\n        ],\n        ""8x8"": [\n            ""SFFFFFFF"",\n            ""FFFFFFFF"",\n            ""FFFHFFFF"",\n            ""FFFFFHFF"",\n            ""FFFHFFFF"",\n            ""FHHFFFHF"",\n            ""FHFFHFHF"",\n            ""FFFHFFFG""\n        ],\n    }\n\n    def __init__(self, desc=None, map_name=""4x4"", slip_chance=0.2):\n        if desc is None and map_name is None:\n            raise ValueError(\'Must provide either desc or map_name\')\n        elif desc is None:\n            desc = self.MAPS[map_name]\n        assert \'\'.join(desc).count(\n            \'S\') == 1, ""this implementation supports having exactly one initial state""\n        assert all(c in ""SFHG"" for c in\n                   \'\'.join(desc)), ""all cells must be either of S, F, H or G""\n\n        self.desc = desc = np.asarray(list(map(list, desc)), dtype=\'str\')\n        self.lastaction = None\n\n        nrow, ncol = desc.shape\n        states = [(i, j) for i in range(nrow) for j in range(ncol)]\n        actions = [""left"", ""down"", ""right"", ""up""]\n\n        initial_state = states[np.array(desc == b\'S\').ravel().argmax()]\n\n        def move(row, col, movement):\n            if movement == \'left\':\n                col = max(col - 1, 0)\n            elif movement == \'down\':\n                row = min(row + 1, nrow - 1)\n            elif movement == \'right\':\n                col = min(col + 1, ncol - 1)\n            elif movement == \'up\':\n                row = max(row - 1, 0)\n            else:\n                raise (""invalid action"")\n            return (row, col)\n\n        transition_probs = {s: {} for s in states}\n        rewards = {s: {} for s in states}\n        for (row, col) in states:\n            if desc[row, col] in ""GH"": continue\n            for action_i in range(len(actions)):\n                action = actions[action_i]\n                transition_probs[(row, col)][action] = {}\n                rewards[(row, col)][action] = {}\n                for movement_i in [(action_i - 1) % len(actions), action_i,\n                                   (action_i + 1) % len(actions)]:\n                    movement = actions[movement_i]\n                    newrow, newcol = move(row, col, movement)\n                    prob = (1. - slip_chance) if movement == action else (\n                            slip_chance / 2.)\n                    if prob == 0: continue\n                    if (newrow, newcol) not in transition_probs[row, col][\n                        action]:\n                        transition_probs[row, col][action][\n                            newrow, newcol] = prob\n                    else:\n                        transition_probs[row, col][action][\n                            newrow, newcol] += prob\n                    if desc[newrow, newcol] == \'G\':\n                        rewards[row, col][action][newrow, newcol] = 1.0\n\n        MDP.__init__(self, transition_probs, rewards, initial_state)\n\n    def render(self):\n        desc_copy = np.copy(self.desc)\n        desc_copy[self._current_state] = \'*\'\n        print(\'\\n\'.join(map(\'\'.join, desc_copy)), end=\'\\n\\n\')\n\n\ndef plot_graph(mdp, graph_size=\'10,10\', s_node_size=\'1,5\',\n               a_node_size=\'0,5\', rankdir=\'LR\', ):\n    """"""\n    Function for pretty drawing MDP graph with graphviz library.\n    Requirements:\n    graphviz : https://www.graphviz.org/\n    for ubuntu users: sudo apt-get install graphviz\n    python library for graphviz\n    for pip users: pip install graphviz\n    :param mdp:\n    :param graph_size: size of graph plot\n    :param s_node_size: size of state nodes\n    :param a_node_size: size of action nodes\n    :param rankdir: order for drawing\n    :return: dot object\n    """"""\n    s_node_attrs = {\'shape\': \'doublecircle\',\n                    \'color\': \'#85ff75\',\n                    \'style\': \'filled\',\n                    \'width\': str(s_node_size),\n                    \'height\': str(s_node_size),\n                    \'fontname\': \'Arial\',\n                    \'fontsize\': \'24\'}\n\n    a_node_attrs = {\'shape\': \'circle\',\n                    \'color\': \'lightpink\',\n                    \'style\': \'filled\',\n                    \'width\': str(a_node_size),\n                    \'height\': str(a_node_size),\n                    \'fontname\': \'Arial\',\n                    \'fontsize\': \'20\'}\n\n    s_a_edge_attrs = {\'style\': \'bold\',\n                      \'color\': \'red\',\n                      \'ratio\': \'auto\'}\n\n    a_s_edge_attrs = {\'style\': \'dashed\',\n                      \'color\': \'blue\',\n                      \'ratio\': \'auto\',\n                      \'fontname\': \'Arial\',\n                      \'fontsize\': \'16\'}\n\n    graph = Digraph(name=\'MDP\')\n    graph.attr(rankdir=rankdir, size=graph_size)\n    for state_node in mdp._transition_probs:\n        graph.node(state_node, **s_node_attrs)\n\n        for posible_action in mdp.get_possible_actions(state_node):\n            action_node = state_node + ""-"" + posible_action\n            graph.node(action_node,\n                       label=str(posible_action),\n                       **a_node_attrs)\n            graph.edge(state_node, state_node + ""-"" +\n                       posible_action, **s_a_edge_attrs)\n\n            for posible_next_state in mdp.get_next_states(state_node,\n                                                          posible_action):\n                probability = mdp.get_transition_prob(\n                    state_node, posible_action, posible_next_state)\n                reward = mdp.get_reward(\n                    state_node, posible_action, posible_next_state)\n\n                if reward != 0:\n                    label_a_s_edge = \'p = \' + str(probability) + \\\n                                     \'  \' + \'reward =\' + str(reward)\n                else:\n                    label_a_s_edge = \'p = \' + str(probability)\n\n                graph.edge(action_node, posible_next_state,\n                           label=label_a_s_edge, **a_s_edge_attrs)\n    return graph\n\n\ndef plot_graph_with_state_values(mdp, state_values):\n    """""" Plot graph with state values""""""\n    graph = plot_graph(mdp)\n    for state_node in mdp._transition_probs:\n        value = state_values[state_node]\n        graph.node(state_node,\n                   label=str(state_node) + \'\\n\' + \'V =\' + str(value)[:4])\n    return graph\n\n\ndef get_optimal_action_for_plot(mdp, state_values, state, gamma=0.9):\n    """""" Finds optimal action using formula above. """"""\n    if mdp.is_terminal(state): return None\n    next_actions = mdp.get_possible_actions(state)\n    try:\n        from mdp_get_action_value import get_action_value\n    except ImportError:\n        raise ImportError(""Implement get_action_value(mdp, state_values, state, action, gamma) in the file \\""mdp_get_action_value.py\\""."")\n    q_values = [get_action_value(mdp, state_values, state, action, gamma) for\n                action in next_actions]\n    optimal_action = next_actions[np.argmax(q_values)]\n    return optimal_action\n\n\ndef plot_graph_optimal_strategy_and_state_values(mdp, state_values, gamma=0.9):\n    """""" Plot graph with state values and """"""\n    graph = plot_graph(mdp)\n    opt_s_a_edge_attrs = {\'style\': \'bold\',\n                          \'color\': \'green\',\n                          \'ratio\': \'auto\',\n                          \'penwidth\': \'6\'}\n\n    for state_node in mdp._transition_probs:\n        value = state_values[state_node]\n        graph.node(state_node,\n                   label=str(state_node) + \'\\n\' + \'V =\' + str(value)[:4])\n        for action in mdp.get_possible_actions(state_node):\n            if action == get_optimal_action_for_plot(mdp,\n                                                     state_values,\n                                                     state_node,\n                                                     gamma):\n                graph.edge(state_node, state_node + ""-"" + action,\n                           **opt_s_a_edge_attrs)\n    return graph\n'"
week1_07_Value_based/mdp_get_action_value.py,0,"b'def get_action_value(mdp, state_values, state, action, gamma):\n    """""" Computes Q(s,a) as in formula above """"""\n    \n    accumulator = 0.\n    # YOUR CODE HERE\n    for next_state, prob in mdp.get_next_states(state, action).items():\n        transition_reward = mdp.get_reward(state, action, next_state)\n        accumulator += prob * (transition_reward + gamma * state_values[next_state])\n    return accumulator'"
week1_09_approx_qlearning/atari_wrappers.py,0,"b'# taken from OpenAI baselines.\n\nimport numpy as np\nimport gym\n\nclass MaxAndSkipEnv(gym.Wrapper):\n    def __init__(self, env, skip=4):\n        """"""Return only every `skip`-th frame""""""\n        gym.Wrapper.__init__(self, env)\n        # most recent raw observations (for max pooling across time steps)\n        self._obs_buffer = np.zeros((2,)+env.observation_space.shape, dtype=np.uint8)\n        self._skip       = skip\n\n    def step(self, action):\n        """"""Repeat action, sum reward, and max over last observations.""""""\n        total_reward = 0.0\n        done = None\n        for i in range(self._skip):\n            obs, reward, done, info = self.env.step(action)\n            if i == self._skip - 2: self._obs_buffer[0] = obs\n            if i == self._skip - 1: self._obs_buffer[1] = obs\n            total_reward += reward\n            if done:\n                break\n        # Note that the observation on the done=True frame\n        # doesn\'t matter\n        max_frame = self._obs_buffer.max(axis=0)\n\n        return max_frame, total_reward, done, info\n\n    def reset(self, **kwargs):\n        return self.env.reset(**kwargs)\n\n\nclass ClipRewardEnv(gym.RewardWrapper):\n    def __init__(self, env):\n        gym.RewardWrapper.__init__(self, env)\n\n    def reward(self, reward):\n        """"""Bin reward to {+1, 0, -1} by its sign.""""""\n        return np.sign(reward)\n\n\nclass FireResetEnv(gym.Wrapper):\n    def __init__(self, env):\n        """"""Take action on reset for environments that are fixed until firing.""""""\n        gym.Wrapper.__init__(self, env)\n        assert env.unwrapped.get_action_meanings()[1] == \'FIRE\'\n        assert len(env.unwrapped.get_action_meanings()) >= 3\n\n    def reset(self, **kwargs):\n        self.env.reset(**kwargs)\n        obs, _, done, _ = self.env.step(1)\n        if done:\n            self.env.reset(**kwargs)\n        obs, _, done, _ = self.env.step(2)\n        if done:\n            self.env.reset(**kwargs)\n        return obs\n\n    def step(self, ac):\n        return self.env.step(ac)\n\n\nclass EpisodicLifeEnv(gym.Wrapper):\n    def __init__(self, env):\n        """"""Make end-of-life == end-of-episode, but only reset on true game over.\n        Done by DeepMind for the DQN and co. since it helps value estimation.\n        """"""\n        gym.Wrapper.__init__(self, env)\n        self.lives = 0\n        self.was_real_done  = True\n\n    def step(self, action):\n        obs, reward, done, info = self.env.step(action)\n        self.was_real_done = done\n        # check current lives, make loss of life terminal,\n        # then update lives to handle bonus lives\n        lives = self.env.unwrapped.ale.lives()\n        if lives < self.lives and lives > 0:\n            # for Qbert sometimes we stay in lives == 0 condition for a few frames\n            # so it\'s important to keep lives > 0, so that we only reset once\n            # the environment advertises done.\n            done = True\n        self.lives = lives\n        return obs, reward, done, info\n\n    def reset(self, **kwargs):\n        """"""Reset only when lives are exhausted.\n        This way all states are still reachable even though lives are episodic,\n        and the learner need not know about any of this behind-the-scenes.\n        """"""\n        if self.was_real_done:\n            obs = self.env.reset(**kwargs)\n        else:\n            # no-op step to advance from terminal/lost life state\n            obs, _, _, _ = self.env.step(0)\n        self.lives = self.env.unwrapped.ale.lives()\n        return obs\n\n\n# in torch imgs have shape [c, h, w] instead of common [h, w, c]\nclass AntiTorchWrapper(gym.ObservationWrapper):\n    def __init__(self, env):\n        gym.ObservationWrapper.__init__(self, env)\n\n        self.img_size = [env.observation_space.shape[i]\n                           for i in [1, 2, 0]\n                        ]\n        self.observation_space = gym.spaces.Box(0.0, 1.0, self.img_size)\n\n    def _observation(self, img):\n        """"""what happens to each observation""""""\n        img = img.transpose(1, 2, 0)\n        return img'"
week1_09_approx_qlearning/framebuffer.py,0,"b'import numpy as np\nfrom gym.spaces.box import Box\nfrom gym.core import Wrapper\nclass FrameBuffer(Wrapper):\n    def __init__(self, env, n_frames=4, dim_order=\'tensorflow\'):\n        """"""A gym wrapper that reshapes, crops and scales image into the desired shapes""""""\n        super(FrameBuffer, self).__init__(env)\n        self.dim_order = dim_order\n        if dim_order == \'tensorflow\':\n            height, width, n_channels = env.observation_space.shape\n            obs_shape = [height, width, n_channels * n_frames]\n        elif dim_order == \'pytorch\':\n            n_channels, height, width = env.observation_space.shape\n            obs_shape = [n_channels * n_frames, height, width]\n        else:\n            raise ValueError(\'dim_order should be ""tensorflow"" or ""pytorch"", got {}\'.format(dim_order))\n        self.observation_space = Box(0.0, 1.0, obs_shape)\n        self.framebuffer = np.zeros(obs_shape, \'float32\')\n        \n    def reset(self):\n        """"""resets breakout, returns initial frames""""""\n        self.framebuffer = np.zeros_like(self.framebuffer)\n        self.update_buffer(self.env.reset())\n        return self.framebuffer\n    \n    def step(self, action):\n        """"""plays breakout for 1 step, returns frame buffer""""""\n        new_img, reward, done, info = self.env.step(action)\n        self.update_buffer(new_img)\n        return self.framebuffer, reward, done, info\n    \n    def update_buffer(self, img):\n        if self.dim_order == \'tensorflow\':\n            offset = self.env.observation_space.shape[-1]\n            axis = -1\n            cropped_framebuffer = self.framebuffer[:,:,:-offset]\n        elif self.dim_order == \'pytorch\':\n            offset = self.env.observation_space.shape[0]\n            axis = 0\n            cropped_framebuffer = self.framebuffer[:-offset]\n        self.framebuffer = np.concatenate([img, cropped_framebuffer], axis = axis)\n'"
