file_path,api_count,code
setup.py,0,"b'from setuptools import setup\n\nversion_dict = {}\nexec(open(""./torchbearer/version.py"").read(), version_dict)\n\nimport sys\nif sys.version_info[0] >= 3:\n    from os import path\n    this_directory = path.abspath(path.dirname(__file__))\n    with open(path.join(this_directory, \'README.md\'), encoding=\'utf-8\') as f:\n        long_description = f.read()\nelse:\n    long_description = \'A model training library for pytorch\'\n\nsetup(\n    name=\'torchbearer\',\n    version=version_dict[\'__version__\'],\n    packages=[\'torchbearer\', \'torchbearer.metrics\', \'torchbearer.callbacks\', \'torchbearer.callbacks.imaging\', \'tests\', \'tests.metrics\', \'tests.callbacks\', \'tests.callbacks.imaging\'],\n    url=\'https://github.com/pytorchbearer/torchbearer\',\n    download_url=\'https://github.com/pytorchbearer/torchbearer/archive/\' + version_dict[\'__version__\'] + \'.tar.gz\',\n    classifiers=[\n        ""License :: OSI Approved :: MIT License""\n    ],\n    author=\'Matt Painter\',\n    author_email=\'mp2u16@ecs.soton.ac.uk\',\n    description=\'A model training library for pytorch\',\n    long_description=long_description,\n    long_description_content_type=\'text/markdown\',\n    install_requires=[\'torch>=1.0.0\', \'numpy\', \'tqdm\'],\n    python_requires=\'>=2.7,!=3.0.*,!=3.1.*,!=3.2.*,!=3.3.*,!=3.4.*\',\n)\n'"
docs/conf.py,1,"b'#!/usr/bin/env python3\n# -*- coding: utf-8 -*-\n#\n# torchbearer documentation build configuration file, created by\n# sphinx-quickstart on Mon Jul 16 14:35:09 2018.\n#\n# This file is execfile()d with the current directory set to its\n# containing dir.\n#\n# Note that not all possible configuration values are present in this\n# autogenerated file.\n#\n# All configuration values have a default; values that are commented out\n# serve to show the default.\n\n# If extensions (or modules to document with autodoc) are in another directory,\n# add these directories to sys.path here. If the directory is relative to the\n# documentation root, use os.path.abspath to make it absolute, like shown here.\n#\nimport os\nimport sys\n\nautodoc_mock_imports = [\'torch\', \'torch.nn.utils.clip_grad_norm\', \'torchvision\', \'torchvision.utils\', \'torchvision.datasets\', \'torchvision.datasets.folder\', \'torch.nn\', \'torch.nn.functional\', \'torch.nn.modules\', \'torch.optim\', \'torch.distributions.utils\', \'torch.distributions\', \'torch.utils\', \'torch.utils.data\', \'numpy\', \'sklearn\', \'sklearn.metrics\', \'tqdm\', \'tensorboardX\', \'tensorboardX.torchvis\', \'livelossplot\', \'IPython\']\n\nsys.path.insert(0, os.path.abspath(\'.\'))\nsys.path.insert(0, os.path.abspath(\'../\'))\nsys.path.insert(0, os.path.abspath(\'../torchbearer\'))\n\n\n# -- General configuration ------------------------------------------------\n\n# If your documentation needs a minimal Sphinx version, state it here.\n#\n# needs_sphinx = \'1.0\'\n\n# Add any Sphinx extension module names here, as strings. They can be\n# extensions coming with Sphinx (named \'sphinx.ext.*\') or your custom\n# ones.\nextensions = [\'sphinx.ext.napoleon\', \'sphinx.ext.mathjax\', \'sphinx.ext.autodoc\', \'sphinx.ext.viewcode\', \'sphinx.ext.intersphinx\']\n\n# Add any paths that contain templates here, relative to this directory.\ntemplates_path = [\'_templates\']\n\n# The suffix(es) of source filenames.\n# You can specify multiple suffix as a list of string:\n#\n# source_suffix = [\'.rst\', \'.md\']\nsource_suffix = \'.rst\'\n\n# The master toctree document.\nmaster_doc = \'index\'\n\n# General information about the project.\nproject = \'torchbearer\'\ncopyright = \'Torchbearer Contributors\'\nauthor = \'Torchbearer Contributors\'\n\n# The version info for the project you\'re documenting, acts as replacement for\n# |version| and |release|, also used in various other places throughout the\n# built documents.\n\nversion_dict = {}\nexec(open(""../torchbearer/version.py"").read(), version_dict)\n\n# The short X.Y version.\nversion = version_dict[\'__version__\']\n# The full version, including alpha/beta/rc tags.\nrelease = version_dict[\'__version__\']\n\n# The language for content autogenerated by Sphinx. Refer to documentation\n# for a list of supported languages.\n#\n# This is also used if you do content translation via gettext catalogs.\n# Usually you set ""language"" from the command line for these cases.\nlanguage = None\n\n# List of patterns, relative to source directory, that match files and\n# directories to ignore when looking for source files.\n# This patterns also effect to html_static_path and html_extra_path\nexclude_patterns = [\'_build\', \'Thumbs.db\', \'.DS_Store\']\n\n# The name of the Pygments (syntax highlighting) style to use.\npygments_style = \'sphinx\'\n\n# If true, `todo` and `todoList` produce output, else they produce nothing.\ntodo_include_todos = False\n\n\n# -- Options for HTML output ----------------------------------------------\n\n# The theme to use for HTML and HTML Help pages.  See the documentation for\n# a list of builtin themes.\n#\nhtml_theme = \'sphinx_rtd_theme\'\n\n# Theme options are theme-specific and customize the look and feel of a theme\n# further.  For a list of options available for each theme, see the\n# documentation.\n#\nhtml_theme_options = {\n    \'collapse_navigation\': False,\n    \'display_version\': True\n}\n\n# Add any paths that contain custom static files (such as style sheets) here,\n# relative to this directory. They are copied after the builtin static files,\n# so a file named ""default.css"" will overwrite the builtin ""default.css"".\nhtml_static_path = [\'_static\']\n\n# Custom sidebar templates, must be a dictionary that maps document names\n# to template names.\n#\n# This is required for the alabaster theme\n# refs: http://alabaster.readthedocs.io/en/latest/installation.html#sidebars\nhtml_sidebars = {\n    \'**\': [\n        \'relations.html\',  # needs \'show_related\': True theme option to display\n        \'searchbox.html\',\n    ]\n}\n\n\n# -- Options for HTMLHelp output ------------------------------------------\n\n# Output file base name for HTML help builder.\nhtmlhelp_basename = \'torchbearerdoc\'\n\n\n# -- Options for LaTeX output ---------------------------------------------\n\nlatex_elements = {\n    # The paper size (\'letterpaper\' or \'a4paper\').\n    #\n    # \'papersize\': \'letterpaper\',\n\n    # The font size (\'10pt\', \'11pt\' or \'12pt\').\n    #\n    # \'pointsize\': \'10pt\',\n\n    # Additional stuff for the LaTeX preamble.\n    #\n    # \'preamble\': \'\',\n\n    # Latex figure (float) alignment\n    #\n    # \'figure_align\': \'htbp\',\n}\n\n# Grouping the document tree into LaTeX files. List of tuples\n# (source start file, target name, title,\n#  author, documentclass [howto, manual, or own class]).\nlatex_documents = [\n    (master_doc, \'torchbearer.tex\', \'torchbearer Documentation\',\n     \'Torchbearer Contributors\', \'manual\'),\n]\n\n\n# -- Options for manual page output ---------------------------------------\n\n# One entry per manual page. List of tuples\n# (source start file, name, description, authors, manual section).\nman_pages = [\n    (master_doc, \'torchbearer\', \'torchbearer Documentation\',\n     [author], 1)\n]\n\n\n# -- Options for Texinfo output -------------------------------------------\n\n# Grouping the document tree into Texinfo files. List of tuples\n# (source start file, target name, title, author,\n#  dir menu entry, description, category)\ntexinfo_documents = [\n    (master_doc, \'torchbearer\', \'torchbearer Documentation\',\n     author, \'torchbearer\', \'One line description of project.\',\n     \'Miscellaneous\'),\n]\n\nhtml_scaled_image_link = False\n\n\n'"
tests/__init__.py,0,b''
