file_path,api_count,code
torchbearer/callbacks/printer.py,2,"b'from __future__ import print_function\nfrom collections import OrderedDict\nfrom functools import partial\n\nfrom tqdm import tqdm\n\nimport torchbearer\nfrom torchbearer.callbacks import Callback\n\n\ndef _format_metrics(metrics, rounder):\n    # Adapted from https://github.com/tqdm/tqdm\n    postfix = OrderedDict([])\n    for key in sorted(metrics.keys()):\n        postfix[key] = metrics[key]\n\n    for key in postfix.keys():\n        try:\n            postfix[key] = str(rounder(postfix[key]))\n        except TypeError:\n            try:\n                postfix[key] = str(list(map(rounder, postfix[key])))\n            except TypeError:\n                postfix[key] = str(postfix[key])\n    postfix = \', \'.join(key + \'=\' + postfix[key].strip() for key in postfix.keys())\n    return postfix\n\n\nclass ConsolePrinter(Callback):\n    """"""The ConsolePrinter callback simply outputs the training metrics to the console.\n\n    Example: ::\n\n        >>> import torch.nn\n        >>> from torchbearer import Trial\n        >>> from torchbearer.callbacks import ConsolePrinter\n\n        # Example Trial which forgoes the usual printer for a console printer\n        >>> printer = ConsolePrinter()\n        >>> trial = Trial(None, callbacks=[printer], verbose=0).for_steps(1).run()\n        0/1(t):\n\n    Args:\n        validation_label_letter (str): This is the letter displayed after the epoch number indicating the current phase\n            of training\n        precision (int): Precision of the number format in decimal places\n\n    State Requirements:\n        - :attr:`torchbearer.state.EPOCH`: The current epoch number\n        - :attr:`torchbearer.state.MAX_EPOCHS`: The total number of epochs for this run\n        - :attr:`torchbearer.state.BATCH`: The current batch / iteration number\n        - :attr:`torchbearer.state.STEPS`: The total number of steps / batches / iterations for this epoch\n        - :attr:`torchbearer.state.METRICS`: The metrics dict to print\n    """"""\n    def __init__(self, validation_label_letter=\'v\', precision=4):\n        super(ConsolePrinter, self).__init__()\n        self.validation_label = validation_label_letter\n        self.rounder = partial(round, ndigits=precision)\n\n    def _step(self, state, letter, steps):\n        epoch_str = \'{:d}/{:d}({:s}): \'.format(state[torchbearer.EPOCH], state[torchbearer.MAX_EPOCHS], letter)\n        batch_str = \'{:d}/{:d} \'.format(state[torchbearer.BATCH], steps)\n        stats_str = _format_metrics(state[torchbearer.METRICS], self.rounder)\n        print(\'\\r\' + epoch_str + batch_str + stats_str, end=\'\')\n\n    def _end(self, state, letter):\n        epoch_str = \'{:d}/{:d}({:s}): \'.format(state[torchbearer.EPOCH], state[torchbearer.MAX_EPOCHS], letter)\n        stats_str = _format_metrics(state[torchbearer.METRICS], self.rounder)\n        print(\'\\r\' + epoch_str + stats_str)\n\n    def on_step_training(self, state):\n        self._step(state, \'t\', state[torchbearer.STEPS])\n\n    def on_end_training(self, state):\n        self._end(state, \'t\')\n\n    def on_step_validation(self, state):\n        self._step(state, self.validation_label, state[torchbearer.STEPS])\n\n    def on_end_validation(self, state):\n        self._end(state, self.validation_label)\n\n\nclass Tqdm(Callback):\n    """"""The Tqdm callback outputs the progress and metrics for training and validation loops to the console using TQDM.\n    The given key is used to label validation output.\n\n    Example: ::\n\n        >>> import torch.nn\n        >>> from torchbearer import Trial\n        >>> from torchbearer.callbacks import Tqdm\n\n        # Example Trial which forgoes the usual printer for a customised tqdm printer.\n        >>> printer = Tqdm(precision=8)\n        # Note that outputs are written to stderr, not stdout as shown in this example\n        >>> trial = Trial(None, callbacks=[printer], verbose=0).for_steps(1).run(1)\n        0/1(t): 100%|...| 1/1 [00:00<00:00, 29.40it/s]\n\n    Args:\n        tqdm_module: The tqdm module to use. If none, defaults to tqdm or tqdm_notebook if in notebook\n        validation_label_letter (str): The letter to use for validation outputs.\n        precision (int): Precision of the number format in decimal places\n        on_epoch (bool): If True, output a single progress bar which tracks epochs\n        tqdm_args: Any extra keyword args provided here will be passed through to the tqdm module constructor.\n            See `github.com/tqdm/tqdm#parameters <https://github.com/tqdm/tqdm#parameters>`_ for more details.\n\n    State Requirements:\n        - :attr:`torchbearer.state.EPOCH`: The current epoch number\n        - :attr:`torchbearer.state.MAX_EPOCHS`: The total number of epochs for this run\n        - :attr:`torchbearer.state.STEPS`: The total number of steps / batches / iterations for this epoch\n        - :attr:`torchbearer.state.METRICS`: The metrics dict to print\n        - :attr:`torchbearer.state.HISTORY`: The history of the :class:`.Trial` object\n    """"""\n    def __init__(self, tqdm_module=None, validation_label_letter=\'v\', precision=4, on_epoch=False, **tqdm_args):\n        if torchbearer.magics.is_notebook() and tqdm_module is None:\n            from tqdm import tqdm_notebook\n            self.tqdm_module = tqdm_notebook\n        else:\n            self.tqdm_module = tqdm if tqdm_module is None else tqdm_module\n\n        self._loader = None\n        self.validation_label = validation_label_letter\n        self.rounder = partial(round, ndigits=precision)\n        self._on_epoch = on_epoch\n        self.tqdm_args = tqdm_args\n\n    def _on_start(self, state, letter):\n        bar_desc = \'{:d}/{:d}({:s})\'.format(state[torchbearer.EPOCH], state[torchbearer.MAX_EPOCHS], letter)\n        self._loader = self.tqdm_module(total=state[torchbearer.STEPS], desc=bar_desc, **self.tqdm_args)\n\n    def _update(self, state):\n        self._loader.update(1)\n        self._loader.set_postfix_str(_format_metrics(state[torchbearer.METRICS], self.rounder))\n\n    def _close(self, state):\n        self._loader.set_postfix_str(_format_metrics(state[torchbearer.METRICS], self.rounder))\n        self._loader.close()\n\n    def on_start(self, state):\n        if self._on_epoch:\n\n            n = len(state[torchbearer.HISTORY])\n            self._loader = self.tqdm_module(initial=n, total=state[torchbearer.MAX_EPOCHS], **self.tqdm_args)\n\n            if n > 0:\n                metrics = dict(state[torchbearer.HISTORY][-1])\n                try:\n                    del metrics[str(torchbearer.TRAIN_STEPS)]\n                except KeyError:\n                    pass\n\n                try:\n                    del metrics[str(torchbearer.VALIDATION_STEPS)]\n                except KeyError:\n                    pass\n                state[torchbearer.METRICS] = metrics\n                self._update(state)\n\n    def on_end_epoch(self, state):\n        if self._on_epoch:\n            self._update(state)\n\n    def on_end(self, state):\n        if self._on_epoch:\n            self._close(state)\n\n    def on_start_training(self, state):\n        """"""Initialise the TQDM bar for this training phase.\n\n        Args:\n            state (dict): The :class:`.Trial` state\n        """"""\n        if not self._on_epoch:\n            self._on_start(state, \'t\')\n\n    def on_step_training(self, state):\n        """"""Update the bar with the metrics from this step.\n\n        Args:\n            state (dict): The :class:`.Trial` state\n        """"""\n        if not self._on_epoch:\n            self._update(state)\n\n    def on_end_training(self, state):\n        """"""Update the bar with the terminal training metrics and then close.\n\n        Args:\n            state (dict): The :class:`.Trial` state\n        """"""\n        if not self._on_epoch:\n            self._close(state)\n\n    def on_start_validation(self, state):\n        """"""Initialise the TQDM bar for this validation phase.\n\n        Args:\n            state (dict): The :class:`.Trial` state\n        """"""\n        if not self._on_epoch:\n            self._on_start(state, self.validation_label)\n\n    def on_step_validation(self, state):\n        """"""Update the bar with the metrics from this step.\n\n        Args:\n            state (dict): The :class:`.Trial` state\n        """"""\n        if not self._on_epoch:\n            self._update(state)\n\n    def on_end_validation(self, state):\n        """"""Update the bar with the terminal validation metrics and then close.\n\n        Args:\n            state (dict): The :class:`.Trial` state\n        """"""\n        if not self._on_epoch:\n            self._close(state)\n'"
torchbearer/callbacks/pycm.py,1,"b'from __future__ import print_function\n\nimport torch\n\nimport torchbearer\nfrom torchbearer import Callback\nfrom torchbearer.bases import cite\nfrom torchbearer.metrics import EpochLambda, MetricList\n\n\npycm_bib = """"""\n@article{Haghighi2018,\n  doi = {10.21105/joss.00729},\n  url = {https://doi.org/10.21105/joss.00729},\n  year  = {2018},\n  month = {may},\n  publisher = {The Open Journal},\n  volume = {3},\n  number = {25},\n  pages = {729},\n  author = {Sepand Haghighi and Masoomeh Jasemi and Shaahin Hessabi and Alireza Zolanvari},\n  title = {{PyCM}: Multiclass confusion matrix library in Python},\n  journal = {Journal of Open Source Software}\n}\n""""""\n\n\ndef _to_pyplot(normalize=False, title=\'Confusion matrix\', cmap=None):\n    """"""\n    This function modified to plots the ConfusionMatrix object.\n    Normalization can be applied by setting `normalize=True`.\n\n    Code Reference :\n    http://scikit-learn.org/stable/auto_examples/model_selection/plot_confusion_matrix.html\n\n    """"""\n    import matplotlib.pyplot as plt\n    import itertools\n    import numpy as np\n\n    if cmap is None:\n        cmap = plt.cm.Blues\n\n    def handler(cm, state):\n        string_state = {str(key): state[key] for key in state.keys()}\n        plt_cm = []\n        for i in cm.classes:\n            row = []\n            for j in cm.classes:\n                row.append(cm.table[i][j])\n            plt_cm.append(row)\n        plt_cm = np.array(plt_cm)\n        if normalize:\n            plt_cm = plt_cm.astype(\'float\') / plt_cm.sum(axis=1)[:, np.newaxis]\n        plt.imshow(plt_cm, interpolation=\'nearest\', cmap=cmap)\n        plt.title(title.format(**string_state))\n        plt.colorbar()\n        tick_marks = np.arange(len(cm.classes))\n        plt.xticks(tick_marks, cm.classes, rotation=45)\n        plt.yticks(tick_marks, cm.classes)\n\n        fmt = \'.2f\' if normalize else \'d\'\n        thresh = plt_cm.max() / 2.\n        for i, j in itertools.product(range(plt_cm.shape[0]), range(plt_cm.shape[1])):\n            plt.text(j, i, format(plt_cm[i, j], fmt),\n                     horizontalalignment=""center"",\n                     color=""white"" if plt_cm[i, j] > thresh else ""black"")\n\n        plt.tight_layout()\n        plt.ylabel(\'Actual\')\n        plt.xlabel(\'Predict\')\n        plt.show()\n    return handler\n\n\n@cite(pycm_bib)\nclass PyCM(Callback):\n    """"""Create confusion matrices using the `PyCM library <https://github.com/sepandhaghighi/pycm>`_.\n\n    Args:\n        kwargs: Additional keyword args to pass to the `ConfusionMatrix` call\n    """"""\n    def __init__(self, **kwargs):\n        import sys\n        if sys.version_info[0] < 3:\n            raise Exception(\'PyCM requires Python>=3!\')\n        self._handlers = []\n\n        self.kwargs = kwargs\n\n    def _add_metric(self, state):\n        from pycm import ConfusionMatrix\n\n        def make_cm(y_pred, y_true):\n            _, y_pred = torch.max(y_pred, 1)\n            cm = ConfusionMatrix(y_true.cpu().numpy(), y_pred.cpu().numpy(), **self.kwargs)\n            for handler in self._handlers:\n                handler(cm, state)\n\n        my_metric = EpochLambda(\'pycm\', make_cm, False)\n        my_metric.reset(state)\n        state[torchbearer.METRIC_LIST] = MetricList([state[torchbearer.METRIC_LIST], my_metric])\n\n    def on_train(self):\n        """"""Process this callback for training batches\n\n        Returns:\n            PyCM: self\n        """"""\n        _old_start_training = self.on_start_training\n\n        def wrapper(state):\n            _old_start_training(state)\n            self._add_metric(state)\n\n        self.on_start_training = wrapper\n        return self\n\n    def on_val(self):\n        """"""Process this callback for validation batches\n\n        Returns:\n            PyCM: self\n        """"""\n        _old_start_validation = self.on_start_validation\n\n        def wrapper(state):\n            _old_start_validation(state)\n            if state[torchbearer.DATA] is torchbearer.VALIDATION_DATA:\n                self._add_metric(state)\n\n        self.on_start_validation = wrapper\n        return self\n\n    def on_test(self):\n        """"""Process this callback for test batches\n\n        Returns:\n            PyCM: self\n        """"""\n        _old_start_validation = self.on_start_validation\n\n        def wrapper(state):\n            _old_start_validation(state)\n            if state[torchbearer.DATA] is torchbearer.TEST_DATA:\n                self._add_metric(state)\n\n        self.on_start_validation = wrapper\n        return self\n\n    def with_handler(self, handler):\n        """"""Append the given output handler to the list of handlers\n\n        Args:\n            handler: A function of confusion and matrix and state\n\n        Returns:\n            PyCM: self\n        """"""\n        self._handlers.append(handler)\n        return self\n\n    def to_state(self, key):\n        """"""Send `ConfusionMatrix` objects from this callback to the given state key\n\n        Args:\n            key (StateKey): The key to store the confusion matrix in\n\n        Returns:\n            PyCM: self\n        """"""\n        def handler(cm, state):\n            state[key] = cm\n        return self.with_handler(handler)\n\n    def to_console(self):\n        """"""Print `ConfusionMatrix` objects from this callback to the console\n\n        Returns:\n            PyCM: self\n        """"""\n        return self.with_handler(lambda cm, _: print(cm))\n\n    def to_pycm_file(self, filename, *args, **kwargs):\n        """"""Save `ConfusionMatrix` objects from this callback to `.pycm` files\n\n        Args:\n            filename (str): The name of the file, will be formatted with state to create unique filenames if desired\n\n        See:\n            `PyCM Source (save_stat) <https://github.com/sepandhaghighi/pycm/blob/master/pycm/pycm_obj.py>`_\n\n        Returns:\n            PyCM: self\n        """"""\n        def handler(cm, state):\n            string_state = {str(key): state[key] for key in state.keys()}\n            cm.save_stat(filename.format(**string_state), *args, **kwargs)\n        return self.with_handler(handler)\n\n    def to_html_file(self, filename, *args, **kwargs):\n        """"""Save `ConfusionMatrix` objects from this callback to `.html` files\n\n        Args:\n            filename (str): The name of the file, will be formatted with state to create unique filenames if desired\n\n        See:\n            `PyCM Source (save_html) <https://github.com/sepandhaghighi/pycm/blob/master/pycm/pycm_obj.py>`_\n\n        Returns:\n            PyCM: self\n        """"""\n        def handler(cm, state):\n            string_state = {str(key): state[key] for key in state.keys()}\n            cm.save_html(filename.format(**string_state), *args, **kwargs)\n        return self.with_handler(handler)\n\n    def to_csv_file(self, filename, *args, **kwargs):\n        """"""Save `ConfusionMatrix` objects from this callback to `.csv` files\n\n        Args:\n            filename (str): The name of the file, will be formatted with state to create unique filenames if desired\n\n        See:\n            `PyCM Source (save_csv) <https://github.com/sepandhaghighi/pycm/blob/master/pycm/pycm_obj.py>`_\n\n        Returns:\n            PyCM: self\n        """"""\n        def handler(cm, state):\n            string_state = {str(key): state[key] for key in state.keys()}\n            cm.save_csv(filename.format(**string_state), *args, **kwargs)\n        return self.with_handler(handler)\n\n    def to_obj_file(self, filename, *args, **kwargs):\n        """"""Save `ConfusionMatrix` objects from this callback to `.obj` files\n\n        Args:\n            filename (str): The name of the file, will be formatted with state to create unique filenames if desired\n\n        See:\n            `PyCM Source (save_obj) <https://github.com/sepandhaghighi/pycm/blob/master/pycm/pycm_obj.py>`_\n\n        Returns:\n            PyCM: self\n        """"""\n        def handler(cm, state):\n            string_state = {str(key): state[key] for key in state.keys()}\n            cm.save_obj(filename.format(**string_state), *args, **kwargs)\n        return self.with_handler(handler)\n\n    def to_pyplot(self, normalize=False, title=\'Confusion matrix\', cmap=None):\n        """"""Plot `ConfusionMatrix` objects from this callback with `matplotlib.pyplot`\n\n        Args:\n            normalize (bool): If true, normalize the confusion matrix\n            title (str): Title to use for the plot, will be formatted with state to create unique titles if desired\n            cmap: Colour map object to use for the plot, defaults to `plt.cm.Blues` if None\n\n        See:\n            `PyCM Source <https://github.com/sepandhaghighi/pycm/blob/master/pycm/pycm_obj.py>`_\n\n        Returns:\n            PyCM: self\n        """"""\n        return self.with_handler(_to_pyplot(normalize=normalize, title=title, cmap=cmap))\n'"
torchbearer/callbacks/sample_pairing.py,1,"b'import torch\n\nimport torchbearer\nfrom torchbearer import cite\nfrom torchbearer.callbacks import Callback, only_if, once_per_epoch\n\n\nbibtex = """"""\n@article{inoue2018data,\n  title={Data augmentation by pairing samples for images classification},\n  author={Inoue, Hiroshi},\n  journal={arXiv preprint arXiv:1801.02929},\n  year={2018}\n}\n""""""\n\n\n@cite(bibtex)\nclass SamplePairing(Callback):\n    """"""Perform SamplePairing on the model inputs. This is the process of averaging each image with another random image\n    without changing the targets. The key here is to use the policy function to only do this some of the time.\n\n    Example: ::\n\n        >>> from torchbearer import Trial\n        >>> from torchbearer.callbacks import SamplePairing\n\n        # Example Trial which does Sample Pairing regularisation with the policy from the paper\n        >>> pairing = SamplePairing()\n        >>> trial = Trial(None, criterion=Mixup.loss, callbacks=[pairing], metrics=[\'acc\'])\n\n    Args:\n        policy: A function of state which returns True if the current batch should be paired.\n    """"""\n\n    @staticmethod\n    def default_policy(start_epoch, end_epoch, on_epochs, off_epochs):\n        """"""Return a policy which performs sample pairing according to the process defined in the paper.\n\n        Args:\n            start_epoch (int): Epoch to start pairing on\n            end_epoch (int): Epoch to end pairing on (and begin fine-tuning)\n            on_epochs (int): Number of epochs to run sample pairing for before a break\n            off_epochs (int): Number of epochs to break for\n\n        Returns:\n            A policy function\n        """"""\n        cache = {\'tick\': 0, \'on\': False}\n\n        @once_per_epoch\n        def compute(state):\n            if start_epoch <= state[torchbearer.EPOCH] < end_epoch:\n                if cache[\'tick\'] < on_epochs:\n                    cache[\'on\'] = True\n                else:\n                    cache[\'on\'] = False\n\n                cache[\'tick\'] = cache[\'tick\'] + 1\n                if cache[\'tick\'] == (on_epochs + off_epochs):\n                    cache[\'tick\'] = 0\n                    cache[\'on\'] = False\n            else:\n                cache[\'on\'] = False\n\n        def policy(state):\n            compute(state)\n            return cache[\'on\']\n\n        return policy\n\n    def __init__(self, policy=None):\n        self.on_sample = only_if(SamplePairing.default_policy(100, 800, 8, 2) if policy is None else policy)(self.on_sample)\n\n    def on_sample(self, state):\n        permutation = torch.randperm(state[torchbearer.X].size(0))\n        state[torchbearer.INPUT] = (state[torchbearer.INPUT] + state[torchbearer.INPUT][permutation]) / 2.\n'"
