file_path,api_count,code
segmentation/train_utils.py,4,"b'#============================================\n__author__ = ""Sachin Mehta""\n__license__ = ""MIT""\n__maintainer__ = ""Sachin Mehta""\n#============================================\nfrom IOUEval import iouEval\nimport time\nimport torch\nimport numpy as np\n\n\ndef poly_lr_scheduler(args, optimizer, epoch, power=0.9):\n    lr = round(args.lr * (1 - epoch / args.max_epochs) ** power, 8)\n    for param_group in optimizer.param_groups:\n        param_group[\'lr\'] = lr\n\n    return lr\n\ndef val(args, val_loader, model, criterion):\n    \'\'\'\n    :param args: general arguments\n    :param val_loader: loaded for validation dataset\n    :param model: model\n    :param criterion: loss function\n    :return: average epoch loss, overall pixel-wise accuracy, per class accuracy, per class iu, and mIOU\n    \'\'\'\n    #switch to evaluation mode\n    model.eval()\n\n    iouEvalVal = iouEval(args.classes)\n\n    epoch_loss = []\n\n    total_batches = len(val_loader)\n    for i, (input, target) in enumerate(val_loader):\n        start_time = time.time()\n\n        if args.onGPU:\n            input = input.cuda(non_blocking=True) #torch.autograd.Variable(input, volatile=True)\n            target = target.cuda(non_blocking=True)#torch.autograd.Variable(target, volatile=True)\n\n        # run the mdoel\n        output1 = model(input)\n\n        # compute the loss\n        loss = criterion(output1, target)\n\n        epoch_loss.append(loss.item())\n\n        time_taken = time.time() - start_time\n\n        # compute the confusion matrix\n        iouEvalVal.addBatch(output1.max(1)[1].data, target.data)\n\n        print(\'[%d/%d] loss: %.3f time: %.2f\' % (i, total_batches, loss.item(), time_taken))\n\n    average_epoch_loss_val = sum(epoch_loss) / len(epoch_loss)\n\n    overall_acc, per_class_acc, per_class_iu, mIOU = iouEvalVal.getMetric()\n\n    return average_epoch_loss_val, overall_acc, per_class_acc, per_class_iu, mIOU\n\ndef train(args, train_loader, model, criterion, optimizer, epoch):\n    \'\'\'\n    :param args: general arguments\n    :param train_loader: loaded for training dataset\n    :param model: model\n    :param criterion: loss function\n    :param optimizer: optimization algo, such as ADAM or SGD\n    :param epoch: epoch number\n    :return: average epoch loss, overall pixel-wise accuracy, per class accuracy, per class iu, and mIOU\n    \'\'\'\n    # switch to train mode\n    model.train()\n\n    iouEvalTrain = iouEval(args.classes)\n\n    epoch_loss = []\n\n    total_batches = len(train_loader)\n    for i, (input, target) in enumerate(train_loader):\n        start_time = time.time()\n\n        if args.onGPU:\n            input = input.cuda(non_blocking=True) #torch.autograd.Variable(input, volatile=True)\n            target = target.cuda(non_blocking=True)\n\n        #run the mdoel\n        output1, output2 = model(input)\n\n        #set the grad to zero\n        optimizer.zero_grad()\n        loss1 = criterion(output1, target)\n        loss2 = criterion(output2, target)\n        loss = loss1 + loss2\n\n        optimizer.zero_grad()\n        loss.backward()\n        optimizer.step()\n\n        epoch_loss.append(loss.item())\n        time_taken = time.time() - start_time\n\n        #compute the confusion matrix\n        iouEvalTrain.addBatch(output1.max(1)[1].data, target.data)\n\n        print(\'[%d/%d] loss: %.3f time:%.2f\' % (i, total_batches, loss.item(), time_taken))\n\n    average_epoch_loss_train = sum(epoch_loss) / len(epoch_loss)\n\n    overall_acc, per_class_acc, per_class_iu, mIOU = iouEvalTrain.getMetric()\n\n    return average_epoch_loss_train, overall_acc, per_class_acc, per_class_iu, mIOU\n\ndef save_checkpoint(state, filenameCheckpoint=\'checkpoint.pth.tar\'):\n    \'\'\'\n    helper function to save the checkpoint\n    :param state: model state\n    :param filenameCheckpoint: where to save the checkpoint\n    :return: nothing\n    \'\'\'\n    torch.save(state, filenameCheckpoint)\n\ndef netParams(model):\n    \'\'\'\n    helper function to see total network parameters\n    :param model: model\n    :return: total network parameters\n    \'\'\'\n    return np.sum([np.prod(parameter.size()) for parameter in model.parameters()])'"
segmentation/cnn/Model.py,5,"b'from torch.nn import init\nimport torch.nn.functional as F\nfrom cnn.cnn_utils import *\nimport math\nimport torch\n\n__author__ = ""Sachin Mehta""\n__version__ = ""1.0.1""\n__maintainer__ = ""Sachin Mehta""\n\nclass EESP(nn.Module):\n    \'\'\'\n    This class defines the EESP block, which is based on the following principle\n        REDUCE ---> SPLIT ---> TRANSFORM --> MERGE\n    \'\'\'\n\n    def __init__(self, nIn, nOut, stride=1, k=4, r_lim=7, down_method=\'esp\'): #down_method --> [\'avg\' or \'esp\']\n        \'\'\'\n        :param nIn: number of input channels\n        :param nOut: number of output channels\n        :param stride: factor by which we should skip (useful for down-sampling). If 2, then down-samples the feature map by 2\n        :param k: # of parallel branches\n        :param r_lim: A maximum value of receptive field allowed for EESP block\n        :param g: number of groups to be used in the feature map reduction step.\n        \'\'\'\n        super().__init__()\n        self.stride = stride\n        n = int(nOut / k)\n        n1 = nOut - (k - 1) * n\n        assert down_method in [\'avg\', \'esp\'], \'One of these is suppported (avg or esp)\'\n        assert n == n1, ""n(={}) and n1(={}) should be equal for Depth-wise Convolution "".format(n, n1)\n        #assert nIn%k == 0, ""Number of input channels ({}) should be divisible by # of branches ({})"".format(nIn, k)\n        #assert n % k == 0, ""Number of output channels ({}) should be divisible by # of branches ({})"".format(n, k)\n        self.proj_1x1 = CBR(nIn, n, 1, stride=1, groups=k)\n\n        # (For convenience) Mapping between dilation rate and receptive field for a 3x3 kernel\n        map_receptive_ksize = {3: 1, 5: 2, 7: 3, 9: 4, 11: 5, 13: 6, 15: 7, 17: 8}\n        self.k_sizes = list()\n        for i in range(k):\n            ksize = int(3 + 2 * i)\n            # After reaching the receptive field limit, fall back to the base kernel size of 3 with a dilation rate of 1\n            ksize = ksize if ksize <= r_lim else 3\n            self.k_sizes.append(ksize)\n        # sort (in ascending order) these kernel sizes based on their receptive field\n        # This enables us to ignore the kernels (3x3 in our case) with the same effective receptive field in hierarchical\n        # feature fusion because kernels with 3x3 receptive fields does not have gridding artifact.\n        self.k_sizes.sort()\n        self.spp_dw = nn.ModuleList()\n        #self.bn = nn.ModuleList()\n        for i in range(k):\n            d_rate = map_receptive_ksize[self.k_sizes[i]]\n            self.spp_dw.append(CDilated(n, n, kSize=3, stride=stride, groups=n, d=d_rate))\n            #self.bn.append(nn.BatchNorm2d(n))\n        self.conv_1x1_exp = CB(nOut, nOut, 1, 1, groups=k)\n        self.br_after_cat = BR(nOut)\n        self.module_act = nn.PReLU(nOut)\n        self.downAvg = True if down_method == \'avg\' else False\n\n    def forward(self, input):\n        \'\'\'\n        :param input: input feature map\n        :return: transformed feature map\n        \'\'\'\n\n        # Reduce --> project high-dimensional feature maps to low-dimensional space\n        output1 = self.proj_1x1(input)\n        output = [self.spp_dw[0](output1)]\n        # compute the output for each branch and hierarchically fuse them\n        # i.e. Split --> Transform --> HFF\n        for k in range(1, len(self.spp_dw)):\n            out_k = self.spp_dw[k](output1)\n            # HFF\n            # We donot combine the branches that have the same effective receptive (3x3 in our case)\n            # because there are no holes in those kernels.\n            out_k = out_k + output[k - 1]\n            #apply batch norm after fusion and then append to the list\n            output.append(out_k)\n        # Merge\n        expanded = self.conv_1x1_exp( # Aggregate the feature maps using point-wise convolution\n            self.br_after_cat( # apply batch normalization followed by activation function (PRelu in this case)\n                torch.cat(output, 1) # concatenate the output of different branches\n            )\n        )\n        del output\n        # if down-sampling, then return the concatenated vector\n        # as Downsampling function will combine it with avg. pooled feature map and then threshold it\n        if self.stride == 2 and self.downAvg:\n            return expanded\n\n        # if dimensions of input and concatenated vector are the same, add them (RESIDUAL LINK)\n        if expanded.size() == input.size():\n            expanded = expanded + input\n\n        # Threshold the feature map using activation function (PReLU in this case)\n        return self.module_act(expanded)\n\n\nclass DownSampler(nn.Module):\n    \'\'\'\n    Down-sampling fucntion that has two parallel branches: (1) avg pooling\n    and (2) EESP block with stride of 2. The output feature maps of these branches\n    are then concatenated and thresholded using an activation function (PReLU in our\n    case) to produce the final output.\n    \'\'\'\n\n    def __init__(self, nin, nout, k=4, r_lim=9, reinf=True):\n        \'\'\'\n            :param nin: number of input channels\n            :param nout: number of output channels\n            :param k: # of parallel branches\n            :param r_lim: A maximum value of receptive field allowed for EESP block\n            :param g: number of groups to be used in the feature map reduction step.\n        \'\'\'\n        super().__init__()\n        nout_new = nout - nin\n        self.eesp = EESP(nin, nout_new, stride=2, k=k, r_lim=r_lim, down_method=\'avg\')\n        self.avg = nn.AvgPool2d(kernel_size=3, padding=1, stride=2)\n        if reinf:\n            self.inp_reinf = nn.Sequential(\n                CBR(config_inp_reinf, config_inp_reinf, 3, 1),\n                CB(config_inp_reinf, nout, 1, 1)\n            )\n        self.act =  nn.PReLU(nout)\n\n    def forward(self, input, input2=None):\n        \'\'\'\n        :param input: input feature map\n        :return: feature map down-sampled by a factor of 2\n        \'\'\'\n        avg_out = self.avg(input)\n        eesp_out = self.eesp(input)\n        output = torch.cat([avg_out, eesp_out], 1)\n        if input2 is not None:\n            #assuming the input is a square image\n            w1 = avg_out.size(2)\n            while True:\n                input2 = F.avg_pool2d(input2, kernel_size=3, padding=1, stride=2)\n                w2 = input2.size(2)\n                if w2 == w1:\n                    break\n            output = output + self.inp_reinf(input2)\n\n        return self.act(output) #self.act(output)\n\nclass EESPNet(nn.Module):\n    \'\'\'\n    This class defines the ESPNetv2 architecture for the ImageNet classification\n    \'\'\'\n\n    def __init__(self, classes=20, s=1):\n        \'\'\'\n        :param classes: number of classes in the dataset. Default is 20 for the cityscapes\n        :param s: factor that scales the number of output feature maps\n        \'\'\'\n        super().__init__()\n        reps = [0, 3, 7, 3]  # how many times EESP blocks should be repeated.\n        channels = 3\n\n        r_lim = [13, 11, 9, 7, 5]  # receptive field at each spatial level\n        K = [4]*len(r_lim) # No. of parallel branches at different levels\n\n        base = 32 #base configuration\n        config_len = 5\n        config = [base] * config_len\n        base_s = 0\n        for i in range(config_len):\n            if i== 0:\n                base_s = int(base * s)\n                base_s = math.ceil(base_s / K[0]) * K[0]\n                config[i] = base if base_s > base else base_s\n            else:\n                config[i] = base_s * pow(2, i)\n        if s <= 1.5:\n            config.append(1024)\n        elif s in [1.5, 2]:\n            config.append(1280)\n        else:\n            ValueError(\'Configuration not supported\')\n\n        #print(\'Config: \', config)\n\n        global config_inp_reinf\n        config_inp_reinf = 3\n        self.input_reinforcement = True\n        assert len(K) == len(r_lim), \'Length of branching factor array and receptive field array should be the same.\'\n\n        self.level1 = CBR(channels, config[0], 3, 2)  # 112 L1\n\n        self.level2_0 = DownSampler(config[0], config[1], k=K[0], r_lim=r_lim[0], reinf=self.input_reinforcement)  # out = 56\n        self.level3_0 = DownSampler(config[1], config[2], k=K[1], r_lim=r_lim[1], reinf=self.input_reinforcement) # out = 28\n        self.level3 = nn.ModuleList()\n        for i in range(reps[1]):\n            self.level3.append(EESP(config[2], config[2], stride=1, k=K[2], r_lim=r_lim[2]))\n\n        self.level4_0 = DownSampler(config[2], config[3], k=K[2], r_lim=r_lim[2], reinf=self.input_reinforcement) #out = 14\n        self.level4 = nn.ModuleList()\n        for i in range(reps[2]):\n            self.level4.append(EESP(config[3], config[3], stride=1, k=K[3], r_lim=r_lim[3]))\n\n        self.level5_0 = DownSampler(config[3], config[4], k=K[3], r_lim=r_lim[3]) #7\n        self.level5 = nn.ModuleList()\n        for i in range(reps[3]):\n            self.level5.append(EESP(config[4], config[4], stride=1, k=K[4], r_lim=r_lim[4]))\n\n        # expand the feature maps using depth-wise separable convolution\n        self.level5.append(CBR(config[4], config[4], 3, 1, groups=config[4]))\n        self.level5.append(CBR(config[4], config[5], 1, 1, groups=K[4]))\n\n\n\n        #self.level5_exp = nn.ModuleList()\n        #assert config[5]%config[4] == 0, \'{} should be divisible by {}\'.format(config[5], config[4])\n        #gr = int(config[5]/config[4])\n        #for i in range(gr):\n        #    self.level5_exp.append(CBR(config[4], config[4], 1, 1, groups=pow(2, i)))\n\n        self.classifier = nn.Linear(config[5], classes)\n        self.init_params()\n\n    def init_params(self):\n        \'\'\'\n        Function to initialze the parameters\n        \'\'\'\n        for m in self.modules():\n            if isinstance(m, nn.Conv2d):\n                init.kaiming_normal_(m.weight, mode=\'fan_out\')\n                if m.bias is not None:\n                    init.constant_(m.bias, 0)\n            elif isinstance(m, nn.BatchNorm2d):\n                init.constant_(m.weight, 1)\n                init.constant_(m.bias, 0)\n            elif isinstance(m, nn.Linear):\n                init.normal_(m.weight, std=0.001)\n                if m.bias is not None:\n                    init.constant_(m.bias, 0)\n\n    def forward(self, input, p=0.2, seg=True):\n        \'\'\'\n        :param input: Receives the input RGB image\n        :return: a C-dimensional vector, C=# of classes\n        \'\'\'\n        out_l1 = self.level1(input)  # 112\n        if not self.input_reinforcement:\n            del input\n            input = None\n\n        out_l2 = self.level2_0(out_l1, input)  # 56\n\n        out_l3_0 = self.level3_0(out_l2, input)  # out_l2_inp_rein\n        for i, layer in enumerate(self.level3):\n            if i == 0:\n                out_l3 = layer(out_l3_0)\n            else:\n                out_l3 = layer(out_l3)\n\n        out_l4_0 = self.level4_0(out_l3, input)  # down-sampled\n        for i, layer in enumerate(self.level4):\n            if i == 0:\n                out_l4 = layer(out_l4_0)\n            else:\n                out_l4 = layer(out_l4)\n\n        if not seg:\n            out_l5_0 = self.level5_0(out_l4)  # down-sampled\n            for i, layer in enumerate(self.level5):\n                if i == 0:\n                    out_l5 = layer(out_l5_0)\n                else:\n                    out_l5 = layer(out_l5)\n\n            #out_e = []\n            #for layer in self.level5_exp:\n            #    out_e.append(layer(out_l5))\n            #out_exp = torch.cat(out_e, dim=1)\n\n\n\n            output_g = F.adaptive_avg_pool2d(out_l5, output_size=1)\n            output_g = F.dropout(output_g, p=p, training=self.training)\n            output_1x1 = output_g.view(output_g.size(0), -1)\n\n            return self.classifier(output_1x1)\n        return out_l1, out_l2, out_l3, out_l4\n\n\n'"
segmentation/cnn/SegmentationModel.py,6,"b'#============================================\n__author__ = ""Sachin Mehta""\n__license__ = ""MIT""\n__maintainer__ = ""Sachin Mehta""\n#============================================\nimport torch\nfrom torch import nn\n\nfrom cnn.Model import EESPNet, EESP\nimport os\nimport torch.nn.functional as F\nfrom cnn.cnn_utils import *\n\nclass EESPNet_Seg(nn.Module):\n    def __init__(self, classes=20, s=1, pretrained=None, gpus=1):\n        super().__init__()\n        classificationNet = EESPNet(classes=1000, s=s)\n        if gpus >=1:\n            classificationNet = nn.DataParallel(classificationNet)\n        # load the pretrained weights\n        if pretrained:\n            if not os.path.isfile(pretrained):\n                print(\'Weight file does not exist. Training without pre-trained weights\')\n            print(\'Model initialized with pretrained weights\')\n            classificationNet.load_state_dict(torch.load(pretrained))\n\n        self.net = classificationNet.module\n\n        del classificationNet\n        # delete last few layers\n        del self.net.classifier\n        del self.net.level5\n        del self.net.level5_0\n        if s <=0.5:\n            p = 0.1\n        else:\n            p=0.2\n\n        self.proj_L4_C = CBR(self.net.level4[-1].module_act.num_parameters, self.net.level3[-1].module_act.num_parameters, 1, 1)\n        pspSize = 2*self.net.level3[-1].module_act.num_parameters\n        self.pspMod = nn.Sequential(EESP(pspSize, pspSize //2, stride=1, k=4, r_lim=7),\n                PSPModule(pspSize // 2, pspSize //2))\n        self.project_l3 = nn.Sequential(nn.Dropout2d(p=p), C(pspSize // 2, classes, 1, 1))\n        self.act_l3 = BR(classes)\n        self.project_l2 = CBR(self.net.level2_0.act.num_parameters + classes, classes, 1, 1)\n        self.project_l1 = nn.Sequential(nn.Dropout2d(p=p), C(self.net.level1.act.num_parameters + classes, classes, 1, 1))\n\n    def hierarchicalUpsample(self, x, factor=3):\n        for i in range(factor):\n            x = F.interpolate(x, scale_factor=2, mode=\'bilinear\', align_corners=True)\n        return x\n\n\n    def forward(self, input):\n        out_l1, out_l2, out_l3, out_l4 = self.net(input, seg=True)\n        out_l4_proj = self.proj_L4_C(out_l4)\n        up_l4_to_l3 = F.interpolate(out_l4_proj, scale_factor=2, mode=\'bilinear\', align_corners=True)\n        merged_l3_upl4 = self.pspMod(torch.cat([out_l3, up_l4_to_l3], 1))\n        proj_merge_l3_bef_act = self.project_l3(merged_l3_upl4)\n        proj_merge_l3 = self.act_l3(proj_merge_l3_bef_act)\n        out_up_l3 = F.interpolate(proj_merge_l3, scale_factor=2, mode=\'bilinear\', align_corners=True)\n        merge_l2 = self.project_l2(torch.cat([out_l2, out_up_l3], 1))\n        out_up_l2 = F.interpolate(merge_l2, scale_factor=2, mode=\'bilinear\', align_corners=True)\n        merge_l1 = self.project_l1(torch.cat([out_l1, out_up_l2], 1))\n        if self.training:\n            return F.interpolate(merge_l1, scale_factor=2, mode=\'bilinear\', align_corners=True), self.hierarchicalUpsample(proj_merge_l3_bef_act)\n        else:\n            return F.interpolate(merge_l1, scale_factor=2, mode=\'bilinear\', align_corners=True)\n\n\nif __name__ == \'__main__\':\n    input = torch.Tensor(1, 3, 512, 1024).cuda()\n    net = EESPNet_Seg(classes=20, s=2).cuda()\n    out_x_8 = net(input)\n    print(out_x_8.size())\n\n'"
segmentation/cnn/cnn_utils.py,3,"b'import torch.nn as nn\nimport torch\nimport torch.nn.functional as F\n\n\n__author__ = ""Sachin Mehta""\n__version__ = ""1.0.1""\n__maintainer__ = ""Sachin Mehta""\n\n\nclass PSPModule(nn.Module):\n    def __init__(self, features, out_features=1024, sizes=(1, 2, 4, 8)):\n        super().__init__()\n        self.stages = []\n        self.stages = nn.ModuleList([C(features, features, 3, 1, groups=features) for size in sizes])\n        self.project = CBR(features * (len(sizes) + 1), out_features, 1, 1)\n \n    def forward(self, feats):\n        h, w = feats.size(2), feats.size(3)\n        out = [feats]\n        for stage in self.stages:\n            feats = F.avg_pool2d(feats, kernel_size=3, stride=2, padding=1)\n            upsampled = F.interpolate(input=stage(feats), size=(h, w), mode=\'bilinear\', align_corners=True)\n            out.append(upsampled)\n        return self.project(torch.cat(out, dim=1))\n\nclass CBR(nn.Module):\n    \'\'\'\n    This class defines the convolution layer with batch normalization and PReLU activation\n    \'\'\'\n\n    def __init__(self, nIn, nOut, kSize, stride=1, groups=1):\n        \'\'\'\n\n        :param nIn: number of input channels\n        :param nOut: number of output channels\n        :param kSize: kernel size\n        :param stride: stride rate for down-sampling. Default is 1\n        \'\'\'\n        super().__init__()\n        padding = int((kSize - 1) / 2)\n        self.conv = nn.Conv2d(nIn, nOut, kSize, stride=stride, padding=padding, bias=False, groups=groups)\n        self.bn = nn.BatchNorm2d(nOut)\n        self.act = nn.PReLU(nOut)\n\n    def forward(self, input):\n        \'\'\'\n        :param input: input feature map\n        :return: transformed feature map\n        \'\'\'\n        output = self.conv(input)\n        # output = self.conv1(output)\n        output = self.bn(output)\n        output = self.act(output)\n        return output\n\n\nclass BR(nn.Module):\n    \'\'\'\n        This class groups the batch normalization and PReLU activation\n    \'\'\'\n\n    def __init__(self, nOut):\n        \'\'\'\n        :param nOut: output feature maps\n        \'\'\'\n        super().__init__()\n        self.bn = nn.BatchNorm2d(nOut)\n        self.act = nn.PReLU(nOut)\n\n    def forward(self, input):\n        \'\'\'\n        :param input: input feature map\n        :return: normalized and thresholded feature map\n        \'\'\'\n        output = self.bn(input)\n        output = self.act(output)\n        return output\n\n\nclass CB(nn.Module):\n    \'\'\'\n       This class groups the convolution and batch normalization\n    \'\'\'\n\n    def __init__(self, nIn, nOut, kSize, stride=1, groups=1):\n        \'\'\'\n        :param nIn: number of input channels\n        :param nOut: number of output channels\n        :param kSize: kernel size\n        :param stride: optinal stide for down-sampling\n        \'\'\'\n        super().__init__()\n        padding = int((kSize - 1) / 2)\n        self.conv = nn.Conv2d(nIn, nOut, kSize, stride=stride, padding=padding, bias=False,\n                              groups=groups)\n        self.bn = nn.BatchNorm2d(nOut)\n\n    def forward(self, input):\n        \'\'\'\n\n        :param input: input feature map\n        :return: transformed feature map\n        \'\'\'\n        output = self.conv(input)\n        output = self.bn(output)\n        return output\n\n\nclass C(nn.Module):\n    \'\'\'\n    This class is for a convolutional layer.\n    \'\'\'\n\n    def __init__(self, nIn, nOut, kSize, stride=1, groups=1):\n        \'\'\'\n\n        :param nIn: number of input channels\n        :param nOut: number of output channels\n        :param kSize: kernel size\n        :param stride: optional stride rate for down-sampling\n        \'\'\'\n        super().__init__()\n        padding = int((kSize - 1) / 2)\n        self.conv = nn.Conv2d(nIn, nOut, kSize, stride=stride, padding=padding, bias=False,\n                              groups=groups)\n\n    def forward(self, input):\n        \'\'\'\n        :param input: input feature map\n        :return: transformed feature map\n        \'\'\'\n        output = self.conv(input)\n        return output\n\n\nclass CDilated(nn.Module):\n    \'\'\'\n    This class defines the dilated convolution.\n    \'\'\'\n\n    def __init__(self, nIn, nOut, kSize, stride=1, d=1, groups=1):\n        \'\'\'\n        :param nIn: number of input channels\n        :param nOut: number of output channels\n        :param kSize: kernel size\n        :param stride: optional stride rate for down-sampling\n        :param d: optional dilation rate\n        \'\'\'\n        super().__init__()\n        padding = int((kSize - 1) / 2) * d\n        self.conv = nn.Conv2d(nIn, nOut,kSize, stride=stride, padding=padding, bias=False,\n                              dilation=d, groups=groups)\n\n    def forward(self, input):\n        \'\'\'\n        :param input: input feature map\n        :return: transformed feature map\n        \'\'\'\n        output = self.conv(input)\n        return output\n\nclass CDilatedB(nn.Module):\n    \'\'\'\n    This class defines the dilated convolution with batch normalization.\n    \'\'\'\n\n    def __init__(self, nIn, nOut, kSize, stride=1, d=1, groups=1):\n        \'\'\'\n        :param nIn: number of input channels\n        :param nOut: number of output channels\n        :param kSize: kernel size\n        :param stride: optional stride rate for down-sampling\n        :param d: optional dilation rate\n        \'\'\'\n        super().__init__()\n        padding = int((kSize - 1) / 2) * d\n        self.conv = nn.Conv2d(nIn, nOut,kSize, stride=stride, padding=padding, bias=False,\n                              dilation=d, groups=groups)\n        self.bn = nn.BatchNorm2d(nOut)\n\n    def forward(self, input):\n        \'\'\'\n        :param input: input feature map\n        :return: transformed feature map\n        \'\'\'\n        return self.bn(self.conv(input))\n'"
