file_path,api_count,code
imagenet/LRSchedule.py,0,"b'\n#============================================\n__author__ = ""Sachin Mehta""\n__license__ = ""MIT""\n__maintainer__ = ""Sachin Mehta""\n#============================================\n\nclass MyLRScheduler(object):\n    \'\'\'\n    CLass that defines cyclic learning rate that decays the learning rate linearly till the end of cycle and then restarts\n    at the maximum value.\n    \'\'\'\n    def __init__(self, initial=0.1, cycle_len=5, steps=[51, 101, 131, 161, 191, 221, 251, 281], gamma=2):\n        super(MyLRScheduler, self).__init__()\n        assert len(steps) > 1, \'Please specify step intervals.\'\n        self.min_lr = initial # minimum learning rate\n        self.m = cycle_len\n        self.steps = steps\n        self.warm_up_interval = 1 # we do not start from max value for the first epoch, because some time it diverges\n        self.counter = 0\n        self.decayFactor = gamma # factor by which we should decay learning rate\n        self.count_cycles = 0\n        self.step_counter = 0\n        self.stepping = True\n        print(\'Using Cyclic LR Scheduler with warm restarts\')\n\n    def get_lr(self, epoch):\n        if epoch%self.steps[self.step_counter] == 0 and epoch > 1 and self.stepping:\n            self.min_lr = self.min_lr / self.decayFactor\n            self.count_cycles = 0\n            if self.step_counter < len(self.steps) - 1:\n                self.step_counter += 1\n            else:\n                self.stepping = False\n        current_lr = self.min_lr\n        # warm-up or cool-down phase\n        if self.count_cycles < self.warm_up_interval:\n            self.count_cycles += 1\n            # We do not need warm up after first step.\n            # so, we set warm up interval to 0 after first step\n            if self.count_cycles == self.warm_up_interval:\n                self.warm_up_interval = 0\n        else:\n            #Cyclic learning rate with warm restarts\n            # max_lr (= min_lr * step_size) is decreased to min_lr using linear decay before\n            # it is set to max value at the end of cycle.\n            if self.counter >= self.m:\n                self.counter = 0\n            current_lr = round((self.min_lr * self.m) - (self.counter * self.min_lr), 5)\n            self.counter += 1\n            self.count_cycles += 1\n        return current_lr\n\n\nif __name__ == \'__main__\':\n    lrSched = MyLRScheduler(0.1)#MyLRScheduler(0.1, 5, [51, 101, 131, 161, 191, 221, 251, 281, 311, 341, 371])\n    max_epochs = 300\n    for i in range(max_epochs):\n        print(i, lrSched.get_lr(i))\n'"
imagenet/Model.py,5,"b'from torch.nn import init\nimport torch.nn.functional as F\nfrom cnn_utils import *\nimport math\nimport torch\n\n#============================================\n__author__ = ""Sachin Mehta""\n__license__ = ""MIT""\n__maintainer__ = ""Sachin Mehta""\n#============================================\n\nclass EESP(nn.Module):\n    \'\'\'\n    This class defines the EESP block, which is based on the following principle\n        REDUCE ---> SPLIT ---> TRANSFORM --> MERGE\n    \'\'\'\n\n    def __init__(self, nIn, nOut, stride=1, k=4, r_lim=7, down_method=\'esp\'): #down_method --> [\'avg\' or \'esp\']\n        \'\'\'\n        :param nIn: number of input channels\n        :param nOut: number of output channels\n        :param stride: factor by which we should skip (useful for down-sampling). If 2, then down-samples the feature map by 2\n        :param k: # of parallel branches\n        :param r_lim: A maximum value of receptive field allowed for EESP block\n        :param down_method: Downsample or not (equivalent to say stride is 2 or not)\n        \'\'\'\n        super().__init__()\n        self.stride = stride\n        n = int(nOut / k)\n        n1 = nOut - (k - 1) * n\n        assert down_method in [\'avg\', \'esp\'], \'One of these is suppported (avg or esp)\'\n        assert n == n1, ""n(={}) and n1(={}) should be equal for Depth-wise Convolution "".format(n, n1)\n        self.proj_1x1 = CBR(nIn, n, 1, stride=1, groups=k)\n\n        # (For convenience) Mapping between dilation rate and receptive field for a 3x3 kernel\n        map_receptive_ksize = {3: 1, 5: 2, 7: 3, 9: 4, 11: 5, 13: 6, 15: 7, 17: 8}\n        self.k_sizes = list()\n        for i in range(k):\n            ksize = int(3 + 2 * i)\n            # After reaching the receptive field limit, fall back to the base kernel size of 3 with a dilation rate of 1\n            ksize = ksize if ksize <= r_lim else 3\n            self.k_sizes.append(ksize)\n        # sort (in ascending order) these kernel sizes based on their receptive field\n        # This enables us to ignore the kernels (3x3 in our case) with the same effective receptive field in hierarchical\n        # feature fusion because kernels with 3x3 receptive fields does not have gridding artifact.\n        self.k_sizes.sort()\n        self.spp_dw = nn.ModuleList()\n        for i in range(k):\n            d_rate = map_receptive_ksize[self.k_sizes[i]]\n            self.spp_dw.append(CDilated(n, n, kSize=3, stride=stride, groups=n, d=d_rate))\n        # Performing a group convolution with K groups is the same as performing K point-wise convolutions\n        self.conv_1x1_exp = CB(nOut, nOut, 1, 1, groups=k)\n        self.br_after_cat = BR(nOut)\n        self.module_act = nn.PReLU(nOut)\n        self.downAvg = True if down_method == \'avg\' else False\n\n    def forward(self, input):\n        \'\'\'\n        :param input: input feature map\n        :return: transformed feature map\n        \'\'\'\n\n        # Reduce --> project high-dimensional feature maps to low-dimensional space\n        output1 = self.proj_1x1(input)\n        output = [self.spp_dw[0](output1)]\n        # compute the output for each branch and hierarchically fuse them\n        # i.e. Split --> Transform --> HFF\n        for k in range(1, len(self.spp_dw)):\n            out_k = self.spp_dw[k](output1)\n            # HFF\n            out_k = out_k + output[k - 1]\n            output.append(out_k)\n        # Merge\n        expanded = self.conv_1x1_exp( # learn linear combinations using group point-wise convolutions\n            self.br_after_cat( # apply batch normalization followed by activation function (PRelu in this case)\n                torch.cat(output, 1) # concatenate the output of different branches\n            )\n        )\n        del output\n        # if down-sampling, then return the concatenated vector\n        # because Downsampling function will combine it with avg. pooled feature map and then threshold it\n        if self.stride == 2 and self.downAvg:\n            return expanded\n\n        # if dimensions of input and concatenated vector are the same, add them (RESIDUAL LINK)\n        if expanded.size() == input.size():\n            expanded = expanded + input\n\n        # Threshold the feature map using activation function (PReLU in this case)\n        return self.module_act(expanded)\n\n\nclass DownSampler(nn.Module):\n    \'\'\'\n    Down-sampling fucntion that has three parallel branches: (1) avg pooling,\n    (2) EESP block with stride of 2 and (3) efficient long-range connection with the input.\n    The output feature maps of branches from (1) and (2) are concatenated and then additively fused with (3) to produce\n    the final output.\n    \'\'\'\n\n    def __init__(self, nin, nout, k=4, r_lim=9, reinf=True):\n        \'\'\'\n            :param nin: number of input channels\n            :param nout: number of output channels\n            :param k: # of parallel branches\n            :param r_lim: A maximum value of receptive field allowed for EESP block\n            :param reinf: Use long range shortcut connection with the input or not.\n        \'\'\'\n        super().__init__()\n        nout_new = nout - nin\n        self.eesp = EESP(nin, nout_new, stride=2, k=k, r_lim=r_lim, down_method=\'avg\')\n        self.avg = nn.AvgPool2d(kernel_size=3, padding=1, stride=2)\n        if reinf:\n            self.inp_reinf = nn.Sequential(\n                CBR(config_inp_reinf, config_inp_reinf, 3, 1),\n                CB(config_inp_reinf, nout, 1, 1)\n            )\n        self.act =  nn.PReLU(nout)\n\n    def forward(self, input, input2=None):\n        \'\'\'\n        :param input: input feature map\n        :return: feature map down-sampled by a factor of 2\n        \'\'\'\n        avg_out = self.avg(input)\n        eesp_out = self.eesp(input)\n        output = torch.cat([avg_out, eesp_out], 1)\n\n        if input2 is not None:\n            #assuming the input is a square image\n            # Shortcut connection with the input image\n            w1 = avg_out.size(2)\n            while True:\n                input2 = F.avg_pool2d(input2, kernel_size=3, padding=1, stride=2)\n                w2 = input2.size(2)\n                if w2 == w1:\n                    break\n            output = output + self.inp_reinf(input2)\n\n        return self.act(output)\n\nclass EESPNet(nn.Module):\n    \'\'\'\n    This class defines the ESPNetv2 architecture for the ImageNet classification\n    \'\'\'\n\n    def __init__(self, classes=1000, s=1):\n        \'\'\'\n        :param classes: number of classes in the dataset. Default is 1000 for the ImageNet dataset\n        :param s: factor that scales the number of output feature maps\n        \'\'\'\n        super().__init__()\n        reps = [0, 3, 7, 3]  # how many times EESP blocks should be repeated at each spatial level.\n        channels = 3\n\n        r_lim = [13, 11, 9, 7, 5]  # receptive field at each spatial level\n        K = [4]*len(r_lim) # No. of parallel branches at different levels\n\n        base = 32 #base configuration\n        config_len = 5\n        config = [base] * config_len\n        base_s = 0\n        for i in range(config_len):\n            if i== 0:\n                base_s = int(base * s)\n                base_s = math.ceil(base_s / K[0]) * K[0]\n                config[i] = base if base_s > base else base_s\n            else:\n                config[i] = base_s * pow(2, i)\n        if s <= 1.5:\n            config.append(1024)\n        elif s <= 2.0:\n            config.append(1280)\n        else:\n            ValueError(\'Configuration not supported\')\n\n\n        global config_inp_reinf\n        config_inp_reinf = 3\n        self.input_reinforcement = True # True for the shortcut connection with input\n\n        assert len(K) == len(r_lim), \'Length of branching factor array and receptive field array should be the same.\'\n\n        self.level1 = CBR(channels, config[0], 3, 2)  # 112 L1\n\n        self.level2_0 = DownSampler(config[0], config[1], k=K[0], r_lim=r_lim[0], reinf=self.input_reinforcement)  # out = 56\n\n        self.level3_0 = DownSampler(config[1], config[2], k=K[1], r_lim=r_lim[1], reinf=self.input_reinforcement) # out = 28\n        self.level3 = nn.ModuleList()\n        for i in range(reps[1]):\n            self.level3.append(EESP(config[2], config[2], stride=1, k=K[2], r_lim=r_lim[2]))\n\n        self.level4_0 = DownSampler(config[2], config[3], k=K[2], r_lim=r_lim[2], reinf=self.input_reinforcement) #out = 14\n        self.level4 = nn.ModuleList()\n        for i in range(reps[2]):\n            self.level4.append(EESP(config[3], config[3], stride=1, k=K[3], r_lim=r_lim[3]))\n\n        self.level5_0 = DownSampler(config[3], config[4], k=K[3], r_lim=r_lim[3]) #7\n        self.level5 = nn.ModuleList()\n        for i in range(reps[3]):\n            self.level5.append(EESP(config[4], config[4], stride=1, k=K[4], r_lim=r_lim[4]))\n\n        # expand the feature maps using depth-wise convolution followed by group point-wise convolution\n        self.level5.append(CBR(config[4], config[4], 3, 1, groups=config[4]))\n        self.level5.append(CBR(config[4], config[5], 1, 1, groups=K[4]))\n\n        self.classifier = nn.Linear(config[5], classes)\n        self.init_params()\n\n    def init_params(self):\n        \'\'\'\n        Function to initialze the parameters\n        \'\'\'\n        for m in self.modules():\n            if isinstance(m, nn.Conv2d):\n                init.kaiming_normal_(m.weight, mode=\'fan_out\')\n                if m.bias is not None:\n                    init.constant_(m.bias, 0)\n            elif isinstance(m, nn.BatchNorm2d):\n                init.constant_(m.weight, 1)\n                init.constant_(m.bias, 0)\n            elif isinstance(m, nn.Linear):\n                init.normal_(m.weight, std=0.001)\n                if m.bias is not None:\n                    init.constant_(m.bias, 0)\n\n    def forward(self, input, p=0.2):\n        \'\'\'\n        :param input: Receives the input RGB image\n        :return: a C-dimensional vector, C=# of classes\n        \'\'\'\n        out_l1 = self.level1(input)  # 112\n        if not self.input_reinforcement:\n            del input\n            input = None\n\n        out_l2 = self.level2_0(out_l1, input)  # 56\n\n        out_l3_0 = self.level3_0(out_l2, input)  # down-sample\n        for i, layer in enumerate(self.level3):\n            if i == 0:\n                out_l3 = layer(out_l3_0)\n            else:\n                out_l3 = layer(out_l3)\n\n        out_l4_0 = self.level4_0(out_l3, input)  # down-sample\n        for i, layer in enumerate(self.level4):\n            if i == 0:\n                out_l4 = layer(out_l4_0)\n            else:\n                out_l4 = layer(out_l4)\n\n        out_l5_0 = self.level5_0(out_l4)  # down-sample\n        for i, layer in enumerate(self.level5):\n            if i == 0:\n                out_l5 = layer(out_l5_0)\n            else:\n                out_l5 = layer(out_l5)\n\n        output_g = F.adaptive_avg_pool2d(out_l5, output_size=1)\n        output_g = F.dropout(output_g, p=p, training=self.training)\n        output_1x1 = output_g.view(output_g.size(0), -1)\n\n        return self.classifier(output_1x1)\n\n\nif __name__ == \'__main__\':\n    input = torch.Tensor(1, 3, 224, 224).cuda()\n    model = EESPNet(classes=1000, s=1.0)\n    out = model(input)\n    print(\'Output size\')\n    print(out.size())\n'"
imagenet/cnn_utils.py,1,"b'import torch.nn as nn\n\n#============================================\n__author__ = ""Sachin Mehta""\n__license__ = ""MIT""\n__maintainer__ = ""Sachin Mehta""\n#============================================\n\nclass CBR(nn.Module):\n    \'\'\'\n    This class defines the convolution layer with batch normalization and PReLU activation\n    \'\'\'\n\n    def __init__(self, nIn, nOut, kSize, stride=1, groups=1):\n        \'\'\'\n\n        :param nIn: number of input channels\n        :param nOut: number of output channels\n        :param kSize: kernel size\n        :param stride: stride rate for down-sampling. Default is 1\n        \'\'\'\n        super().__init__()\n        padding = int((kSize - 1) / 2)\n        self.conv = nn.Conv2d(nIn, nOut, kSize, stride=stride, padding=padding, bias=False, groups=groups)\n        self.bn = nn.BatchNorm2d(nOut)\n        self.act = nn.PReLU(nOut)\n\n    def forward(self, input):\n        \'\'\'\n        :param input: input feature map\n        :return: transformed feature map\n        \'\'\'\n        output = self.conv(input)\n        # output = self.conv1(output)\n        output = self.bn(output)\n        output = self.act(output)\n        return output\n\n\nclass BR(nn.Module):\n    \'\'\'\n        This class groups the batch normalization and PReLU activation\n    \'\'\'\n\n    def __init__(self, nOut):\n        \'\'\'\n        :param nOut: output feature maps\n        \'\'\'\n        super().__init__()\n        self.bn = nn.BatchNorm2d(nOut)\n        self.act = nn.PReLU(nOut)\n\n    def forward(self, input):\n        \'\'\'\n        :param input: input feature map\n        :return: normalized and thresholded feature map\n        \'\'\'\n        output = self.bn(input)\n        output = self.act(output)\n        return output\n\n\nclass CB(nn.Module):\n    \'\'\'\n       This class groups the convolution and batch normalization\n    \'\'\'\n\n    def __init__(self, nIn, nOut, kSize, stride=1, groups=1):\n        \'\'\'\n        :param nIn: number of input channels\n        :param nOut: number of output channels\n        :param kSize: kernel size\n        :param stride: optinal stide for down-sampling\n        \'\'\'\n        super().__init__()\n        padding = int((kSize - 1) / 2)\n        self.conv = nn.Conv2d(nIn, nOut, kSize, stride=stride, padding=padding, bias=False,\n                              groups=groups)\n        self.bn = nn.BatchNorm2d(nOut)\n\n    def forward(self, input):\n        \'\'\'\n\n        :param input: input feature map\n        :return: transformed feature map\n        \'\'\'\n        output = self.conv(input)\n        output = self.bn(output)\n        return output\n\n\nclass C(nn.Module):\n    \'\'\'\n    This class is for a convolutional layer.\n    \'\'\'\n\n    def __init__(self, nIn, nOut, kSize, stride=1, groups=1):\n        \'\'\'\n\n        :param nIn: number of input channels\n        :param nOut: number of output channels\n        :param kSize: kernel size\n        :param stride: optional stride rate for down-sampling\n        \'\'\'\n        super().__init__()\n        padding = int((kSize - 1) / 2)\n        self.conv = nn.Conv2d(nIn, nOut, kSize, stride=stride, padding=padding, bias=False,\n                              groups=groups)\n\n    def forward(self, input):\n        \'\'\'\n        :param input: input feature map\n        :return: transformed feature map\n        \'\'\'\n        output = self.conv(input)\n        return output\n\n\nclass CDilated(nn.Module):\n    \'\'\'\n    This class defines the dilated convolution.\n    \'\'\'\n\n    def __init__(self, nIn, nOut, kSize, stride=1, d=1, groups=1):\n        \'\'\'\n        :param nIn: number of input channels\n        :param nOut: number of output channels\n        :param kSize: kernel size\n        :param stride: optional stride rate for down-sampling\n        :param d: optional dilation rate\n        \'\'\'\n        super().__init__()\n        padding = int((kSize - 1) / 2) * d\n        self.conv = nn.Conv2d(nIn, nOut,kSize, stride=stride, padding=padding, bias=False,\n                              dilation=d, groups=groups)\n\n    def forward(self, input):\n        \'\'\'\n        :param input: input feature map\n        :return: transformed feature map\n        \'\'\'\n        output = self.conv(input)\n        return output\n\nclass CDilatedB(nn.Module):\n    \'\'\'\n    This class defines the dilated convolution with batch normalization.\n    \'\'\'\n\n    def __init__(self, nIn, nOut, kSize, stride=1, d=1, groups=1):\n        \'\'\'\n        :param nIn: number of input channels\n        :param nOut: number of output channels\n        :param kSize: kernel size\n        :param stride: optional stride rate for down-sampling\n        :param d: optional dilation rate\n        \'\'\'\n        super().__init__()\n        padding = int((kSize - 1) / 2) * d\n        self.conv = nn.Conv2d(nIn, nOut,kSize, stride=stride, padding=padding, bias=False,\n                              dilation=d, groups=groups)\n        self.bn = nn.BatchNorm2d(nOut)\n\n    def forward(self, input):\n        \'\'\'\n        :param input: input feature map\n        :return: transformed feature map\n        \'\'\'\n        return self.bn(self.conv(input))\n'"
imagenet/evaluate.py,9,"b'import argparse\nimport time\nfrom torch.autograd import Variable\nimport torch.nn.parallel\nimport torch.backends.cudnn as cudnn\nimport torch.optim\nimport torch.utils.data\nimport torch.utils.data.distributed\nimport torchvision.transforms as transforms\nimport torchvision.datasets as datasets\nimport Model as Net\nimport numpy as np\nfrom utils import *\nimport os\nimport torchvision.models as preModels\n\ncudnn.benchmark = True\n\n\'\'\'\nThis file is mostly adapted from the PyTorch ImageNet example\n\'\'\'\n\n#============================================\n__author__ = ""Sachin Mehta""\n__license__ = ""MIT""\n__maintainer__ = ""Sachin Mehta""\n#============================================\n\ndef main(args):\n\n    model = Net.EESPNet(classes=1000, s=args.s)\n    model = torch.nn.DataParallel(model).cuda()\n    if not os.path.isfile(args.weightFile):\n        print(\'Weight file does not exist\')\n        exit(-1)\n    dict_model = torch.load(args.weightFile)\n    model.load_state_dict(dict_model)\n\n\n    n_params = sum([np.prod(p.size()) for p in model.parameters()])\n    print(\'Parameters: \' + str(n_params))\n\n    # Data loading code\n    valdir = os.path.join(args.data, \'val\')\n    traindir = os.path.join(args.data, \'train\')\n    normalize = transforms.Normalize(mean=[0.485, 0.456, 0.406],\n                                     std=[0.229, 0.224, 0.225])\n\n    val_loader = torch.utils.data.DataLoader(\n        datasets.ImageFolder(valdir, transforms.Compose([\n            transforms.Resize(int(args.inpSize/0.875)),\n            transforms.CenterCrop(args.inpSize),\n            transforms.ToTensor(),\n            normalize,\n        ])),\n        batch_size=args.batch_size, shuffle=False,\n        num_workers=args.workers, pin_memory=True)\n\n    validate(val_loader, model)\n    return\n\n\nif __name__ == \'__main__\':\n    parser = argparse.ArgumentParser(description=\'ESPNetv2 Training on the ImageNet\')\n    parser.add_argument(\'--data\', default=\'/home/ubuntu/ILSVRC2015/Data/CLS-LOC/\', help=\'path to dataset\')\n    parser.add_argument(\'--workers\', default=12, type=int, help=\'number of data loading workers (default: 4)\')\n    parser.add_argument(\'-b\', \'--batch-size\', default=512, type=int,\n                        metavar=\'N\', help=\'mini-batch size (default: 256)\')\n    parser.add_argument(\'--print-freq\', \'-p\', default=10, type=int,\n                        metavar=\'N\', help=\'print frequency (default: 10)\')\n    parser.add_argument(\'--s\', default=1, type=float,\n                        help=\'Factor by which output channels should be reduced (s > 1 for increasing the dims while < 1 for decreasing)\')\n    parser.add_argument(\'--weightFile\', type=str, default=\'\', help=\'weight file\')\n    parser.add_argument(\'--inpSize\', default=224, type=int,\n                        help=\'Input size\')\n\n\n    args = parser.parse_args()\n    args.parallel = True\n\n    main(args)\n'"
