file_path,api_count,code
src/guided_backprop.py,3,"b'""""""\nCreated on Thu Oct 26 11:23:47 2017\n\n@author: Utku Ozbulak - github.com/utkuozbulak\n""""""\nimport torch\nfrom torch.nn import ReLU\n\nfrom misc_functions import (get_example_params,\n                            convert_to_grayscale,\n                            save_gradient_images,\n                            get_positive_negative_saliency)\n\n\nclass GuidedBackprop():\n    """"""\n       Produces gradients generated with guided back propagation from the given image\n    """"""\n    def __init__(self, model):\n        self.model = model\n        self.gradients = None\n        self.forward_relu_outputs = []\n        # Put model in evaluation mode\n        self.model.eval()\n        self.update_relus()\n        self.hook_layers()\n\n    def hook_layers(self):\n        def hook_function(module, grad_in, grad_out):\n            self.gradients = grad_in[0]\n        # Register hook to the first layer\n        first_layer = list(self.model.features._modules.items())[0][1]\n        first_layer.register_backward_hook(hook_function)\n\n    def update_relus(self):\n        """"""\n            Updates relu activation functions so that\n                1- stores output in forward pass\n                2- imputes zero for gradient values that are less than zero\n        """"""\n        def relu_backward_hook_function(module, grad_in, grad_out):\n            """"""\n            If there is a negative gradient, change it to zero\n            """"""\n            # Get last forward output\n            corresponding_forward_output = self.forward_relu_outputs[-1]\n            corresponding_forward_output[corresponding_forward_output > 0] = 1\n            modified_grad_out = corresponding_forward_output * torch.clamp(grad_in[0], min=0.0)\n            del self.forward_relu_outputs[-1]  # Remove last forward output\n            return (modified_grad_out,)\n\n        def relu_forward_hook_function(module, ten_in, ten_out):\n            """"""\n            Store results of forward pass\n            """"""\n            self.forward_relu_outputs.append(ten_out)\n\n        # Loop through layers, hook up ReLUs\n        for pos, module in self.model.features._modules.items():\n            if isinstance(module, ReLU):\n                module.register_backward_hook(relu_backward_hook_function)\n                module.register_forward_hook(relu_forward_hook_function)\n\n    def generate_gradients(self, input_image, target_class):\n        # Forward pass\n        model_output = self.model(input_image)\n        # Zero gradients\n        self.model.zero_grad()\n        # Target for backprop\n        one_hot_output = torch.FloatTensor(1, model_output.size()[-1]).zero_()\n        one_hot_output[0][target_class] = 1\n        # Backward pass\n        model_output.backward(gradient=one_hot_output)\n        # Convert Pytorch variable to numpy array\n        # [0] to get rid of the first channel (1,3,224,224)\n        gradients_as_arr = self.gradients.data.numpy()[0]\n        return gradients_as_arr\n\n\nif __name__ == \'__main__\':\n    target_example = 0  # Snake\n    (original_image, prep_img, target_class, file_name_to_export, pretrained_model) =\\\n        get_example_params(target_example)\n\n    # Guided backprop\n    GBP = GuidedBackprop(pretrained_model)\n    # Get gradients\n    guided_grads = GBP.generate_gradients(prep_img, target_class)\n    # Save colored gradients\n    save_gradient_images(guided_grads, file_name_to_export + \'_Guided_BP_color\')\n    # Convert to grayscale\n    grayscale_guided_grads = convert_to_grayscale(guided_grads)\n    # Save grayscale gradients\n    save_gradient_images(grayscale_guided_grads, file_name_to_export + \'_Guided_BP_gray\')\n    # Positive and negative saliency maps\n    pos_sal, neg_sal = get_positive_negative_saliency(guided_grads)\n    save_gradient_images(pos_sal, file_name_to_export + \'_pos_sal\')\n    save_gradient_images(neg_sal, file_name_to_export + \'_neg_sal\')\n    print(\'Guided backprop completed\')\n'"
src/guided_gradcam.py,0,"b'""""""\nCreated on Thu Oct 23 11:27:15 2017\n\n@author: Utku Ozbulak - github.com/utkuozbulak\n""""""\nimport numpy as np\n\nfrom misc_functions import (get_example_params,\n                            convert_to_grayscale,\n                            save_gradient_images)\nfrom gradcam import GradCam\nfrom guided_backprop import GuidedBackprop\n\n\ndef guided_grad_cam(grad_cam_mask, guided_backprop_mask):\n    """"""\n        Guided grad cam is just pointwise multiplication of cam mask and\n        guided backprop mask\n\n    Args:\n        grad_cam_mask (np_arr): Class activation map mask\n        guided_backprop_mask (np_arr):Guided backprop mask\n    """"""\n    cam_gb = np.multiply(grad_cam_mask, guided_backprop_mask)\n    return cam_gb\n\n\nif __name__ == \'__main__\':\n    # Get params\n    target_example = 0  # Snake\n    (original_image, prep_img, target_class, file_name_to_export, pretrained_model) =\\\n        get_example_params(target_example)\n\n    # Grad cam\n    gcv2 = GradCam(pretrained_model, target_layer=11)\n    # Generate cam mask\n    cam = gcv2.generate_cam(prep_img, target_class)\n    print(\'Grad cam completed\')\n\n    # Guided backprop\n    GBP = GuidedBackprop(pretrained_model)\n    # Get gradients\n    guided_grads = GBP.generate_gradients(prep_img, target_class)\n    print(\'Guided backpropagation completed\')\n\n    # Guided Grad cam\n    cam_gb = guided_grad_cam(cam, guided_grads)\n    save_gradient_images(cam_gb, file_name_to_export + \'_GGrad_Cam\')\n    grayscale_cam_gb = convert_to_grayscale(cam_gb)\n    save_gradient_images(grayscale_cam_gb, file_name_to_export + \'_GGrad_Cam_gray\')\n    print(\'Guided grad cam completed\')\n'"
src/integrated_gradients.py,1,"b'""""""\nCreated on Wed Jun 19 17:06:48 2019\n\n@author: Utku Ozbulak - github.com/utkuozbulak\n""""""\nimport torch\nimport numpy as np\n\nfrom misc_functions import get_example_params, convert_to_grayscale, save_gradient_images\n\n\nclass IntegratedGradients():\n    """"""\n        Produces gradients generated with integrated gradients from the image\n    """"""\n    def __init__(self, model):\n        self.model = model\n        self.gradients = None\n        # Put model in evaluation mode\n        self.model.eval()\n        # Hook the first layer to get the gradient\n        self.hook_layers()\n\n    def hook_layers(self):\n        def hook_function(module, grad_in, grad_out):\n            self.gradients = grad_in[0]\n\n        # Register hook to the first layer\n        first_layer = list(self.model.features._modules.items())[0][1]\n        first_layer.register_backward_hook(hook_function)\n\n    def generate_images_on_linear_path(self, input_image, steps):\n        # Generate uniform numbers between 0 and steps\n        step_list = np.arange(steps+1)/steps\n        # Generate scaled xbar images\n        xbar_list = [input_image*step for step in step_list]\n        return xbar_list\n\n    def generate_gradients(self, input_image, target_class):\n        # Forward\n        model_output = self.model(input_image)\n        # Zero grads\n        self.model.zero_grad()\n        # Target for backprop\n        one_hot_output = torch.FloatTensor(1, model_output.size()[-1]).zero_()\n        one_hot_output[0][target_class] = 1\n        # Backward pass\n        model_output.backward(gradient=one_hot_output)\n        # Convert Pytorch variable to numpy array\n        # [0] to get rid of the first channel (1,3,224,224)\n        gradients_as_arr = self.gradients.data.numpy()[0]\n        return gradients_as_arr\n\n    def generate_integrated_gradients(self, input_image, target_class, steps):\n        # Generate xbar images\n        xbar_list = self.generate_images_on_linear_path(input_image, steps)\n        # Initialize an iamge composed of zeros\n        integrated_grads = np.zeros(input_image.size())\n        for xbar_image in xbar_list:\n            # Generate gradients from xbar images\n            single_integrated_grad = self.generate_gradients(xbar_image, target_class)\n            # Add rescaled grads from xbar images\n            integrated_grads = integrated_grads + single_integrated_grad/steps\n        # [0] to get rid of the first channel (1,3,224,224)\n        return integrated_grads[0]\n\n\nif __name__ == \'__main__\':\n    # Get params\n    target_example = 0  # Snake\n    (original_image, prep_img, target_class, file_name_to_export, pretrained_model) =\\\n        get_example_params(target_example)\n    # Vanilla backprop\n    IG = IntegratedGradients(pretrained_model)\n    # Generate gradients\n    integrated_grads = IG.generate_integrated_gradients(prep_img, target_class, 100)\n    # Convert to grayscale\n    grayscale_integrated_grads = convert_to_grayscale(integrated_grads)\n    # Save grayscale gradients\n    save_gradient_images(grayscale_integrated_grads, file_name_to_export + \'_Integrated_G_gray\')\n    print(\'Integrated gradients completed.\')\n'"
src/inverted_representation.py,3,"b'""""""\nCreated on Wed Jan 17 08:05:11 2018\n\n@author: Utku Ozbulak - github.com/utkuozbulak\n""""""\nimport torch\nfrom torch.autograd import Variable\nfrom torch.optim import SGD\nimport os\n\nfrom misc_functions import get_example_params, recreate_image, save_image\n\n\nclass InvertedRepresentation():\n    def __init__(self, model):\n        self.model = model\n        self.model.eval()\n        if not os.path.exists(\'../generated\'):\n            os.makedirs(\'../generated\')\n\n    def alpha_norm(self, input_matrix, alpha):\n        """"""\n            Converts matrix to vector then calculates the alpha norm\n        """"""\n        alpha_norm = ((input_matrix.view(-1))**alpha).sum()\n        return alpha_norm\n\n    def total_variation_norm(self, input_matrix, beta):\n        """"""\n            Total variation norm is the second norm in the paper\n            represented as R_V(x)\n        """"""\n        to_check = input_matrix[:, :-1, :-1]  # Trimmed: right - bottom\n        one_bottom = input_matrix[:, 1:, :-1]  # Trimmed: top - right\n        one_right = input_matrix[:, :-1, 1:]  # Trimmed: top - right\n        total_variation = (((to_check - one_bottom)**2 +\n                            (to_check - one_right)**2)**(beta/2)).sum()\n        return total_variation\n\n    def euclidian_loss(self, org_matrix, target_matrix):\n        """"""\n            Euclidian loss is the main loss function in the paper\n            ||fi(x) - fi(x_0)||_2^2& / ||fi(x_0)||_2^2\n        """"""\n        distance_matrix = target_matrix - org_matrix\n        euclidian_distance = self.alpha_norm(distance_matrix, 2)\n        normalized_euclidian_distance = euclidian_distance / self.alpha_norm(org_matrix, 2)\n        return normalized_euclidian_distance\n\n    def get_output_from_specific_layer(self, x, layer_id):\n        """"""\n            Saves the output after a forward pass until nth layer\n            This operation could be done with a forward hook too\n            but this one is simpler (I think)\n        """"""\n        layer_output = None\n        for index, layer in enumerate(self.model.features):\n            x = layer(x)\n            if str(index) == str(layer_id):\n                layer_output = x[0]\n                break\n        return layer_output\n\n    def generate_inverted_image_specific_layer(self, input_image, img_size, target_layer=3):\n        # Generate a random image which we will optimize\n        opt_img = Variable(1e-1 * torch.randn(1, 3, img_size, img_size), requires_grad=True)\n        # Define optimizer for previously created image\n        optimizer = SGD([opt_img], lr=1e4, momentum=0.9)\n        # Get the output from the model after a forward pass until target_layer\n        # with the input image (real image, NOT the randomly generated one)\n        input_image_layer_output = \\\n            self.get_output_from_specific_layer(input_image, target_layer)\n\n        # Alpha regularization parametrs\n        # Parameter alpha, which is actually sixth norm\n        alpha_reg_alpha = 6\n        # The multiplier, lambda alpha\n        alpha_reg_lambda = 1e-7\n\n        # Total variation regularization parameters\n        # Parameter beta, which is actually second norm\n        tv_reg_beta = 2\n        # The multiplier, lambda beta\n        tv_reg_lambda = 1e-8\n\n        for i in range(201):\n            optimizer.zero_grad()\n            # Get the output from the model after a forward pass until target_layer\n            # with the generated image (randomly generated one, NOT the real image)\n            output = self.get_output_from_specific_layer(opt_img, target_layer)\n            # Calculate euclidian loss\n            euc_loss = 1e-1 * self.euclidian_loss(input_image_layer_output.detach(), output)\n            # Calculate alpha regularization\n            reg_alpha = alpha_reg_lambda * self.alpha_norm(opt_img, alpha_reg_alpha)\n            # Calculate total variation regularization\n            reg_total_variation = tv_reg_lambda * self.total_variation_norm(opt_img,\n                                                                            tv_reg_beta)\n            # Sum all to optimize\n            loss = euc_loss + reg_alpha + reg_total_variation\n            # Step\n            loss.backward()\n            optimizer.step()\n            # Generate image every 5 iterations\n            if i % 5 == 0:\n                print(\'Iteration:\', str(i), \'Loss:\', loss.data.numpy())\n                recreated_im = recreate_image(opt_img)\n                im_path = \'../generated/Inv_Image_Layer_\' + str(target_layer) + \\\n                    \'_Iteration_\' + str(i) + \'.jpg\'\n                save_image(recreated_im, im_path)\n\n            # Reduce learning rate every 40 iterations\n            if i % 40 == 0:\n                for param_group in optimizer.param_groups:\n                    param_group[\'lr\'] *= 1/10\n\n\nif __name__ == \'__main__\':\n    # Get params\n    target_example = 0  # Snake\n    (original_image, prep_img, target_class, file_name_to_export, pretrained_model) =\\\n        get_example_params(target_example)\n\n    inverted_representation = InvertedRepresentation(pretrained_model)\n    image_size = 224  # width & height\n    target_layer = 4\n    inverted_representation.generate_inverted_image_specific_layer(prep_img,\n                                                                   image_size,\n                                                                   target_layer)\n'"
src/layer_activation_with_guided_backprop.py,3,"b'""""""\nCreated on Thu Oct 26 11:23:47 2017\n\n@author: Utku Ozbulak - github.com/utkuozbulak\n""""""\nimport torch\nfrom torch.nn import ReLU\n\nfrom misc_functions import (get_example_params,\n                            convert_to_grayscale,\n                            save_gradient_images,\n                            get_positive_negative_saliency)\n\n\nclass GuidedBackprop():\n    """"""\n       Produces gradients generated with guided back propagation from the given image\n    """"""\n    def __init__(self, model):\n        self.model = model\n        self.gradients = None\n        self.forward_relu_outputs = []\n        # Put model in evaluation mode\n        self.model.eval()\n        self.update_relus()\n        self.hook_layers()\n\n    def hook_layers(self):\n        def hook_function(module, grad_in, grad_out):\n            self.gradients = grad_in[0]\n        # Register hook to the first layer\n        first_layer = list(self.model.features._modules.items())[0][1]\n        first_layer.register_backward_hook(hook_function)\n\n    def update_relus(self):\n        """"""\n            Updates relu activation functions so that\n                1- stores output in forward pass\n                2- imputes zero for gradient values that are less than zero\n        """"""\n        def relu_backward_hook_function(module, grad_in, grad_out):\n            """"""\n            If there is a negative gradient, change it to zero\n            """"""\n            # Get last forward output\n            corresponding_forward_output = self.forward_relu_outputs[-1]\n            corresponding_forward_output[corresponding_forward_output > 0] = 1\n            modified_grad_out = corresponding_forward_output * torch.clamp(grad_in[0], min=0.0)\n            del self.forward_relu_outputs[-1]  # Remove last forward output\n            return (modified_grad_out,)\n\n        def relu_forward_hook_function(module, ten_in, ten_out):\n            """"""\n            Store results of forward pass\n            """"""\n            self.forward_relu_outputs.append(ten_out)\n\n        # Loop through layers, hook up ReLUs\n        for pos, module in self.model.features._modules.items():\n            if isinstance(module, ReLU):\n                module.register_backward_hook(relu_backward_hook_function)\n                module.register_forward_hook(relu_forward_hook_function)\n\n    def generate_gradients(self, input_image, target_class, cnn_layer, filter_pos):\n        self.model.zero_grad()\n        # Forward pass\n        x = input_image\n        for index, layer in enumerate(self.model.features):\n            # Forward pass layer by layer\n            # x is not used after this point because it is only needed to trigger\n            # the forward hook function\n            x = layer(x)\n            # Only need to forward until the selected layer is reached\n            if index == cnn_layer:\n                # (forward hook function triggered)\n                break\n        conv_output = torch.sum(torch.abs(x[0, filter_pos]))\n        # Backward pass\n        conv_output.backward()\n        # Convert Pytorch variable to numpy array\n        # [0] to get rid of the first channel (1,3,224,224)\n        gradients_as_arr = self.gradients.data.numpy()[0]\n        return gradients_as_arr\n\n\nif __name__ == \'__main__\':\n    cnn_layer = 10\n    filter_pos = 5\n    target_example = 2  # Spider\n    (original_image, prep_img, target_class, file_name_to_export, pretrained_model) =\\\n        get_example_params(target_example)\n\n    # File export name\n    file_name_to_export = file_name_to_export + \'_layer\' + str(cnn_layer) + \'_filter\' + str(filter_pos)\n    # Guided backprop\n    GBP = GuidedBackprop(pretrained_model)\n    # Get gradients\n    guided_grads = GBP.generate_gradients(prep_img, target_class, cnn_layer, filter_pos)\n    # Save colored gradients\n    save_gradient_images(guided_grads, file_name_to_export + \'_Guided_BP_color\')\n    # Convert to grayscale\n    grayscale_guided_grads = convert_to_grayscale(guided_grads)\n    # Save grayscale gradients\n    save_gradient_images(grayscale_guided_grads, file_name_to_export + \'_Guided_BP_gray\')\n    # Positive and negative saliency maps\n    pos_sal, neg_sal = get_positive_negative_saliency(guided_grads)\n    save_gradient_images(pos_sal, file_name_to_export + \'_pos_sal\')\n    save_gradient_images(neg_sal, file_name_to_export + \'_neg_sal\')\n    print(\'Layer Guided backprop completed\')\n'"
