file_path,api_count,code
src/cnn_layer_visualization.py,3,"b'""""""\nCreated on Sat Nov 18 23:12:08 2017\n\n@author: Utku Ozbulak - github.com/utkuozbulak\n""""""\nimport os\nimport numpy as np\n\nimport torch\nfrom torch.optim import Adam\nfrom torchvision import models\n\nfrom misc_functions import preprocess_image, recreate_image, save_image\n\n\nclass CNNLayerVisualization():\n    """"""\n        Produces an image that minimizes the loss of a convolution\n        operation for a specific layer and filter\n    """"""\n    def __init__(self, model, selected_layer, selected_filter):\n        self.model = model\n        self.model.eval()\n        self.selected_layer = selected_layer\n        self.selected_filter = selected_filter\n        self.conv_output = 0\n        # Create the folder to export images if not exists\n        if not os.path.exists(\'../generated\'):\n            os.makedirs(\'../generated\')\n\n    def hook_layer(self):\n        def hook_function(module, grad_in, grad_out):\n            # Gets the conv output of the selected filter (from selected layer)\n            self.conv_output = grad_out[0, self.selected_filter]\n        # Hook the selected layer\n        self.model[self.selected_layer].register_forward_hook(hook_function)\n\n    def visualise_layer_with_hooks(self):\n        # Hook the selected layer\n        self.hook_layer()\n        # Generate a random image\n        random_image = np.uint8(np.random.uniform(150, 180, (224, 224, 3)))\n        # Process image and return variable\n        processed_image = preprocess_image(random_image, False)\n        # Define optimizer for the image\n        optimizer = Adam([processed_image], lr=0.1, weight_decay=1e-6)\n        for i in range(1, 31):\n            optimizer.zero_grad()\n            # Assign create image to a variable to move forward in the model\n            x = processed_image\n            for index, layer in enumerate(self.model):\n                # Forward pass layer by layer\n                # x is not used after this point because it is only needed to trigger\n                # the forward hook function\n                x = layer(x)\n                # Only need to forward until the selected layer is reached\n                if index == self.selected_layer:\n                    # (forward hook function triggered)\n                    break\n            # Loss function is the mean of the output of the selected layer/filter\n            # We try to minimize the mean of the output of that specific filter\n            loss = -torch.mean(self.conv_output)\n            print(\'Iteration:\', str(i), \'Loss:\', ""{0:.2f}"".format(loss.data.numpy()))\n            # Backward\n            loss.backward()\n            # Update image\n            optimizer.step()\n            # Recreate image\n            self.created_image = recreate_image(processed_image)\n            # Save image\n            if i % 5 == 0:\n                im_path = \'../generated/layer_vis_l\' + str(self.selected_layer) + \\\n                    \'_f\' + str(self.selected_filter) + \'_iter\' + str(i) + \'.jpg\'\n                save_image(self.created_image, im_path)\n\n    def visualise_layer_without_hooks(self):\n        # Process image and return variable\n        # Generate a random image\n        random_image = np.uint8(np.random.uniform(150, 180, (224, 224, 3)))\n        # Process image and return variable\n        processed_image = preprocess_image(random_image, False)\n        # Define optimizer for the image\n        optimizer = Adam([processed_image], lr=0.1, weight_decay=1e-6)\n        for i in range(1, 31):\n            optimizer.zero_grad()\n            # Assign create image to a variable to move forward in the model\n            x = processed_image\n            for index, layer in enumerate(self.model):\n                # Forward pass layer by layer\n                x = layer(x)\n                if index == self.selected_layer:\n                    # Only need to forward until the selected layer is reached\n                    # Now, x is the output of the selected layer\n                    break\n            # Here, we get the specific filter from the output of the convolution operation\n            # x is a tensor of shape 1x512x28x28.(For layer 17)\n            # So there are 512 unique filter outputs\n            # Following line selects a filter from 512 filters so self.conv_output will become\n            # a tensor of shape 28x28\n            self.conv_output = x[0, self.selected_filter]\n            # Loss function is the mean of the output of the selected layer/filter\n            # We try to minimize the mean of the output of that specific filter\n            loss = -torch.mean(self.conv_output)\n            print(\'Iteration:\', str(i), \'Loss:\', ""{0:.2f}"".format(loss.data.numpy()))\n            # Backward\n            loss.backward()\n            # Update image\n            optimizer.step()\n            # Recreate image\n            self.created_image = recreate_image(processed_image)\n            # Save image\n            if i % 5 == 0:\n                im_path = \'../generated/layer_vis_l\' + str(self.selected_layer) + \\\n                    \'_f\' + str(self.selected_filter) + \'_iter\' + str(i) + \'.jpg\'\n                save_image(self.created_image, im_path)\n\n\nif __name__ == \'__main__\':\n    cnn_layer = 17\n    filter_pos = 5\n    # Fully connected layer is not needed\n    pretrained_model = models.vgg16(pretrained=True).features\n    layer_vis = CNNLayerVisualization(pretrained_model, cnn_layer, filter_pos)\n\n    # Layer visualization with pytorch hooks\n    layer_vis.visualise_layer_with_hooks()\n\n    # Layer visualization without pytorch hooks\n    # layer_vis.visualise_layer_without_hooks()\n'"
src/deep_dream.py,2,"b'""""""\nCreated on Mon Nov 21 21:57:29 2017\n\n@author: Utku Ozbulak - github.com/utkuozbulak\n""""""\nimport os\nfrom PIL import Image\n\nimport torch\nfrom torch.optim import SGD\nfrom torchvision import models\n\nfrom misc_functions import preprocess_image, recreate_image, save_image\n\n\nclass DeepDream():\n    """"""\n        Produces an image that minimizes the loss of a convolution\n        operation for a specific layer and filter\n    """"""\n    def __init__(self, model, selected_layer, selected_filter, im_path):\n        self.model = model\n        self.model.eval()\n        self.selected_layer = selected_layer\n        self.selected_filter = selected_filter\n        self.conv_output = 0\n        # Generate a random image\n        self.created_image = Image.open(im_path).convert(\'RGB\')\n        # Hook the layers to get result of the convolution\n        self.hook_layer()\n        # Create the folder to export images if not exists\n        if not os.path.exists(\'../generated\'):\n            os.makedirs(\'../generated\')\n\n    def hook_layer(self):\n        def hook_function(module, grad_in, grad_out):\n            # Gets the conv output of the selected filter (from selected layer)\n            self.conv_output = grad_out[0, self.selected_filter]\n\n        # Hook the selected layer\n        self.model[self.selected_layer].register_forward_hook(hook_function)\n\n    def dream(self):\n        # Process image and return variable\n        self.processed_image = preprocess_image(self.created_image, True)\n        # Define optimizer for the image\n        # Earlier layers need higher learning rates to visualize whereas layer layers need less\n        optimizer = SGD([self.processed_image], lr=12,  weight_decay=1e-4)\n        for i in range(1, 251):\n            optimizer.zero_grad()\n            # Assign create image to a variable to move forward in the model\n            x = self.processed_image\n            for index, layer in enumerate(self.model):\n                # Forward\n                x = layer(x)\n                # Only need to forward until we the selected layer is reached\n                if index == self.selected_layer:\n                    break\n            # Loss function is the mean of the output of the selected layer/filter\n            # We try to minimize the mean of the output of that specific filter\n            loss = -torch.mean(self.conv_output)\n            print(\'Iteration:\', str(i), \'Loss:\', ""{0:.2f}"".format(loss.data.numpy()))\n            # Backward\n            loss.backward()\n            # Update image\n            optimizer.step()\n            # Recreate image\n            self.created_image = recreate_image(self.processed_image)\n            # Save image every 20 iteration\n            if i % 10 == 0:\n                print(self.created_image.shape)\n                im_path = \'../generated/ddream_l\' + str(self.selected_layer) + \\\n                    \'_f\' + str(self.selected_filter) + \'_iter\' + str(i) + \'.jpg\'\n                save_image(self.created_image, im_path)\n\n\nif __name__ == \'__main__\':\n    # THIS OPERATION IS MEMORY HUNGRY! #\n    # Because of the selected image is very large\n    # If it gives out of memory error or locks the computer\n    # Try it with a smaller image\n    cnn_layer = 34\n    filter_pos = 94\n\n    im_path = \'../input_images/dd_tree.jpg\'\n    # Fully connected layer is not needed\n    pretrained_model = models.vgg19(pretrained=True).features\n    dd = DeepDream(pretrained_model, cnn_layer, filter_pos, im_path)\n    # This operation can also be done without Pytorch hooks\n    # See layer visualisation for the implementation without hooks\n    dd.dream()\n'"
src/generate_class_specific_samples.py,1,"b'""""""\nCreated on Thu Oct 26 14:19:44 2017\n\n@author: Utku Ozbulak - github.com/utkuozbulak\n""""""\nimport os\nimport numpy as np\n\nimport torch\nfrom torch.optim import SGD\nfrom torchvision import models\n\nfrom misc_functions import preprocess_image, recreate_image, save_image\n\n\nclass ClassSpecificImageGeneration():\n    """"""\n        Produces an image that maximizes a certain class with gradient ascent\n    """"""\n    def __init__(self, model, target_class):\n        self.mean = [-0.485, -0.456, -0.406]\n        self.std = [1/0.229, 1/0.224, 1/0.225]\n        self.model = model\n        self.model.eval()\n        self.target_class = target_class\n        # Generate a random image\n        self.created_image = np.uint8(np.random.uniform(0, 255, (224, 224, 3)))\n        # Create the folder to export images if not exists\n        if not os.path.exists(\'../generated/class_\'+str(self.target_class)):\n            os.makedirs(\'../generated/class_\'+str(self.target_class))\n\n    def generate(self, iterations=150):\n        """"""Generates class specific image\n\n        Keyword Arguments:\n            iterations {int} -- Total iterations for gradient ascent (default: {150})\n\n        Returns:\n            np.ndarray -- Final maximally activated class image\n        """"""\n        initial_learning_rate = 6\n        for i in range(1, iterations):\n            # Process image and return variable\n            self.processed_image = preprocess_image(self.created_image, False)\n\n            # Define optimizer for the image\n            optimizer = SGD([self.processed_image], lr=initial_learning_rate)\n            # Forward\n            output = self.model(self.processed_image)\n            # Target specific class\n            class_loss = -output[0, self.target_class]\n\n            if i % 10 == 0 or i == iterations-1:\n                print(\'Iteration:\', str(i), \'Loss\',\n                      ""{0:.2f}"".format(class_loss.data.numpy()))\n            # Zero grads\n            self.model.zero_grad()\n            # Backward\n            class_loss.backward()\n            # Update image\n            optimizer.step()\n            # Recreate image\n            self.created_image = recreate_image(self.processed_image)\n            if i % 10 == 0 or i == iterations-1:\n                # Save image\n                im_path = \'../generated/class_\'+str(self.target_class)+\'/c_\'+str(self.target_class)+\'_\'+\'iter_\'+str(i)+\'.png\'\n                save_image(self.created_image, im_path)\n\n        return self.processed_image\n\n\nif __name__ == \'__main__\':\n    target_class = 130  # Flamingo\n    pretrained_model = models.alexnet(pretrained=True)\n    csig = ClassSpecificImageGeneration(pretrained_model, target_class)\n    csig.generate()\n'"
src/generate_regularized_class_specific_samples.py,5,"b'""""""\nCreated on Tues Mar 10 08:13:15 2020\n@author: Alex Stoken - https://github.com/alexstoken\n\nLast tested with torchvision 0.5.0 with image and model on cpu\n""""""\nimport os\nimport numpy as np\nfrom PIL import Image, ImageFilter\n\nimport torch\nfrom torch.optim import SGD\nfrom torch.autograd import Variable\nfrom torchvision import models\n\nfrom misc_functions import recreate_image, save_image\n\nuse_cuda = torch.cuda.is_available()\n\nclass RegularizedClassSpecificImageGeneration():\n    """"""\n        Produces an image that maximizes a certain class with gradient ascent. Uses Gaussian blur, weight decay, and clipping. \n    """"""\n\n    def __init__(self, model, target_class):\n        self.mean = [-0.485, -0.456, -0.406]\n        self.std = [1/0.229, 1/0.224, 1/0.225]\n        self.model = model.cuda() if use_cuda else model\n        self.model.eval()\n        self.target_class = target_class\n        # Generate a random image\n        self.created_image = np.uint8(np.random.uniform(0, 255, (224, 224, 3)))\n        # Create the folder to export images if not exists\n        if not os.path.exists(f\'../generated/class_{self.target_class}\'):\n            os.makedirs(f\'../generated/class_{self.target_class}\')\n\n    def generate(self, iterations=150, blur_freq=4, blur_rad=1, wd=0.0001, clipping_value=0.1):\n        """"""Generates class specific image with enhancements to improve image quality. \n        See https://arxiv.org/abs/1506.06579 for details on each argument\'s effect on output quality. \n        \n\n        Play around with combinations of arguments. Besides the defaults, this combination has produced good images:\n        blur_freq=6, blur_rad=0.8, wd = 0.05\n\n        Keyword Arguments:\n            iterations {int} -- Total iterations for gradient ascent (default: {150})\n            blur_freq {int} -- Frequency of Gaussian blur effect, in iterations (default: {6})\n            blur_rad {float} -- Radius for gaussian blur, passed to PIL.ImageFilter.GaussianBlur() (default: {0.8})\n            wd {float} -- Weight decay value for Stochastic Gradient Ascent (default: {0.05})\n            clipping_value {None or float} -- Value for gradient clipping (default: {0.1})\n        \n        Returns:\n            np.ndarray -- Final maximally activated class image\n        """"""\n        initial_learning_rate = 6\n        for i in range(1, iterations):\n            # Process image and return variable\n\n            #implement gaussian blurring every ith iteration\n            #to improve output\n            if i % blur_freq == 0:\n                self.processed_image = preprocess_and_blur_image(\n                    self.created_image, False, blur_rad)\n            else:\n                self.processed_image = preprocess_and_blur_image(\n                    self.created_image, False)\n\n            if use_cuda:\n                self.processed_image = self.processed_image.cuda()\n\n            # Define optimizer for the image - use weight decay to add regularization\n            # in SGD, wd = 2 * L2 regularization (https://bbabenko.github.io/weight-decay/)\n            optimizer = SGD([self.processed_image],\n                            lr=initial_learning_rate, weight_decay=wd)\n            # Forward\n            output = self.model(self.processed_image)\n            # Target specific class\n            class_loss = -output[0, self.target_class]\n\n            if i in np.linspace(0, iterations, 10, dtype=int):\n                print(\'Iteration:\', str(i), \'Loss\',\n                      ""{0:.2f}"".format(class_loss.data.cpu().numpy()))\n            # Zero grads\n            self.model.zero_grad()\n            # Backward\n            class_loss.backward()\n\n            if clipping_value:\n                torch.nn.utils.clip_grad_norm(\n                    self.model.parameters(), clipping_value)\n            # Update image\n            optimizer.step()\n            # Recreate image\n            self.created_image = recreate_image(self.processed_image.cpu())\n\n            if i in np.linspace(0, iterations, 10, dtype=int):\n                # Save image\n                im_path = f\'../generated/class_{self.target_class}/c_{self.target_class}_iter_{i}_loss_{class_loss.data.cpu().numpy()}.jpg\'\n                save_image(self.created_image, im_path)\n\n        #save final image\n        im_path = f\'../generated/class_{self.target_class}/c_{self.target_class}_iter_{i}_loss_{class_loss.data.cpu().numpy()}.jpg\'\n        save_image(self.created_image, im_path)\n\n        #write file with regularization details\n        with open(f\'../generated/class_{self.target_class}/run_details.txt\', \'w\') as f:\n            f.write(f\'Iterations: {iterations}\\n\')\n            f.write(f\'Blur freq: {blur_freq}\\n\')\n            f.write(f\'Blur radius: {blur_rad}\\n\')\n            f.write(f\'Weight decay: {wd}\\n\')\n            f.write(f\'Clip value: {clipping_value}\\n\')\n\n        #rename folder path with regularization details for easy access\n        os.rename(f\'../generated/class_{self.target_class}\',\n                  f\'../generated/class_{self.target_class}_blurfreq_{blur_freq}_blurrad_{blur_rad}_wd{wd}\')\n        return self.processed_image\n\n\ndef preprocess_and_blur_image(pil_im, resize_im=True, blur_rad=None):\n    """"""\n        Processes image with optional Gaussian blur for CNNs\n\n    Args:\n        PIL_img (PIL_img): PIL Image or numpy array to process\n        resize_im (bool): Resize to 224 or not\n        blur_rad (int): Pixel radius for Gaussian blurring (default = None)\n    returns:\n        im_as_var (torch variable): Variable that contains processed float tensor\n    """"""\n    # mean and std list for channels (Imagenet)\n    mean = [0.485, 0.456, 0.406]\n    std = [0.229, 0.224, 0.225]\n\n    #ensure or transform incoming image to PIL image\n    if type(pil_im) != Image.Image:\n        try:\n            pil_im = Image.fromarray(pil_im)\n        except Exception as e:\n            print(\n                ""could not transform PIL_img to a PIL Image object. Please check input."")\n\n    # Resize image\n    if resize_im:\n        pil_im.thumbnail((224, 224))\n\n    #add gaussin blur to image\n    if blur_rad:\n        pil_im = pil_im.filter(ImageFilter.GaussianBlur(blur_rad))\n\n    im_as_arr = np.float32(pil_im)\n    im_as_arr = im_as_arr.transpose(2, 0, 1)  # Convert array to D,W,H\n    # Normalize the channels\n    for channel, _ in enumerate(im_as_arr):\n        im_as_arr[channel] /= 255\n        im_as_arr[channel] -= mean[channel]\n        im_as_arr[channel] /= std[channel]\n    # Convert to float tensor\n    im_as_ten = torch.from_numpy(im_as_arr).float()\n    # Add one more channel to the beginning. Tensor shape = 1,3,224,224\n    im_as_ten.unsqueeze_(0)\n    # Convert to Pytorch variable\n    if use_cuda:\n        im_as_var = Variable(im_as_ten.cuda(), requires_grad=True)\n    else:\n        im_as_var = Variable(im_as_ten, requires_grad=True)\n    return im_as_var\n\nif __name__ == \'__main__\':\n    target_class = 130  # Flamingo\n    pretrained_model = models.alexnet(pretrained=True)\n    csig = RegularizedClassSpecificImageGeneration(pretrained_model, target_class)\n    csig.generate()\n'"
src/grad_times_image.py,0,"b'""""""\nCreated on Wed Jun 19 17:12:04 2019\n\n@author: Utku Ozbulak - github.com/utkuozbulak\n""""""\nfrom misc_functions import (get_example_params,\n                            convert_to_grayscale,\n                            save_gradient_images)\nfrom vanilla_backprop import VanillaBackprop\n# from guided_backprop import GuidedBackprop  # To use with guided backprop\n# from integrated_gradients import IntegratedGradients  # To use with integrated grads\n\nif __name__ == \'__main__\':\n    # Get params\n    target_example = 0  # Snake\n    (original_image, prep_img, target_class, file_name_to_export, pretrained_model) =\\\n        get_example_params(target_example)\n    # Vanilla backprop\n    VBP = VanillaBackprop(pretrained_model)\n    # Generate gradients\n    vanilla_grads = VBP.generate_gradients(prep_img, target_class)\n\n    grad_times_image = vanilla_grads[0] * prep_img.detach().numpy()[0]\n    # Convert to grayscale\n    grayscale_vanilla_grads = convert_to_grayscale(grad_times_image)\n    # Save grayscale gradients\n    save_gradient_images(grayscale_vanilla_grads,\n                         file_name_to_export + \'_Vanilla_grad_times_image_gray\')\n    print(\'Grad times image completed.\')\n'"
src/gradcam.py,1,"b'""""""\nCreated on Thu Oct 26 11:06:51 2017\n\n@author: Utku Ozbulak - github.com/utkuozbulak\n""""""\nfrom PIL import Image\nimport numpy as np\nimport torch\n\nfrom misc_functions import get_example_params, save_class_activation_images\n\n\nclass CamExtractor():\n    """"""\n        Extracts cam features from the model\n    """"""\n    def __init__(self, model, target_layer):\n        self.model = model\n        self.target_layer = target_layer\n        self.gradients = None\n\n    def save_gradient(self, grad):\n        self.gradients = grad\n\n    def forward_pass_on_convolutions(self, x):\n        """"""\n            Does a forward pass on convolutions, hooks the function at given layer\n        """"""\n        conv_output = None\n        for module_pos, module in self.model.features._modules.items():\n            x = module(x)  # Forward\n            if int(module_pos) == self.target_layer:\n                x.register_hook(self.save_gradient)\n                conv_output = x  # Save the convolution output on that layer\n        return conv_output, x\n\n    def forward_pass(self, x):\n        """"""\n            Does a full forward pass on the model\n        """"""\n        # Forward pass on the convolutions\n        conv_output, x = self.forward_pass_on_convolutions(x)\n        x = x.view(x.size(0), -1)  # Flatten\n        # Forward pass on the classifier\n        x = self.model.classifier(x)\n        return conv_output, x\n\n\nclass GradCam():\n    """"""\n        Produces class activation map\n    """"""\n    def __init__(self, model, target_layer):\n        self.model = model\n        self.model.eval()\n        # Define extractor\n        self.extractor = CamExtractor(self.model, target_layer)\n\n    def generate_cam(self, input_image, target_class=None):\n        # Full forward pass\n        # conv_output is the output of convolutions at specified layer\n        # model_output is the final output of the model (1, 1000)\n        conv_output, model_output = self.extractor.forward_pass(input_image)\n        if target_class is None:\n            target_class = np.argmax(model_output.data.numpy())\n        # Target for backprop\n        one_hot_output = torch.FloatTensor(1, model_output.size()[-1]).zero_()\n        one_hot_output[0][target_class] = 1\n        # Zero grads\n        self.model.features.zero_grad()\n        self.model.classifier.zero_grad()\n        # Backward pass with specified target\n        model_output.backward(gradient=one_hot_output, retain_graph=True)\n        # Get hooked gradients\n        guided_gradients = self.extractor.gradients.data.numpy()[0]\n        # Get convolution outputs\n        target = conv_output.data.numpy()[0]\n        # Get weights from gradients\n        weights = np.mean(guided_gradients, axis=(1, 2))  # Take averages for each gradient\n        # Create empty numpy array for cam\n        cam = np.ones(target.shape[1:], dtype=np.float32)\n        # Multiply each weight with its conv output and then, sum\n        for i, w in enumerate(weights):\n            cam += w * target[i, :, :]\n        cam = np.maximum(cam, 0)\n        cam = (cam - np.min(cam)) / (np.max(cam) - np.min(cam))  # Normalize between 0-1\n        cam = np.uint8(cam * 255)  # Scale between 0-255 to visualize\n        cam = np.uint8(Image.fromarray(cam).resize((input_image.shape[2],\n                       input_image.shape[3]), Image.ANTIALIAS))/255\n        # ^ I am extremely unhappy with this line. Originally resizing was done in cv2 which\n        # supports resizing numpy matrices with antialiasing, however,\n        # when I moved the repository to PIL, this option was out of the window.\n        # So, in order to use resizing with ANTIALIAS feature of PIL,\n        # I briefly convert matrix to PIL image and then back.\n        # If there is a more beautiful way, do not hesitate to send a PR.\n\n        # You can also use the code below instead of the code line above, suggested by @ ptschandl\n        # from scipy.ndimage.interpolation import zoom\n        # cam = zoom(cam, np.array(input_image[0].shape[1:])/np.array(cam.shape))\n        return cam\n\n\nif __name__ == \'__main__\':\n    # Get params\n    target_example = 0  # Snake\n    (original_image, prep_img, target_class, file_name_to_export, pretrained_model) =\\\n        get_example_params(target_example)\n    # Grad cam\n    grad_cam = GradCam(pretrained_model, target_layer=11)\n    # Generate cam mask\n    cam = grad_cam.generate_cam(prep_img, target_class)\n    # Save mask\n    save_class_activation_images(original_image, cam, file_name_to_export)\n    print(\'Grad cam completed\')\n'"
